yr,periodDesc,rgDesc,rtTitle,ptTitle,cmdCode,cmdDescE,TradeValue_export,Unnamed: 0_export,rtLat,rtLon,ptLat,ptLon,mid,TradeValue_import,Unnamed: 0_import
2019.0,2019.0,Export,Morocco,World,2.0,Meat and edible meat offal,1270075.0,,31.1728205,-7.3362482,-36.8535712,174.7456809,2.02019.0Morocco,44161848.0,
2019.0,2019.0,Export,Morocco,World,3.0,"Fish and crustaceans, molluscs and other aquatic invertebrates",1213819158.0,,31.1728205,-7.3362482,-36.8535712,174.7456809,3.02019.0Morocco,215959772.0,
2019.0,2019.0,Export,Morocco,World,4.0,"Dairy produce; birds' eggs; natural honey; edible products of animal origin, not elsewhere specified or included",66657956.0,,31.1728205,-7.3362482,-36.8535712,174.7456809,4.02019.0Morocco,253146997.0,
2019.0,2019.0,Export,Morocco,World,5.0,Animal originated products; not elsewhere specified or included,90564163.0,,31.1728205,-7.3362482,-36.8535712,174.7456809,5.02019.0Morocco,76501402.0,
2019.0,2019.0,Export,Morocco,World,6.0,"Trees and other plants, live; bulbs, roots and the like; cut flowers and ornamental foliage",31351798.0,,31.1728205,-7.3362482,-36.8535712,174.7456809,6.02019.0Morocco,88897444.0,
2019.0,2019.0,Export,Morocco,World,7.0,Vegetables and certain roots and tubers; edible,1394862533.0,,31.1728205,-7.3362482,-36.8535712,174.7456809,7.02019.0Morocco,103467720.0,
2019.0,2019.0,Export,Morocco,World,8.0,"Fruit and nuts, edible; peel of citrus fruit or melons",1359266993.0,,31.1728205,-7.3362482,-36.8535712,174.7456809,8.02019.0Morocco,335577924.0,
2019.0,2019.0,Export,Morocco,World,13.0,"Lac; gums, resins and other vegetable saps and extracts",60137253.0,,31.1728205,-7.3362482,-36.8535712,174.7456809,13.02019.0Morocco,33808062.0,
2019.0,2019.0,Export,Morocco,World,14.0,Vegetable plaiting materials; vegetable products not elsewhere specified or included,646606.0,,31.1728205,-7.3362482,-36.8535712,174.7456809,14.02019.0Morocco,939736.0,
2019.0,2019.0,Export,Morocco,World,16.0,"Meat, fish or crustaceans, molluscs or other aquatic invertebrates; preparations thereof",817977453.0,,31.1728205,-7.3362482,-36.8535712,174.7456809,16.02019.0Morocco,36956226.0,
2019.0,2019.0,Export,Morocco,World,17.0,Sugars and sugar confectionery,232362346.0,,31.1728205,-7.3362482,-36.8535712,174.7456809,17.02019.0Morocco,440534027.0,
2019.0,2019.0,Export,Morocco,World,18.0,Cocoa and cocoa preparations,3848656.0,,31.1728205,-7.3362482,-36.8535712,174.7456809,18.02019.0Morocco,80237034.0,
2019.0,2019.0,Export,Morocco,World,19.0,"Preparations of cereals, flour, starch or milk; pastrycooks' products",57267191.0,,31.1728205,-7.3362482,-36.8535712,174.7456809,19.02019.0Morocco,155765882.0,
2019.0,2019.0,Export,Morocco,World,20.0,"Preparations of vegetables, fruit, nuts or other parts of plants",227358392.0,,31.1728205,-7.3362482,-36.8535712,174.7456809,20.02019.0Morocco,89339120.0,
2019.0,2019.0,Export,Morocco,World,21.0,Miscellaneous edible preparations,125895489.0,,31.1728205,-7.3362482,-36.8535712,174.7456809,21.02019.0Morocco,145720811.0,
2019.0,2019.0,Export,Morocco,World,22.0,"Beverages, spirits and vinegar",33071280.0,,31.1728205,-7.3362482,-36.8535712,174.7456809,22.02019.0Morocco,110099035.0,
2019.0,2019.0,Export,Morocco,World,23.0,"Food industries, residues and wastes thereof; prepared animal fodder",173520576.0,,31.1728205,-7.3362482,-36.8535712,174.7456809,23.02019.0Morocco,620564785.0,
2019.0,2019.0,Export,Morocco,World,24.0,Tobacco and manufactured tobacco substitutes,80928127.0,,31.1728205,-7.3362482,-36.8535712,174.7456809,24.02019.0Morocco,198986513.0,
2019.0,2019.0,Export,Morocco,World,25.0,"Salt; sulphur; earths, stone; plastering materials, lime and cement",1003416712.0,,31.1728205,-7.3362482,-36.8535712,174.7456809,25.02019.0Morocco,786078040.0,
2019.0,2019.0,Export,Morocco,World,26.0,"Ores, slag and ash",258672964.0,,31.1728205,-7.3362482,-36.8535712,174.7456809,26.02019.0Morocco,31720501.0,
2019.0,2019.0,Export,Morocco,World,27.0,"Mineral fuels, mineral oils and products of their distillation; bituminous substances; mineral waxes",446597405.0,,31.1728205,-7.3362482,-36.8535712,174.7456809,27.02019.0Morocco,7939450440.0,
2019.0,2019.0,Export,Morocco,World,28.0,"Inorganic chemicals; organic and inorganic compounds of precious metals; of rare earth metals, of radio-active elements and of isotopes",1433056684.0,,31.1728205,-7.3362482,-36.8535712,174.7456809,28.02019.0Morocco,692299533.0,
2019.0,2019.0,Export,Morocco,World,29.0,Organic chemicals,19452334.0,,31.1728205,-7.3362482,-36.8535712,174.7456809,29.02019.0Morocco,456123064.0,
2019.0,2019.0,Export,Morocco,World,30.0,Pharmaceutical products,117046521.0,,31.1728205,-7.3362482,-36.8535712,174.7456809,30.02019.0Morocco,668870223.0,
2019.0,2019.0,Export,Morocco,World,31.0,Fertilizers,2913954666.0,,31.1728205,-7.3362482,-36.8535712,174.7456809,31.02019.0Morocco,265839915.0,
2019.0,2019.0,Export,Morocco,World,32.0,"Tanning or dyeing extracts; tannins and their derivatives; dyes, pigments and other colouring matter; paints, varnishes; putty, other mastics; inks",27572276.0,,31.1728205,-7.3362482,-36.8535712,174.7456809,32.02019.0Morocco,299068227.0,
2019.0,2019.0,Export,Morocco,World,34.0,"Soap, organic surface-active agents; washing, lubricating, polishing or scouring preparations; artificial or prepared waxes, candles and similar articles, modelling pastes, dental waxes and dental preparations with a basis of plaster",19970755.0,,31.1728205,-7.3362482,-36.8535712,174.7456809,34.02019.0Morocco,186855072.0,
2019.0,2019.0,Export,Morocco,World,36.0,Explosives; pyrotechnic products; matches; pyrophoric alloys; certain combustible preparations,3885846.0,,31.1728205,-7.3362482,-36.8535712,174.7456809,36.02019.0Morocco,5406813.0,
2019.0,2019.0,Export,Morocco,World,37.0,Photographic or cinematographic goods,173178.0,,31.1728205,-7.3362482,-36.8535712,174.7456809,37.02019.0Morocco,20724541.0,
2019.0,2019.0,Export,Morocco,World,38.0,Chemical products n.e.c.,13969215.0,,31.1728205,-7.3362482,-36.8535712,174.7456809,38.02019.0Morocco,559801676.0,
2019.0,2019.0,Export,Morocco,World,39.0,Plastics and articles thereof,241235385.0,,31.1728205,-7.3362482,-36.8535712,174.7456809,39.02019.0Morocco,2209687512.0,
2019.0,2019.0,Export,Morocco,World,40.0,Rubber and articles thereof,88220952.0,,31.1728205,-7.3362482,-36.8535712,174.7456809,40.02019.0Morocco,574434079.0,
2019.0,2019.0,Export,Morocco,World,43.0,Furskins and artificial fur; manufactures thereof,894728.0,,31.1728205,-7.3362482,-36.8535712,174.7456809,43.02019.0Morocco,1772934.0,
2019.0,2019.0,Export,Morocco,World,44.0,Wood and articles of wood; wood charcoal,31935478.0,,31.1728205,-7.3362482,-36.8535712,174.7456809,44.02019.0Morocco,520887110.0,
2019.0,2019.0,Export,Morocco,World,45.0,Cork and articles of cork,23020113.0,,31.1728205,-7.3362482,-36.8535712,174.7456809,45.02019.0Morocco,1018077.0,
2019.0,2019.0,Export,Morocco,World,46.0,"Manufactures of straw, esparto or other plaiting materials; basketware and wickerwork",8780604.0,,31.1728205,-7.3362482,-36.8535712,174.7456809,46.02019.0Morocco,767908.0,
2019.0,2019.0,Export,Morocco,World,47.0,Pulp of wood or other fibrous cellulosic material; recovered (waste and scrap) paper or paperboard,1957162.0,,31.1728205,-7.3362482,-36.8535712,174.7456809,47.02019.0Morocco,48309014.0,
2019.0,2019.0,Export,Morocco,World,48.0,"Paper and paperboard; articles of paper pulp, of paper or paperboard",93976469.0,,31.1728205,-7.3362482,-36.8535712,174.7456809,48.02019.0Morocco,744046382.0,
2019.0,2019.0,Export,Morocco,World,49.0,"Printed books, newspapers, pictures and other products of the printing industry; manuscripts, typescripts and plans",8994593.0,,31.1728205,-7.3362482,-36.8535712,174.7456809,49.02019.0Morocco,125486761.0,
2019.0,2019.0,Export,Morocco,World,50.0,Silk,93185.0,,31.1728205,-7.3362482,-36.8535712,174.7456809,50.02019.0Morocco,5375651.0,
2019.0,2019.0,Export,Morocco,World,52.0,Cotton,35046893.0,,31.1728205,-7.3362482,-36.8535712,174.7456809,52.02019.0Morocco,484201666.0,
2019.0,2019.0,Export,Morocco,World,53.0,Vegetable textile fibres; paper yarn and woven fabrics of paper yarn,818412.0,,31.1728205,-7.3362482,-36.8535712,174.7456809,53.02019.0Morocco,57177555.0,
2019.0,2019.0,Export,Morocco,World,54.0,Man-made filaments; strip and the like of man-made textile materials,17708136.0,,31.1728205,-7.3362482,-36.8535712,174.7456809,54.02019.0Morocco,390777298.0,
2019.0,2019.0,Export,Morocco,World,55.0,Man-made staple fibres,26671581.0,,31.1728205,-7.3362482,-36.8535712,174.7456809,55.02019.0Morocco,802765847.0,
2019.0,2019.0,Export,Morocco,World,56.0,"Wadding, felt and nonwovens, special yarns; twine, cordage, ropes and cables and articles thereof",11176261.0,,31.1728205,-7.3362482,-36.8535712,174.7456809,56.02019.0Morocco,172529276.0,
2019.0,2019.0,Export,Morocco,World,57.0,Carpets and other textile floor coverings,22931940.0,,31.1728205,-7.3362482,-36.8535712,174.7456809,57.02019.0Morocco,70994332.0,
2019.0,2019.0,Export,Morocco,World,58.0,"Fabrics; special woven fabrics, tufted textile fabrics, lace, tapestries, trimmings, embroidery",15858592.0,,31.1728205,-7.3362482,-36.8535712,174.7456809,58.02019.0Morocco,201258459.0,
2019.0,2019.0,Export,Morocco,World,59.0,"Textile fabrics; impregnated, coated, covered or laminated; textile articles of a kind suitable for industrial use",7302409.0,,31.1728205,-7.3362482,-36.8535712,174.7456809,59.02019.0Morocco,208999054.0,
2019.0,2019.0,Export,Morocco,World,60.0,Fabrics; knitted or crocheted,16336435.0,,31.1728205,-7.3362482,-36.8535712,174.7456809,60.02019.0Morocco,597547012.0,
2019.0,2019.0,Export,Morocco,World,61.0,Apparel and clothing accessories; knitted or crocheted,779667439.0,,31.1728205,-7.3362482,-36.8535712,174.7456809,61.02019.0Morocco,233931630.0,
2019.0,2019.0,Export,Morocco,World,62.0,Apparel and clothing accessories; not knitted or crocheted,2423284091.0,,31.1728205,-7.3362482,-36.8535712,174.7456809,62.02019.0Morocco,266393380.0,
2019.0,2019.0,Export,Morocco,World,63.0,"Textiles, made up articles; sets; worn clothing and worn textile articles; rags",278972979.0,,31.1728205,-7.3362482,-36.8535712,174.7456809,63.02019.0Morocco,115205519.0,
2019.0,2019.0,Export,Morocco,World,64.0,Footwear; gaiters and the like; parts of such articles,300049454.0,,31.1728205,-7.3362482,-36.8535712,174.7456809,64.02019.0Morocco,248646147.0,
2019.0,2019.0,Export,Morocco,World,65.0,Headgear and parts thereof,9199307.0,,31.1728205,-7.3362482,-36.8535712,174.7456809,65.02019.0Morocco,13750370.0,
2019.0,2019.0,Export,Morocco,World,66.0,"Umbrellas, sun umbrellas, walking-sticks, seat sticks, whips, riding crops; and parts thereof",241182.0,,31.1728205,-7.3362482,-36.8535712,174.7456809,66.02019.0Morocco,7232692.0,
2019.0,2019.0,Export,Morocco,World,67.0,"Feathers and down, prepared; and articles made of feather or of down; artificial flowers; articles of human hair",90531.0,,31.1728205,-7.3362482,-36.8535712,174.7456809,67.02019.0Morocco,4529736.0,
2019.0,2019.0,Export,Morocco,World,68.0,"Stone, plaster, cement, asbestos, mica or similar materials; articles thereof",37995375.0,,31.1728205,-7.3362482,-36.8535712,174.7456809,68.02019.0Morocco,219297940.0,
2019.0,2019.0,Export,Morocco,World,69.0,Ceramic products,67740070.0,,31.1728205,-7.3362482,-36.8535712,174.7456809,69.02019.0Morocco,296837469.0,
2019.0,2019.0,Export,Morocco,World,70.0,Glass and glassware,85298485.0,,31.1728205,-7.3362482,-36.8535712,174.7456809,70.02019.0Morocco,267902041.0,
2019.0,2019.0,Export,Morocco,World,71.0,"Natural, cultured pearls; precious, semi-precious stones; precious metals, metals clad with precious metal, and articles thereof; imitation jewellery; coin",165971444.0,,31.1728205,-7.3362482,-36.8535712,174.7456809,71.02019.0Morocco,121402965.0,
2019.0,2019.0,Export,Morocco,World,72.0,Iron and steel,79013556.0,,31.1728205,-7.3362482,-36.8535712,174.7456809,72.02019.0Morocco,1517045952.0,
2019.0,2019.0,Export,Morocco,World,73.0,Iron or steel articles,164531192.0,,31.1728205,-7.3362482,-36.8535712,174.7456809,73.02019.0Morocco,921067050.0,
2019.0,2019.0,Export,Morocco,World,74.0,Copper and articles thereof,133988662.0,,31.1728205,-7.3362482,-36.8535712,174.7456809,74.02019.0Morocco,612040533.0,
2019.0,2019.0,Export,Morocco,World,75.0,Nickel and articles thereof,1658799.0,,31.1728205,-7.3362482,-36.8535712,174.7456809,75.02019.0Morocco,2246797.0,
2019.0,2019.0,Export,Morocco,World,76.0,Aluminium and articles thereof,122929462.0,,31.1728205,-7.3362482,-36.8535712,174.7456809,76.02019.0Morocco,572379514.0,
2019.0,2019.0,Export,Morocco,World,78.0,Lead and articles thereof,1297004.0,,31.1728205,-7.3362482,-36.8535712,174.7456809,78.02019.0Morocco,633264.0,
2019.0,2019.0,Export,Morocco,World,79.0,Zinc and articles thereof,2706996.0,,31.1728205,-7.3362482,-36.8535712,174.7456809,79.02019.0Morocco,39489500.0,
2019.0,2019.0,Export,Morocco,World,81.0,"Metals; n.e.c., cermets and articles thereof",130555985.0,,31.1728205,-7.3362482,-36.8535712,174.7456809,81.02019.0Morocco,40131557.0,
2019.0,2019.0,Export,Morocco,World,82.0,"Tools, implements, cutlery, spoons and forks, of base metal; parts thereof, of base metal",5480092.0,,31.1728205,-7.3362482,-36.8535712,174.7456809,82.02019.0Morocco,126982696.0,
2019.0,2019.0,Export,Morocco,World,83.0,Metal; miscellaneous products of base metal,17088548.0,,31.1728205,-7.3362482,-36.8535712,174.7456809,83.02019.0Morocco,230989105.0,
2019.0,2019.0,Export,Morocco,World,84.0,"Nuclear reactors, boilers, machinery and mechanical appliances; parts thereof",465236371.0,,31.1728205,-7.3362482,-36.8535712,174.7456809,84.02019.0Morocco,5642930677.0,
2019.0,2019.0,Export,Morocco,World,85.0,"Electrical machinery and equipment and parts thereof; sound recorders and reproducers; television image and sound recorders and reproducers, parts and accessories of such articles",5298614668.0,,31.1728205,-7.3362482,-36.8535712,174.7456809,85.02019.0Morocco,4922718473.0,
2019.0,2019.0,Export,Morocco,World,86.0,"Railway, tramway locomotives, rolling-stock and parts thereof; railway or tramway track fixtures and fittings and parts thereof; mechanical (including electro-mechanical) traffic signalling equipment of all kinds",4257363.0,,31.1728205,-7.3362482,-36.8535712,174.7456809,86.02019.0Morocco,78118165.0,
2019.0,2019.0,Export,Morocco,World,87.0,"Vehicles; other than railway or tramway rolling stock, and parts and accessories thereof",3829577118.0,,31.1728205,-7.3362482,-36.8535712,174.7456809,87.02019.0Morocco,5120947335.0,
2019.0,2019.0,Export,Morocco,World,88.0,"Aircraft, spacecraft and parts thereof",1057604126.0,,31.1728205,-7.3362482,-36.8535712,174.7456809,88.02019.0Morocco,1682692082.0,
2019.0,2019.0,Export,Morocco,World,89.0,"Ships, boats and floating structures",6911276.0,,31.1728205,-7.3362482,-36.8535712,174.7456809,89.02019.0Morocco,59890960.0,
2019.0,2019.0,Export,Morocco,World,90.0,"Optical, photographic, cinematographic, measuring, checking, medical or surgical instruments and apparatus; parts and accessories",69602092.0,,31.1728205,-7.3362482,-36.8535712,174.7456809,90.02019.0Morocco,649888826.0,
2019.0,2019.0,Export,Morocco,World,91.0,Clocks and watches and parts thereof,1511889.0,,31.1728205,-7.3362482,-36.8535712,174.7456809,91.02019.0Morocco,38889554.0,
2019.0,2019.0,Export,Morocco,World,92.0,Musical instruments; parts and accessories of such articles,27805.0,,31.1728205,-7.3362482,-36.8535712,174.7456809,92.02019.0Morocco,2626303.0,
2019.0,2019.0,Export,Morocco,World,93.0,Arms and ammunition; parts and accessories thereof,170861.0,,31.1728205,-7.3362482,-36.8535712,174.7456809,93.02019.0Morocco,8378673.0,
2019.0,2019.0,Export,Morocco,World,94.0,"Furniture; bedding, mattresses, mattress supports, cushions and similar stuffed furnishings; lamps and lighting fittings, n.e.c.; illuminated signs, illuminated name-plates and the like; prefabricated buildings",408554659.0,,31.1728205,-7.3362482,-36.8535712,174.7456809,94.02019.0Morocco,543798331.0,
2019.0,2019.0,Export,Morocco,World,95.0,"Toys, games and sports requisites; parts and accessories thereof",8354377.0,,31.1728205,-7.3362482,-36.8535712,174.7456809,95.02019.0Morocco,103113145.0,
2019.0,2019.0,Export,Morocco,World,96.0,Miscellaneous manufactured articles,11692966.0,,31.1728205,-7.3362482,-36.8535712,174.7456809,96.02019.0Morocco,488612052.0,
2019.0,2019.0,Export,Morocco,World,97.0,Works of art; collectors' pieces and antiques,4555731.0,,31.1728205,-7.3362482,-36.8535712,174.7456809,97.02019.0Morocco,1214386.0,
