yr,periodDesc,rgDesc,rtTitle,ptTitle,cmdCode,cmdDescE,TradeValue_export,Unnamed: 0_export,rtLat,rtLon,ptLat,ptLon,mid,TradeValue_import,Unnamed: 0_import
2014.0,2014.0,Export,Malta,World,1.0,Animals; live,938201.0,,35.8885993,14.4476911,-36.8535712,174.7456809,1.02014.0Malta,282869.0,
2014.0,2014.0,Export,Malta,World,2.0,Meat and edible meat offal,28931.0,,35.8885993,14.4476911,-36.8535712,174.7456809,2.02014.0Malta,68235949.0,
2014.0,2014.0,Export,Malta,World,3.0,"Fish and crustaceans, molluscs and other aquatic invertebrates",129782600.0,,35.8885993,14.4476911,-36.8535712,174.7456809,3.02014.0Malta,66637512.0,
2014.0,2014.0,Export,Malta,World,4.0,"Dairy produce; birds' eggs; natural honey; edible products of animal origin, not elsewhere specified or included",25126.0,,35.8885993,14.4476911,-36.8535712,174.7456809,4.02014.0Malta,59775969.0,
2014.0,2014.0,Export,Malta,World,5.0,Animal originated products; not elsewhere specified or included,140609.0,,35.8885993,14.4476911,-36.8535712,174.7456809,5.02014.0Malta,4294294.0,
2014.0,2014.0,Export,Malta,World,6.0,"Trees and other plants, live; bulbs, roots and the like; cut flowers and ornamental foliage",285.0,,35.8885993,14.4476911,-36.8535712,174.7456809,6.02014.0Malta,5085497.0,
2014.0,2014.0,Export,Malta,World,7.0,Vegetables and certain roots and tubers; edible,1948611.0,,35.8885993,14.4476911,-36.8535712,174.7456809,7.02014.0Malta,20241538.0,
2014.0,2014.0,Export,Malta,World,8.0,"Fruit and nuts, edible; peel of citrus fruit or melons",2063.0,,35.8885993,14.4476911,-36.8535712,174.7456809,8.02014.0Malta,44768306.0,
2014.0,2014.0,Export,Malta,World,9.0,"Coffee, tea, mate and spices",40752.0,,35.8885993,14.4476911,-36.8535712,174.7456809,9.02014.0Malta,7838119.0,
2014.0,2014.0,Export,Malta,World,10.0,Cereals,3534586.0,,35.8885993,14.4476911,-36.8535712,174.7456809,10.02014.0Malta,48884575.0,
2014.0,2014.0,Export,Malta,World,11.0,"Products of the milling industry; malt, starches, inulin, wheat gluten",1795682.0,,35.8885993,14.4476911,-36.8535712,174.7456809,11.02014.0Malta,12441733.0,
2014.0,2014.0,Export,Malta,World,12.0,"Oil seeds and oleaginous fruits; miscellaneous grains, seeds and fruit, industrial or medicinal plants; straw and fodder",607357.0,,35.8885993,14.4476911,-36.8535712,174.7456809,12.02014.0Malta,6825755.0,
2014.0,2014.0,Export,Malta,World,13.0,"Lac; gums, resins and other vegetable saps and extracts",1790785.0,,35.8885993,14.4476911,-36.8535712,174.7456809,13.02014.0Malta,1318308.0,
2014.0,2014.0,Export,Malta,World,15.0,Animal or vegetable fats and oils and their cleavage products; prepared animal fats; animal or vegetable waxes,16031.0,,35.8885993,14.4476911,-36.8535712,174.7456809,15.02014.0Malta,19371140.0,
2014.0,2014.0,Export,Malta,World,16.0,"Meat, fish or crustaceans, molluscs or other aquatic invertebrates; preparations thereof",395409.0,,35.8885993,14.4476911,-36.8535712,174.7456809,16.02014.0Malta,60819839.0,
2014.0,2014.0,Export,Malta,World,17.0,Sugars and sugar confectionery,702396.0,,35.8885993,14.4476911,-36.8535712,174.7456809,17.02014.0Malta,27904810.0,
2014.0,2014.0,Export,Malta,World,18.0,Cocoa and cocoa preparations,5890248.0,,35.8885993,14.4476911,-36.8535712,174.7456809,18.02014.0Malta,29405520.0,
2014.0,2014.0,Export,Malta,World,19.0,"Preparations of cereals, flour, starch or milk; pastrycooks' products",31728629.0,,35.8885993,14.4476911,-36.8535712,174.7456809,19.02014.0Malta,79075242.0,
2014.0,2014.0,Export,Malta,World,20.0,"Preparations of vegetables, fruit, nuts or other parts of plants",667915.0,,35.8885993,14.4476911,-36.8535712,174.7456809,20.02014.0Malta,36136839.0,
2014.0,2014.0,Export,Malta,World,21.0,Miscellaneous edible preparations,86462821.0,,35.8885993,14.4476911,-36.8535712,174.7456809,21.02014.0Malta,50456014.0,
2014.0,2014.0,Export,Malta,World,22.0,"Beverages, spirits and vinegar",14277488.0,,35.8885993,14.4476911,-36.8535712,174.7456809,22.02014.0Malta,80555011.0,
2014.0,2014.0,Export,Malta,World,23.0,"Food industries, residues and wastes thereof; prepared animal fodder",767418.0,,35.8885993,14.4476911,-36.8535712,174.7456809,23.02014.0Malta,44520167.0,
2014.0,2014.0,Export,Malta,World,24.0,Tobacco and manufactured tobacco substitutes,24392893.0,,35.8885993,14.4476911,-36.8535712,174.7456809,24.02014.0Malta,38690176.0,
2014.0,2014.0,Export,Malta,World,25.0,"Salt; sulphur; earths, stone; plastering materials, lime and cement",161783.0,,35.8885993,14.4476911,-36.8535712,174.7456809,25.02014.0Malta,27213241.0,
2014.0,2014.0,Export,Malta,World,26.0,"Ores, slag and ash",33401.0,,35.8885993,14.4476911,-36.8535712,174.7456809,26.02014.0Malta,74305.0,
2014.0,2014.0,Export,Malta,World,27.0,"Mineral fuels, mineral oils and products of their distillation; bituminous substances; mineral waxes",2139524271.0,,35.8885993,14.4476911,-36.8535712,174.7456809,27.02014.0Malta,3399387195.0,
2014.0,2014.0,Export,Malta,World,28.0,"Inorganic chemicals; organic and inorganic compounds of precious metals; of rare earth metals, of radio-active elements and of isotopes",1831922.0,,35.8885993,14.4476911,-36.8535712,174.7456809,28.02014.0Malta,9379120.0,
2014.0,2014.0,Export,Malta,World,29.0,Organic chemicals,126300426.0,,35.8885993,14.4476911,-36.8535712,174.7456809,29.02014.0Malta,215409502.0,
2014.0,2014.0,Export,Malta,World,30.0,Pharmaceutical products,330447238.0,,35.8885993,14.4476911,-36.8535712,174.7456809,30.02014.0Malta,158098154.0,
2014.0,2014.0,Export,Malta,World,33.0,"Essential oils and resinoids; perfumery, cosmetic or toilet preparations",24314351.0,,35.8885993,14.4476911,-36.8535712,174.7456809,33.02014.0Malta,54898912.0,
2014.0,2014.0,Export,Malta,World,34.0,"Soap, organic surface-active agents; washing, lubricating, polishing or scouring preparations; artificial or prepared waxes, candles and similar articles, modelling pastes, dental waxes and dental preparations with a basis of plaster",707358.0,,35.8885993,14.4476911,-36.8535712,174.7456809,34.02014.0Malta,31138428.0,
2014.0,2014.0,Export,Malta,World,35.0,Albuminoidal substances; modified starches; glues; enzymes,15018.0,,35.8885993,14.4476911,-36.8535712,174.7456809,35.02014.0Malta,5152339.0,
2014.0,2014.0,Export,Malta,World,36.0,Explosives; pyrotechnic products; matches; pyrophoric alloys; certain combustible preparations,6611.0,,35.8885993,14.4476911,-36.8535712,174.7456809,36.02014.0Malta,515676.0,
2014.0,2014.0,Export,Malta,World,37.0,Photographic or cinematographic goods,1767505.0,,35.8885993,14.4476911,-36.8535712,174.7456809,37.02014.0Malta,3272991.0,
2014.0,2014.0,Export,Malta,World,38.0,Chemical products n.e.c.,5989683.0,,35.8885993,14.4476911,-36.8535712,174.7456809,38.02014.0Malta,30680810.0,
2014.0,2014.0,Export,Malta,World,39.0,Plastics and articles thereof,52070970.0,,35.8885993,14.4476911,-36.8535712,174.7456809,39.02014.0Malta,188180600.0,
2014.0,2014.0,Export,Malta,World,40.0,Rubber and articles thereof,69883565.0,,35.8885993,14.4476911,-36.8535712,174.7456809,40.02014.0Malta,23467812.0,
2014.0,2014.0,Export,Malta,World,41.0,Raw hides and skins (other than furskins) and leather,224403.0,,35.8885993,14.4476911,-36.8535712,174.7456809,41.02014.0Malta,96479.0,
2014.0,2014.0,Export,Malta,World,42.0,"Articles of leather; saddlery and harness; travel goods, handbags and similar containers; articles of animal gut (other than silk-worm gut)",2045206.0,,35.8885993,14.4476911,-36.8535712,174.7456809,42.02014.0Malta,10304607.0,
2014.0,2014.0,Export,Malta,World,44.0,Wood and articles of wood; wood charcoal,579912.0,,35.8885993,14.4476911,-36.8535712,174.7456809,44.02014.0Malta,23590226.0,
2014.0,2014.0,Export,Malta,World,46.0,"Manufactures of straw, esparto or other plaiting materials; basketware and wickerwork",542.0,,35.8885993,14.4476911,-36.8535712,174.7456809,46.02014.0Malta,328835.0,
2014.0,2014.0,Export,Malta,World,47.0,Pulp of wood or other fibrous cellulosic material; recovered (waste and scrap) paper or paperboard,3856026.0,,35.8885993,14.4476911,-36.8535712,174.7456809,47.02014.0Malta,12444.0,
2014.0,2014.0,Export,Malta,World,48.0,"Paper and paperboard; articles of paper pulp, of paper or paperboard",4557001.0,,35.8885993,14.4476911,-36.8535712,174.7456809,48.02014.0Malta,106121496.0,
2014.0,2014.0,Export,Malta,World,49.0,"Printed books, newspapers, pictures and other products of the printing industry; manuscripts, typescripts and plans",128216590.0,,35.8885993,14.4476911,-36.8535712,174.7456809,49.02014.0Malta,30412319.0,
2014.0,2014.0,Export,Malta,World,50.0,Silk,751.0,,35.8885993,14.4476911,-36.8535712,174.7456809,50.02014.0Malta,145716.0,
2014.0,2014.0,Export,Malta,World,51.0,"Wool, fine or coarse animal hair; horsehair yarn and woven fabric",160513.0,,35.8885993,14.4476911,-36.8535712,174.7456809,51.02014.0Malta,243325.0,
2014.0,2014.0,Export,Malta,World,52.0,Cotton,34708.0,,35.8885993,14.4476911,-36.8535712,174.7456809,52.02014.0Malta,845342.0,
2014.0,2014.0,Export,Malta,World,53.0,Vegetable textile fibres; paper yarn and woven fabrics of paper yarn,4717.0,,35.8885993,14.4476911,-36.8535712,174.7456809,53.02014.0Malta,102050.0,
2014.0,2014.0,Export,Malta,World,54.0,Man-made filaments; strip and the like of man-made textile materials,3215556.0,,35.8885993,14.4476911,-36.8535712,174.7456809,54.02014.0Malta,5839186.0,
2014.0,2014.0,Export,Malta,World,55.0,Man-made staple fibres,14769.0,,35.8885993,14.4476911,-36.8535712,174.7456809,55.02014.0Malta,1314336.0,
2014.0,2014.0,Export,Malta,World,56.0,"Wadding, felt and nonwovens, special yarns; twine, cordage, ropes and cables and articles thereof",179239.0,,35.8885993,14.4476911,-36.8535712,174.7456809,56.02014.0Malta,3398774.0,
2014.0,2014.0,Export,Malta,World,57.0,Carpets and other textile floor coverings,134229.0,,35.8885993,14.4476911,-36.8535712,174.7456809,57.02014.0Malta,3141386.0,
2014.0,2014.0,Export,Malta,World,58.0,"Fabrics; special woven fabrics, tufted textile fabrics, lace, tapestries, trimmings, embroidery",11984.0,,35.8885993,14.4476911,-36.8535712,174.7456809,58.02014.0Malta,1080465.0,
2014.0,2014.0,Export,Malta,World,59.0,"Textile fabrics; impregnated, coated, covered or laminated; textile articles of a kind suitable for industrial use",12204.0,,35.8885993,14.4476911,-36.8535712,174.7456809,59.02014.0Malta,1869325.0,
2014.0,2014.0,Export,Malta,World,60.0,Fabrics; knitted or crocheted,33894643.0,,35.8885993,14.4476911,-36.8535712,174.7456809,60.02014.0Malta,610668.0,
2014.0,2014.0,Export,Malta,World,61.0,Apparel and clothing accessories; knitted or crocheted,14364985.0,,35.8885993,14.4476911,-36.8535712,174.7456809,61.02014.0Malta,58030444.0,
2014.0,2014.0,Export,Malta,World,62.0,Apparel and clothing accessories; not knitted or crocheted,7337623.0,,35.8885993,14.4476911,-36.8535712,174.7456809,62.02014.0Malta,49327955.0,
2014.0,2014.0,Export,Malta,World,63.0,"Textiles, made up articles; sets; worn clothing and worn textile articles; rags",1126639.0,,35.8885993,14.4476911,-36.8535712,174.7456809,63.02014.0Malta,12998232.0,
2014.0,2014.0,Export,Malta,World,64.0,Footwear; gaiters and the like; parts of such articles,10207387.0,,35.8885993,14.4476911,-36.8535712,174.7456809,64.02014.0Malta,32119449.0,
2014.0,2014.0,Export,Malta,World,65.0,Headgear and parts thereof,402147.0,,35.8885993,14.4476911,-36.8535712,174.7456809,65.02014.0Malta,1553340.0,
2014.0,2014.0,Export,Malta,World,66.0,"Umbrellas, sun umbrellas, walking-sticks, seat sticks, whips, riding crops; and parts thereof",14870.0,,35.8885993,14.4476911,-36.8535712,174.7456809,66.02014.0Malta,762946.0,
2014.0,2014.0,Export,Malta,World,67.0,"Feathers and down, prepared; and articles made of feather or of down; artificial flowers; articles of human hair",22678.0,,35.8885993,14.4476911,-36.8535712,174.7456809,67.02014.0Malta,673505.0,
2014.0,2014.0,Export,Malta,World,68.0,"Stone, plaster, cement, asbestos, mica or similar materials; articles thereof",203283.0,,35.8885993,14.4476911,-36.8535712,174.7456809,68.02014.0Malta,15416951.0,
2014.0,2014.0,Export,Malta,World,69.0,Ceramic products,493921.0,,35.8885993,14.4476911,-36.8535712,174.7456809,69.02014.0Malta,32946744.0,
2014.0,2014.0,Export,Malta,World,70.0,Glass and glassware,4510705.0,,35.8885993,14.4476911,-36.8535712,174.7456809,70.02014.0Malta,18397147.0,
2014.0,2014.0,Export,Malta,World,71.0,"Natural, cultured pearls; precious, semi-precious stones; precious metals, metals clad with precious metal, and articles thereof; imitation jewellery; coin",36632549.0,,35.8885993,14.4476911,-36.8535712,174.7456809,71.02014.0Malta,63375622.0,
2014.0,2014.0,Export,Malta,World,72.0,Iron and steel,8129189.0,,35.8885993,14.4476911,-36.8535712,174.7456809,72.02014.0Malta,34111690.0,
2014.0,2014.0,Export,Malta,World,73.0,Iron or steel articles,24417803.0,,35.8885993,14.4476911,-36.8535712,174.7456809,73.02014.0Malta,78151934.0,
2014.0,2014.0,Export,Malta,World,74.0,Copper and articles thereof,2484309.0,,35.8885993,14.4476911,-36.8535712,174.7456809,74.02014.0Malta,13956439.0,
2014.0,2014.0,Export,Malta,World,75.0,Nickel and articles thereof,22227.0,,35.8885993,14.4476911,-36.8535712,174.7456809,75.02014.0Malta,589492.0,
2014.0,2014.0,Export,Malta,World,76.0,Aluminium and articles thereof,5431089.0,,35.8885993,14.4476911,-36.8535712,174.7456809,76.02014.0Malta,26839242.0,
2014.0,2014.0,Export,Malta,World,79.0,Zinc and articles thereof,11704.0,,35.8885993,14.4476911,-36.8535712,174.7456809,79.02014.0Malta,417342.0,
2014.0,2014.0,Export,Malta,World,80.0,Tin; articles thereof,44550.0,,35.8885993,14.4476911,-36.8535712,174.7456809,80.02014.0Malta,95026.0,
2014.0,2014.0,Export,Malta,World,81.0,"Metals; n.e.c., cermets and articles thereof",11782.0,,35.8885993,14.4476911,-36.8535712,174.7456809,81.02014.0Malta,217466.0,
2014.0,2014.0,Export,Malta,World,82.0,"Tools, implements, cutlery, spoons and forks, of base metal; parts thereof, of base metal",4902006.0,,35.8885993,14.4476911,-36.8535712,174.7456809,82.02014.0Malta,12585689.0,
2014.0,2014.0,Export,Malta,World,83.0,Metal; miscellaneous products of base metal,859727.0,,35.8885993,14.4476911,-36.8535712,174.7456809,83.02014.0Malta,17816645.0,
2014.0,2014.0,Export,Malta,World,85.0,"Electrical machinery and equipment and parts thereof; sound recorders and reproducers; television image and sound recorders and reproducers, parts and accessories of such articles",1044950986.0,,35.8885993,14.4476911,-36.8535712,174.7456809,85.02014.0Malta,760033331.0,
2014.0,2014.0,Export,Malta,World,86.0,"Railway, tramway locomotives, rolling-stock and parts thereof; railway or tramway track fixtures and fittings and parts thereof; mechanical (including electro-mechanical) traffic signalling equipment of all kinds",421836.0,,35.8885993,14.4476911,-36.8535712,174.7456809,86.02014.0Malta,217792.0,
2014.0,2014.0,Export,Malta,World,87.0,"Vehicles; other than railway or tramway rolling stock, and parts and accessories thereof",25275633.0,,35.8885993,14.4476911,-36.8535712,174.7456809,87.02014.0Malta,173786243.0,
2014.0,2014.0,Export,Malta,World,89.0,"Ships, boats and floating structures",5857404.0,,35.8885993,14.4476911,-36.8535712,174.7456809,89.02014.0Malta,698346180.0,
2014.0,2014.0,Export,Malta,World,90.0,"Optical, photographic, cinematographic, measuring, checking, medical or surgical instruments and apparatus; parts and accessories",88476799.0,,35.8885993,14.4476911,-36.8535712,174.7456809,90.02014.0Malta,78821730.0,
2014.0,2014.0,Export,Malta,World,92.0,Musical instruments; parts and accessories of such articles,6144.0,,35.8885993,14.4476911,-36.8535712,174.7456809,92.02014.0Malta,1812740.0,
2014.0,2014.0,Export,Malta,World,94.0,"Furniture; bedding, mattresses, mattress supports, cushions and similar stuffed furnishings; lamps and lighting fittings, n.e.c.; illuminated signs, illuminated name-plates and the like; prefabricated buildings",2478132.0,,35.8885993,14.4476911,-36.8535712,174.7456809,94.02014.0Malta,77089681.0,
2014.0,2014.0,Export,Malta,World,95.0,"Toys, games and sports requisites; parts and accessories thereof",132341022.0,,35.8885993,14.4476911,-36.8535712,174.7456809,95.02014.0Malta,25356154.0,
2014.0,2014.0,Export,Malta,World,96.0,Miscellaneous manufactured articles,2144349.0,,35.8885993,14.4476911,-36.8535712,174.7456809,96.02014.0Malta,19394649.0,
2014.0,2014.0,Export,Malta,World,97.0,Works of art; collectors' pieces and antiques,167476.0,,35.8885993,14.4476911,-36.8535712,174.7456809,97.02014.0Malta,1930629.0,
2014.0,2014.0,Export,Malta,World,99.0,Commodities not specified according to kind,36565264.0,,35.8885993,14.4476911,-36.8535712,174.7456809,99.02014.0Malta,5279302.0,
