yr,periodDesc,rgDesc,rtTitle,ptTitle,cmdCode,cmdDescE,TradeValue_export,Unnamed: 0_export,rtLat,rtLon,ptLat,ptLon,mid,TradeValue_import,Unnamed: 0_import
2000.0,2000.0,Export,Oman,World,1.0,Live animals,33913105.0,,21.0000287,57.0036901,-36.8535712,174.7456809,1.02000.0Oman,48017137.0,
2000.0,2000.0,Export,Oman,World,2.0,Meat and edible meat offal,1209883.0,,21.0000287,57.0036901,-36.8535712,174.7456809,2.02000.0Oman,74417832.0,
2000.0,2000.0,Export,Oman,World,3.0,"Fish, crustaceans, molluscs, aquatic invertebrates nes",49759800.0,,21.0000287,57.0036901,-36.8535712,174.7456809,3.02000.0Oman,4244915.0,
2000.0,2000.0,Export,Oman,World,4.0,"Dairy products, eggs, honey, edible animal product nes",49603561.0,,21.0000287,57.0036901,-36.8535712,174.7456809,4.02000.0Oman,132992500.0,
2000.0,2000.0,Export,Oman,World,5.0,"Products of animal origin, nes",14393.0,,21.0000287,57.0036901,-36.8535712,174.7456809,5.02000.0Oman,56299.0,
2000.0,2000.0,Export,Oman,World,6.0,"Live trees, plants, bulbs, roots, cut flowers etc",115360.0,,21.0000287,57.0036901,-36.8535712,174.7456809,6.02000.0Oman,3194135.0,
2000.0,2000.0,Export,Oman,World,7.0,Edible vegetables and certain roots and tubers,7011113.0,,21.0000287,57.0036901,-36.8535712,174.7456809,7.02000.0Oman,29553540.0,
2000.0,2000.0,Export,Oman,World,8.0,"Edible fruit, nuts, peel of citrus fruit, melons",6915370.0,,21.0000287,57.0036901,-36.8535712,174.7456809,8.02000.0Oman,39777677.0,
2000.0,2000.0,Export,Oman,World,9.0,"Coffee, tea, mate and spices",2342340.0,,21.0000287,57.0036901,-36.8535712,174.7456809,9.02000.0Oman,22353181.0,
2000.0,2000.0,Export,Oman,World,10.0,Cereals,6613654.0,,21.0000287,57.0036901,-36.8535712,174.7456809,10.02000.0Oman,106588144.0,
2000.0,2000.0,Export,Oman,World,11.0,"Milling products, malt, starches, inulin, wheat gluten",35349661.0,,21.0000287,57.0036901,-36.8535712,174.7456809,11.02000.0Oman,12131367.0,
2000.0,2000.0,Export,Oman,World,12.0,"Oil seed, oleagic fruits, grain, seed, fruit, etc, nes",827706.0,,21.0000287,57.0036901,-36.8535712,174.7456809,12.02000.0Oman,15235148.0,
2000.0,2000.0,Export,Oman,World,13.0,"Lac, gums, resins, vegetable saps and extracts nes",921.0,,21.0000287,57.0036901,-36.8535712,174.7456809,13.02000.0Oman,94830.0,
2000.0,2000.0,Export,Oman,World,14.0,"Vegetable plaiting materials, vegetable products nes",59417.0,,21.0000287,57.0036901,-36.8535712,174.7456809,14.02000.0Oman,123040.0,
2000.0,2000.0,Export,Oman,World,15.0,"Animal,vegetable fats and oils, cleavage products, etc",28158762.0,,21.0000287,57.0036901,-36.8535712,174.7456809,15.02000.0Oman,33888533.0,
2000.0,2000.0,Export,Oman,World,16.0,"Meat, fish and seafood food preparations nes",1434341.0,,21.0000287,57.0036901,-36.8535712,174.7456809,16.02000.0Oman,6416946.0,
2000.0,2000.0,Export,Oman,World,17.0,Sugars and sugar confectionery,1230302.0,,21.0000287,57.0036901,-36.8535712,174.7456809,17.02000.0Oman,16859533.0,
2000.0,2000.0,Export,Oman,World,18.0,Cocoa and cocoa preparations,2086296.0,,21.0000287,57.0036901,-36.8535712,174.7456809,18.02000.0Oman,16875455.0,
2000.0,2000.0,Export,Oman,World,19.0,"Cereal, flour, starch, milk preparations and products",11355510.0,,21.0000287,57.0036901,-36.8535712,174.7456809,19.02000.0Oman,20935738.0,
2000.0,2000.0,Export,Oman,World,20.0,"Vegetable, fruit, nut, etc food preparations",3818483.0,,21.0000287,57.0036901,-36.8535712,174.7456809,20.02000.0Oman,30122361.0,
2000.0,2000.0,Export,Oman,World,21.0,Miscellaneous edible preparations,12775317.0,,21.0000287,57.0036901,-36.8535712,174.7456809,21.02000.0Oman,30009032.0,
2000.0,2000.0,Export,Oman,World,22.0,"Beverages, spirits and vinegar",8032837.0,,21.0000287,57.0036901,-36.8535712,174.7456809,22.02000.0Oman,46337759.0,
2000.0,2000.0,Export,Oman,World,23.0,"Residues, wastes of food industry, animal fodder",1546874.0,,21.0000287,57.0036901,-36.8535712,174.7456809,23.02000.0Oman,7175323.0,
2000.0,2000.0,Export,Oman,World,24.0,Tobacco and manufactured tobacco substitutes,133812279.0,,21.0000287,57.0036901,-36.8535712,174.7456809,24.02000.0Oman,389726602.0,
2000.0,2000.0,Export,Oman,World,25.0,"Salt, sulphur, earth, stone, plaster, lime and cement",34786413.0,,21.0000287,57.0036901,-36.8535712,174.7456809,25.02000.0Oman,32363493.0,
2000.0,2000.0,Export,Oman,World,26.0,"Ores, slag and ash",6713209.0,,21.0000287,57.0036901,-36.8535712,174.7456809,26.02000.0Oman,88143464.0,
2000.0,2000.0,Export,Oman,World,27.0,"Mineral fuels, oils, distillation products, etc",9418180375.0,,21.0000287,57.0036901,-36.8535712,174.7456809,27.02000.0Oman,87409865.0,
2000.0,2000.0,Export,Oman,World,28.0,"Inorganic chemicals, precious metal compound, isotopes",9810974.0,,21.0000287,57.0036901,-36.8535712,174.7456809,28.02000.0Oman,17799957.0,
2000.0,2000.0,Export,Oman,World,29.0,Organic chemicals,80401.0,,21.0000287,57.0036901,-36.8535712,174.7456809,29.02000.0Oman,4981729.0,
2000.0,2000.0,Export,Oman,World,30.0,Pharmaceutical products,1287056.0,,21.0000287,57.0036901,-36.8535712,174.7456809,30.02000.0Oman,66036558.0,
2000.0,2000.0,Export,Oman,World,31.0,Fertilizers,1307428.0,,21.0000287,57.0036901,-36.8535712,174.7456809,31.02000.0Oman,8577854.0,
2000.0,2000.0,Export,Oman,World,32.0,"Tanning, dyeing extracts, tannins, derivs,pigments etc",6568917.0,,21.0000287,57.0036901,-36.8535712,174.7456809,32.02000.0Oman,16674251.0,
2000.0,2000.0,Export,Oman,World,33.0,"Essential oils, perfumes, cosmetics, toileteries",13778857.0,,21.0000287,57.0036901,-36.8535712,174.7456809,33.02000.0Oman,70567869.0,
2000.0,2000.0,Export,Oman,World,34.0,"Soaps, lubricants, waxes, candles, modelling pastes",33517191.0,,21.0000287,57.0036901,-36.8535712,174.7456809,34.02000.0Oman,23930417.0,
2000.0,2000.0,Export,Oman,World,35.0,"Albuminoids, modified starches, glues, enzymes",818107.0,,21.0000287,57.0036901,-36.8535712,174.7456809,35.02000.0Oman,3977167.0,
2000.0,2000.0,Export,Oman,World,36.0,"Explosives, pyrotechnics, matches, pyrophorics, etc",77649.0,,21.0000287,57.0036901,-36.8535712,174.7456809,36.02000.0Oman,3486535.0,
2000.0,2000.0,Export,Oman,World,37.0,Photographic or cinematographic goods,6316668.0,,21.0000287,57.0036901,-36.8535712,174.7456809,37.02000.0Oman,7508709.0,
2000.0,2000.0,Export,Oman,World,38.0,Miscellaneous chemical products,4950150.0,,21.0000287,57.0036901,-36.8535712,174.7456809,38.02000.0Oman,81170253.0,
2000.0,2000.0,Export,Oman,World,39.0,Plastics and articles thereof,33072821.0,,21.0000287,57.0036901,-36.8535712,174.7456809,39.02000.0Oman,103198160.0,
2000.0,2000.0,Export,Oman,World,40.0,Rubber and articles thereof,21432126.0,,21.0000287,57.0036901,-36.8535712,174.7456809,40.02000.0Oman,55609126.0,
2000.0,2000.0,Export,Oman,World,41.0,Raw hides and skins (other than furskins) and leather,256257.0,,21.0000287,57.0036901,-36.8535712,174.7456809,41.02000.0Oman,1607217.0,
2000.0,2000.0,Export,Oman,World,42.0,"Articles of leather, animal gut, harness, travel goods",145113.0,,21.0000287,57.0036901,-36.8535712,174.7456809,42.02000.0Oman,6703401.0,
2000.0,2000.0,Export,Oman,World,43.0,"Furskins and artificial fur, manufactures thereof",29165.0,,21.0000287,57.0036901,-36.8535712,174.7456809,43.02000.0Oman,5753.0,
2000.0,2000.0,Export,Oman,World,44.0,"Wood and articles of wood, wood charcoal",1061480.0,,21.0000287,57.0036901,-36.8535712,174.7456809,44.02000.0Oman,51166815.0,
2000.0,2000.0,Export,Oman,World,46.0,"Manufactures of plaiting material, basketwork, etc.",125498.0,,21.0000287,57.0036901,-36.8535712,174.7456809,46.02000.0Oman,416226.0,
2000.0,2000.0,Export,Oman,World,47.0,"Pulp of wood, fibrous cellulosic material, waste etc",375690.0,,21.0000287,57.0036901,-36.8535712,174.7456809,47.02000.0Oman,370333.0,
2000.0,2000.0,Export,Oman,World,48.0,"Paper & paperboard, articles of pulp, paper and board",5938655.0,,21.0000287,57.0036901,-36.8535712,174.7456809,48.02000.0Oman,75138441.0,
2000.0,2000.0,Export,Oman,World,49.0,"Printed books, newspapers, pictures etc",2235742.0,,21.0000287,57.0036901,-36.8535712,174.7456809,49.02000.0Oman,13376626.0,
2000.0,2000.0,Export,Oman,World,50.0,Silk,97280.0,,21.0000287,57.0036901,-36.8535712,174.7456809,50.02000.0Oman,1372770.0,
2000.0,2000.0,Export,Oman,World,51.0,"Wool, animal hair, horsehair yarn and fabric thereof",1040.0,,21.0000287,57.0036901,-36.8535712,174.7456809,51.02000.0Oman,280268.0,
2000.0,2000.0,Export,Oman,World,52.0,Cotton,990876.0,,21.0000287,57.0036901,-36.8535712,174.7456809,52.02000.0Oman,30111324.0,
2000.0,2000.0,Export,Oman,World,53.0,"Vegetable textile fibres nes, paper yarn, woven fabric",79966.0,,21.0000287,57.0036901,-36.8535712,174.7456809,53.02000.0Oman,744710.0,
2000.0,2000.0,Export,Oman,World,54.0,Manmade filaments,631709.0,,21.0000287,57.0036901,-36.8535712,174.7456809,54.02000.0Oman,11830280.0,
2000.0,2000.0,Export,Oman,World,55.0,Manmade staple fibres,23893504.0,,21.0000287,57.0036901,-36.8535712,174.7456809,55.02000.0Oman,79923402.0,
2000.0,2000.0,Export,Oman,World,56.0,"Wadding, felt, nonwovens, yarns, twine, cordage, etc",97677.0,,21.0000287,57.0036901,-36.8535712,174.7456809,56.02000.0Oman,4254372.0,
2000.0,2000.0,Export,Oman,World,57.0,Carpets and other textile floor coverings,666312.0,,21.0000287,57.0036901,-36.8535712,174.7456809,57.02000.0Oman,12509307.0,
2000.0,2000.0,Export,Oman,World,58.0,"Special woven or tufted fabric, lace, tapestry etc",78718.0,,21.0000287,57.0036901,-36.8535712,174.7456809,58.02000.0Oman,1971321.0,
2000.0,2000.0,Export,Oman,World,61.0,"Articles of apparel, accessories, knit or crochet",22500929.0,,21.0000287,57.0036901,-36.8535712,174.7456809,61.02000.0Oman,26846416.0,
2000.0,2000.0,Export,Oman,World,62.0,"Articles of apparel, accessories, not knit or crochet",92012577.0,,21.0000287,57.0036901,-36.8535712,174.7456809,62.02000.0Oman,11637583.0,
2000.0,2000.0,Export,Oman,World,63.0,"Other made textile articles, sets, worn clothing etc",489878.0,,21.0000287,57.0036901,-36.8535712,174.7456809,63.02000.0Oman,11742007.0,
2000.0,2000.0,Export,Oman,World,64.0,"Footwear, gaiters and the like, parts thereof",2892156.0,,21.0000287,57.0036901,-36.8535712,174.7456809,64.02000.0Oman,19442032.0,
2000.0,2000.0,Export,Oman,World,65.0,Headgear and parts thereof,30635.0,,21.0000287,57.0036901,-36.8535712,174.7456809,65.02000.0Oman,822268.0,
2000.0,2000.0,Export,Oman,World,67.0,"Bird skin, feathers, artificial flowers, human hair",25046.0,,21.0000287,57.0036901,-36.8535712,174.7456809,67.02000.0Oman,558629.0,
2000.0,2000.0,Export,Oman,World,68.0,"Stone, plaster, cement, asbestos, mica, etc articles",15135447.0,,21.0000287,57.0036901,-36.8535712,174.7456809,68.02000.0Oman,19155858.0,
2000.0,2000.0,Export,Oman,World,69.0,Ceramic products,8157942.0,,21.0000287,57.0036901,-36.8535712,174.7456809,69.02000.0Oman,32242707.0,
2000.0,2000.0,Export,Oman,World,70.0,Glass and glassware,3220767.0,,21.0000287,57.0036901,-36.8535712,174.7456809,70.02000.0Oman,20175514.0,
2000.0,2000.0,Export,Oman,World,71.0,"Pearls, precious stones, metals, coins, etc",8793651.0,,21.0000287,57.0036901,-36.8535712,174.7456809,71.02000.0Oman,71100966.0,
2000.0,2000.0,Export,Oman,World,72.0,Iron and steel,23620112.0,,21.0000287,57.0036901,-36.8535712,174.7456809,72.02000.0Oman,65383240.0,
2000.0,2000.0,Export,Oman,World,73.0,Articles of iron or steel,25152809.0,,21.0000287,57.0036901,-36.8535712,174.7456809,73.02000.0Oman,117163576.0,
2000.0,2000.0,Export,Oman,World,74.0,Copper and articles thereof,46218909.0,,21.0000287,57.0036901,-36.8535712,174.7456809,74.02000.0Oman,31229820.0,
2000.0,2000.0,Export,Oman,World,76.0,Aluminium and articles thereof,27828564.0,,21.0000287,57.0036901,-36.8535712,174.7456809,76.02000.0Oman,56620289.0,
2000.0,2000.0,Export,Oman,World,78.0,Lead and articles thereof,19594.0,,21.0000287,57.0036901,-36.8535712,174.7456809,78.02000.0Oman,2789394.0,
2000.0,2000.0,Export,Oman,World,79.0,Zinc and articles thereof,18010.0,,21.0000287,57.0036901,-36.8535712,174.7456809,79.02000.0Oman,1438887.0,
2000.0,2000.0,Export,Oman,World,80.0,Tin and articles thereof,19701.0,,21.0000287,57.0036901,-36.8535712,174.7456809,80.02000.0Oman,542996.0,
2000.0,2000.0,Export,Oman,World,81.0,"Other base metals, cermets, articles thereof",221069.0,,21.0000287,57.0036901,-36.8535712,174.7456809,81.02000.0Oman,68572.0,
2000.0,2000.0,Export,Oman,World,82.0,"Tools, implements, cutlery, etc of base metal",190588.0,,21.0000287,57.0036901,-36.8535712,174.7456809,82.02000.0Oman,7138452.0,
2000.0,2000.0,Export,Oman,World,83.0,Miscellaneous articles of base metal,1990920.0,,21.0000287,57.0036901,-36.8535712,174.7456809,83.02000.0Oman,20555475.0,
2000.0,2000.0,Export,Oman,World,84.0,"Nuclear reactors, boilers, machinery, etc",82637022.0,,21.0000287,57.0036901,-36.8535712,174.7456809,84.02000.0Oman,689711035.0,
2000.0,2000.0,Export,Oman,World,85.0,"Electrical, electronic equipment",123074384.0,,21.0000287,57.0036901,-36.8535712,174.7456809,85.02000.0Oman,271150790.0,
2000.0,2000.0,Export,Oman,World,86.0,"Railway, tramway locomotives, rolling stock, equipment",76312.0,,21.0000287,57.0036901,-36.8535712,174.7456809,86.02000.0Oman,745906.0,
2000.0,2000.0,Export,Oman,World,87.0,"Vehicles other than railway, tramway",611924899.0,,21.0000287,57.0036901,-36.8535712,174.7456809,87.02000.0Oman,1117290870.0,
2000.0,2000.0,Export,Oman,World,88.0,"Aircraft, spacecraft, and parts thereof",73025203.0,,21.0000287,57.0036901,-36.8535712,174.7456809,88.02000.0Oman,37704210.0,
2000.0,2000.0,Export,Oman,World,89.0,"Ships, boats and other floating structures",13599949.0,,21.0000287,57.0036901,-36.8535712,174.7456809,89.02000.0Oman,54581054.0,
2000.0,2000.0,Export,Oman,World,90.0,"Optical, photo, technical, medical, etc apparatus",12413715.0,,21.0000287,57.0036901,-36.8535712,174.7456809,90.02000.0Oman,63432702.0,
2000.0,2000.0,Export,Oman,World,91.0,Clocks and watches and parts thereof,7520665.0,,21.0000287,57.0036901,-36.8535712,174.7456809,91.02000.0Oman,32397961.0,
2000.0,2000.0,Export,Oman,World,92.0,"Musical instruments, parts and accessories",227152.0,,21.0000287,57.0036901,-36.8535712,174.7456809,92.02000.0Oman,2243823.0,
2000.0,2000.0,Export,Oman,World,93.0,"Arms and ammunition, parts and accessories thereof",116775.0,,21.0000287,57.0036901,-36.8535712,174.7456809,93.02000.0Oman,1592686.0,
2000.0,2000.0,Export,Oman,World,94.0,"Furniture, lighting, signs, prefabricated buildings",32449201.0,,21.0000287,57.0036901,-36.8535712,174.7456809,94.02000.0Oman,47120794.0,
2000.0,2000.0,Export,Oman,World,95.0,"Toys, games, sports requisites",1337623.0,,21.0000287,57.0036901,-36.8535712,174.7456809,95.02000.0Oman,16874792.0,
2000.0,2000.0,Export,Oman,World,96.0,Miscellaneous manufactured articles,1613768.0,,21.0000287,57.0036901,-36.8535712,174.7456809,96.02000.0Oman,8860506.0,
2000.0,2000.0,Export,Oman,World,97.0,"Works of art, collectors pieces and antiques",52257.0,,21.0000287,57.0036901,-36.8535712,174.7456809,97.02000.0Oman,1856299.0,
2000.0,2000.0,Export,Oman,World,99.0,Commodities not elsewhere specified,52067223.0,,21.0000287,57.0036901,-36.8535712,174.7456809,99.02000.0Oman,124636553.0,
