yr,periodDesc,rgDesc,rtTitle,ptTitle,cmdCode,cmdDescE,TradeValue_export,Unnamed: 0_export,rtLat,rtLon,ptLat,ptLon,mid,TradeValue_import,Unnamed: 0_import
2010.0,2010.0,Export,Saudi Arabia,World,1.0,Live animals; animal products,138396706.0,,25.6242618,42.3528328,-36.8535712,174.7456809,1.02010.0Saudi Arabia,593999676.0,
2010.0,2010.0,Export,Saudi Arabia,World,2.0,Meat and edible meat offal,99035857.0,,25.6242618,42.3528328,-36.8535712,174.7456809,2.02010.0Saudi Arabia,1957886181.0,
2010.0,2010.0,Export,Saudi Arabia,World,3.0,"Fish and crustaceans, molluscs and other acquatic invertebrates",117728947.0,,25.6242618,42.3528328,-36.8535712,174.7456809,3.02010.0Saudi Arabia,224209880.0,
2010.0,2010.0,Export,Saudi Arabia,World,4.0,"Dairy produce; birds' eggs; natural honey; edible products of animal origin, not elsewhere specified or included",910924605.0,,25.6242618,42.3528328,-36.8535712,174.7456809,4.02010.0Saudi Arabia,1464993831.0,
2010.0,2010.0,Export,Saudi Arabia,World,5.0,"Products of animal origin, not elsewhere specified or included",568801.0,,25.6242618,42.3528328,-36.8535712,174.7456809,5.02010.0Saudi Arabia,4269872.0,
2010.0,2010.0,Export,Saudi Arabia,World,6.0,"Live trees and other plants; bulbs, roots and the like; cut flowers and ornamental foliage",8944278.0,,25.6242618,42.3528328,-36.8535712,174.7456809,6.02010.0Saudi Arabia,19840825.0,
2010.0,2010.0,Export,Saudi Arabia,World,7.0,Edible vegetables and certain roots and tubers,161312468.0,,25.6242618,42.3528328,-36.8535712,174.7456809,7.02010.0Saudi Arabia,436832013.0,
2010.0,2010.0,Export,Saudi Arabia,World,8.0,Edible fruit and nuts; peel of citrus fruit or melons,140598842.0,,25.6242618,42.3528328,-36.8535712,174.7456809,8.02010.0Saudi Arabia,894534452.0,
2010.0,2010.0,Export,Saudi Arabia,World,9.0,"Coffee, tea, maté and spices",27505634.0,,25.6242618,42.3528328,-36.8535712,174.7456809,9.02010.0Saudi Arabia,610447163.0,
2010.0,2010.0,Export,Saudi Arabia,World,10.0,Cereals,11900548.0,,25.6242618,42.3528328,-36.8535712,174.7456809,10.02010.0Saudi Arabia,4102456861.0,
2010.0,2010.0,Export,Saudi Arabia,World,11.0,Products of the milling industry; malt; starches; inulin; wheat gluten,9844279.0,,25.6242618,42.3528328,-36.8535712,174.7456809,11.02010.0Saudi Arabia,113146541.0,
2010.0,2010.0,Export,Saudi Arabia,World,12.0,"Oil seeds and oleaginous fruits; miscellaneous grains, seeds and fruit; industrial or medicinal plants; straw and fodder",1050935.0,,25.6242618,42.3528328,-36.8535712,174.7456809,12.02010.0Saudi Arabia,366950059.0,
2010.0,2010.0,Export,Saudi Arabia,World,13.0,"Lac; gums, resins and other vegetable saps and extracts",2281336.0,,25.6242618,42.3528328,-36.8535712,174.7456809,13.02010.0Saudi Arabia,32685108.0,
2010.0,2010.0,Export,Saudi Arabia,World,14.0,Vegetable plaiting materials; vegetable products not elsewhere specified or included,480001.0,,25.6242618,42.3528328,-36.8535712,174.7456809,14.02010.0Saudi Arabia,3524538.0,
2010.0,2010.0,Export,Saudi Arabia,World,15.0,Animal or vegetable fats and oils and their cleavage products; prepared edible fats; animal or vegetable waxes,179397558.0,,25.6242618,42.3528328,-36.8535712,174.7456809,15.02010.0Saudi Arabia,731301447.0,
2010.0,2010.0,Export,Saudi Arabia,World,16.0,"Preparations of meat, of fish or of crustaceans, molluscs or other aquatic invertebrates",39934983.0,,25.6242618,42.3528328,-36.8535712,174.7456809,16.02010.0Saudi Arabia,172187949.0,
2010.0,2010.0,Export,Saudi Arabia,World,17.0,Sugars and sugar confectionery,300746243.0,,25.6242618,42.3528328,-36.8535712,174.7456809,17.02010.0Saudi Arabia,1002465253.0,
2010.0,2010.0,Export,Saudi Arabia,World,18.0,Cocoa and cocoa preparations,25378432.0,,25.6242618,42.3528328,-36.8535712,174.7456809,18.02010.0Saudi Arabia,331842815.0,
2010.0,2010.0,Export,Saudi Arabia,World,19.0,"Preparations of cereals, flour, starch or milk; pastrycooks' products",287277159.0,,25.6242618,42.3528328,-36.8535712,174.7456809,19.02010.0Saudi Arabia,792359924.0,
2010.0,2010.0,Export,Saudi Arabia,World,20.0,"Preparations of vegetables, fruit, nuts or other parts of plants",312583324.0,,25.6242618,42.3528328,-36.8535712,174.7456809,20.02010.0Saudi Arabia,596544212.0,
2010.0,2010.0,Export,Saudi Arabia,World,21.0,Miscellaneous edible preparations,53693134.0,,25.6242618,42.3528328,-36.8535712,174.7456809,21.02010.0Saudi Arabia,992316707.0,
2010.0,2010.0,Export,Saudi Arabia,World,22.0,"Beverages, spirits and vinegar",191210906.0,,25.6242618,42.3528328,-36.8535712,174.7456809,22.02010.0Saudi Arabia,170118346.0,
2010.0,2010.0,Export,Saudi Arabia,World,23.0,Residues and waste from the food industries; prepared animal fodder,2849337.0,,25.6242618,42.3528328,-36.8535712,174.7456809,23.02010.0Saudi Arabia,353760976.0,
2010.0,2010.0,Export,Saudi Arabia,World,24.0,Tobacco and manufactured tobacco substitutes,698668.0,,25.6242618,42.3528328,-36.8535712,174.7456809,24.02010.0Saudi Arabia,694318468.0,
2010.0,2010.0,Export,Saudi Arabia,World,25.0,"Salt; sulphur; earths and stone; plastering materials, lime and cement",248797644.0,,25.6242618,42.3528328,-36.8535712,174.7456809,25.02010.0Saudi Arabia,214784002.0,
2010.0,2010.0,Export,Saudi Arabia,World,26.0,"Ores, slag and ash",26311766.0,,25.6242618,42.3528328,-36.8535712,174.7456809,26.02010.0Saudi Arabia,1510449888.0,
2010.0,2010.0,Export,Saudi Arabia,World,27.0,"Mineral fuels, mineral oils and products of their distillation; bituminous substances; mineral waxes",215247457859.0,,25.6242618,42.3528328,-36.8535712,174.7456809,27.02010.0Saudi Arabia,236434429.0,
2010.0,2010.0,Export,Saudi Arabia,World,28.0,"Inorganic chemicals; organic or inorganic compounds of precious metals, of rare-earth metals, of radioactive elements or of isotopes",304313714.0,,25.6242618,42.3528328,-36.8535712,174.7456809,28.02010.0Saudi Arabia,532923866.0,
2010.0,2010.0,Export,Saudi Arabia,World,29.0,Organic chemicals,7434980227.0,,25.6242618,42.3528328,-36.8535712,174.7456809,29.02010.0Saudi Arabia,1530430180.0,
2010.0,2010.0,Export,Saudi Arabia,World,30.0,Pharmaceutical products,232414424.0,,25.6242618,42.3528328,-36.8535712,174.7456809,30.02010.0Saudi Arabia,3342529245.0,
2010.0,2010.0,Export,Saudi Arabia,World,31.0,Fertilisers,1249532229.0,,25.6242618,42.3528328,-36.8535712,174.7456809,31.02010.0Saudi Arabia,62009411.0,
2010.0,2010.0,Export,Saudi Arabia,World,32.0,"Tanning or dyeing extracts; tannins and their derivatives; dyes, pigments and other colouring matter; paints and varnishes; putty and other mastics; inks",386593550.0,,25.6242618,42.3528328,-36.8535712,174.7456809,32.02010.0Saudi Arabia,467881652.0,
2010.0,2010.0,Export,Saudi Arabia,World,33.0,"Essential oils and resinoids; perfumery, cosmetic or toilet preparations",264233664.0,,25.6242618,42.3528328,-36.8535712,174.7456809,33.02010.0Saudi Arabia,1103454446.0,
2010.0,2010.0,Export,Saudi Arabia,World,34.0,"Soap, organic surface-active agents, washing preparations, lubricating preparations, artificialwaxes, prepared waxes, polishing or scouring preparations, candles and similar articles, modelling pastes, dental waxes and dental preparations with a basis o",520580117.0,,25.6242618,42.3528328,-36.8535712,174.7456809,34.02010.0Saudi Arabia,310617455.0,
2010.0,2010.0,Export,Saudi Arabia,World,35.0,Albuminoidal substances; modified starches; glues; enzymes,40997385.0,,25.6242618,42.3528328,-36.8535712,174.7456809,35.02010.0Saudi Arabia,140250309.0,
2010.0,2010.0,Export,Saudi Arabia,World,36.0,Explosives; pyrotechnic products; matches; pyrophoric alloys; certain combustible preparations,3774138.0,,25.6242618,42.3528328,-36.8535712,174.7456809,36.02010.0Saudi Arabia,17012288.0,
2010.0,2010.0,Export,Saudi Arabia,World,37.0,Photographic or cinematographic goods,24079763.0,,25.6242618,42.3528328,-36.8535712,174.7456809,37.02010.0Saudi Arabia,53390200.0,
2010.0,2010.0,Export,Saudi Arabia,World,38.0,Miscellaneous chemical products,372745533.0,,25.6242618,42.3528328,-36.8535712,174.7456809,38.02010.0Saudi Arabia,1539732058.0,
2010.0,2010.0,Export,Saudi Arabia,World,39.0,Plastics and articles thereof,11302591995.0,,25.6242618,42.3528328,-36.8535712,174.7456809,39.02010.0Saudi Arabia,2162387503.0,
2010.0,2010.0,Export,Saudi Arabia,World,40.0,Rubber and articles thereof,45437923.0,,25.6242618,42.3528328,-36.8535712,174.7456809,40.02010.0Saudi Arabia,1589721454.0,
2010.0,2010.0,Export,Saudi Arabia,World,41.0,Raw hides and skins(other than furskins) and leather,117526814.0,,25.6242618,42.3528328,-36.8535712,174.7456809,41.02010.0Saudi Arabia,736801.0,
2010.0,2010.0,Export,Saudi Arabia,World,42.0,"Articles of leather; saddlery and harness; travel goods, handbags and similar containers; articles of animal gut (other than silk-worm gut)",2457603.0,,25.6242618,42.3528328,-36.8535712,174.7456809,42.02010.0Saudi Arabia,254005384.0,
2010.0,2010.0,Export,Saudi Arabia,World,43.0,Furskins and artificial fur; manufactures thereof,1450402.0,,25.6242618,42.3528328,-36.8535712,174.7456809,43.02010.0Saudi Arabia,1145335.0,
2010.0,2010.0,Export,Saudi Arabia,World,44.0,Wood and articles of wood; wood charcoal,35137111.0,,25.6242618,42.3528328,-36.8535712,174.7456809,44.02010.0Saudi Arabia,1175159602.0,
2010.0,2010.0,Export,Saudi Arabia,World,45.0,Cork and articles of cork,124533.0,,25.6242618,42.3528328,-36.8535712,174.7456809,45.02010.0Saudi Arabia,2975204.0,
2010.0,2010.0,Export,Saudi Arabia,World,46.0,"Manufactures of straw, of esparto or of other plaiting materials; basketware and wickerwork",243467.0,,25.6242618,42.3528328,-36.8535712,174.7456809,46.02010.0Saudi Arabia,8571477.0,
2010.0,2010.0,Export,Saudi Arabia,World,47.0,Pulp of wood or of other fibrous cellulosic material; recovered (waste and scrap) of paper or paperboard,25149631.0,,25.6242618,42.3528328,-36.8535712,174.7456809,47.02010.0Saudi Arabia,89004645.0,
2010.0,2010.0,Export,Saudi Arabia,World,48.0,"Paper and paperboard; articles of paper pulp, of paper or of paperboard",964094538.0,,25.6242618,42.3528328,-36.8535712,174.7456809,48.02010.0Saudi Arabia,1449155678.0,
2010.0,2010.0,Export,Saudi Arabia,World,49.0,"Printed books, newspapers, pictures and other products of the printing industry; manuscripts, typescripts and plans",16474421.0,,25.6242618,42.3528328,-36.8535712,174.7456809,49.02010.0Saudi Arabia,125558824.0,
2010.0,2010.0,Export,Saudi Arabia,World,50.0,Silk,154134.0,,25.6242618,42.3528328,-36.8535712,174.7456809,50.02010.0Saudi Arabia,6802142.0,
2010.0,2010.0,Export,Saudi Arabia,World,51.0,"Wool, fine or coarse animal hair; horsehair yarn and woven fabric",6080808.0,,25.6242618,42.3528328,-36.8535712,174.7456809,51.02010.0Saudi Arabia,23067762.0,
2010.0,2010.0,Export,Saudi Arabia,World,52.0,Cotton,1581602.0,,25.6242618,42.3528328,-36.8535712,174.7456809,52.02010.0Saudi Arabia,37422980.0,
2010.0,2010.0,Export,Saudi Arabia,World,53.0,Other vegetable textile fibres; paper yarn and woven fabrics of paper yarn,66667.0,,25.6242618,42.3528328,-36.8535712,174.7456809,53.02010.0Saudi Arabia,27754435.0,
2010.0,2010.0,Export,Saudi Arabia,World,54.0,Man-made filaments; strip and the like of man-made textile materials,62306211.0,,25.6242618,42.3528328,-36.8535712,174.7456809,54.02010.0Saudi Arabia,362615120.0,
2010.0,2010.0,Export,Saudi Arabia,World,55.0,Man-made staple fibres,24008297.0,,25.6242618,42.3528328,-36.8535712,174.7456809,55.02010.0Saudi Arabia,228017885.0,
2010.0,2010.0,Export,Saudi Arabia,World,57.0,Carpets and other textile floor coverings,170372746.0,,25.6242618,42.3528328,-36.8535712,174.7456809,57.02010.0Saudi Arabia,169349545.0,
2010.0,2010.0,Export,Saudi Arabia,World,58.0,Special woven fabrics; tufted textile fabrics; lace; tapestries; trimmings; embroidery,962935.0,,25.6242618,42.3528328,-36.8535712,174.7456809,58.02010.0Saudi Arabia,57222472.0,
2010.0,2010.0,Export,Saudi Arabia,World,59.0,"Impregnated, coated, covered or laminated textile fabrics; textile articles of a kind suitable for industrial use",4760539.0,,25.6242618,42.3528328,-36.8535712,174.7456809,59.02010.0Saudi Arabia,52741933.0,
2010.0,2010.0,Export,Saudi Arabia,World,60.0,Knitted or crocheted fabrics,4207472.0,,25.6242618,42.3528328,-36.8535712,174.7456809,60.02010.0Saudi Arabia,7244542.0,
2010.0,2010.0,Export,Saudi Arabia,World,61.0,"Articles of apparel and clothing accessories, knitted or crocheted",4807739.0,,25.6242618,42.3528328,-36.8535712,174.7456809,61.02010.0Saudi Arabia,534641735.0,
2010.0,2010.0,Export,Saudi Arabia,World,62.0,"Articles of apparel and clothing accessories, not knitted or crocheted",83239571.0,,25.6242618,42.3528328,-36.8535712,174.7456809,62.02010.0Saudi Arabia,1482875187.0,
2010.0,2010.0,Export,Saudi Arabia,World,63.0,Other made up textile articles; sets; worn clothing and worn textile articles; rags,45156590.0,,25.6242618,42.3528328,-36.8535712,174.7456809,63.02010.0Saudi Arabia,250255779.0,
2010.0,2010.0,Export,Saudi Arabia,World,64.0,"Footwear, gaiters and the like; parts of such articles",4921073.0,,25.6242618,42.3528328,-36.8535712,174.7456809,64.02010.0Saudi Arabia,420441592.0,
2010.0,2010.0,Export,Saudi Arabia,World,65.0,Headgear and parts thereof,5101340.0,,25.6242618,42.3528328,-36.8535712,174.7456809,65.02010.0Saudi Arabia,69467287.0,
2010.0,2010.0,Export,Saudi Arabia,World,66.0,"Umbrella, sun umbrellas, walking-sticks, seat-sticks, whips, riding-crops and parts thereof",184000.0,,25.6242618,42.3528328,-36.8535712,174.7456809,66.02010.0Saudi Arabia,4560006.0,
2010.0,2010.0,Export,Saudi Arabia,World,68.0,"Articles of stone, plaster, cement, asbestos, mica or similar materials",177282355.0,,25.6242618,42.3528328,-36.8535712,174.7456809,68.02010.0Saudi Arabia,338884690.0,
2010.0,2010.0,Export,Saudi Arabia,World,69.0,Ceramic products,33696309.0,,25.6242618,42.3528328,-36.8535712,174.7456809,69.02010.0Saudi Arabia,662074694.0,
2010.0,2010.0,Export,Saudi Arabia,World,70.0,Glass and glassware,189549837.0,,25.6242618,42.3528328,-36.8535712,174.7456809,70.02010.0Saudi Arabia,467334984.0,
2010.0,2010.0,Export,Saudi Arabia,World,71.0,"Natural or cultured pearls, precious or semi-precious stones, precious metals, metals cladwith precious metal, and articles thereof; imitation jewellery; coin",530976664.0,,25.6242618,42.3528328,-36.8535712,174.7456809,71.02010.0Saudi Arabia,1272258124.0,
2010.0,2010.0,Export,Saudi Arabia,World,72.0,Iron and steel,656878688.0,,25.6242618,42.3528328,-36.8535712,174.7456809,72.02010.0Saudi Arabia,4607200159.0,
2010.0,2010.0,Export,Saudi Arabia,World,73.0,Articles of iron or steel,850061329.0,,25.6242618,42.3528328,-36.8535712,174.7456809,73.02010.0Saudi Arabia,3968634561.0,
2010.0,2010.0,Export,Saudi Arabia,World,74.0,Copper and articles thereof,77316630.0,,25.6242618,42.3528328,-36.8535712,174.7456809,74.02010.0Saudi Arabia,2083818871.0,
2010.0,2010.0,Export,Saudi Arabia,World,75.0,Nickel and articles thereof,9875212.0,,25.6242618,42.3528328,-36.8535712,174.7456809,75.02010.0Saudi Arabia,11368014.0,
2010.0,2010.0,Export,Saudi Arabia,World,76.0,Aluminum and articles thereof,506839034.0,,25.6242618,42.3528328,-36.8535712,174.7456809,76.02010.0Saudi Arabia,1407278292.0,
2010.0,2010.0,Export,Saudi Arabia,World,78.0,Lead and articles thereof,8794144.0,,25.6242618,42.3528328,-36.8535712,174.7456809,78.02010.0Saudi Arabia,35399244.0,
2010.0,2010.0,Export,Saudi Arabia,World,79.0,Zinc and articles thereof,10737080.0,,25.6242618,42.3528328,-36.8535712,174.7456809,79.02010.0Saudi Arabia,156595129.0,
2010.0,2010.0,Export,Saudi Arabia,World,80.0,Tin and articles thereof,1095201.0,,25.6242618,42.3528328,-36.8535712,174.7456809,80.02010.0Saudi Arabia,9048545.0,
2010.0,2010.0,Export,Saudi Arabia,World,81.0,Other base metals; cermets; articles thereof,373067.0,,25.6242618,42.3528328,-36.8535712,174.7456809,81.02010.0Saudi Arabia,11536814.0,
2010.0,2010.0,Export,Saudi Arabia,World,82.0,"Tools, implements, cutlery, spoons and forks, of base metal; parts thereof of base metal",8300277.0,,25.6242618,42.3528328,-36.8535712,174.7456809,82.02010.0Saudi Arabia,296924371.0,
2010.0,2010.0,Export,Saudi Arabia,World,83.0,Miscellaneous articles of base metal,91547581.0,,25.6242618,42.3528328,-36.8535712,174.7456809,83.02010.0Saudi Arabia,395413294.0,
2010.0,2010.0,Export,Saudi Arabia,World,84.0,"Nuclear reactors, boilers, machinery and mechanical appliances; parts thereof",1473515175.0,,25.6242618,42.3528328,-36.8535712,174.7456809,84.02010.0Saudi Arabia,15876736379.0,
2010.0,2010.0,Export,Saudi Arabia,World,85.0,"Electrical machinery and equipment and parts thereof; sound recorders and reproducers, television image and sound recorders and reproducers, and parts and accessories of such articles",1033719959.0,,25.6242618,42.3528328,-36.8535712,174.7456809,85.02010.0Saudi Arabia,10104444897.0,
2010.0,2010.0,Export,Saudi Arabia,World,86.0,"Railway or tramway locomotives, rolling-stock and parts thereof; railway or tramway track fixtures and fittings and parts thereof; mechanical (including electro-mechanical) traffic signalling equipment of all kinds",2554403.0,,25.6242618,42.3528328,-36.8535712,174.7456809,86.02010.0Saudi Arabia,435581878.0,
2010.0,2010.0,Export,Saudi Arabia,World,87.0,"Vehicles other than railway or tramway rolling-stock, and parts and accessories thereof",1198456431.0,,25.6242618,42.3528328,-36.8535712,174.7456809,87.02010.0Saudi Arabia,15604570172.0,
2010.0,2010.0,Export,Saudi Arabia,World,88.0,"Aircraft, spacecraft, and parts thereof",326273475.0,,25.6242618,42.3528328,-36.8535712,174.7456809,88.02010.0Saudi Arabia,2184254997.0,
2010.0,2010.0,Export,Saudi Arabia,World,89.0,"Ships, boats and floating structures",631268256.0,,25.6242618,42.3528328,-36.8535712,174.7456809,89.02010.0Saudi Arabia,667073367.0,
2010.0,2010.0,Export,Saudi Arabia,World,90.0,"Optical, photographic, cinematographic, measuring, checking, precision, medical or surgical instruments and apparatus; parts and accessories thereof",138531106.0,,25.6242618,42.3528328,-36.8535712,174.7456809,90.02010.0Saudi Arabia,2354705343.0,
2010.0,2010.0,Export,Saudi Arabia,World,91.0,Clocks and watches and parts thereof,9175478.0,,25.6242618,42.3528328,-36.8535712,174.7456809,91.02010.0Saudi Arabia,353667909.0,
2010.0,2010.0,Export,Saudi Arabia,World,94.0,"Furniture; bedding, mattresses, mattress supports, cushions and similar stuffed furnishings; lamps and lighting fittings, not elsewhere specified or included; illuminated signs, illuminated name-plates and the like; prefabricated buildings",149586054.0,,25.6242618,42.3528328,-36.8535712,174.7456809,94.02010.0Saudi Arabia,1230829005.0,
2010.0,2010.0,Export,Saudi Arabia,World,95.0,"Toys, games and sports requisites; parts and accessories thereof",5307473.0,,25.6242618,42.3528328,-36.8535712,174.7456809,95.02010.0Saudi Arabia,359389783.0,
2010.0,2010.0,Export,Saudi Arabia,World,96.0,Miscellaneous manufactured articles,2633603.0,,25.6242618,42.3528328,-36.8535712,174.7456809,96.02010.0Saudi Arabia,244274439.0,
2010.0,2010.0,Export,Saudi Arabia,World,97.0,"Works of art, collectors' pieces and antiques",3605605.0,,25.6242618,42.3528328,-36.8535712,174.7456809,97.02010.0Saudi Arabia,10509346.0,
2010.0,2010.0,Export,Saudi Arabia,World,99.0,Commodities not specified according to kind,46729392.0,,25.6242618,42.3528328,-36.8535712,174.7456809,99.02010.0Saudi Arabia,15138952.0,
