yr,periodDesc,rgDesc,rtTitle,ptTitle,cmdCode,cmdDescE,TradeValue_export,Unnamed: 0_export,rtLat,rtLon,ptLat,ptLon,mid,TradeValue_import,Unnamed: 0_import
2020.0,2020.0,Export,Mauritania,World,1.0,Animals; live,174.0,,20.2540382,-9.2399263,-36.8535712,174.7456809,1.02020.0Mauritania,65437.0,
2020.0,2020.0,Export,Mauritania,World,2.0,Meat and edible meat offal,32228.0,,20.2540382,-9.2399263,-36.8535712,174.7456809,2.02020.0Mauritania,23945893.0,
2020.0,2020.0,Export,Mauritania,World,3.0,"Fish and crustaceans, molluscs and other aquatic invertebrates",635746600.0,,20.2540382,-9.2399263,-36.8535712,174.7456809,3.02020.0Mauritania,823941.0,
2020.0,2020.0,Export,Mauritania,World,25.0,"Salt; sulphur; earths, stone; plastering materials, lime and cement",4034233.0,,20.2540382,-9.2399263,-36.8535712,174.7456809,25.02020.0Mauritania,41475835.0,
2020.0,2020.0,Export,Mauritania,World,26.0,"Ores, slag and ash",1190426333.0,,20.2540382,-9.2399263,-36.8535712,174.7456809,26.02020.0Mauritania,2059061.0,
2020.0,2020.0,Export,Mauritania,World,27.0,"Mineral fuels, mineral oils and products of their distillation; bituminous substances; mineral waxes",9520238.0,,20.2540382,-9.2399263,-36.8535712,174.7456809,27.02020.0Mauritania,795084439.0,
2020.0,2020.0,Export,Mauritania,World,28.0,"Inorganic chemicals; organic and inorganic compounds of precious metals; of rare earth metals, of radio-active elements and of isotopes",28081542.0,,20.2540382,-9.2399263,-36.8535712,174.7456809,28.02020.0Mauritania,36246837.0,
2020.0,2020.0,Export,Mauritania,World,29.0,Organic chemicals,61265.0,,20.2540382,-9.2399263,-36.8535712,174.7456809,29.02020.0Mauritania,7049546.0,
2020.0,2020.0,Export,Mauritania,World,30.0,Pharmaceutical products,134.0,,20.2540382,-9.2399263,-36.8535712,174.7456809,30.02020.0Mauritania,42551721.0,
2020.0,2020.0,Export,Mauritania,World,31.0,Fertilizers,5234084.0,,20.2540382,-9.2399263,-36.8535712,174.7456809,31.02020.0Mauritania,17554829.0,
2020.0,2020.0,Export,Mauritania,World,33.0,"Essential oils and resinoids; perfumery, cosmetic or toilet preparations",99.0,,20.2540382,-9.2399263,-36.8535712,174.7456809,33.02020.0Mauritania,2290088.0,
2020.0,2020.0,Export,Mauritania,World,34.0,"Soap, organic surface-active agents; washing, lubricating, polishing or scouring preparations; artificial or prepared waxes, candles and similar articles, modelling pastes, dental waxes and dental preparations with a basis of plaster",27071.0,,20.2540382,-9.2399263,-36.8535712,174.7456809,34.02020.0Mauritania,12240080.0,
2020.0,2020.0,Export,Mauritania,World,35.0,Albuminoidal substances; modified starches; glues; enzymes,935.0,,20.2540382,-9.2399263,-36.8535712,174.7456809,35.02020.0Mauritania,1637814.0,
2020.0,2020.0,Export,Mauritania,World,36.0,Explosives; pyrotechnic products; matches; pyrophoric alloys; certain combustible preparations,476010.0,,20.2540382,-9.2399263,-36.8535712,174.7456809,36.02020.0Mauritania,4833338.0,
2020.0,2020.0,Export,Mauritania,World,38.0,Chemical products n.e.c.,3147565.0,,20.2540382,-9.2399263,-36.8535712,174.7456809,38.02020.0Mauritania,8457740.0,
2020.0,2020.0,Export,Mauritania,World,39.0,Plastics and articles thereof,3097553.0,,20.2540382,-9.2399263,-36.8535712,174.7456809,39.02020.0Mauritania,43638369.0,
2020.0,2020.0,Export,Mauritania,World,40.0,Rubber and articles thereof,243399.0,,20.2540382,-9.2399263,-36.8535712,174.7456809,40.02020.0Mauritania,37108860.0,
2020.0,2020.0,Export,Mauritania,World,41.0,Raw hides and skins (other than furskins) and leather,249736.0,,20.2540382,-9.2399263,-36.8535712,174.7456809,41.02020.0Mauritania,9013.0,
2020.0,2020.0,Export,Mauritania,World,42.0,"Articles of leather; saddlery and harness; travel goods, handbags and similar containers; articles of animal gut (other than silk-worm gut)",1145.0,,20.2540382,-9.2399263,-36.8535712,174.7456809,42.02020.0Mauritania,3553718.0,
2020.0,2020.0,Export,Mauritania,World,44.0,Wood and articles of wood; wood charcoal,112210.0,,20.2540382,-9.2399263,-36.8535712,174.7456809,44.02020.0Mauritania,5608605.0,
2020.0,2020.0,Export,Mauritania,World,48.0,"Paper and paperboard; articles of paper pulp, of paper or paperboard",382345.0,,20.2540382,-9.2399263,-36.8535712,174.7456809,48.02020.0Mauritania,20882862.0,
2020.0,2020.0,Export,Mauritania,World,49.0,"Printed books, newspapers, pictures and other products of the printing industry; manuscripts, typescripts and plans",4709.0,,20.2540382,-9.2399263,-36.8535712,174.7456809,49.02020.0Mauritania,3062250.0,
2020.0,2020.0,Export,Mauritania,World,52.0,Cotton,22721.0,,20.2540382,-9.2399263,-36.8535712,174.7456809,52.02020.0Mauritania,9693382.0,
2020.0,2020.0,Export,Mauritania,World,56.0,"Wadding, felt and nonwovens, special yarns; twine, cordage, ropes and cables and articles thereof",246650.0,,20.2540382,-9.2399263,-36.8535712,174.7456809,56.02020.0Mauritania,1923610.0,
2020.0,2020.0,Export,Mauritania,World,61.0,Apparel and clothing accessories; knitted or crocheted,1747.0,,20.2540382,-9.2399263,-36.8535712,174.7456809,61.02020.0Mauritania,3697470.0,
2020.0,2020.0,Export,Mauritania,World,62.0,Apparel and clothing accessories; not knitted or crocheted,409908.0,,20.2540382,-9.2399263,-36.8535712,174.7456809,62.02020.0Mauritania,6840738.0,
2020.0,2020.0,Export,Mauritania,World,63.0,"Textiles, made up articles; sets; worn clothing and worn textile articles; rags",155631.0,,20.2540382,-9.2399263,-36.8535712,174.7456809,63.02020.0Mauritania,13070417.0,
2020.0,2020.0,Export,Mauritania,World,64.0,Footwear; gaiters and the like; parts of such articles,4987.0,,20.2540382,-9.2399263,-36.8535712,174.7456809,64.02020.0Mauritania,5236185.0,
2020.0,2020.0,Export,Mauritania,World,68.0,"Stone, plaster, cement, asbestos, mica or similar materials; articles thereof",314.0,,20.2540382,-9.2399263,-36.8535712,174.7456809,68.02020.0Mauritania,4795231.0,
2020.0,2020.0,Export,Mauritania,World,69.0,Ceramic products,255.0,,20.2540382,-9.2399263,-36.8535712,174.7456809,69.02020.0Mauritania,16769347.0,
2020.0,2020.0,Export,Mauritania,World,70.0,Glass and glassware,172.0,,20.2540382,-9.2399263,-36.8535712,174.7456809,70.02020.0Mauritania,4320757.0,
2020.0,2020.0,Export,Mauritania,World,71.0,"Natural, cultured pearls; precious, semi-precious stones; precious metals, metals clad with precious metal, and articles thereof; imitation jewellery; coin",738328139.0,,20.2540382,-9.2399263,-36.8535712,174.7456809,71.02020.0Mauritania,152412.0,
2020.0,2020.0,Export,Mauritania,World,72.0,Iron and steel,173414.0,,20.2540382,-9.2399263,-36.8535712,174.7456809,72.02020.0Mauritania,38062743.0,
2020.0,2020.0,Export,Mauritania,World,73.0,Iron or steel articles,961475.0,,20.2540382,-9.2399263,-36.8535712,174.7456809,73.02020.0Mauritania,110753307.0,
2020.0,2020.0,Export,Mauritania,World,75.0,Nickel and articles thereof,476.0,,20.2540382,-9.2399263,-36.8535712,174.7456809,75.02020.0Mauritania,65301.0,
2020.0,2020.0,Export,Mauritania,World,76.0,Aluminium and articles thereof,52891.0,,20.2540382,-9.2399263,-36.8535712,174.7456809,76.02020.0Mauritania,13289280.0,
2020.0,2020.0,Export,Mauritania,World,78.0,Lead and articles thereof,433980.0,,20.2540382,-9.2399263,-36.8535712,174.7456809,78.02020.0Mauritania,15394.0,
2020.0,2020.0,Export,Mauritania,World,82.0,"Tools, implements, cutlery, spoons and forks, of base metal; parts thereof, of base metal",89798.0,,20.2540382,-9.2399263,-36.8535712,174.7456809,82.02020.0Mauritania,8879187.0,
2020.0,2020.0,Export,Mauritania,World,84.0,"Nuclear reactors, boilers, machinery and mechanical appliances; parts thereof",13303202.0,,20.2540382,-9.2399263,-36.8535712,174.7456809,84.02020.0Mauritania,311886718.0,
2020.0,2020.0,Export,Mauritania,World,85.0,"Electrical machinery and equipment and parts thereof; sound recorders and reproducers; television image and sound recorders and reproducers, parts and accessories of such articles",1753298.0,,20.2540382,-9.2399263,-36.8535712,174.7456809,85.02020.0Mauritania,87217980.0,
2020.0,2020.0,Export,Mauritania,World,86.0,"Railway, tramway locomotives, rolling-stock and parts thereof; railway or tramway track fixtures and fittings and parts thereof; mechanical (including electro-mechanical) traffic signalling equipment of all kinds",115098.0,,20.2540382,-9.2399263,-36.8535712,174.7456809,86.02020.0Mauritania,6489560.0,
2020.0,2020.0,Export,Mauritania,World,87.0,"Vehicles; other than railway or tramway rolling stock, and parts and accessories thereof",3468617.0,,20.2540382,-9.2399263,-36.8535712,174.7456809,87.02020.0Mauritania,140433145.0,
2020.0,2020.0,Export,Mauritania,World,88.0,"Aircraft, spacecraft and parts thereof",570828.0,,20.2540382,-9.2399263,-36.8535712,174.7456809,88.02020.0Mauritania,570084.0,
2020.0,2020.0,Export,Mauritania,World,89.0,"Ships, boats and floating structures",2366.0,,20.2540382,-9.2399263,-36.8535712,174.7456809,89.02020.0Mauritania,801353.0,
2020.0,2020.0,Export,Mauritania,World,90.0,"Optical, photographic, cinematographic, measuring, checking, medical or surgical instruments and apparatus; parts and accessories",303799.0,,20.2540382,-9.2399263,-36.8535712,174.7456809,90.02020.0Mauritania,15988323.0,
2020.0,2020.0,Export,Mauritania,World,94.0,"Furniture; bedding, mattresses, mattress supports, cushions and similar stuffed furnishings; lamps and lighting fittings, n.e.c.; illuminated signs, illuminated name-plates and the like; prefabricated buildings",1344.0,,20.2540382,-9.2399263,-36.8535712,174.7456809,94.02020.0Mauritania,6784675.0,
2020.0,2020.0,Export,Mauritania,World,96.0,Miscellaneous manufactured articles,3346.0,,20.2540382,-9.2399263,-36.8535712,174.7456809,96.02020.0Mauritania,6466748.0,
