yr,periodDesc,rgDesc,rtTitle,ptTitle,cmdCode,cmdDescE,TradeValue_export,Unnamed: 0_export,rtLat,rtLon,ptLat,ptLon,mid,TradeValue_import,Unnamed: 0_import
1994.0,1994.0,Export,Turkey,World,2.0,Meat and edible meat offal,35041037.0,,38.9597594,34.9249653,-36.8535712,174.7456809,2.01994.0Turkey,9766029.0,
1994.0,1994.0,Export,Turkey,World,3.0,"Fish, crustaceans, molluscs, aquatic invertebrates ne",48921826.0,,38.9597594,34.9249653,-36.8535712,174.7456809,3.01994.0Turkey,24752947.0,
1994.0,1994.0,Export,Turkey,World,4.0,"Dairy products, eggs, honey, edible animal product nes",21605118.0,,38.9597594,34.9249653,-36.8535712,174.7456809,4.01994.0Turkey,19334919.0,
1994.0,1994.0,Export,Turkey,World,5.0,"Products of animal origin, nes",36187072.0,,38.9597594,34.9249653,-36.8535712,174.7456809,5.01994.0Turkey,6211814.0,
1994.0,1994.0,Export,Turkey,World,6.0,"Live trees, plants, bulbs, roots, cut flowers etc",13346710.0,,38.9597594,34.9249653,-36.8535712,174.7456809,6.01994.0Turkey,6478823.0,
1994.0,1994.0,Export,Turkey,World,7.0,Edible vegetables and certain roots and tubers,339202672.0,,38.9597594,34.9249653,-36.8535712,174.7456809,7.01994.0Turkey,11126792.0,
1994.0,1994.0,Export,Turkey,World,8.0,"Edible fruit, nuts, peel of citrus fruit, melons",1113880592.0,,38.9597594,34.9249653,-36.8535712,174.7456809,8.01994.0Turkey,29544055.0,
1994.0,1994.0,Export,Turkey,World,9.0,"Coffee, tea, mate and spices",46990767.0,,38.9597594,34.9249653,-36.8535712,174.7456809,9.01994.0Turkey,24519440.0,
1994.0,1994.0,Export,Turkey,World,10.0,Cereals,151200696.0,,38.9597594,34.9249653,-36.8535712,174.7456809,10.01994.0Turkey,155045736.0,
1994.0,1994.0,Export,Turkey,World,11.0,"Milling products, malt, starches, inulin, wheat glute",156986273.0,,38.9597594,34.9249653,-36.8535712,174.7456809,11.01994.0Turkey,1040596.0,
1994.0,1994.0,Export,Turkey,World,12.0,"Oil seed, oleagic fruits, grain, seed, fruit, etc, ne",50822210.0,,38.9597594,34.9249653,-36.8535712,174.7456809,12.01994.0Turkey,99703321.0,
1994.0,1994.0,Export,Turkey,World,13.0,"Lac, gums, resins, vegetable saps and extracts nes",2032430.0,,38.9597594,34.9249653,-36.8535712,174.7456809,13.01994.0Turkey,7210552.0,
1994.0,1994.0,Export,Turkey,World,14.0,"Vegetable plaiting materials, vegetable products nes",7938318.0,,38.9597594,34.9249653,-36.8535712,174.7456809,14.01994.0Turkey,1084570.0,
1994.0,1994.0,Export,Turkey,World,15.0,"Animal,vegetable fats and oils, cleavage products, et",274216834.0,,38.9597594,34.9249653,-36.8535712,174.7456809,15.01994.0Turkey,461642193.0,
1994.0,1994.0,Export,Turkey,World,16.0,"Meat, fish and seafood food preparations nes",29461528.0,,38.9597594,34.9249653,-36.8535712,174.7456809,16.01994.0Turkey,1365160.0,
1994.0,1994.0,Export,Turkey,World,17.0,Sugars and sugar confectionery,309978810.0,,38.9597594,34.9249653,-36.8535712,174.7456809,17.01994.0Turkey,10118759.0,
1994.0,1994.0,Export,Turkey,World,18.0,Cocoa and cocoa preparations,48966714.0,,38.9597594,34.9249653,-36.8535712,174.7456809,18.01994.0Turkey,32952865.0,
1994.0,1994.0,Export,Turkey,World,19.0,"Cereal, flour, starch, milk preparations and products",119850858.0,,38.9597594,34.9249653,-36.8535712,174.7456809,19.01994.0Turkey,9710938.0,
1994.0,1994.0,Export,Turkey,World,20.0,"Vegetable, fruit, nut, etc food preparations",495466543.0,,38.9597594,34.9249653,-36.8535712,174.7456809,20.01994.0Turkey,4990403.0,
1994.0,1994.0,Export,Turkey,World,21.0,Miscellaneous edible preparations,50842113.0,,38.9597594,34.9249653,-36.8535712,174.7456809,21.01994.0Turkey,18954485.0,
1994.0,1994.0,Export,Turkey,World,22.0,"Beverages, spirits and vinegar",48565526.0,,38.9597594,34.9249653,-36.8535712,174.7456809,22.01994.0Turkey,13709776.0,
1994.0,1994.0,Export,Turkey,World,23.0,"Residues, wastes of food industry, animal fodder",7836445.0,,38.9597594,34.9249653,-36.8535712,174.7456809,23.01994.0Turkey,85048809.0,
1994.0,1994.0,Export,Turkey,World,24.0,Tobacco and manufactured tobacco substitutes,423635251.0,,38.9597594,34.9249653,-36.8535712,174.7456809,24.01994.0Turkey,139819470.0,
1994.0,1994.0,Export,Turkey,World,25.0,"Salt, sulphur, earth, stone, plaster, lime and cement",360064473.0,,38.9597594,34.9249653,-36.8535712,174.7456809,25.01994.0Turkey,89323066.0,
1994.0,1994.0,Export,Turkey,World,26.0,"Ores, slag and ash",54776402.0,,38.9597594,34.9249653,-36.8535712,174.7456809,26.01994.0Turkey,55456147.0,
1994.0,1994.0,Export,Turkey,World,27.0,"Mineral fuels, oils, distillation products, etc",243849482.0,,38.9597594,34.9249653,-36.8535712,174.7456809,27.01994.0Turkey,3811634955.0,
1994.0,1994.0,Export,Turkey,World,28.0,"Inorganic chemicals, precious metal compound, isotope",150028603.0,,38.9597594,34.9249653,-36.8535712,174.7456809,28.01994.0Turkey,284532930.0,
1994.0,1994.0,Export,Turkey,World,29.0,Organic chemicals,113010213.0,,38.9597594,34.9249653,-36.8535712,174.7456809,29.01994.0Turkey,1028565605.0,
1994.0,1994.0,Export,Turkey,World,30.0,Pharmaceutical products,73090470.0,,38.9597594,34.9249653,-36.8535712,174.7456809,30.01994.0Turkey,203069736.0,
1994.0,1994.0,Export,Turkey,World,31.0,Fertilizers,31986986.0,,38.9597594,34.9249653,-36.8535712,174.7456809,31.01994.0Turkey,169500071.0,
1994.0,1994.0,Export,Turkey,World,32.0,"Tanning, dyeing extracts, tannins, derivs,pigments et",34482777.0,,38.9597594,34.9249653,-36.8535712,174.7456809,32.01994.0Turkey,395379273.0,
1994.0,1994.0,Export,Turkey,World,33.0,"Essential oils, perfumes, cosmetics, toileteries",16645468.0,,38.9597594,34.9249653,-36.8535712,174.7456809,33.01994.0Turkey,83713333.0,
1994.0,1994.0,Export,Turkey,World,34.0,"Soaps, lubricants, waxes, candles, modelling pastes",103829429.0,,38.9597594,34.9249653,-36.8535712,174.7456809,34.01994.0Turkey,90100671.0,
1994.0,1994.0,Export,Turkey,World,35.0,"Albuminoids, modified starches, glues, enzymes",5321969.0,,38.9597594,34.9249653,-36.8535712,174.7456809,35.01994.0Turkey,42829980.0,
1994.0,1994.0,Export,Turkey,World,36.0,"Explosives, pyrotechnics, matches, pyrophorics, etc",3357285.0,,38.9597594,34.9249653,-36.8535712,174.7456809,36.01994.0Turkey,7300716.0,
1994.0,1994.0,Export,Turkey,World,37.0,Photographic or cinematographic goods,349754.0,,38.9597594,34.9249653,-36.8535712,174.7456809,37.01994.0Turkey,80349758.0,
1994.0,1994.0,Export,Turkey,World,38.0,Miscellaneous chemical products,37551990.0,,38.9597594,34.9249653,-36.8535712,174.7456809,38.01994.0Turkey,262337018.0,
1994.0,1994.0,Export,Turkey,World,39.0,Plastics and articles thereof,237206209.0,,38.9597594,34.9249653,-36.8535712,174.7456809,39.01994.0Turkey,760914152.0,
1994.0,1994.0,Export,Turkey,World,40.0,Rubber and articles thereof,245233386.0,,38.9597594,34.9249653,-36.8535712,174.7456809,40.01994.0Turkey,247663112.0,
1994.0,1994.0,Export,Turkey,World,41.0,Raw hides and skins (other than furskins) and leather,25937319.0,,38.9597594,34.9249653,-36.8535712,174.7456809,41.01994.0Turkey,438355556.0,
1994.0,1994.0,Export,Turkey,World,42.0,"Articles of leather, animal gut, harness, travel good",442365213.0,,38.9597594,34.9249653,-36.8535712,174.7456809,42.01994.0Turkey,6506617.0,
1994.0,1994.0,Export,Turkey,World,43.0,"Furskins and artificial fur, manufactures thereof",63693437.0,,38.9597594,34.9249653,-36.8535712,174.7456809,43.01994.0Turkey,16200017.0,
1994.0,1994.0,Export,Turkey,World,44.0,"Wood and articles of wood, wood charcoal",61960291.0,,38.9597594,34.9249653,-36.8535712,174.7456809,44.01994.0Turkey,194690227.0,
1994.0,1994.0,Export,Turkey,World,45.0,Cork and articles of cork,20182.0,,38.9597594,34.9249653,-36.8535712,174.7456809,45.01994.0Turkey,1084592.0,
1994.0,1994.0,Export,Turkey,World,46.0,"Manufactures of plaiting material, basketwork, etc.",48079.0,,38.9597594,34.9249653,-36.8535712,174.7456809,46.01994.0Turkey,848469.0,
1994.0,1994.0,Export,Turkey,World,47.0,"Pulp of wood, fibrous cellulosic material, waste etc",1761792.0,,38.9597594,34.9249653,-36.8535712,174.7456809,47.01994.0Turkey,102242135.0,
1994.0,1994.0,Export,Turkey,World,48.0,"Paper & paperboard, articles of pulp, paper and board",108095886.0,,38.9597594,34.9249653,-36.8535712,174.7456809,48.01994.0Turkey,301712640.0,
1994.0,1994.0,Export,Turkey,World,49.0,"Printed books, newspapers, pictures etc",11611927.0,,38.9597594,34.9249653,-36.8535712,174.7456809,49.01994.0Turkey,79125128.0,
1994.0,1994.0,Export,Turkey,World,50.0,Silk,1295899.0,,38.9597594,34.9249653,-36.8535712,174.7456809,50.01994.0Turkey,3120425.0,
1994.0,1994.0,Export,Turkey,World,51.0,"Wool, animal hair, horsehair yarn and fabric thereof",52748903.0,,38.9597594,34.9249653,-36.8535712,174.7456809,51.01994.0Turkey,125761806.0,
1994.0,1994.0,Export,Turkey,World,52.0,Cotton,601458924.0,,38.9597594,34.9249653,-36.8535712,174.7456809,52.01994.0Turkey,549156040.0,
1994.0,1994.0,Export,Turkey,World,53.0,"Vegetable textile fibres nes, paper yarn, woven fabri",2845597.0,,38.9597594,34.9249653,-36.8535712,174.7456809,53.01994.0Turkey,45715497.0,
1994.0,1994.0,Export,Turkey,World,54.0,manmade filaments,265313725.0,,38.9597594,34.9249653,-36.8535712,174.7456809,54.01994.0Turkey,281994682.0,
1994.0,1994.0,Export,Turkey,World,55.0,manmade staple fibres,439976288.0,,38.9597594,34.9249653,-36.8535712,174.7456809,55.01994.0Turkey,353462586.0,
1994.0,1994.0,Export,Turkey,World,56.0,"Wadding, felt, nonwovens, yarns, twine, cordage, etc",9130816.0,,38.9597594,34.9249653,-36.8535712,174.7456809,56.01994.0Turkey,36184110.0,
1994.0,1994.0,Export,Turkey,World,57.0,Carpets and other textile floor coverings,252527207.0,,38.9597594,34.9249653,-36.8535712,174.7456809,57.01994.0Turkey,4796813.0,
1994.0,1994.0,Export,Turkey,World,58.0,"Special woven or tufted fabric, lace, tapestry etc",108617904.0,,38.9597594,34.9249653,-36.8535712,174.7456809,58.01994.0Turkey,55597899.0,
1994.0,1994.0,Export,Turkey,World,59.0,"Impregnated, coated or laminated textile fabric",70282797.0,,38.9597594,34.9249653,-36.8535712,174.7456809,59.01994.0Turkey,54205861.0,
1994.0,1994.0,Export,Turkey,World,60.0,Knitted or crocheted fabric,140588240.0,,38.9597594,34.9249653,-36.8535712,174.7456809,60.01994.0Turkey,90587972.0,
1994.0,1994.0,Export,Turkey,World,61.0,"Articles of apparel, accessories, knit or crochet",2580709041.0,,38.9597594,34.9249653,-36.8535712,174.7456809,61.01994.0Turkey,9170493.0,
1994.0,1994.0,Export,Turkey,World,62.0,"Articles of apparel, accessories, not knit or crochet",1527153201.0,,38.9597594,34.9249653,-36.8535712,174.7456809,62.01994.0Turkey,19611409.0,
1994.0,1994.0,Export,Turkey,World,63.0,"Other made textile articles, sets, worn clothing etc",382173444.0,,38.9597594,34.9249653,-36.8535712,174.7456809,63.01994.0Turkey,7801914.0,
1994.0,1994.0,Export,Turkey,World,64.0,"Footwear, gaiters and the like, parts thereof",159453316.0,,38.9597594,34.9249653,-36.8535712,174.7456809,64.01994.0Turkey,28158513.0,
1994.0,1994.0,Export,Turkey,World,65.0,Headgear and parts thereof,1857838.0,,38.9597594,34.9249653,-36.8535712,174.7456809,65.01994.0Turkey,1045478.0,
1994.0,1994.0,Export,Turkey,World,66.0,"Umbrellas, walking-sticks, seat-sticks, whips, etc",477949.0,,38.9597594,34.9249653,-36.8535712,174.7456809,66.01994.0Turkey,1840285.0,
1994.0,1994.0,Export,Turkey,World,67.0,"Bird skin, feathers, artificial flowers, human hair",216673.0,,38.9597594,34.9249653,-36.8535712,174.7456809,67.01994.0Turkey,955306.0,
1994.0,1994.0,Export,Turkey,World,68.0,"Stone, plaster, cement, asbestos, mica, etc articles",69204975.0,,38.9597594,34.9249653,-36.8535712,174.7456809,68.01994.0Turkey,39374372.0,
1994.0,1994.0,Export,Turkey,World,69.0,Ceramic products,147948905.0,,38.9597594,34.9249653,-36.8535712,174.7456809,69.01994.0Turkey,74305518.0,
1994.0,1994.0,Export,Turkey,World,70.0,Glass and glassware,199088648.0,,38.9597594,34.9249653,-36.8535712,174.7456809,70.01994.0Turkey,61392642.0,
1994.0,1994.0,Export,Turkey,World,71.0,"Pearls, precious stones, metals, coins, etc",51373224.0,,38.9597594,34.9249653,-36.8535712,174.7456809,71.01994.0Turkey,10108452.0,
1994.0,1994.0,Export,Turkey,World,72.0,Iron and steel,2019381097.0,,38.9597594,34.9249653,-36.8535712,174.7456809,72.01994.0Turkey,1982559738.0,
1994.0,1994.0,Export,Turkey,World,73.0,Articles of iron or steel,332358516.0,,38.9597594,34.9249653,-36.8535712,174.7456809,73.01994.0Turkey,397529552.0,
1994.0,1994.0,Export,Turkey,World,74.0,Copper and articles thereof,100004003.0,,38.9597594,34.9249653,-36.8535712,174.7456809,74.01994.0Turkey,183213892.0,
1994.0,1994.0,Export,Turkey,World,75.0,Nickel and articles thereof,201872.0,,38.9597594,34.9249653,-36.8535712,174.7456809,75.01994.0Turkey,12930929.0,
1994.0,1994.0,Export,Turkey,World,76.0,Aluminium and articles thereof,112779737.0,,38.9597594,34.9249653,-36.8535712,174.7456809,76.01994.0Turkey,185911800.0,
1994.0,1994.0,Export,Turkey,World,78.0,Lead and articles thereof,102600.0,,38.9597594,34.9249653,-36.8535712,174.7456809,78.01994.0Turkey,16753435.0,
1994.0,1994.0,Export,Turkey,World,79.0,Zinc and articles thereof,484628.0,,38.9597594,34.9249653,-36.8535712,174.7456809,79.01994.0Turkey,26048841.0,
1994.0,1994.0,Export,Turkey,World,80.0,Tin and articles thereof,41288.0,,38.9597594,34.9249653,-36.8535712,174.7456809,80.01994.0Turkey,5219106.0,
1994.0,1994.0,Export,Turkey,World,81.0,"Other base metals, cermets, articles thereof",1599146.0,,38.9597594,34.9249653,-36.8535712,174.7456809,81.01994.0Turkey,11970266.0,
1994.0,1994.0,Export,Turkey,World,82.0,"Tools, implements, cutlery, etc of base metal",14991483.0,,38.9597594,34.9249653,-36.8535712,174.7456809,82.01994.0Turkey,66622679.0,
1994.0,1994.0,Export,Turkey,World,83.0,Miscellaneous articles of base metal,32571073.0,,38.9597594,34.9249653,-36.8535712,174.7456809,83.01994.0Turkey,71946634.0,
1994.0,1994.0,Export,Turkey,World,84.0,"Nuclear reactors, boilers, machinery, etc",547983519.0,,38.9597594,34.9249653,-36.8535712,174.7456809,84.01994.0Turkey,3765734221.0,
1994.0,1994.0,Export,Turkey,World,85.0,"Electrical, electronic equipment",746866230.0,,38.9597594,34.9249653,-36.8535712,174.7456809,85.01994.0Turkey,1819810907.0,
1994.0,1994.0,Export,Turkey,World,86.0,"Railway, tramway locomotives, rolling stock, equipmen",84251099.0,,38.9597594,34.9249653,-36.8535712,174.7456809,86.01994.0Turkey,107168864.0,
1994.0,1994.0,Export,Turkey,World,87.0,"Vehicles other than railway, tramway",333304693.0,,38.9597594,34.9249653,-36.8535712,174.7456809,87.01994.0Turkey,947574812.0,
1994.0,1994.0,Export,Turkey,World,88.0,"Aircraft, spacecraft, and parts thereof",22318508.0,,38.9597594,34.9249653,-36.8535712,174.7456809,88.01994.0Turkey,802741244.0,
1994.0,1994.0,Export,Turkey,World,89.0,"Ships, boats and other floating structures",53779004.0,,38.9597594,34.9249653,-36.8535712,174.7456809,89.01994.0Turkey,279407534.0,
1994.0,1994.0,Export,Turkey,World,90.0,"Optical, photo, technical, medical, etc apparatus",26154364.0,,38.9597594,34.9249653,-36.8535712,174.7456809,90.01994.0Turkey,549404824.0,
1994.0,1994.0,Export,Turkey,World,91.0,Clocks and watches and parts thereof,2598157.0,,38.9597594,34.9249653,-36.8535712,174.7456809,91.01994.0Turkey,52355191.0,
1994.0,1994.0,Export,Turkey,World,92.0,"Musical instruments, parts and accessories",628545.0,,38.9597594,34.9249653,-36.8535712,174.7456809,92.01994.0Turkey,3758616.0,
1994.0,1994.0,Export,Turkey,World,93.0,"Arms and ammunition, parts and accessories thereof",8832013.0,,38.9597594,34.9249653,-36.8535712,174.7456809,93.01994.0Turkey,26784610.0,
1994.0,1994.0,Export,Turkey,World,94.0,"Furniture, lighting, signs, prefabricated buildings",96669266.0,,38.9597594,34.9249653,-36.8535712,174.7456809,94.01994.0Turkey,54955555.0,
1994.0,1994.0,Export,Turkey,World,96.0,Miscellaneous manufactured articles,15516654.0,,38.9597594,34.9249653,-36.8535712,174.7456809,96.01994.0Turkey,64667459.0,
1994.0,1994.0,Export,Turkey,World,97.0,"Works of art, collectors pieces and antiques",227543.0,,38.9597594,34.9249653,-36.8535712,174.7456809,97.01994.0Turkey,478486.0,
1994.0,1994.0,Export,Turkey,World,99.0,Commodities not specified according to kind,39000.0,,38.9597594,34.9249653,-36.8535712,174.7456809,99.01994.0Turkey,,
