yr,periodDesc,rgDesc,rtTitle,ptTitle,cmdCode,cmdDescE,TradeValue_export,Unnamed: 0_export,rtLat,rtLon,ptLat,ptLon,mid,TradeValue_import,Unnamed: 0_import
2018.0,2018.0,Export,Armenia,World,1.0,Animals; live,2198050.0,,40.7696272,44.6736646,-36.8535712,174.7456809,1.02018.0Armenia,6671802.0,
2018.0,2018.0,Export,Armenia,World,2.0,Meat and edible meat offal,14467589.0,,40.7696272,44.6736646,-36.8535712,174.7456809,2.02018.0Armenia,68321611.0,
2018.0,2018.0,Export,Armenia,World,3.0,"Fish and crustaceans, molluscs and other aquatic invertebrates",23873771.0,,40.7696272,44.6736646,-36.8535712,174.7456809,3.02018.0Armenia,3846741.0,
2018.0,2018.0,Export,Armenia,World,4.0,"Dairy produce; birds' eggs; natural honey; edible products of animal origin, not elsewhere specified or included",10003463.0,,40.7696272,44.6736646,-36.8535712,174.7456809,4.02018.0Armenia,46157134.0,
2018.0,2018.0,Export,Armenia,World,5.0,Animal originated products; not elsewhere specified or included,12317.0,,40.7696272,44.6736646,-36.8535712,174.7456809,5.02018.0Armenia,6925070.0,
2018.0,2018.0,Export,Armenia,World,6.0,"Trees and other plants, live; bulbs, roots and the like; cut flowers and ornamental foliage",8223715.0,,40.7696272,44.6736646,-36.8535712,174.7456809,6.02018.0Armenia,4546560.0,
2018.0,2018.0,Export,Armenia,World,7.0,Vegetables and certain roots and tubers; edible,28280224.0,,40.7696272,44.6736646,-36.8535712,174.7456809,7.02018.0Armenia,11931425.0,
2018.0,2018.0,Export,Armenia,World,8.0,"Fruit and nuts, edible; peel of citrus fruit or melons",25184874.0,,40.7696272,44.6736646,-36.8535712,174.7456809,8.02018.0Armenia,55247067.0,
2018.0,2018.0,Export,Armenia,World,9.0,"Coffee, tea, mate and spices",4266751.0,,40.7696272,44.6736646,-36.8535712,174.7456809,9.02018.0Armenia,29892596.0,
2018.0,2018.0,Export,Armenia,World,10.0,Cereals,5348.0,,40.7696272,44.6736646,-36.8535712,174.7456809,10.02018.0Armenia,83507979.0,
2018.0,2018.0,Export,Armenia,World,11.0,"Products of the milling industry; malt, starches, inulin, wheat gluten",162727.0,,40.7696272,44.6736646,-36.8535712,174.7456809,11.02018.0Armenia,12415119.0,
2018.0,2018.0,Export,Armenia,World,12.0,"Oil seeds and oleaginous fruits; miscellaneous grains, seeds and fruit, industrial or medicinal plants; straw and fodder",671936.0,,40.7696272,44.6736646,-36.8535712,174.7456809,12.02018.0Armenia,11855786.0,
2018.0,2018.0,Export,Armenia,World,15.0,Animal or vegetable fats and oils and their cleavage products; prepared animal fats; animal or vegetable waxes,77017.0,,40.7696272,44.6736646,-36.8535712,174.7456809,15.02018.0Armenia,55059332.0,
2018.0,2018.0,Export,Armenia,World,16.0,"Meat, fish or crustaceans, molluscs or other aquatic invertebrates; preparations thereof",6758761.0,,40.7696272,44.6736646,-36.8535712,174.7456809,16.02018.0Armenia,8312885.0,
2018.0,2018.0,Export,Armenia,World,17.0,Sugars and sugar confectionery,1096591.0,,40.7696272,44.6736646,-36.8535712,174.7456809,17.02018.0Armenia,41705293.0,
2018.0,2018.0,Export,Armenia,World,18.0,Cocoa and cocoa preparations,16147258.0,,40.7696272,44.6736646,-36.8535712,174.7456809,18.02018.0Armenia,47715302.0,
2018.0,2018.0,Export,Armenia,World,19.0,"Preparations of cereals, flour, starch or milk; pastrycooks' products",1258121.0,,40.7696272,44.6736646,-36.8535712,174.7456809,19.02018.0Armenia,34404778.0,
2018.0,2018.0,Export,Armenia,World,20.0,"Preparations of vegetables, fruit, nuts or other parts of plants",26974000.0,,40.7696272,44.6736646,-36.8535712,174.7456809,20.02018.0Armenia,19295382.0,
2018.0,2018.0,Export,Armenia,World,21.0,Miscellaneous edible preparations,3295620.0,,40.7696272,44.6736646,-36.8535712,174.7456809,21.02018.0Armenia,31166582.0,
2018.0,2018.0,Export,Armenia,World,22.0,"Beverages, spirits and vinegar",229662373.0,,40.7696272,44.6736646,-36.8535712,174.7456809,22.02018.0Armenia,40971392.0,
2018.0,2018.0,Export,Armenia,World,23.0,"Food industries, residues and wastes thereof; prepared animal fodder",47247.0,,40.7696272,44.6736646,-36.8535712,174.7456809,23.02018.0Armenia,45798721.0,
2018.0,2018.0,Export,Armenia,World,24.0,Tobacco and manufactured tobacco substitutes,267620167.0,,40.7696272,44.6736646,-36.8535712,174.7456809,24.02018.0Armenia,130421964.0,
2018.0,2018.0,Export,Armenia,World,25.0,"Salt; sulphur; earths, stone; plastering materials, lime and cement",6435729.0,,40.7696272,44.6736646,-36.8535712,174.7456809,25.02018.0Armenia,40527098.0,
2018.0,2018.0,Export,Armenia,World,26.0,"Ores, slag and ash",557086289.0,,40.7696272,44.6736646,-36.8535712,174.7456809,26.02018.0Armenia,2181464.0,
2018.0,2018.0,Export,Armenia,World,27.0,"Mineral fuels, mineral oils and products of their distillation; bituminous substances; mineral waxes",81156824.0,,40.7696272,44.6736646,-36.8535712,174.7456809,27.02018.0Armenia,677923441.0,
2018.0,2018.0,Export,Armenia,World,28.0,"Inorganic chemicals; organic and inorganic compounds of precious metals; of rare earth metals, of radio-active elements and of isotopes",652843.0,,40.7696272,44.6736646,-36.8535712,174.7456809,28.02018.0Armenia,30712306.0,
2018.0,2018.0,Export,Armenia,World,29.0,Organic chemicals,293825.0,,40.7696272,44.6736646,-36.8535712,174.7456809,29.02018.0Armenia,12540742.0,
2018.0,2018.0,Export,Armenia,World,30.0,Pharmaceutical products,21316419.0,,40.7696272,44.6736646,-36.8535712,174.7456809,30.02018.0Armenia,158574917.0,
2018.0,2018.0,Export,Armenia,World,31.0,Fertilizers,65508.0,,40.7696272,44.6736646,-36.8535712,174.7456809,31.02018.0Armenia,25101929.0,
2018.0,2018.0,Export,Armenia,World,33.0,"Essential oils and resinoids; perfumery, cosmetic or toilet preparations",3543804.0,,40.7696272,44.6736646,-36.8535712,174.7456809,33.02018.0Armenia,61940690.0,
2018.0,2018.0,Export,Armenia,World,34.0,"Soap, organic surface-active agents; washing, lubricating, polishing or scouring preparations; artificial or prepared waxes, candles and similar articles, modelling pastes, dental waxes and dental preparations with a basis of plaster",396999.0,,40.7696272,44.6736646,-36.8535712,174.7456809,34.02018.0Armenia,34739221.0,
2018.0,2018.0,Export,Armenia,World,36.0,Explosives; pyrotechnic products; matches; pyrophoric alloys; certain combustible preparations,425440.0,,40.7696272,44.6736646,-36.8535712,174.7456809,36.02018.0Armenia,2691161.0,
2018.0,2018.0,Export,Armenia,World,37.0,Photographic or cinematographic goods,13852.0,,40.7696272,44.6736646,-36.8535712,174.7456809,37.02018.0Armenia,1292029.0,
2018.0,2018.0,Export,Armenia,World,38.0,Chemical products n.e.c.,575739.0,,40.7696272,44.6736646,-36.8535712,174.7456809,38.02018.0Armenia,29535823.0,
2018.0,2018.0,Export,Armenia,World,39.0,Plastics and articles thereof,12148098.0,,40.7696272,44.6736646,-36.8535712,174.7456809,39.02018.0Armenia,142384303.0,
2018.0,2018.0,Export,Armenia,World,40.0,Rubber and articles thereof,2124137.0,,40.7696272,44.6736646,-36.8535712,174.7456809,40.02018.0Armenia,57291025.0,
2018.0,2018.0,Export,Armenia,World,41.0,Raw hides and skins (other than furskins) and leather,997905.0,,40.7696272,44.6736646,-36.8535712,174.7456809,41.02018.0Armenia,2580509.0,
2018.0,2018.0,Export,Armenia,World,42.0,"Articles of leather; saddlery and harness; travel goods, handbags and similar containers; articles of animal gut (other than silk-worm gut)",12003617.0,,40.7696272,44.6736646,-36.8535712,174.7456809,42.02018.0Armenia,16528656.0,
2018.0,2018.0,Export,Armenia,World,43.0,Furskins and artificial fur; manufactures thereof,715609.0,,40.7696272,44.6736646,-36.8535712,174.7456809,43.02018.0Armenia,5175122.0,
2018.0,2018.0,Export,Armenia,World,44.0,Wood and articles of wood; wood charcoal,1818410.0,,40.7696272,44.6736646,-36.8535712,174.7456809,44.02018.0Armenia,52172678.0,
2018.0,2018.0,Export,Armenia,World,45.0,Cork and articles of cork,47713.0,,40.7696272,44.6736646,-36.8535712,174.7456809,45.02018.0Armenia,4081124.0,
2018.0,2018.0,Export,Armenia,World,46.0,"Manufactures of straw, esparto or other plaiting materials; basketware and wickerwork",53294.0,,40.7696272,44.6736646,-36.8535712,174.7456809,46.02018.0Armenia,130290.0,
2018.0,2018.0,Export,Armenia,World,47.0,Pulp of wood or other fibrous cellulosic material; recovered (waste and scrap) paper or paperboard,26017.0,,40.7696272,44.6736646,-36.8535712,174.7456809,47.02018.0Armenia,42534.0,
2018.0,2018.0,Export,Armenia,World,48.0,"Paper and paperboard; articles of paper pulp, of paper or paperboard",1091008.0,,40.7696272,44.6736646,-36.8535712,174.7456809,48.02018.0Armenia,86768205.0,
2018.0,2018.0,Export,Armenia,World,50.0,Silk,13975.0,,40.7696272,44.6736646,-36.8535712,174.7456809,50.02018.0Armenia,74308.0,
2018.0,2018.0,Export,Armenia,World,51.0,"Wool, fine or coarse animal hair; horsehair yarn and woven fabric",4179.0,,40.7696272,44.6736646,-36.8535712,174.7456809,51.02018.0Armenia,690882.0,
2018.0,2018.0,Export,Armenia,World,52.0,Cotton,1081765.0,,40.7696272,44.6736646,-36.8535712,174.7456809,52.02018.0Armenia,26238721.0,
2018.0,2018.0,Export,Armenia,World,53.0,Vegetable textile fibres; paper yarn and woven fabrics of paper yarn,3183.0,,40.7696272,44.6736646,-36.8535712,174.7456809,53.02018.0Armenia,768150.0,
2018.0,2018.0,Export,Armenia,World,54.0,Man-made filaments; strip and the like of man-made textile materials,303684.0,,40.7696272,44.6736646,-36.8535712,174.7456809,54.02018.0Armenia,30802421.0,
2018.0,2018.0,Export,Armenia,World,55.0,Man-made staple fibres,2383183.0,,40.7696272,44.6736646,-36.8535712,174.7456809,55.02018.0Armenia,23897862.0,
2018.0,2018.0,Export,Armenia,World,56.0,"Wadding, felt and nonwovens, special yarns; twine, cordage, ropes and cables and articles thereof",761400.0,,40.7696272,44.6736646,-36.8535712,174.7456809,56.02018.0Armenia,6302110.0,
2018.0,2018.0,Export,Armenia,World,58.0,"Fabrics; special woven fabrics, tufted textile fabrics, lace, tapestries, trimmings, embroidery",333394.0,,40.7696272,44.6736646,-36.8535712,174.7456809,58.02018.0Armenia,6172448.0,
2018.0,2018.0,Export,Armenia,World,59.0,"Textile fabrics; impregnated, coated, covered or laminated; textile articles of a kind suitable for industrial use",10286.0,,40.7696272,44.6736646,-36.8535712,174.7456809,59.02018.0Armenia,7673972.0,
2018.0,2018.0,Export,Armenia,World,60.0,Fabrics; knitted or crocheted,7767867.0,,40.7696272,44.6736646,-36.8535712,174.7456809,60.02018.0Armenia,15763144.0,
2018.0,2018.0,Export,Armenia,World,61.0,Apparel and clothing accessories; knitted or crocheted,53377727.0,,40.7696272,44.6736646,-36.8535712,174.7456809,61.02018.0Armenia,84653244.0,
2018.0,2018.0,Export,Armenia,World,62.0,Apparel and clothing accessories; not knitted or crocheted,157515165.0,,40.7696272,44.6736646,-36.8535712,174.7456809,62.02018.0Armenia,96429962.0,
2018.0,2018.0,Export,Armenia,World,63.0,"Textiles, made up articles; sets; worn clothing and worn textile articles; rags",489444.0,,40.7696272,44.6736646,-36.8535712,174.7456809,63.02018.0Armenia,13971450.0,
2018.0,2018.0,Export,Armenia,World,65.0,Headgear and parts thereof,1119395.0,,40.7696272,44.6736646,-36.8535712,174.7456809,65.02018.0Armenia,1532680.0,
2018.0,2018.0,Export,Armenia,World,66.0,"Umbrellas, sun umbrellas, walking-sticks, seat sticks, whips, riding crops; and parts thereof",312922.0,,40.7696272,44.6736646,-36.8535712,174.7456809,66.02018.0Armenia,938716.0,
2018.0,2018.0,Export,Armenia,World,67.0,"Feathers and down, prepared; and articles made of feather or of down; artificial flowers; articles of human hair",18838.0,,40.7696272,44.6736646,-36.8535712,174.7456809,67.02018.0Armenia,566031.0,
2018.0,2018.0,Export,Armenia,World,68.0,"Stone, plaster, cement, asbestos, mica or similar materials; articles thereof",11741469.0,,40.7696272,44.6736646,-36.8535712,174.7456809,68.02018.0Armenia,18655219.0,
2018.0,2018.0,Export,Armenia,World,69.0,Ceramic products,774020.0,,40.7696272,44.6736646,-36.8535712,174.7456809,69.02018.0Armenia,34956753.0,
2018.0,2018.0,Export,Armenia,World,70.0,Glass and glassware,11615404.0,,40.7696272,44.6736646,-36.8535712,174.7456809,70.02018.0Armenia,40274137.0,
2018.0,2018.0,Export,Armenia,World,71.0,"Natural, cultured pearls; precious, semi-precious stones; precious metals, metals clad with precious metal, and articles thereof; imitation jewellery; coin",307368520.0,,40.7696272,44.6736646,-36.8535712,174.7456809,71.02018.0Armenia,288278357.0,
2018.0,2018.0,Export,Armenia,World,72.0,Iron and steel,126470707.0,,40.7696272,44.6736646,-36.8535712,174.7456809,72.02018.0Armenia,107439904.0,
2018.0,2018.0,Export,Armenia,World,73.0,Iron or steel articles,2344066.0,,40.7696272,44.6736646,-36.8535712,174.7456809,73.02018.0Armenia,93239462.0,
2018.0,2018.0,Export,Armenia,World,74.0,Copper and articles thereof,68258274.0,,40.7696272,44.6736646,-36.8535712,174.7456809,74.02018.0Armenia,5762977.0,
2018.0,2018.0,Export,Armenia,World,75.0,Nickel and articles thereof,44.0,,40.7696272,44.6736646,-36.8535712,174.7456809,75.02018.0Armenia,107230.0,
2018.0,2018.0,Export,Armenia,World,76.0,Aluminium and articles thereof,96059224.0,,40.7696272,44.6736646,-36.8535712,174.7456809,76.02018.0Armenia,95906417.0,
2018.0,2018.0,Export,Armenia,World,78.0,Lead and articles thereof,64713.0,,40.7696272,44.6736646,-36.8535712,174.7456809,78.02018.0Armenia,780875.0,
2018.0,2018.0,Export,Armenia,World,79.0,Zinc and articles thereof,5175.0,,40.7696272,44.6736646,-36.8535712,174.7456809,79.02018.0Armenia,276946.0,
2018.0,2018.0,Export,Armenia,World,80.0,Tin; articles thereof,23027.0,,40.7696272,44.6736646,-36.8535712,174.7456809,80.02018.0Armenia,57364.0,
2018.0,2018.0,Export,Armenia,World,81.0,"Metals; n.e.c., cermets and articles thereof",2662.0,,40.7696272,44.6736646,-36.8535712,174.7456809,81.02018.0Armenia,309238.0,
2018.0,2018.0,Export,Armenia,World,82.0,"Tools, implements, cutlery, spoons and forks, of base metal; parts thereof, of base metal",898921.0,,40.7696272,44.6736646,-36.8535712,174.7456809,82.02018.0Armenia,12038157.0,
2018.0,2018.0,Export,Armenia,World,83.0,Metal; miscellaneous products of base metal,2469419.0,,40.7696272,44.6736646,-36.8535712,174.7456809,83.02018.0Armenia,24269567.0,
2018.0,2018.0,Export,Armenia,World,84.0,"Nuclear reactors, boilers, machinery and mechanical appliances; parts thereof",22291592.0,,40.7696272,44.6736646,-36.8535712,174.7456809,84.02018.0Armenia,565444018.0,
2018.0,2018.0,Export,Armenia,World,85.0,"Electrical machinery and equipment and parts thereof; sound recorders and reproducers; television image and sound recorders and reproducers, parts and accessories of such articles",21269387.0,,40.7696272,44.6736646,-36.8535712,174.7456809,85.02018.0Armenia,366467294.0,
2018.0,2018.0,Export,Armenia,World,86.0,"Railway, tramway locomotives, rolling-stock and parts thereof; railway or tramway track fixtures and fittings and parts thereof; mechanical (including electro-mechanical) traffic signalling equipment of all kinds",3153447.0,,40.7696272,44.6736646,-36.8535712,174.7456809,86.02018.0Armenia,4408514.0,
2018.0,2018.0,Export,Armenia,World,87.0,"Vehicles; other than railway or tramway rolling stock, and parts and accessories thereof",21612134.0,,40.7696272,44.6736646,-36.8535712,174.7456809,87.02018.0Armenia,187939283.0,
2018.0,2018.0,Export,Armenia,World,88.0,"Aircraft, spacecraft and parts thereof",17475.0,,40.7696272,44.6736646,-36.8535712,174.7456809,88.02018.0Armenia,12420422.0,
2018.0,2018.0,Export,Armenia,World,89.0,"Ships, boats and floating structures",68.0,,40.7696272,44.6736646,-36.8535712,174.7456809,89.02018.0Armenia,737291.0,
2018.0,2018.0,Export,Armenia,World,90.0,"Optical, photographic, cinematographic, measuring, checking, medical or surgical instruments and apparatus; parts and accessories",19331039.0,,40.7696272,44.6736646,-36.8535712,174.7456809,90.02018.0Armenia,103739377.0,
2018.0,2018.0,Export,Armenia,World,91.0,Clocks and watches and parts thereof,33429133.0,,40.7696272,44.6736646,-36.8535712,174.7456809,91.02018.0Armenia,12077142.0,
2018.0,2018.0,Export,Armenia,World,92.0,Musical instruments; parts and accessories of such articles,32141.0,,40.7696272,44.6736646,-36.8535712,174.7456809,92.02018.0Armenia,784185.0,
2018.0,2018.0,Export,Armenia,World,94.0,"Furniture; bedding, mattresses, mattress supports, cushions and similar stuffed furnishings; lamps and lighting fittings, n.e.c.; illuminated signs, illuminated name-plates and the like; prefabricated buildings",20507646.0,,40.7696272,44.6736646,-36.8535712,174.7456809,94.02018.0Armenia,108619513.0,
2018.0,2018.0,Export,Armenia,World,95.0,"Toys, games and sports requisites; parts and accessories thereof",575622.0,,40.7696272,44.6736646,-36.8535712,174.7456809,95.02018.0Armenia,18976751.0,
2018.0,2018.0,Export,Armenia,World,96.0,Miscellaneous manufactured articles,7795882.0,,40.7696272,44.6736646,-36.8535712,174.7456809,96.02018.0Armenia,28809713.0,
2018.0,2018.0,Export,Armenia,World,97.0,Works of art; collectors' pieces and antiques,26624.0,,40.7696272,44.6736646,-36.8535712,174.7456809,97.02018.0Armenia,60212.0,
2018.0,2018.0,Export,Armenia,World,99.0,Commodities not specified according to kind,802070.0,,40.7696272,44.6736646,-36.8535712,174.7456809,99.02018.0Armenia,2086589.0,
