yr,periodDesc,rgDesc,rtTitle,cmdCode,cmdDescE,Subregion_export,Region_export,TradeValue_export,rtLat,rtLon,ptLon,ptLat,mid,Subregion_import,Region_import,TradeValue_import
2001.0,2001.0,Export,Lebanon,1.0,Live animals,World,World,119417.0,33.8750629,35.843409,,,12001Lebanon,World,World,154021331.0
2001.0,2001.0,Export,Lebanon,2.0,Meat and edible meat offal,World,World,114685.0,33.8750629,35.843409,,,22001Lebanon,World,World,19369525.0
2001.0,2001.0,Export,Lebanon,3.0,"Fish, crustaceans, molluscs, aquatic invertebrates nes",World,World,18155.0,33.8750629,35.843409,,,32001Lebanon,World,World,34877886.0
2001.0,2001.0,Export,Lebanon,4.0,"Dairy products, eggs, honey, edible animal product nes",World,World,1966736.0,33.8750629,35.843409,,,42001Lebanon,World,World,145501457.0
2001.0,2001.0,Export,Lebanon,5.0,"Products of animal origin, nes",World,World,3745303.0,33.8750629,35.843409,,,52001Lebanon,World,World,5576686.0
2001.0,2001.0,Export,Lebanon,6.0,"Live trees, plants, bulbs, roots, cut flowers etc",World,World,326453.0,33.8750629,35.843409,,,62001Lebanon,World,World,12260128.0
2001.0,2001.0,Export,Lebanon,7.0,Edible vegetables and certain roots and tubers,World,World,14237252.0,33.8750629,35.843409,,,72001Lebanon,World,World,73321438.0
2001.0,2001.0,Export,Lebanon,8.0,"Edible fruit, nuts, peel of citrus fruit, melons",World,World,29420674.0,33.8750629,35.843409,,,82001Lebanon,World,World,75517511.0
2001.0,2001.0,Export,Lebanon,9.0,"Coffee, tea, mate and spices",World,World,3826059.0,33.8750629,35.843409,,,92001Lebanon,World,World,44591936.0
2001.0,2001.0,Export,Lebanon,10.0,Cereals,World,World,236674.0,33.8750629,35.843409,,,102001Lebanon,World,World,108132701.0
2001.0,2001.0,Export,Lebanon,11.0,"Milling products, malt, starches, inulin, wheat gluten",World,World,174055.0,33.8750629,35.843409,,,112001Lebanon,World,World,7263875.0
2001.0,2001.0,Export,Lebanon,12.0,"Oil seed, oleagic fruits, grain, seed, fruit, etc, nes",World,World,1398069.0,33.8750629,35.843409,,,122001Lebanon,World,World,39181729.0
2001.0,2001.0,Export,Lebanon,13.0,"Lac, gums, resins, vegetable saps and extracts nes",World,World,988.0,33.8750629,35.843409,,,132001Lebanon,World,World,935241.0
2001.0,2001.0,Export,Lebanon,14.0,"Vegetable plaiting materials, vegetable products nes",World,World,193979.0,33.8750629,35.843409,,,142001Lebanon,World,World,723555.0
2001.0,2001.0,Export,Lebanon,15.0,"Animal,vegetable fats and oils, cleavage products, etc",World,World,9445583.0,33.8750629,35.843409,,,152001Lebanon,World,World,44274578.0
2001.0,2001.0,Export,Lebanon,16.0,"Meat, fish and seafood food preparations nes",World,World,747347.0,33.8750629,35.843409,,,162001Lebanon,World,World,43127319.0
2001.0,2001.0,Export,Lebanon,17.0,Sugars and sugar confectionery,World,World,9523596.0,33.8750629,35.843409,,,172001Lebanon,World,World,39510266.0
2001.0,2001.0,Export,Lebanon,18.0,Cocoa and cocoa preparations,World,World,4034965.0,33.8750629,35.843409,,,182001Lebanon,World,World,29775584.0
2001.0,2001.0,Export,Lebanon,19.0,"Cereal, flour, starch, milk preparations and products",World,World,6690553.0,33.8750629,35.843409,,,192001Lebanon,World,World,62217706.0
2001.0,2001.0,Export,Lebanon,20.0,"Vegetable, fruit, nut, etc food preparations",World,World,19232202.0,33.8750629,35.843409,,,202001Lebanon,World,World,32419821.0
2001.0,2001.0,Export,Lebanon,21.0,Miscellaneous edible preparations,World,World,7160840.0,33.8750629,35.843409,,,212001Lebanon,World,World,73359121.0
2001.0,2001.0,Export,Lebanon,22.0,"Beverages, spirits and vinegar",World,World,11681471.0,33.8750629,35.843409,,,222001Lebanon,World,World,34139179.0
2001.0,2001.0,Export,Lebanon,23.0,"Residues, wastes of food industry, animal fodder",World,World,2952651.0,33.8750629,35.843409,,,232001Lebanon,World,World,33324053.0
2001.0,2001.0,Export,Lebanon,24.0,Tobacco and manufactured tobacco substitutes,World,World,37645258.0,33.8750629,35.843409,,,242001Lebanon,World,World,154805606.0
2001.0,2001.0,Export,Lebanon,25.0,"Salt, sulphur, earth, stone, plaster, lime and cement",World,World,30941659.0,33.8750629,35.843409,,,252001Lebanon,World,World,46874649.0
2001.0,2001.0,Export,Lebanon,26.0,"Ores, slag and ash",World,World,1331.0,33.8750629,35.843409,,,262001Lebanon,World,World,407670.0
2001.0,2001.0,Export,Lebanon,27.0,"Mineral fuels, oils, distillation products, etc",World,World,1382534.0,33.8750629,35.843409,,,272001Lebanon,World,World,1293295707.0
2001.0,2001.0,Export,Lebanon,28.0,"Inorganic chemicals, precious metal compound, isotopes",World,World,41408294.0,33.8750629,35.843409,,,282001Lebanon,World,World,21033733.0
2001.0,2001.0,Export,Lebanon,29.0,Organic chemicals,World,World,474501.0,33.8750629,35.843409,,,292001Lebanon,World,World,32129805.0
2001.0,2001.0,Export,Lebanon,30.0,Pharmaceutical products,World,World,5290272.0,33.8750629,35.843409,,,302001Lebanon,World,World,291409059.0
2001.0,2001.0,Export,Lebanon,31.0,Fertilizers,World,World,11405675.0,33.8750629,35.843409,,,312001Lebanon,World,World,17542201.0
2001.0,2001.0,Export,Lebanon,32.0,"Tanning, dyeing extracts, tannins, derivs,pigments etc",World,World,3569587.0,33.8750629,35.843409,,,322001Lebanon,World,World,33084689.0
2001.0,2001.0,Export,Lebanon,33.0,"Essential oils, perfumes, cosmetics, toileteries",World,World,9326791.0,33.8750629,35.843409,,,332001Lebanon,World,World,74392475.0
2001.0,2001.0,Export,Lebanon,35.0,"Albuminoids, modified starches, glues, enzymes",World,World,523573.0,33.8750629,35.843409,,,352001Lebanon,World,World,8054600.0
2001.0,2001.0,Export,Lebanon,36.0,"Explosives, pyrotechnics, matches, pyrophorics, etc",World,World,247468.0,33.8750629,35.843409,,,362001Lebanon,World,World,4038338.0
2001.0,2001.0,Export,Lebanon,37.0,Photographic or cinematographic goods,World,World,1340735.0,33.8750629,35.843409,,,372001Lebanon,World,World,19383840.0
2001.0,2001.0,Export,Lebanon,38.0,Miscellaneous chemical products,World,World,3884033.0,33.8750629,35.843409,,,382001Lebanon,World,World,50778616.0
2001.0,2001.0,Export,Lebanon,39.0,Plastics and articles thereof,World,World,23835598.0,33.8750629,35.843409,,,392001Lebanon,World,World,202685528.0
2001.0,2001.0,Export,Lebanon,40.0,Rubber and articles thereof,World,World,2264431.0,33.8750629,35.843409,,,402001Lebanon,World,World,55097815.0
2001.0,2001.0,Export,Lebanon,41.0,Raw hides and skins (other than furskins) and leather,World,World,11745523.0,33.8750629,35.843409,,,412001Lebanon,World,World,5180305.0
2001.0,2001.0,Export,Lebanon,42.0,"Articles of leather, animal gut, harness, travel goods",World,World,17874389.0,33.8750629,35.843409,,,422001Lebanon,World,World,25565865.0
2001.0,2001.0,Export,Lebanon,43.0,"Furskins and artificial fur, manufactures thereof",World,World,1791.0,33.8750629,35.843409,,,432001Lebanon,World,World,401797.0
2001.0,2001.0,Export,Lebanon,44.0,"Wood and articles of wood, wood charcoal",World,World,9156728.0,33.8750629,35.843409,,,442001Lebanon,World,World,102774616.0
2001.0,2001.0,Export,Lebanon,45.0,Cork and articles of cork,World,World,1131.0,33.8750629,35.843409,,,452001Lebanon,World,World,769776.0
2001.0,2001.0,Export,Lebanon,46.0,"Manufactures of plaiting material, basketwork, etc.",World,World,130097.0,33.8750629,35.843409,,,462001Lebanon,World,World,1328446.0
2001.0,2001.0,Export,Lebanon,47.0,"Pulp of wood, fibrous cellulosic material, waste etc",World,World,106742.0,33.8750629,35.843409,,,472001Lebanon,World,World,17323481.0
2001.0,2001.0,Export,Lebanon,48.0,"Paper & paperboard, articles of pulp, paper and board",World,World,33255394.0,33.8750629,35.843409,,,482001Lebanon,World,World,141688487.0
2001.0,2001.0,Export,Lebanon,49.0,"Printed books, newspapers, pictures etc",World,World,26845452.0,33.8750629,35.843409,,,492001Lebanon,World,World,35770608.0
2001.0,2001.0,Export,Lebanon,50.0,Silk,World,World,86922.0,33.8750629,35.843409,,,502001Lebanon,World,World,5105043.0
2001.0,2001.0,Export,Lebanon,51.0,"Wool, animal hair, horsehair yarn and fabric thereof",World,World,210958.0,33.8750629,35.843409,,,512001Lebanon,World,World,5877496.0
2001.0,2001.0,Export,Lebanon,52.0,Cotton,World,World,673966.0,33.8750629,35.843409,,,522001Lebanon,World,World,36117285.0
2001.0,2001.0,Export,Lebanon,53.0,"Vegetable textile fibres nes, paper yarn, woven fabric",World,World,787.0,33.8750629,35.843409,,,532001Lebanon,World,World,5003158.0
2001.0,2001.0,Export,Lebanon,54.0,Manmade filaments,World,World,798883.0,33.8750629,35.843409,,,542001Lebanon,World,World,45147821.0
2001.0,2001.0,Export,Lebanon,55.0,Manmade staple fibres,World,World,1968337.0,33.8750629,35.843409,,,552001Lebanon,World,World,64523430.0
2001.0,2001.0,Export,Lebanon,56.0,"Wadding, felt, nonwovens, yarns, twine, cordage, etc",World,World,173845.0,33.8750629,35.843409,,,562001Lebanon,World,World,6643970.0
2001.0,2001.0,Export,Lebanon,57.0,Carpets and other textile floor coverings,World,World,4676500.0,33.8750629,35.843409,,,572001Lebanon,World,World,18467372.0
2001.0,2001.0,Export,Lebanon,58.0,"Special woven or tufted fabric, lace, tapestry etc",World,World,507536.0,33.8750629,35.843409,,,582001Lebanon,World,World,14172346.0
2001.0,2001.0,Export,Lebanon,59.0,"Impregnated, coated or laminated textile fabric",World,World,493990.0,33.8750629,35.843409,,,592001Lebanon,World,World,6833322.0
2001.0,2001.0,Export,Lebanon,60.0,Knitted or crocheted fabric,World,World,1126658.0,33.8750629,35.843409,,,602001Lebanon,World,World,16554807.0
2001.0,2001.0,Export,Lebanon,61.0,"Articles of apparel, accessories, knit or crochet",World,World,10106651.0,33.8750629,35.843409,,,612001Lebanon,World,World,81260208.0
2001.0,2001.0,Export,Lebanon,62.0,"Articles of apparel, accessories, not knit or crochet",World,World,15936949.0,33.8750629,35.843409,,,622001Lebanon,World,World,122578020.0
2001.0,2001.0,Export,Lebanon,63.0,"Other made textile articles, sets, worn clothing etc",World,World,40259136.0,33.8750629,35.843409,,,632001Lebanon,World,World,36440252.0
2001.0,2001.0,Export,Lebanon,64.0,"Footwear, gaiters and the like, parts thereof",World,World,14958750.0,33.8750629,35.843409,,,642001Lebanon,World,World,59915081.0
2001.0,2001.0,Export,Lebanon,65.0,Headgear and parts thereof,World,World,123053.0,33.8750629,35.843409,,,652001Lebanon,World,World,2982978.0
2001.0,2001.0,Export,Lebanon,66.0,"Umbrellas, walking-sticks, seat-sticks, whips, etc",World,World,20904.0,33.8750629,35.843409,,,662001Lebanon,World,World,2001818.0
2001.0,2001.0,Export,Lebanon,67.0,"Bird skin, feathers, artificial flowers, human hair",World,World,231165.0,33.8750629,35.843409,,,672001Lebanon,World,World,4407343.0
2001.0,2001.0,Export,Lebanon,68.0,"Stone, plaster, cement, asbestos, mica, etc articles",World,World,4588078.0,33.8750629,35.843409,,,682001Lebanon,World,World,29562847.0
2001.0,2001.0,Export,Lebanon,69.0,Ceramic products,World,World,6595373.0,33.8750629,35.843409,,,692001Lebanon,World,World,59154089.0
2001.0,2001.0,Export,Lebanon,70.0,Glass and glassware,World,World,11241280.0,33.8750629,35.843409,,,702001Lebanon,World,World,56673481.0
2001.0,2001.0,Export,Lebanon,71.0,"Pearls, precious stones, metals, coins, etc",World,World,140887211.0,33.8750629,35.843409,,,712001Lebanon,World,World,363203804.0
2001.0,2001.0,Export,Lebanon,72.0,Iron and steel,World,World,17029024.0,33.8750629,35.843409,,,722001Lebanon,World,World,167558421.0
2001.0,2001.0,Export,Lebanon,73.0,Articles of iron or steel,World,World,10546707.0,33.8750629,35.843409,,,732001Lebanon,World,World,96778813.0
2001.0,2001.0,Export,Lebanon,74.0,Copper and articles thereof,World,World,7405870.0,33.8750629,35.843409,,,742001Lebanon,World,World,35001298.0
2001.0,2001.0,Export,Lebanon,75.0,Nickel and articles thereof,World,World,16066.0,33.8750629,35.843409,,,752001Lebanon,World,World,286862.0
2001.0,2001.0,Export,Lebanon,76.0,Aluminium and articles thereof,World,World,23884513.0,33.8750629,35.843409,,,762001Lebanon,World,World,65923109.0
2001.0,2001.0,Export,Lebanon,78.0,Lead and articles thereof,World,World,2253800.0,33.8750629,35.843409,,,782001Lebanon,World,World,125810.0
2001.0,2001.0,Export,Lebanon,79.0,Zinc and articles thereof,World,World,20439.0,33.8750629,35.843409,,,792001Lebanon,World,World,926331.0
2001.0,2001.0,Export,Lebanon,80.0,Tin and articles thereof,World,World,477.0,33.8750629,35.843409,,,802001Lebanon,World,World,130924.0
2001.0,2001.0,Export,Lebanon,81.0,"Other base metals, cermets, articles thereof",World,World,40550.0,33.8750629,35.843409,,,812001Lebanon,World,World,213929.0
2001.0,2001.0,Export,Lebanon,82.0,"Tools, implements, cutlery, etc of base metal",World,World,1648833.0,33.8750629,35.843409,,,822001Lebanon,World,World,26326512.0
2001.0,2001.0,Export,Lebanon,83.0,Miscellaneous articles of base metal,World,World,2369697.0,33.8750629,35.843409,,,832001Lebanon,World,World,33427630.0
2001.0,2001.0,Export,Lebanon,84.0,"Nuclear reactors, boilers, machinery, etc",World,World,41998035.0,33.8750629,35.843409,,,842001Lebanon,World,World,515688885.0
2001.0,2001.0,Export,Lebanon,85.0,"Electrical, electronic equipment",World,World,72359107.0,33.8750629,35.843409,,,852001Lebanon,World,World,483307549.0
2001.0,2001.0,Export,Lebanon,86.0,"Railway, tramway locomotives, rolling stock, equipment",World,World,190979.0,33.8750629,35.843409,,,862001Lebanon,World,World,1342456.0
2001.0,2001.0,Export,Lebanon,87.0,"Vehicles other than railway, tramway",World,World,10572601.0,33.8750629,35.843409,,,872001Lebanon,World,World,619568408.0
2001.0,2001.0,Export,Lebanon,88.0,"Aircraft, spacecraft, and parts thereof",World,World,140960.0,33.8750629,35.843409,,,882001Lebanon,World,World,47970815.0
2001.0,2001.0,Export,Lebanon,89.0,"Ships, boats and other floating structures",World,World,660789.0,33.8750629,35.843409,,,892001Lebanon,World,World,43687153.0
2001.0,2001.0,Export,Lebanon,90.0,"Optical, photo, technical, medical, etc apparatus",World,World,2987564.0,33.8750629,35.843409,,,902001Lebanon,World,World,113301218.0
2001.0,2001.0,Export,Lebanon,91.0,Clocks and watches and parts thereof,World,World,3716407.0,33.8750629,35.843409,,,912001Lebanon,World,World,25877049.0
2001.0,2001.0,Export,Lebanon,92.0,"Musical instruments, parts and accessories",World,World,17016.0,33.8750629,35.843409,,,922001Lebanon,World,World,2060802.0
2001.0,2001.0,Export,Lebanon,93.0,"Arms and ammunition, parts and accessories thereof",World,World,326425.0,33.8750629,35.843409,,,932001Lebanon,World,World,9740190.0
2001.0,2001.0,Export,Lebanon,94.0,"Furniture, lighting, signs, prefabricated buildings",World,World,22498928.0,33.8750629,35.843409,,,942001Lebanon,World,World,91113235.0
2001.0,2001.0,Export,Lebanon,95.0,"Toys, games, sports requisites",World,World,908266.0,33.8750629,35.843409,,,952001Lebanon,World,World,43988505.0
2001.0,2001.0,Export,Lebanon,96.0,Miscellaneous manufactured articles,World,World,780809.0,33.8750629,35.843409,,,962001Lebanon,World,World,28002787.0
2001.0,2001.0,Export,Lebanon,97.0,"Works of art, collectors pieces and antiques",World,World,632793.0,33.8750629,35.843409,,,972001Lebanon,World,World,2649263.0
