yr,periodDesc,rgDesc,rtTitle,ptTitle,cmdCode,cmdDescE,TradeValue_export,Unnamed: 0_export,rtLat,rtLon,ptLat,ptLon,mid,TradeValue_import,Unnamed: 0_import
2019.0,2019.0,Export,Kuwait,World,1.0,Animals; live,2438366.0,,29.2733964,47.4979476,-36.8535712,174.7456809,1.02019.0Kuwait,217744110.0,
2019.0,2019.0,Export,Kuwait,World,2.0,Meat and edible meat offal,5989771.0,,29.2733964,47.4979476,-36.8535712,174.7456809,2.02019.0Kuwait,588905116.0,
2019.0,2019.0,Export,Kuwait,World,3.0,"Fish and crustaceans, molluscs and other aquatic invertebrates",224146.0,,29.2733964,47.4979476,-36.8535712,174.7456809,3.02019.0Kuwait,196335228.0,
2019.0,2019.0,Export,Kuwait,World,4.0,"Dairy produce; birds' eggs; natural honey; edible products of animal origin, not elsewhere specified or included",10247940.0,,29.2733964,47.4979476,-36.8535712,174.7456809,4.02019.0Kuwait,585574773.0,
2019.0,2019.0,Export,Kuwait,World,5.0,Animal originated products; not elsewhere specified or included,2969.0,,29.2733964,47.4979476,-36.8535712,174.7456809,5.02019.0Kuwait,1333143.0,
2019.0,2019.0,Export,Kuwait,World,6.0,"Trees and other plants, live; bulbs, roots and the like; cut flowers and ornamental foliage",45706.0,,29.2733964,47.4979476,-36.8535712,174.7456809,6.02019.0Kuwait,33759639.0,
2019.0,2019.0,Export,Kuwait,World,7.0,Vegetables and certain roots and tubers; edible,413689.0,,29.2733964,47.4979476,-36.8535712,174.7456809,7.02019.0Kuwait,347088991.0,
2019.0,2019.0,Export,Kuwait,World,8.0,"Fruit and nuts, edible; peel of citrus fruit or melons",5662615.0,,29.2733964,47.4979476,-36.8535712,174.7456809,8.02019.0Kuwait,547709030.0,
2019.0,2019.0,Export,Kuwait,World,9.0,"Coffee, tea, mate and spices",1304125.0,,29.2733964,47.4979476,-36.8535712,174.7456809,9.02019.0Kuwait,173031141.0,
2019.0,2019.0,Export,Kuwait,World,10.0,Cereals,19658695.0,,29.2733964,47.4979476,-36.8535712,174.7456809,10.02019.0Kuwait,675447727.0,
2019.0,2019.0,Export,Kuwait,World,11.0,"Products of the milling industry; malt, starches, inulin, wheat gluten",56500772.0,,29.2733964,47.4979476,-36.8535712,174.7456809,11.02019.0Kuwait,20980941.0,
2019.0,2019.0,Export,Kuwait,World,12.0,"Oil seeds and oleaginous fruits; miscellaneous grains, seeds and fruit, industrial or medicinal plants; straw and fodder",1170489.0,,29.2733964,47.4979476,-36.8535712,174.7456809,12.02019.0Kuwait,77124532.0,
2019.0,2019.0,Export,Kuwait,World,13.0,"Lac; gums, resins and other vegetable saps and extracts",957452.0,,29.2733964,47.4979476,-36.8535712,174.7456809,13.02019.0Kuwait,5380608.0,
2019.0,2019.0,Export,Kuwait,World,14.0,Vegetable plaiting materials; vegetable products not elsewhere specified or included,10088.0,,29.2733964,47.4979476,-36.8535712,174.7456809,14.02019.0Kuwait,2312474.0,
2019.0,2019.0,Export,Kuwait,World,15.0,Animal or vegetable fats and oils and their cleavage products; prepared animal fats; animal or vegetable waxes,7257242.0,,29.2733964,47.4979476,-36.8535712,174.7456809,15.02019.0Kuwait,167474286.0,
2019.0,2019.0,Export,Kuwait,World,16.0,"Meat, fish or crustaceans, molluscs or other aquatic invertebrates; preparations thereof",30529684.0,,29.2733964,47.4979476,-36.8535712,174.7456809,16.02019.0Kuwait,134591053.0,
2019.0,2019.0,Export,Kuwait,World,17.0,Sugars and sugar confectionery,10048469.0,,29.2733964,47.4979476,-36.8535712,174.7456809,17.02019.0Kuwait,112181547.0,
2019.0,2019.0,Export,Kuwait,World,18.0,Cocoa and cocoa preparations,3735594.0,,29.2733964,47.4979476,-36.8535712,174.7456809,18.02019.0Kuwait,197768978.0,
2019.0,2019.0,Export,Kuwait,World,19.0,"Preparations of cereals, flour, starch or milk; pastrycooks' products",49874748.0,,29.2733964,47.4979476,-36.8535712,174.7456809,19.02019.0Kuwait,389091408.0,
2019.0,2019.0,Export,Kuwait,World,20.0,"Preparations of vegetables, fruit, nuts or other parts of plants",104331114.0,,29.2733964,47.4979476,-36.8535712,174.7456809,20.02019.0Kuwait,324811458.0,
2019.0,2019.0,Export,Kuwait,World,21.0,Miscellaneous edible preparations,29999482.0,,29.2733964,47.4979476,-36.8535712,174.7456809,21.02019.0Kuwait,331830505.0,
2019.0,2019.0,Export,Kuwait,World,22.0,"Beverages, spirits and vinegar",40466786.0,,29.2733964,47.4979476,-36.8535712,174.7456809,22.02019.0Kuwait,89404407.0,
2019.0,2019.0,Export,Kuwait,World,23.0,"Food industries, residues and wastes thereof; prepared animal fodder",1393048.0,,29.2733964,47.4979476,-36.8535712,174.7456809,23.02019.0Kuwait,73869250.0,
2019.0,2019.0,Export,Kuwait,World,24.0,Tobacco and manufactured tobacco substitutes,9364715.0,,29.2733964,47.4979476,-36.8535712,174.7456809,24.02019.0Kuwait,291460689.0,
2019.0,2019.0,Export,Kuwait,World,25.0,"Salt; sulphur; earths, stone; plastering materials, lime and cement",5710316.0,,29.2733964,47.4979476,-36.8535712,174.7456809,25.02019.0Kuwait,562684767.0,
2019.0,2019.0,Export,Kuwait,World,26.0,"Ores, slag and ash",364131.0,,29.2733964,47.4979476,-36.8535712,174.7456809,26.02019.0Kuwait,30067714.0,
2019.0,2019.0,Export,Kuwait,World,27.0,"Mineral fuels, mineral oils and products of their distillation; bituminous substances; mineral waxes",58689726858.0,,29.2733964,47.4979476,-36.8535712,174.7456809,27.02019.0Kuwait,184988774.0,
2019.0,2019.0,Export,Kuwait,World,28.0,"Inorganic chemicals; organic and inorganic compounds of precious metals; of rare earth metals, of radio-active elements and of isotopes",26887775.0,,29.2733964,47.4979476,-36.8535712,174.7456809,28.02019.0Kuwait,102886196.0,
2019.0,2019.0,Export,Kuwait,World,29.0,Organic chemicals,1667540691.0,,29.2733964,47.4979476,-36.8535712,174.7456809,29.02019.0Kuwait,254297040.0,
2019.0,2019.0,Export,Kuwait,World,30.0,Pharmaceutical products,43655774.0,,29.2733964,47.4979476,-36.8535712,174.7456809,30.02019.0Kuwait,1390645844.0,
2019.0,2019.0,Export,Kuwait,World,31.0,Fertilizers,140265.0,,29.2733964,47.4979476,-36.8535712,174.7456809,31.02019.0Kuwait,10764123.0,
2019.0,2019.0,Export,Kuwait,World,32.0,"Tanning or dyeing extracts; tannins and their derivatives; dyes, pigments and other colouring matter; paints, varnishes; putty, other mastics; inks",9419549.0,,29.2733964,47.4979476,-36.8535712,174.7456809,32.02019.0Kuwait,149095138.0,
2019.0,2019.0,Export,Kuwait,World,33.0,"Essential oils and resinoids; perfumery, cosmetic or toilet preparations",49777282.0,,29.2733964,47.4979476,-36.8535712,174.7456809,33.02019.0Kuwait,637897539.0,
2019.0,2019.0,Export,Kuwait,World,34.0,"Soap, organic surface-active agents; washing, lubricating, polishing or scouring preparations; artificial or prepared waxes, candles and similar articles, modelling pastes, dental waxes and dental preparations with a basis of plaster",37160390.0,,29.2733964,47.4979476,-36.8535712,174.7456809,34.02019.0Kuwait,320745879.0,
2019.0,2019.0,Export,Kuwait,World,35.0,Albuminoidal substances; modified starches; glues; enzymes,1174443.0,,29.2733964,47.4979476,-36.8535712,174.7456809,35.02019.0Kuwait,30467431.0,
2019.0,2019.0,Export,Kuwait,World,36.0,Explosives; pyrotechnic products; matches; pyrophoric alloys; certain combustible preparations,1122494.0,,29.2733964,47.4979476,-36.8535712,174.7456809,36.02019.0Kuwait,19648292.0,
2019.0,2019.0,Export,Kuwait,World,37.0,Photographic or cinematographic goods,124639.0,,29.2733964,47.4979476,-36.8535712,174.7456809,37.02019.0Kuwait,11380312.0,
2019.0,2019.0,Export,Kuwait,World,38.0,Chemical products n.e.c.,159578091.0,,29.2733964,47.4979476,-36.8535712,174.7456809,38.02019.0Kuwait,521064668.0,
2019.0,2019.0,Export,Kuwait,World,39.0,Plastics and articles thereof,626953392.0,,29.2733964,47.4979476,-36.8535712,174.7456809,39.02019.0Kuwait,1041824839.0,
2019.0,2019.0,Export,Kuwait,World,40.0,Rubber and articles thereof,113976859.0,,29.2733964,47.4979476,-36.8535712,174.7456809,40.02019.0Kuwait,304234249.0,
2019.0,2019.0,Export,Kuwait,World,41.0,Raw hides and skins (other than furskins) and leather,864675.0,,29.2733964,47.4979476,-36.8535712,174.7456809,41.02019.0Kuwait,572256.0,
2019.0,2019.0,Export,Kuwait,World,42.0,"Articles of leather; saddlery and harness; travel goods, handbags and similar containers; articles of animal gut (other than silk-worm gut)",6690541.0,,29.2733964,47.4979476,-36.8535712,174.7456809,42.02019.0Kuwait,231211294.0,
2019.0,2019.0,Export,Kuwait,World,43.0,Furskins and artificial fur; manufactures thereof,81368.0,,29.2733964,47.4979476,-36.8535712,174.7456809,43.02019.0Kuwait,387309.0,
2019.0,2019.0,Export,Kuwait,World,44.0,Wood and articles of wood; wood charcoal,3972123.0,,29.2733964,47.4979476,-36.8535712,174.7456809,44.02019.0Kuwait,238948421.0,
2019.0,2019.0,Export,Kuwait,World,45.0,Cork and articles of cork,22125.0,,29.2733964,47.4979476,-36.8535712,174.7456809,45.02019.0Kuwait,1892202.0,
2019.0,2019.0,Export,Kuwait,World,46.0,"Manufactures of straw, esparto or other plaiting materials; basketware and wickerwork",207736.0,,29.2733964,47.4979476,-36.8535712,174.7456809,46.02019.0Kuwait,6111007.0,
2019.0,2019.0,Export,Kuwait,World,47.0,Pulp of wood or other fibrous cellulosic material; recovered (waste and scrap) paper or paperboard,14913193.0,,29.2733964,47.4979476,-36.8535712,174.7456809,47.02019.0Kuwait,11641355.0,
2019.0,2019.0,Export,Kuwait,World,48.0,"Paper and paperboard; articles of paper pulp, of paper or paperboard",78708547.0,,29.2733964,47.4979476,-36.8535712,174.7456809,48.02019.0Kuwait,384685868.0,
2019.0,2019.0,Export,Kuwait,World,49.0,"Printed books, newspapers, pictures and other products of the printing industry; manuscripts, typescripts and plans",3237980.0,,29.2733964,47.4979476,-36.8535712,174.7456809,49.02019.0Kuwait,46439924.0,
2019.0,2019.0,Export,Kuwait,World,50.0,Silk,83304.0,,29.2733964,47.4979476,-36.8535712,174.7456809,50.02019.0Kuwait,949544.0,
2019.0,2019.0,Export,Kuwait,World,51.0,"Wool, fine or coarse animal hair; horsehair yarn and woven fabric",357436.0,,29.2733964,47.4979476,-36.8535712,174.7456809,51.02019.0Kuwait,6540506.0,
2019.0,2019.0,Export,Kuwait,World,52.0,Cotton,588923.0,,29.2733964,47.4979476,-36.8535712,174.7456809,52.02019.0Kuwait,21735687.0,
2019.0,2019.0,Export,Kuwait,World,53.0,Vegetable textile fibres; paper yarn and woven fabrics of paper yarn,15627.0,,29.2733964,47.4979476,-36.8535712,174.7456809,53.02019.0Kuwait,3238906.0,
2019.0,2019.0,Export,Kuwait,World,54.0,Man-made filaments; strip and the like of man-made textile materials,3049420.0,,29.2733964,47.4979476,-36.8535712,174.7456809,54.02019.0Kuwait,74094004.0,
2019.0,2019.0,Export,Kuwait,World,55.0,Man-made staple fibres,1153144.0,,29.2733964,47.4979476,-36.8535712,174.7456809,55.02019.0Kuwait,53574326.0,
2019.0,2019.0,Export,Kuwait,World,56.0,"Wadding, felt and nonwovens, special yarns; twine, cordage, ropes and cables and articles thereof",911405.0,,29.2733964,47.4979476,-36.8535712,174.7456809,56.02019.0Kuwait,22697862.0,
2019.0,2019.0,Export,Kuwait,World,57.0,Carpets and other textile floor coverings,2697597.0,,29.2733964,47.4979476,-36.8535712,174.7456809,57.02019.0Kuwait,62476387.0,
2019.0,2019.0,Export,Kuwait,World,58.0,"Fabrics; special woven fabrics, tufted textile fabrics, lace, tapestries, trimmings, embroidery",200570.0,,29.2733964,47.4979476,-36.8535712,174.7456809,58.02019.0Kuwait,19245310.0,
2019.0,2019.0,Export,Kuwait,World,59.0,"Textile fabrics; impregnated, coated, covered or laminated; textile articles of a kind suitable for industrial use",57717.0,,29.2733964,47.4979476,-36.8535712,174.7456809,59.02019.0Kuwait,21790964.0,
2019.0,2019.0,Export,Kuwait,World,60.0,Fabrics; knitted or crocheted,800296.0,,29.2733964,47.4979476,-36.8535712,174.7456809,60.02019.0Kuwait,15460993.0,
2019.0,2019.0,Export,Kuwait,World,61.0,Apparel and clothing accessories; knitted or crocheted,18460129.0,,29.2733964,47.4979476,-36.8535712,174.7456809,61.02019.0Kuwait,582590514.0,
2019.0,2019.0,Export,Kuwait,World,62.0,Apparel and clothing accessories; not knitted or crocheted,28518558.0,,29.2733964,47.4979476,-36.8535712,174.7456809,62.02019.0Kuwait,550403890.0,
2019.0,2019.0,Export,Kuwait,World,63.0,"Textiles, made up articles; sets; worn clothing and worn textile articles; rags",20747707.0,,29.2733964,47.4979476,-36.8535712,174.7456809,63.02019.0Kuwait,97480860.0,
2019.0,2019.0,Export,Kuwait,World,64.0,Footwear; gaiters and the like; parts of such articles,19307864.0,,29.2733964,47.4979476,-36.8535712,174.7456809,64.02019.0Kuwait,290532827.0,
2019.0,2019.0,Export,Kuwait,World,65.0,Headgear and parts thereof,1285860.0,,29.2733964,47.4979476,-36.8535712,174.7456809,65.02019.0Kuwait,17445470.0,
2019.0,2019.0,Export,Kuwait,World,66.0,"Umbrellas, sun umbrellas, walking-sticks, seat sticks, whips, riding crops; and parts thereof",2906338.0,,29.2733964,47.4979476,-36.8535712,174.7456809,66.02019.0Kuwait,1641704.0,
2019.0,2019.0,Export,Kuwait,World,67.0,"Feathers and down, prepared; and articles made of feather or of down; artificial flowers; articles of human hair",157293.0,,29.2733964,47.4979476,-36.8535712,174.7456809,67.02019.0Kuwait,12248203.0,
2019.0,2019.0,Export,Kuwait,World,68.0,"Stone, plaster, cement, asbestos, mica or similar materials; articles thereof",3018005.0,,29.2733964,47.4979476,-36.8535712,174.7456809,68.02019.0Kuwait,235159150.0,
2019.0,2019.0,Export,Kuwait,World,69.0,Ceramic products,3474460.0,,29.2733964,47.4979476,-36.8535712,174.7456809,69.02019.0Kuwait,169801398.0,
2019.0,2019.0,Export,Kuwait,World,70.0,Glass and glassware,74152784.0,,29.2733964,47.4979476,-36.8535712,174.7456809,70.02019.0Kuwait,184858612.0,
2019.0,2019.0,Export,Kuwait,World,71.0,"Natural, cultured pearls; precious, semi-precious stones; precious metals, metals clad with precious metal, and articles thereof; imitation jewellery; coin",135843623.0,,29.2733964,47.4979476,-36.8535712,174.7456809,71.02019.0Kuwait,1094903366.0,
2019.0,2019.0,Export,Kuwait,World,72.0,Iron and steel,75063312.0,,29.2733964,47.4979476,-36.8535712,174.7456809,72.02019.0Kuwait,927004176.0,
2019.0,2019.0,Export,Kuwait,World,73.0,Iron or steel articles,76605655.0,,29.2733964,47.4979476,-36.8535712,174.7456809,73.02019.0Kuwait,1912845974.0,
2019.0,2019.0,Export,Kuwait,World,74.0,Copper and articles thereof,38166052.0,,29.2733964,47.4979476,-36.8535712,174.7456809,74.02019.0Kuwait,172415270.0,
2019.0,2019.0,Export,Kuwait,World,75.0,Nickel and articles thereof,365373.0,,29.2733964,47.4979476,-36.8535712,174.7456809,75.02019.0Kuwait,7486179.0,
2019.0,2019.0,Export,Kuwait,World,76.0,Aluminium and articles thereof,43497940.0,,29.2733964,47.4979476,-36.8535712,174.7456809,76.02019.0Kuwait,303699149.0,
2019.0,2019.0,Export,Kuwait,World,78.0,Lead and articles thereof,1714599.0,,29.2733964,47.4979476,-36.8535712,174.7456809,78.02019.0Kuwait,2961616.0,
2019.0,2019.0,Export,Kuwait,World,79.0,Zinc and articles thereof,1991635.0,,29.2733964,47.4979476,-36.8535712,174.7456809,79.02019.0Kuwait,11449109.0,
2019.0,2019.0,Export,Kuwait,World,80.0,Tin; articles thereof,45026446.0,,29.2733964,47.4979476,-36.8535712,174.7456809,80.02019.0Kuwait,391720.0,
2019.0,2019.0,Export,Kuwait,World,81.0,"Metals; n.e.c., cermets and articles thereof",16785964.0,,29.2733964,47.4979476,-36.8535712,174.7456809,81.02019.0Kuwait,1595404.0,
2019.0,2019.0,Export,Kuwait,World,82.0,"Tools, implements, cutlery, spoons and forks, of base metal; parts thereof, of base metal",8706260.0,,29.2733964,47.4979476,-36.8535712,174.7456809,82.02019.0Kuwait,110789170.0,
2019.0,2019.0,Export,Kuwait,World,83.0,Metal; miscellaneous products of base metal,4738513.0,,29.2733964,47.4979476,-36.8535712,174.7456809,83.02019.0Kuwait,119040440.0,
2019.0,2019.0,Export,Kuwait,World,84.0,"Nuclear reactors, boilers, machinery and mechanical appliances; parts thereof",309507742.0,,29.2733964,47.4979476,-36.8535712,174.7456809,84.02019.0Kuwait,3921282988.0,
2019.0,2019.0,Export,Kuwait,World,85.0,"Electrical machinery and equipment and parts thereof; sound recorders and reproducers; television image and sound recorders and reproducers, parts and accessories of such articles",216717152.0,,29.2733964,47.4979476,-36.8535712,174.7456809,85.02019.0Kuwait,3676366335.0,
2019.0,2019.0,Export,Kuwait,World,86.0,"Railway, tramway locomotives, rolling-stock and parts thereof; railway or tramway track fixtures and fittings and parts thereof; mechanical (including electro-mechanical) traffic signalling equipment of all kinds",1851974.0,,29.2733964,47.4979476,-36.8535712,174.7456809,86.02019.0Kuwait,13905741.0,
2019.0,2019.0,Export,Kuwait,World,87.0,"Vehicles; other than railway or tramway rolling stock, and parts and accessories thereof",1099964883.0,,29.2733964,47.4979476,-36.8535712,174.7456809,87.02019.0Kuwait,4397341094.0,
2019.0,2019.0,Export,Kuwait,World,88.0,"Aircraft, spacecraft and parts thereof",349.0,,29.2733964,47.4979476,-36.8535712,174.7456809,88.02019.0Kuwait,16375543.0,
2019.0,2019.0,Export,Kuwait,World,89.0,"Ships, boats and floating structures",1791567.0,,29.2733964,47.4979476,-36.8535712,174.7456809,89.02019.0Kuwait,124615223.0,
2019.0,2019.0,Export,Kuwait,World,90.0,"Optical, photographic, cinematographic, measuring, checking, medical or surgical instruments and apparatus; parts and accessories",64601369.0,,29.2733964,47.4979476,-36.8535712,174.7456809,90.02019.0Kuwait,899667028.0,
2019.0,2019.0,Export,Kuwait,World,91.0,Clocks and watches and parts thereof,73093377.0,,29.2733964,47.4979476,-36.8535712,174.7456809,91.02019.0Kuwait,238287313.0,
2019.0,2019.0,Export,Kuwait,World,92.0,Musical instruments; parts and accessories of such articles,1061705.0,,29.2733964,47.4979476,-36.8535712,174.7456809,92.02019.0Kuwait,2903345.0,
2019.0,2019.0,Export,Kuwait,World,93.0,Arms and ammunition; parts and accessories thereof,2219321.0,,29.2733964,47.4979476,-36.8535712,174.7456809,93.02019.0Kuwait,21113102.0,
2019.0,2019.0,Export,Kuwait,World,94.0,"Furniture; bedding, mattresses, mattress supports, cushions and similar stuffed furnishings; lamps and lighting fittings, n.e.c.; illuminated signs, illuminated name-plates and the like; prefabricated buildings",81472233.0,,29.2733964,47.4979476,-36.8535712,174.7456809,94.02019.0Kuwait,684032309.0,
2019.0,2019.0,Export,Kuwait,World,95.0,"Toys, games and sports requisites; parts and accessories thereof",6150429.0,,29.2733964,47.4979476,-36.8535712,174.7456809,95.02019.0Kuwait,133484945.0,
2019.0,2019.0,Export,Kuwait,World,96.0,Miscellaneous manufactured articles,6467665.0,,29.2733964,47.4979476,-36.8535712,174.7456809,96.02019.0Kuwait,157273891.0,
2019.0,2019.0,Export,Kuwait,World,97.0,Works of art; collectors' pieces and antiques,2795925.0,,29.2733964,47.4979476,-36.8535712,174.7456809,97.02019.0Kuwait,8922425.0,
2019.0,2019.0,Export,Kuwait,World,99.0,Commodities not specified according to kind,50312178.0,,29.2733964,47.4979476,-36.8535712,174.7456809,99.02019.0Kuwait,46979342.0,
