yr,periodDesc,rgDesc,rtTitle,cmdCode,cmdDescE,Subregion_export,Region_export,TradeValue_export,rtLat,rtLon,ptLon,ptLat,mid,Subregion_import,Region_import,TradeValue_import
2005.0,2005.0,Export,Algeria,1.0,Live animals,World,World,60287.0,28.0000272,2.9999825,,,12005Algeria,World,World,51481094.0
2005.0,2005.0,Export,Algeria,3.0,"Fish and crustaceans, molluscs and other aquatic invertebrates",World,World,11928177.0,28.0000272,2.9999825,,,32005Algeria,World,World,23139914.0
2005.0,2005.0,Export,Algeria,4.0,Dairy produce; birds eggs; natural honey;,World,World,5385110.0,28.0000272,2.9999825,,,42005Algeria,World,World,743574370.0
2005.0,2005.0,Export,Algeria,6.0,Live trees and other plants;,World,World,271.0,28.0000272,2.9999825,,,62005Algeria,World,World,6876875.0
2005.0,2005.0,Export,Algeria,7.0,Edible vegetables and certain roots and tubers,World,World,1109378.0,28.0000272,2.9999825,,,72005Algeria,World,World,166923311.0
2005.0,2005.0,Export,Algeria,8.0,Edible fruit and nuts; peel of citrus fruit or melons,World,World,19310965.0,28.0000272,2.9999825,,,82005Algeria,World,World,99082448.0
2005.0,2005.0,Export,Algeria,9.0,"Coffee, tea, matΦ and spices",World,World,1629.0,28.0000272,2.9999825,,,92005Algeria,World,World,144438318.0
2005.0,2005.0,Export,Algeria,11.0,Products of the milling industry; malt; starches; inulin,World,World,3014092.0,28.0000272,2.9999825,,,112005Algeria,World,World,13186384.0
2005.0,2005.0,Export,Algeria,12.0,Oil seeds and oleaginous fruits,World,World,5303366.0,28.0000272,2.9999825,,,122005Algeria,World,World,46759219.0
2005.0,2005.0,Export,Algeria,14.0,Vegetable plaiting materials; vegetable products nes,World,World,71789.0,28.0000272,2.9999825,,,142005Algeria,World,World,760048.0
2005.0,2005.0,Export,Algeria,15.0,Animal or vegetable fats and oils,World,World,7129627.0,28.0000272,2.9999825,,,152005Algeria,World,World,311187454.0
2005.0,2005.0,Export,Algeria,17.0,Sugars and sugar confectionery,World,World,2025371.0,28.0000272,2.9999825,,,172005Algeria,World,World,293808819.0
2005.0,2005.0,Export,Algeria,18.0,Cocoa and cocoa preparations,World,World,6901389.0,28.0000272,2.9999825,,,182005Algeria,World,World,20068939.0
2005.0,2005.0,Export,Algeria,19.0,"Preparations of cereals, flour, starch or milk; bakers' wares",World,World,1788554.0,28.0000272,2.9999825,,,192005Algeria,World,World,15223031.0
2005.0,2005.0,Export,Algeria,20.0,"Preparations of vegetables, fruit or nuts",World,World,464255.0,28.0000272,2.9999825,,,202005Algeria,World,World,24651229.0
2005.0,2005.0,Export,Algeria,21.0,Miscellaneous edible preparations,World,World,336339.0,28.0000272,2.9999825,,,212005Algeria,World,World,109980508.0
2005.0,2005.0,Export,Algeria,22.0,"Beverages, spirits and vinegar",World,World,5641951.0,28.0000272,2.9999825,,,222005Algeria,World,World,14036105.0
2005.0,2005.0,Export,Algeria,23.0,Residues and waste from the food industries,World,World,68.0,28.0000272,2.9999825,,,232005Algeria,World,World,163775500.0
2005.0,2005.0,Export,Algeria,24.0,Tobacco and manufactured tobacco substitutes,World,World,26207.0,28.0000272,2.9999825,,,242005Algeria,World,World,47973750.0
2005.0,2005.0,Export,Algeria,25.0,Salt; sulfur; earths and stone; plastering materials,World,World,23262468.0,28.0000272,2.9999825,,,252005Algeria,World,World,94608821.0
2005.0,2005.0,Export,Algeria,26.0,"Ores, slag and ash",World,World,211372.0,28.0000272,2.9999825,,,262005Algeria,World,World,69759879.0
2005.0,2005.0,Export,Algeria,27.0,"Mineral fuels, mineral oils and products of their distillation",World,World,45264246598.0,28.0000272,2.9999825,,,272005Algeria,World,World,209650906.0
2005.0,2005.0,Export,Algeria,28.0,Inorganic chemicals,World,World,191420181.0,28.0000272,2.9999825,,,282005Algeria,World,World,108897216.0
2005.0,2005.0,Export,Algeria,29.0,Organic chemicals,World,World,37926762.0,28.0000272,2.9999825,,,292005Algeria,World,World,204260658.0
2005.0,2005.0,Export,Algeria,30.0,Pharmaceutical products,World,World,952987.0,28.0000272,2.9999825,,,302005Algeria,World,World,1072593262.0
2005.0,2005.0,Export,Algeria,31.0,Fertilizers,World,World,54380088.0,28.0000272,2.9999825,,,312005Algeria,World,World,41431613.0
2005.0,2005.0,Export,Algeria,32.0,Tanning or dyeing extracts,World,World,156517.0,28.0000272,2.9999825,,,322005Algeria,World,World,96486991.0
2005.0,2005.0,Export,Algeria,33.0,"Essential oils and resinoids; perfumery, cosmetic or toilet preparations",World,World,154809.0,28.0000272,2.9999825,,,332005Algeria,World,World,61578975.0
2005.0,2005.0,Export,Algeria,36.0,Explosives; pyrotechnic products; matches,World,World,118147.0,28.0000272,2.9999825,,,362005Algeria,World,World,3385502.0
2005.0,2005.0,Export,Algeria,41.0,Raw hides and skins (other than fur skins) and leather,World,World,7789064.0,28.0000272,2.9999825,,,412005Algeria,World,World,1600239.0
2005.0,2005.0,Export,Algeria,42.0,Articles of leather; saddlery and harness,World,World,21324.0,28.0000272,2.9999825,,,422005Algeria,World,World,13568706.0
2005.0,2005.0,Export,Algeria,43.0,Fur skins and artificial fur; manufactures thereof,World,World,96.0,28.0000272,2.9999825,,,432005Algeria,World,World,6025.0
2005.0,2005.0,Export,Algeria,44.0,Wood and articles of wood; wood charcoal,World,World,162641.0,28.0000272,2.9999825,,,442005Algeria,World,World,347954767.0
2005.0,2005.0,Export,Algeria,45.0,Cork and articles of cork,World,World,11575512.0,28.0000272,2.9999825,,,452005Algeria,World,World,337769.0
2005.0,2005.0,Export,Algeria,46.0,"Manufactures of straw, of esparto or of other plaiting materials",World,World,4545.0,28.0000272,2.9999825,,,462005Algeria,World,World,606597.0
2005.0,2005.0,Export,Algeria,47.0,Pulp of wood or of other fibrous cellulose material,World,World,1133633.0,28.0000272,2.9999825,,,472005Algeria,World,World,5909473.0
2005.0,2005.0,Export,Algeria,48.0,"Paper and paperboard; articles of paper pulp, of paper or of paperboard",World,World,5505272.0,28.0000272,2.9999825,,,482005Algeria,World,World,302966151.0
2005.0,2005.0,Export,Algeria,49.0,"Printed books, newspapers, pictures and other products of the printing indu ...",World,World,1537388.0,28.0000272,2.9999825,,,492005Algeria,World,World,47284593.0
2005.0,2005.0,Export,Algeria,52.0,Cotton,World,World,45922.0,28.0000272,2.9999825,,,522005Algeria,World,World,21517701.0
2005.0,2005.0,Export,Algeria,54.0,Man-made filaments,World,World,381188.0,28.0000272,2.9999825,,,542005Algeria,World,World,57658653.0
2005.0,2005.0,Export,Algeria,55.0,Man-made staple fibers,World,World,41574.0,28.0000272,2.9999825,,,552005Algeria,World,World,41557471.0
2005.0,2005.0,Export,Algeria,56.0,"Wadding, felt and non-wovens; special yarns, twine, cordage, ropes and cabl ...",World,World,80349.0,28.0000272,2.9999825,,,562005Algeria,World,World,13332741.0
2005.0,2005.0,Export,Algeria,57.0,Carpets and other textile floor coverings,World,World,1222393.0,28.0000272,2.9999825,,,572005Algeria,World,World,5314311.0
2005.0,2005.0,Export,Algeria,58.0,"Special woven fabrics; tufted textile fabrics; lace, tapestries; trimmings; ...",World,World,200422.0,28.0000272,2.9999825,,,582005Algeria,World,World,10093468.0
2005.0,2005.0,Export,Algeria,59.0,"Impregnated, coated, covered or laminated textile fabrics",World,World,3717.0,28.0000272,2.9999825,,,592005Algeria,World,World,8117461.0
2005.0,2005.0,Export,Algeria,61.0,"Articles of apparel and clothing accessories, knitted or crocheted",World,World,159002.0,28.0000272,2.9999825,,,612005Algeria,World,World,40177001.0
2005.0,2005.0,Export,Algeria,62.0,"Articles of apparel and clothing accessories, not knitted or crocheted",World,World,40889.0,28.0000272,2.9999825,,,622005Algeria,World,World,33987542.0
2005.0,2005.0,Export,Algeria,63.0,Other made up textile articles; sets; worn clothing and worn textile articl ...,World,World,1171670.0,28.0000272,2.9999825,,,632005Algeria,World,World,25804838.0
2005.0,2005.0,Export,Algeria,64.0,"Footwear, gaiters and the like; parts of such articles",World,World,242735.0,28.0000272,2.9999825,,,642005Algeria,World,World,43076390.0
2005.0,2005.0,Export,Algeria,65.0,Headgear and parts thereof,World,World,1482.0,28.0000272,2.9999825,,,652005Algeria,World,World,5156141.0
2005.0,2005.0,Export,Algeria,67.0,Prepared feathers and down and articles made of feathers or of down,World,World,150.0,28.0000272,2.9999825,,,672005Algeria,World,World,1305892.0
2005.0,2005.0,Export,Algeria,68.0,"Articles of stone, plaster, cement, asbestos, mica or similar materials",World,World,21821.0,28.0000272,2.9999825,,,682005Algeria,World,World,56274524.0
2005.0,2005.0,Export,Algeria,69.0,Ceramic products,World,World,1165099.0,28.0000272,2.9999825,,,692005Algeria,World,World,88768109.0
2005.0,2005.0,Export,Algeria,70.0,Glass and glassware,World,World,884316.0,28.0000272,2.9999825,,,702005Algeria,World,World,82326293.0
2005.0,2005.0,Export,Algeria,71.0,"Natural or cultured pearls, precious or semi-precious stones",World,World,6182.0,28.0000272,2.9999825,,,712005Algeria,World,World,4475333.0
2005.0,2005.0,Export,Algeria,72.0,Iron and steel,World,World,162265455.0,28.0000272,2.9999825,,,722005Algeria,World,World,1034330260.0
2005.0,2005.0,Export,Algeria,73.0,Articles of iron or steel,World,World,6442936.0,28.0000272,2.9999825,,,732005Algeria,World,World,1015151644.0
2005.0,2005.0,Export,Algeria,74.0,Copper and articles thereof,World,World,50561966.0,28.0000272,2.9999825,,,742005Algeria,World,World,85683994.0
2005.0,2005.0,Export,Algeria,76.0,Aluminum and articles thereof,World,World,8205026.0,28.0000272,2.9999825,,,762005Algeria,World,World,134243192.0
2005.0,2005.0,Export,Algeria,78.0,Lead and articles thereof,World,World,73944.0,28.0000272,2.9999825,,,782005Algeria,World,World,9938040.0
2005.0,2005.0,Export,Algeria,79.0,Zinc and articles thereof,World,World,38418588.0,28.0000272,2.9999825,,,792005Algeria,World,World,2013995.0
2005.0,2005.0,Export,Algeria,82.0,"Tools, implements, cutlery, spoons and forks, of base metal",World,World,1022328.0,28.0000272,2.9999825,,,822005Algeria,World,World,118752728.0
2005.0,2005.0,Export,Algeria,83.0,Miscellaneous articles of base metal,World,World,79936.0,28.0000272,2.9999825,,,832005Algeria,World,World,48695366.0
2005.0,2005.0,Export,Algeria,84.0,Machinery and mechanical appliances; parts thereof,World,World,13685102.0,28.0000272,2.9999825,,,842005Algeria,World,World,3332656446.0
2005.0,2005.0,Export,Algeria,85.0,Electrical machinery and equipment and parts thereof; sound recorders and r ...,World,World,3390950.0,28.0000272,2.9999825,,,852005Algeria,World,World,2226953821.0
2005.0,2005.0,Export,Algeria,86.0,"Railway or tramway locomotives, rolling-stock and parts thereof",World,World,2916170.0,28.0000272,2.9999825,,,862005Algeria,World,World,25712661.0
2005.0,2005.0,Export,Algeria,87.0,Vehicles other than railway or tramway rolling stock,World,World,5445206.0,28.0000272,2.9999825,,,872005Algeria,World,World,2293884248.0
2005.0,2005.0,Export,Algeria,88.0,"Aircraft, spacecraft, and parts thereof",World,World,2080118.0,28.0000272,2.9999825,,,882005Algeria,World,World,851996436.0
2005.0,2005.0,Export,Algeria,89.0,"Ships, boats and floating structures",World,World,1695633.0,28.0000272,2.9999825,,,892005Algeria,World,World,130103764.0
2005.0,2005.0,Export,Algeria,90.0,"Optical, photographic, cinematographic, measuring, checking, precision, med ...",World,World,3004012.0,28.0000272,2.9999825,,,902005Algeria,World,World,420904292.0
2005.0,2005.0,Export,Algeria,91.0,Clocks and watches and parts thereof,World,World,2640.0,28.0000272,2.9999825,,,912005Algeria,World,World,6445706.0
2005.0,2005.0,Export,Algeria,92.0,Musical instruments; parts and accessories of such articles,World,World,48.0,28.0000272,2.9999825,,,922005Algeria,World,World,1147549.0
2005.0,2005.0,Export,Algeria,94.0,"Furniture; bedding, mattresses, cushions and similar stuffed furnishing",World,World,316308.0,28.0000272,2.9999825,,,942005Algeria,World,World,193538129.0
2005.0,2005.0,Export,Algeria,95.0,"Toys, games and sports requisites; parts and accessories thereof",World,World,13192.0,28.0000272,2.9999825,,,952005Algeria,World,World,15195782.0
2005.0,2005.0,Export,Algeria,96.0,Miscellaneous manufactured articles,World,World,128690.0,28.0000272,2.9999825,,,962005Algeria,World,World,17301896.0
2005.0,2005.0,Export,Algeria,97.0,"Works of art, collectors' pieces and antiques",World,World,1080.0,28.0000272,2.9999825,,,972005Algeria,World,World,6333.0
