yr,periodDesc,rgDesc,rtTitle,cmdCode,cmdDescE,Subregion_export,Region_export,TradeValue_export,rtLat,rtLon,ptLon,ptLat,mid,Subregion_import,Region_import,TradeValue_import
1998.0,1998.0,Export,Turkey,1.0,Live animals,World,World,47859300.0,38.9597594,34.9249653,,,11998Turkey,World,World,26090856.0
1998.0,1998.0,Export,Turkey,2.0,Meat and edible meat offal,World,World,19760776.0,38.9597594,34.9249653,,,21998Turkey,World,World,272702.0
1998.0,1998.0,Export,Turkey,3.0,"Fish, crustaceans, molluscs, aquatic invertebrates nes",World,World,39882424.0,38.9597594,34.9249653,,,31998Turkey,World,World,40558024.0
1998.0,1998.0,Export,Turkey,4.0,"Dairy products, eggs, honey, edible animal product nes",World,World,57984784.0,38.9597594,34.9249653,,,41998Turkey,World,World,36157068.0
1998.0,1998.0,Export,Turkey,5.0,"Products of animal origin, nes",World,World,44883712.0,38.9597594,34.9249653,,,51998Turkey,World,World,18274316.0
1998.0,1998.0,Export,Turkey,6.0,"Live trees, plants, bulbs, roots, cut flowers etc",World,World,18963560.0,38.9597594,34.9249653,,,61998Turkey,World,World,27103880.0
1998.0,1998.0,Export,Turkey,7.0,Edible vegetables and certain roots and tubers,World,World,391485344.0,38.9597594,34.9249653,,,71998Turkey,World,World,89836672.0
1998.0,1998.0,Export,Turkey,8.0,"Edible fruit, nuts, peel of citrus fruit, melons",World,World,1288513024.0,38.9597594,34.9249653,,,81998Turkey,World,World,63315520.0
1998.0,1998.0,Export,Turkey,9.0,"Coffee, tea, mate and spices",World,World,82969776.0,38.9597594,34.9249653,,,91998Turkey,World,World,39175824.0
1998.0,1998.0,Export,Turkey,10.0,Cereals,World,World,287111744.0,38.9597594,34.9249653,,,101998Turkey,World,World,465566272.0
1998.0,1998.0,Export,Turkey,11.0,"Milling products, malt, starches, inulin, wheat gluten",World,World,140354944.0,38.9597594,34.9249653,,,111998Turkey,World,World,5367331.0
1998.0,1998.0,Export,Turkey,12.0,"Oil seed, oleagic fruits, grain, seed, fruit, etc, nes",World,World,62036408.0,38.9597594,34.9249653,,,121998Turkey,World,World,353128448.0
1998.0,1998.0,Export,Turkey,13.0,"Lac, gums, resins, vegetable saps and extracts nes",World,World,653939.0,38.9597594,34.9249653,,,131998Turkey,World,World,16103873.0
1998.0,1998.0,Export,Turkey,14.0,"Vegetable plaiting materials, vegetable products nes",World,World,12768186.0,38.9597594,34.9249653,,,141998Turkey,World,World,2506122.0
1998.0,1998.0,Export,Turkey,15.0,"Animal,vegetable fats and oils, cleavage products, etc",World,World,348353728.0,38.9597594,34.9249653,,,151998Turkey,World,World,517091968.0
1998.0,1998.0,Export,Turkey,16.0,"Meat, fish and seafood food preparations nes",World,World,58400464.0,38.9597594,34.9249653,,,161998Turkey,World,World,2924816.0
1998.0,1998.0,Export,Turkey,17.0,Sugars and sugar confectionery,World,World,218740928.0,38.9597594,34.9249653,,,171998Turkey,World,World,13192217.0
1998.0,1998.0,Export,Turkey,18.0,Cocoa and cocoa preparations,World,World,74038264.0,38.9597594,34.9249653,,,181998Turkey,World,World,69547440.0
1998.0,1998.0,Export,Turkey,19.0,"Cereal, flour, starch, milk preparations and products",World,World,194432224.0,38.9597594,34.9249653,,,191998Turkey,World,World,32749714.0
1998.0,1998.0,Export,Turkey,20.0,"Vegetable, fruit, nut, etc food preparations",World,World,618220800.0,38.9597594,34.9249653,,,201998Turkey,World,World,24817752.0
1998.0,1998.0,Export,Turkey,23.0,"Residues, wastes of food industry, animal fodder",World,World,3873391.0,38.9597594,34.9249653,,,231998Turkey,World,World,157717632.0
1998.0,1998.0,Export,Turkey,24.0,Tobacco and manufactured tobacco substitutes,World,World,587158400.0,38.9597594,34.9249653,,,241998Turkey,World,World,307379936.0
1998.0,1998.0,Export,Turkey,25.0,"Salt, sulphur, earth, stone, plaster, lime and cement",World,World,412852064.0,38.9597594,34.9249653,,,251998Turkey,World,World,172085488.0
1998.0,1998.0,Export,Turkey,26.0,"Ores, slag and ash",World,World,125279856.0,38.9597594,34.9249653,,,261998Turkey,World,World,181131568.0
1998.0,1998.0,Export,Turkey,27.0,"Mineral fuels, oils, distillation products, etc",World,World,258929280.0,38.9597594,34.9249653,,,271998Turkey,World,World,4509460992.0
1998.0,1998.0,Export,Turkey,28.0,"Inorganic chemicals, precious metal compound, isotopes",World,World,185366128.0,38.9597594,34.9249653,,,281998Turkey,World,World,475076032.0
1998.0,1998.0,Export,Turkey,29.0,Organic chemicals,World,World,105419040.0,38.9597594,34.9249653,,,291998Turkey,World,World,1626556416.0
1998.0,1998.0,Export,Turkey,30.0,Pharmaceutical products,World,World,89077184.0,38.9597594,34.9249653,,,301998Turkey,World,World,718980032.0
1998.0,1998.0,Export,Turkey,31.0,Fertilizers,World,World,14115827.0,38.9597594,34.9249653,,,311998Turkey,World,World,365436320.0
1998.0,1998.0,Export,Turkey,32.0,"Tanning, dyeing extracts, tannins, derivs,pigments etc",World,World,100584288.0,38.9597594,34.9249653,,,321998Turkey,World,World,668808064.0
1998.0,1998.0,Export,Turkey,33.0,"Essential oils, perfumes, cosmetics, toileteries",World,World,67266840.0,38.9597594,34.9249653,,,331998Turkey,World,World,270033024.0
1998.0,1998.0,Export,Turkey,35.0,"Albuminoids, modified starches, glues, enzymes",World,World,11911346.0,38.9597594,34.9249653,,,351998Turkey,World,World,96074344.0
1998.0,1998.0,Export,Turkey,36.0,"Explosives, pyrotechnics, matches, pyrophorics, etc",World,World,5106250.0,38.9597594,34.9249653,,,361998Turkey,World,World,10128840.0
1998.0,1998.0,Export,Turkey,38.0,Miscellaneous chemical products,World,World,51969436.0,38.9597594,34.9249653,,,381998Turkey,World,World,549724992.0
1998.0,1998.0,Export,Turkey,40.0,Rubber and articles thereof,World,World,335100160.0,38.9597594,34.9249653,,,401998Turkey,World,World,483325504.0
1998.0,1998.0,Export,Turkey,42.0,"Articles of leather, animal gut, harness, travel goods",World,World,328892544.0,38.9597594,34.9249653,,,421998Turkey,World,World,52676520.0
1998.0,1998.0,Export,Turkey,43.0,"Furskins and artificial fur, manufactures thereof",World,World,79093072.0,38.9597594,34.9249653,,,431998Turkey,World,World,58935712.0
1998.0,1998.0,Export,Turkey,44.0,"Wood and articles of wood, wood charcoal",World,World,71035824.0,38.9597594,34.9249653,,,441998Turkey,World,World,282126944.0
1998.0,1998.0,Export,Turkey,45.0,Cork and articles of cork,World,World,296657.0,38.9597594,34.9249653,,,451998Turkey,World,World,2565174.0
1998.0,1998.0,Export,Turkey,47.0,"Pulp of wood, fibrous cellulosic material, waste etc",World,World,593090.0,38.9597594,34.9249653,,,471998Turkey,World,World,153255344.0
1998.0,1998.0,Export,Turkey,48.0,"Paper & paperboard, articles of pulp, paper and board",World,World,159235168.0,38.9597594,34.9249653,,,481998Turkey,World,World,719222464.0
1998.0,1998.0,Export,Turkey,49.0,"Printed books, newspapers, pictures etc",World,World,17597504.0,38.9597594,34.9249653,,,491998Turkey,World,World,83010744.0
1998.0,1998.0,Export,Turkey,50.0,Silk,World,World,1152539.0,38.9597594,34.9249653,,,501998Turkey,World,World,13143001.0
1998.0,1998.0,Export,Turkey,51.0,"Wool, animal hair, horsehair yarn and fabric thereof",World,World,97427480.0,38.9597594,34.9249653,,,511998Turkey,World,World,283069856.0
1998.0,1998.0,Export,Turkey,52.0,Cotton,World,World,781686016.0,38.9597594,34.9249653,,,521998Turkey,World,World,994751296.0
1998.0,1998.0,Export,Turkey,53.0,"Vegetable textile fibres nes, paper yarn, woven fabric",World,World,1895856.0,38.9597594,34.9249653,,,531998Turkey,World,World,66979828.0
1998.0,1998.0,Export,Turkey,54.0,Manmade filaments,World,World,375635360.0,38.9597594,34.9249653,,,541998Turkey,World,World,781923200.0
1998.0,1998.0,Export,Turkey,55.0,Manmade staple fibres,World,World,670521856.0,38.9597594,34.9249653,,,551998Turkey,World,World,640640640.0
1998.0,1998.0,Export,Turkey,56.0,"Wadding, felt, nonwovens, yarns, twine, cordage, etc",World,World,44138316.0,38.9597594,34.9249653,,,561998Turkey,World,World,91127920.0
1998.0,1998.0,Export,Turkey,57.0,Carpets and other textile floor coverings,World,World,343438112.0,38.9597594,34.9249653,,,571998Turkey,World,World,53502216.0
1998.0,1998.0,Export,Turkey,58.0,"Special woven or tufted fabric, lace, tapestry etc",World,World,177026224.0,38.9597594,34.9249653,,,581998Turkey,World,World,131783744.0
1998.0,1998.0,Export,Turkey,59.0,"Impregnated, coated or laminated textile fabric",World,World,122358240.0,38.9597594,34.9249653,,,591998Turkey,World,World,142563968.0
1998.0,1998.0,Export,Turkey,60.0,Knitted or crocheted fabric,World,World,191313728.0,38.9597594,34.9249653,,,601998Turkey,World,World,105647136.0
1998.0,1998.0,Export,Turkey,61.0,"Articles of apparel, accessories, knit or crochet",World,World,4225132288.0,38.9597594,34.9249653,,,611998Turkey,World,World,88195920.0
1998.0,1998.0,Export,Turkey,62.0,"Articles of apparel, accessories, not knit or crochet",World,World,2469593856.0,38.9597594,34.9249653,,,621998Turkey,World,World,117874768.0
1998.0,1998.0,Export,Turkey,63.0,"Other made textile articles, sets, worn clothing etc",World,World,930663488.0,38.9597594,34.9249653,,,631998Turkey,World,World,24810556.0
1998.0,1998.0,Export,Turkey,64.0,"Footwear, gaiters and the like, parts thereof",World,World,186149264.0,38.9597594,34.9249653,,,641998Turkey,World,World,128386704.0
1998.0,1998.0,Export,Turkey,65.0,Headgear and parts thereof,World,World,4544508.0,38.9597594,34.9249653,,,651998Turkey,World,World,4634126.0
1998.0,1998.0,Export,Turkey,66.0,"Umbrellas, walking-sticks, seat-sticks, whips, etc",World,World,521019.0,38.9597594,34.9249653,,,661998Turkey,World,World,6290604.0
1998.0,1998.0,Export,Turkey,67.0,"Bird skin, feathers, artificial flowers, human hair",World,World,262306.0,38.9597594,34.9249653,,,671998Turkey,World,World,8095870.0
1998.0,1998.0,Export,Turkey,68.0,"Stone, plaster, cement, asbestos, mica, etc articles",World,World,139535328.0,38.9597594,34.9249653,,,681998Turkey,World,World,124436464.0
1998.0,1998.0,Export,Turkey,69.0,Ceramic products,World,World,269878112.0,38.9597594,34.9249653,,,691998Turkey,World,World,108648992.0
1998.0,1998.0,Export,Turkey,70.0,Glass and glassware,World,World,349075104.0,38.9597594,34.9249653,,,701998Turkey,World,World,195907360.0
1998.0,1998.0,Export,Turkey,71.0,"Pearls, precious stones, metals, coins, etc",World,World,218264064.0,38.9597594,34.9249653,,,711998Turkey,World,World,83841200.0
1998.0,1998.0,Export,Turkey,72.0,Iron and steel,World,World,1588661376.0,38.9597594,34.9249653,,,721998Turkey,World,World,2782940416.0
1998.0,1998.0,Export,Turkey,73.0,Articles of iron or steel,World,World,661209216.0,38.9597594,34.9249653,,,731998Turkey,World,World,648925120.0
1998.0,1998.0,Export,Turkey,74.0,Copper and articles thereof,World,World,173979824.0,38.9597594,34.9249653,,,741998Turkey,World,World,350684928.0
1998.0,1998.0,Export,Turkey,75.0,Nickel and articles thereof,World,World,1428174.0,38.9597594,34.9249653,,,751998Turkey,World,World,22822068.0
1998.0,1998.0,Export,Turkey,76.0,Aluminium and articles thereof,World,World,280719872.0,38.9597594,34.9249653,,,761998Turkey,World,World,503072192.0
1998.0,1998.0,Export,Turkey,78.0,Lead and articles thereof,World,World,750264.0,38.9597594,34.9249653,,,781998Turkey,World,World,30987576.0
1998.0,1998.0,Export,Turkey,79.0,Zinc and articles thereof,World,World,18746488.0,38.9597594,34.9249653,,,791998Turkey,World,World,66646136.0
1998.0,1998.0,Export,Turkey,80.0,Tin and articles thereof,World,World,188253.0,38.9597594,34.9249653,,,801998Turkey,World,World,9285284.0
1998.0,1998.0,Export,Turkey,81.0,"Other base metals, cermets, articles thereof",World,World,3849857.0,38.9597594,34.9249653,,,811998Turkey,World,World,19303104.0
1998.0,1998.0,Export,Turkey,82.0,"Tools, implements, cutlery, etc of base metal",World,World,67354688.0,38.9597594,34.9249653,,,821998Turkey,World,World,155437600.0
1998.0,1998.0,Export,Turkey,84.0,"Nuclear reactors, boilers, machinery, etc",World,World,1161734272.0,38.9597594,34.9249653,,,841998Turkey,World,World,8925767680.0
1998.0,1998.0,Export,Turkey,86.0,"Railway, tramway locomotives, rolling stock, equipment",World,World,58712888.0,38.9597594,34.9249653,,,861998Turkey,World,World,41427048.0
1998.0,1998.0,Export,Turkey,88.0,"Aircraft, spacecraft, and parts thereof",World,World,123425192.0,38.9597594,34.9249653,,,881998Turkey,World,World,795999488.0
1998.0,1998.0,Export,Turkey,89.0,"Ships, boats and other floating structures",World,World,152505824.0,38.9597594,34.9249653,,,891998Turkey,World,World,319423680.0
1998.0,1998.0,Export,Turkey,91.0,Clocks and watches and parts thereof,World,World,3538070.0,38.9597594,34.9249653,,,911998Turkey,World,World,110292152.0
1998.0,1998.0,Export,Turkey,92.0,"Musical instruments, parts and accessories",World,World,1812529.0,38.9597594,34.9249653,,,921998Turkey,World,World,13862154.0
1998.0,1998.0,Export,Turkey,93.0,"Arms and ammunition, parts and accessories thereof",World,World,17389180.0,38.9597594,34.9249653,,,931998Turkey,World,World,264972528.0
1998.0,1998.0,Export,Turkey,94.0,"Furniture, lighting, signs, prefabricated buildings",World,World,163238176.0,38.9597594,34.9249653,,,941998Turkey,World,World,275526976.0
1998.0,1998.0,Export,Turkey,95.0,"Toys, games, sports requisites",World,World,14568522.0,38.9597594,34.9249653,,,951998Turkey,World,World,107002104.0
1998.0,1998.0,Export,Turkey,96.0,Miscellaneous manufactured articles,World,World,34946644.0,38.9597594,34.9249653,,,961998Turkey,World,World,148277216.0
1998.0,1998.0,Export,Turkey,97.0,"Works of art, collectors pieces and antiques",World,World,4037131.0,38.9597594,34.9249653,,,971998Turkey,World,World,3388380.0
