yr,periodDesc,rgDesc,rtTitle,cmdCode,cmdDescE,Subregion_export,Region_export,TradeValue_export,rtLat,rtLon,ptLon,ptLat,mid,Subregion_import,Region_import,TradeValue_import
2005.0,2005.0,Export,Mauritania,3.0,"Fish, crustaceans, molluscs, aquatic invertebrates nes",World,World,166786697.0,20.2540382,-9.2399263,,,32005Mauritania,World,World,16688.0
2005.0,2005.0,Export,Mauritania,15.0,"Animal,vegetable fats and oils, cleavage products, etc",World,World,69117.0,20.2540382,-9.2399263,,,152005Mauritania,World,World,45984933.0
2005.0,2005.0,Export,Mauritania,16.0,"Meat, fish and seafood food preparations nes",World,World,5920831.0,20.2540382,-9.2399263,,,162005Mauritania,World,World,101400.0
2005.0,2005.0,Export,Mauritania,23.0,"Residues, wastes of food industry, animal fodder",World,World,1960790.0,20.2540382,-9.2399263,,,232005Mauritania,World,World,295280.0
2005.0,2005.0,Export,Mauritania,26.0,"Ores, slag and ash",World,World,381584972.0,20.2540382,-9.2399263,,,262005Mauritania,World,World,53681.0
2005.0,2005.0,Export,Mauritania,41.0,Raw hides and skins (other than furskins) and leather,World,World,74948.0,20.2540382,-9.2399263,,,412005Mauritania,World,World,14152.0
