yr,periodDesc,rgDesc,rtTitle,ptTitle,cmdCode,cmdDescE,TradeValue_export,Unnamed: 0_export,rtLat,rtLon,ptLat,ptLon,mid,TradeValue_import,Unnamed: 0_import
2013.0,2013.0,Export,Yemen,World,3.0,"Fish and crustaceans, molluscs and other aquatic invertebrates",200987806.0,,16.3471243,47.8915271,-36.8535712,174.7456809,3.02013.0Yemen,3688677.0,
2013.0,2013.0,Export,Yemen,World,5.0,Animal originated products; not elsewhere specified or included,1024896.0,,16.3471243,47.8915271,-36.8535712,174.7456809,5.02013.0Yemen,22890.0,
2013.0,2013.0,Export,Yemen,World,6.0,"Trees and other plants, live; bulbs, roots and the like; cut flowers and ornamental foliage",1821443.0,,16.3471243,47.8915271,-36.8535712,174.7456809,6.02013.0Yemen,1394669.0,
2013.0,2013.0,Export,Yemen,World,7.0,Vegetables and certain roots and tubers; edible,19823562.0,,16.3471243,47.8915271,-36.8535712,174.7456809,7.02013.0Yemen,48938471.0,
2013.0,2013.0,Export,Yemen,World,8.0,"Fruit and nuts, edible; peel of citrus fruit or melons",45064124.0,,16.3471243,47.8915271,-36.8535712,174.7456809,8.02013.0Yemen,39692041.0,
2013.0,2013.0,Export,Yemen,World,9.0,"Coffee, tea, mate and spices",34758704.0,,16.3471243,47.8915271,-36.8535712,174.7456809,9.02013.0Yemen,62458160.0,
2013.0,2013.0,Export,Yemen,World,10.0,Cereals,4244976.0,,16.3471243,47.8915271,-36.8535712,174.7456809,10.02013.0Yemen,1565608892.0,
2013.0,2013.0,Export,Yemen,World,11.0,"Products of the milling industry; malt, starches, inulin, wheat gluten",24593688.0,,16.3471243,47.8915271,-36.8535712,174.7456809,11.02013.0Yemen,29309261.0,
2013.0,2013.0,Export,Yemen,World,12.0,"Oil seeds and oleaginous fruits; miscellaneous grains, seeds and fruit, industrial or medicinal plants; straw and fodder",815861.0,,16.3471243,47.8915271,-36.8535712,174.7456809,12.02013.0Yemen,33248958.0,
2013.0,2013.0,Export,Yemen,World,14.0,Vegetable plaiting materials; vegetable products not elsewhere specified or included,1415954.0,,16.3471243,47.8915271,-36.8535712,174.7456809,14.02013.0Yemen,299428.0,
2013.0,2013.0,Export,Yemen,World,15.0,Animal or vegetable fats and oils and their cleavage products; prepared animal fats; animal or vegetable waxes,7028009.0,,16.3471243,47.8915271,-36.8535712,174.7456809,15.02013.0Yemen,243814960.0,
2013.0,2013.0,Export,Yemen,World,16.0,"Meat, fish or crustaceans, molluscs or other aquatic invertebrates; preparations thereof",7747434.0,,16.3471243,47.8915271,-36.8535712,174.7456809,16.02013.0Yemen,30605492.0,
2013.0,2013.0,Export,Yemen,World,17.0,Sugars and sugar confectionery,4985117.0,,16.3471243,47.8915271,-36.8535712,174.7456809,17.02013.0Yemen,400814166.0,
2013.0,2013.0,Export,Yemen,World,18.0,Cocoa and cocoa preparations,109970.0,,16.3471243,47.8915271,-36.8535712,174.7456809,18.02013.0Yemen,20354387.0,
2013.0,2013.0,Export,Yemen,World,19.0,"Preparations of cereals, flour, starch or milk; pastrycooks' products",15152968.0,,16.3471243,47.8915271,-36.8535712,174.7456809,19.02013.0Yemen,156131779.0,
2013.0,2013.0,Export,Yemen,World,20.0,"Preparations of vegetables, fruit, nuts or other parts of plants",15186461.0,,16.3471243,47.8915271,-36.8535712,174.7456809,20.02013.0Yemen,187079656.0,
2013.0,2013.0,Export,Yemen,World,21.0,Miscellaneous edible preparations,698313.0,,16.3471243,47.8915271,-36.8535712,174.7456809,21.02013.0Yemen,71660455.0,
2013.0,2013.0,Export,Yemen,World,22.0,"Beverages, spirits and vinegar",1609459.0,,16.3471243,47.8915271,-36.8535712,174.7456809,22.02013.0Yemen,98031750.0,
2013.0,2013.0,Export,Yemen,World,23.0,"Food industries, residues and wastes thereof; prepared animal fodder",7966410.0,,16.3471243,47.8915271,-36.8535712,174.7456809,23.02013.0Yemen,137970932.0,
2013.0,2013.0,Export,Yemen,World,24.0,Tobacco and manufactured tobacco substitutes,12154839.0,,16.3471243,47.8915271,-36.8535712,174.7456809,24.02013.0Yemen,70078332.0,
2013.0,2013.0,Export,Yemen,World,25.0,"Salt; sulphur; earths, stone; plastering materials, lime and cement",441003.0,,16.3471243,47.8915271,-36.8535712,174.7456809,25.02013.0Yemen,76731552.0,
2013.0,2013.0,Export,Yemen,World,26.0,"Ores, slag and ash",50005.0,,16.3471243,47.8915271,-36.8535712,174.7456809,26.02013.0Yemen,1739948.0,
2013.0,2013.0,Export,Yemen,World,27.0,"Mineral fuels, mineral oils and products of their distillation; bituminous substances; mineral waxes",6448326711.0,,16.3471243,47.8915271,-36.8535712,174.7456809,27.02013.0Yemen,4352627312.0,
2013.0,2013.0,Export,Yemen,World,28.0,"Inorganic chemicals; organic and inorganic compounds of precious metals; of rare earth metals, of radio-active elements and of isotopes",612051.0,,16.3471243,47.8915271,-36.8535712,174.7456809,28.02013.0Yemen,34909874.0,
2013.0,2013.0,Export,Yemen,World,29.0,Organic chemicals,35082.0,,16.3471243,47.8915271,-36.8535712,174.7456809,29.02013.0Yemen,36973616.0,
2013.0,2013.0,Export,Yemen,World,30.0,Pharmaceutical products,5564789.0,,16.3471243,47.8915271,-36.8535712,174.7456809,30.02013.0Yemen,354374655.0,
2013.0,2013.0,Export,Yemen,World,32.0,"Tanning or dyeing extracts; tannins and their derivatives; dyes, pigments and other colouring matter; paints, varnishes; putty, other mastics; inks",6881.0,,16.3471243,47.8915271,-36.8535712,174.7456809,32.02013.0Yemen,28618656.0,
2013.0,2013.0,Export,Yemen,World,33.0,"Essential oils and resinoids; perfumery, cosmetic or toilet preparations",567779.0,,16.3471243,47.8915271,-36.8535712,174.7456809,33.02013.0Yemen,66171943.0,
2013.0,2013.0,Export,Yemen,World,34.0,"Soap, organic surface-active agents; washing, lubricating, polishing or scouring preparations; artificial or prepared waxes, candles and similar articles, modelling pastes, dental waxes and dental preparations with a basis of plaster",27998388.0,,16.3471243,47.8915271,-36.8535712,174.7456809,34.02013.0Yemen,64229026.0,
2013.0,2013.0,Export,Yemen,World,38.0,Chemical products n.e.c.,214065.0,,16.3471243,47.8915271,-36.8535712,174.7456809,38.02013.0Yemen,59835335.0,
2013.0,2013.0,Export,Yemen,World,39.0,Plastics and articles thereof,4694632.0,,16.3471243,47.8915271,-36.8535712,174.7456809,39.02013.0Yemen,374287034.0,
2013.0,2013.0,Export,Yemen,World,40.0,Rubber and articles thereof,43115.0,,16.3471243,47.8915271,-36.8535712,174.7456809,40.02013.0Yemen,100878704.0,
2013.0,2013.0,Export,Yemen,World,41.0,Raw hides and skins (other than furskins) and leather,20629509.0,,16.3471243,47.8915271,-36.8535712,174.7456809,41.02013.0Yemen,548161.0,
2013.0,2013.0,Export,Yemen,World,42.0,"Articles of leather; saddlery and harness; travel goods, handbags and similar containers; articles of animal gut (other than silk-worm gut)",41454.0,,16.3471243,47.8915271,-36.8535712,174.7456809,42.02013.0Yemen,6991077.0,
2013.0,2013.0,Export,Yemen,World,43.0,Furskins and artificial fur; manufactures thereof,6201.0,,16.3471243,47.8915271,-36.8535712,174.7456809,43.02013.0Yemen,,
2013.0,2013.0,Export,Yemen,World,44.0,Wood and articles of wood; wood charcoal,55387.0,,16.3471243,47.8915271,-36.8535712,174.7456809,44.02013.0Yemen,176257393.0,
2013.0,2013.0,Export,Yemen,World,46.0,"Manufactures of straw, esparto or other plaiting materials; basketware and wickerwork",7822.0,,16.3471243,47.8915271,-36.8535712,174.7456809,46.02013.0Yemen,284462.0,
2013.0,2013.0,Export,Yemen,World,47.0,Pulp of wood or other fibrous cellulosic material; recovered (waste and scrap) paper or paperboard,1681854.0,,16.3471243,47.8915271,-36.8535712,174.7456809,47.02013.0Yemen,1043529.0,
2013.0,2013.0,Export,Yemen,World,48.0,"Paper and paperboard; articles of paper pulp, of paper or paperboard",1406795.0,,16.3471243,47.8915271,-36.8535712,174.7456809,48.02013.0Yemen,172665631.0,
2013.0,2013.0,Export,Yemen,World,49.0,"Printed books, newspapers, pictures and other products of the printing industry; manuscripts, typescripts and plans",121514.0,,16.3471243,47.8915271,-36.8535712,174.7456809,49.02013.0Yemen,9782872.0,
2013.0,2013.0,Export,Yemen,World,52.0,Cotton,506144.0,,16.3471243,47.8915271,-36.8535712,174.7456809,52.02013.0Yemen,360841.0,
2013.0,2013.0,Export,Yemen,World,53.0,Vegetable textile fibres; paper yarn and woven fabrics of paper yarn,6327.0,,16.3471243,47.8915271,-36.8535712,174.7456809,53.02013.0Yemen,133234.0,
2013.0,2013.0,Export,Yemen,World,54.0,Man-made filaments; strip and the like of man-made textile materials,84446.0,,16.3471243,47.8915271,-36.8535712,174.7456809,54.02013.0Yemen,59318239.0,
2013.0,2013.0,Export,Yemen,World,59.0,"Textile fabrics; impregnated, coated, covered or laminated; textile articles of a kind suitable for industrial use",104422.0,,16.3471243,47.8915271,-36.8535712,174.7456809,59.02013.0Yemen,4098627.0,
2013.0,2013.0,Export,Yemen,World,60.0,Fabrics; knitted or crocheted,76431.0,,16.3471243,47.8915271,-36.8535712,174.7456809,60.02013.0Yemen,170699.0,
2013.0,2013.0,Export,Yemen,World,61.0,Apparel and clothing accessories; knitted or crocheted,210756.0,,16.3471243,47.8915271,-36.8535712,174.7456809,61.02013.0Yemen,4766661.0,
2013.0,2013.0,Export,Yemen,World,62.0,Apparel and clothing accessories; not knitted or crocheted,152578.0,,16.3471243,47.8915271,-36.8535712,174.7456809,62.02013.0Yemen,85149868.0,
2013.0,2013.0,Export,Yemen,World,63.0,"Textiles, made up articles; sets; worn clothing and worn textile articles; rags",339623.0,,16.3471243,47.8915271,-36.8535712,174.7456809,63.02013.0Yemen,30603996.0,
2013.0,2013.0,Export,Yemen,World,64.0,Footwear; gaiters and the like; parts of such articles,1298707.0,,16.3471243,47.8915271,-36.8535712,174.7456809,64.02013.0Yemen,46018365.0,
2013.0,2013.0,Export,Yemen,World,67.0,"Feathers and down, prepared; and articles made of feather or of down; artificial flowers; articles of human hair",11724.0,,16.3471243,47.8915271,-36.8535712,174.7456809,67.02013.0Yemen,716547.0,
2013.0,2013.0,Export,Yemen,World,68.0,"Stone, plaster, cement, asbestos, mica or similar materials; articles thereof",685521.0,,16.3471243,47.8915271,-36.8535712,174.7456809,68.02013.0Yemen,18677858.0,
2013.0,2013.0,Export,Yemen,World,69.0,Ceramic products,381964.0,,16.3471243,47.8915271,-36.8535712,174.7456809,69.02013.0Yemen,77167475.0,
2013.0,2013.0,Export,Yemen,World,70.0,Glass and glassware,5695.0,,16.3471243,47.8915271,-36.8535712,174.7456809,70.02013.0Yemen,26895111.0,
2013.0,2013.0,Export,Yemen,World,71.0,"Natural, cultured pearls; precious, semi-precious stones; precious metals, metals clad with precious metal, and articles thereof; imitation jewellery; coin",16430366.0,,16.3471243,47.8915271,-36.8535712,174.7456809,71.02013.0Yemen,46308226.0,
2013.0,2013.0,Export,Yemen,World,72.0,Iron and steel,46500412.0,,16.3471243,47.8915271,-36.8535712,174.7456809,72.02013.0Yemen,436728248.0,
2013.0,2013.0,Export,Yemen,World,73.0,Iron or steel articles,1188985.0,,16.3471243,47.8915271,-36.8535712,174.7456809,73.02013.0Yemen,204281281.0,
2013.0,2013.0,Export,Yemen,World,74.0,Copper and articles thereof,1024840.0,,16.3471243,47.8915271,-36.8535712,174.7456809,74.02013.0Yemen,11874524.0,
2013.0,2013.0,Export,Yemen,World,76.0,Aluminium and articles thereof,108216.0,,16.3471243,47.8915271,-36.8535712,174.7456809,76.02013.0Yemen,59687697.0,
2013.0,2013.0,Export,Yemen,World,78.0,Lead and articles thereof,75007.0,,16.3471243,47.8915271,-36.8535712,174.7456809,78.02013.0Yemen,11876.0,
2013.0,2013.0,Export,Yemen,World,82.0,"Tools, implements, cutlery, spoons and forks, of base metal; parts thereof, of base metal",3554285.0,,16.3471243,47.8915271,-36.8535712,174.7456809,82.02013.0Yemen,22558435.0,
2013.0,2013.0,Export,Yemen,World,83.0,Metal; miscellaneous products of base metal,184473.0,,16.3471243,47.8915271,-36.8535712,174.7456809,83.02013.0Yemen,15258969.0,
2013.0,2013.0,Export,Yemen,World,84.0,"Nuclear reactors, boilers, machinery and mechanical appliances; parts thereof",33126437.0,,16.3471243,47.8915271,-36.8535712,174.7456809,84.02013.0Yemen,573369332.0,
2013.0,2013.0,Export,Yemen,World,85.0,"Electrical machinery and equipment and parts thereof; sound recorders and reproducers; television image and sound recorders and reproducers, parts and accessories of such articles",15658791.0,,16.3471243,47.8915271,-36.8535712,174.7456809,85.02013.0Yemen,409984055.0,
2013.0,2013.0,Export,Yemen,World,86.0,"Railway, tramway locomotives, rolling-stock and parts thereof; railway or tramway track fixtures and fittings and parts thereof; mechanical (including electro-mechanical) traffic signalling equipment of all kinds",191283.0,,16.3471243,47.8915271,-36.8535712,174.7456809,86.02013.0Yemen,15277373.0,
2013.0,2013.0,Export,Yemen,World,87.0,"Vehicles; other than railway or tramway rolling stock, and parts and accessories thereof",11752181.0,,16.3471243,47.8915271,-36.8535712,174.7456809,87.02013.0Yemen,1052929070.0,
2013.0,2013.0,Export,Yemen,World,88.0,"Aircraft, spacecraft and parts thereof",27875861.0,,16.3471243,47.8915271,-36.8535712,174.7456809,88.02013.0Yemen,56293924.0,
2013.0,2013.0,Export,Yemen,World,89.0,"Ships, boats and floating structures",2091451.0,,16.3471243,47.8915271,-36.8535712,174.7456809,89.02013.0Yemen,2128411.0,
2013.0,2013.0,Export,Yemen,World,90.0,"Optical, photographic, cinematographic, measuring, checking, medical or surgical instruments and apparatus; parts and accessories",2703166.0,,16.3471243,47.8915271,-36.8535712,174.7456809,90.02013.0Yemen,70522062.0,
2013.0,2013.0,Export,Yemen,World,94.0,"Furniture; bedding, mattresses, mattress supports, cushions and similar stuffed furnishings; lamps and lighting fittings, n.e.c.; illuminated signs, illuminated name-plates and the like; prefabricated buildings",3337879.0,,16.3471243,47.8915271,-36.8535712,174.7456809,94.02013.0Yemen,38260767.0,
2013.0,2013.0,Export,Yemen,World,95.0,"Toys, games and sports requisites; parts and accessories thereof",35342.0,,16.3471243,47.8915271,-36.8535712,174.7456809,95.02013.0Yemen,7179506.0,
2013.0,2013.0,Export,Yemen,World,96.0,Miscellaneous manufactured articles,309958.0,,16.3471243,47.8915271,-36.8535712,174.7456809,96.02013.0Yemen,45047015.0,
2013.0,2013.0,Export,Yemen,World,97.0,Works of art; collectors' pieces and antiques,1074221.0,,16.3471243,47.8915271,-36.8535712,174.7456809,97.02013.0Yemen,15907.0,
