yr,periodDesc,rgDesc,rtTitle,cmdCode,cmdDescE,Subregion_export,Region_export,TradeValue_export,rtLat,rtLon,ptLon,ptLat,mid,Subregion_import,Region_import,TradeValue_import
2008.0,2008.0,Export,Bahrain,1.0,Live animals,World,World,2253863.0,26.1551249,50.5344606,,,12008Bahrain,World,World,93284274.0
2008.0,2008.0,Export,Bahrain,2.0,Meat and edible meat offal,World,World,6584454.0,26.1551249,50.5344606,,,22008Bahrain,World,World,99172488.0
2008.0,2008.0,Export,Bahrain,3.0,"Fish and crustaceans, molluscs and other aquatic invertebrates",World,World,20170176.0,26.1551249,50.5344606,,,32008Bahrain,World,World,12716891.0
2008.0,2008.0,Export,Bahrain,4.0,Dairy produce; birds eggs; natural honey;,World,World,111624608.0,26.1551249,50.5344606,,,42008Bahrain,World,World,206250377.0
2008.0,2008.0,Export,Bahrain,6.0,Live trees and other plants;,World,World,505.0,26.1551249,50.5344606,,,62008Bahrain,World,World,7473631.0
2008.0,2008.0,Export,Bahrain,7.0,Edible vegetables and certain roots and tubers,World,World,2531435.0,26.1551249,50.5344606,,,72008Bahrain,World,World,53118451.0
2008.0,2008.0,Export,Bahrain,8.0,Edible fruit and nuts; peel of citrus fruit or melons,World,World,3033612.0,26.1551249,50.5344606,,,82008Bahrain,World,World,65718719.0
2008.0,2008.0,Export,Bahrain,9.0,"Coffee, tea, matΦ and spices",World,World,1381998.0,26.1551249,50.5344606,,,92008Bahrain,World,World,20536670.0
2008.0,2008.0,Export,Bahrain,10.0,Cereals,World,World,319755.0,26.1551249,50.5344606,,,102008Bahrain,World,World,121418812.0
2008.0,2008.0,Export,Bahrain,11.0,Products of the milling industry; malt; starches; inulin,World,World,105734.0,26.1551249,50.5344606,,,112008Bahrain,World,World,6247769.0
2008.0,2008.0,Export,Bahrain,12.0,Oil seeds and oleaginous fruits,World,World,43851.0,26.1551249,50.5344606,,,122008Bahrain,World,World,8137114.0
2008.0,2008.0,Export,Bahrain,13.0,"Lac; gums, resins and other vegetable saps and extracts",World,World,48542.0,26.1551249,50.5344606,,,132008Bahrain,World,World,1237421.0
2008.0,2008.0,Export,Bahrain,14.0,Vegetable plaiting materials; vegetable products nes,World,World,33308.0,26.1551249,50.5344606,,,142008Bahrain,World,World,424414.0
2008.0,2008.0,Export,Bahrain,15.0,Animal or vegetable fats and oils,World,World,233300.0,26.1551249,50.5344606,,,152008Bahrain,World,World,40159217.0
2008.0,2008.0,Export,Bahrain,16.0,"Preparations of meat, of fish or of crustaceans",World,World,239335.0,26.1551249,50.5344606,,,162008Bahrain,World,World,35983517.0
2008.0,2008.0,Export,Bahrain,17.0,Sugars and sugar confectionery,World,World,13321281.0,26.1551249,50.5344606,,,172008Bahrain,World,World,35009758.0
2008.0,2008.0,Export,Bahrain,18.0,Cocoa and cocoa preparations,World,World,313162.0,26.1551249,50.5344606,,,182008Bahrain,World,World,26162778.0
2008.0,2008.0,Export,Bahrain,19.0,"Preparations of cereals, flour, starch or milk; bakers' wares",World,World,10404746.0,26.1551249,50.5344606,,,192008Bahrain,World,World,67003933.0
2008.0,2008.0,Export,Bahrain,20.0,"Preparations of vegetables, fruit or nuts",World,World,13094494.0,26.1551249,50.5344606,,,202008Bahrain,World,World,55169330.0
2008.0,2008.0,Export,Bahrain,21.0,Miscellaneous edible preparations,World,World,77922271.0,26.1551249,50.5344606,,,212008Bahrain,World,World,57283337.0
2008.0,2008.0,Export,Bahrain,22.0,"Beverages, spirits and vinegar",World,World,15179927.0,26.1551249,50.5344606,,,222008Bahrain,World,World,103021013.0
2008.0,2008.0,Export,Bahrain,23.0,Residues and waste from the food industries,World,World,68971.0,26.1551249,50.5344606,,,232008Bahrain,World,World,5876243.0
2008.0,2008.0,Export,Bahrain,24.0,Tobacco and manufactured tobacco substitutes,World,World,5049792.0,26.1551249,50.5344606,,,242008Bahrain,World,World,51715466.0
2008.0,2008.0,Export,Bahrain,25.0,Salt; sulfur; earths and stone; plastering materials,World,World,2490062.0,26.1551249,50.5344606,,,252008Bahrain,World,World,138498105.0
2008.0,2008.0,Export,Bahrain,26.0,"Ores, slag and ash",World,World,633860135.0,26.1551249,50.5344606,,,262008Bahrain,World,World,418457082.0
2008.0,2008.0,Export,Bahrain,27.0,"Mineral fuels, mineral oils and products of their distillation",World,World,8685830782.0,26.1551249,50.5344606,,,272008Bahrain,World,World,8166429953.0
2008.0,2008.0,Export,Bahrain,28.0,Inorganic chemicals,World,World,48716689.0,26.1551249,50.5344606,,,282008Bahrain,World,World,743164376.0
2008.0,2008.0,Export,Bahrain,29.0,Organic chemicals,World,World,121864968.0,26.1551249,50.5344606,,,292008Bahrain,World,World,29892519.0
2008.0,2008.0,Export,Bahrain,30.0,Pharmaceutical products,World,World,1360224.0,26.1551249,50.5344606,,,302008Bahrain,World,World,135599418.0
2008.0,2008.0,Export,Bahrain,31.0,Fertilizers,World,World,300422192.0,26.1551249,50.5344606,,,312008Bahrain,World,World,4552171.0
2008.0,2008.0,Export,Bahrain,32.0,Tanning or dyeing extracts,World,World,1772532.0,26.1551249,50.5344606,,,322008Bahrain,World,World,64317299.0
2008.0,2008.0,Export,Bahrain,33.0,"Essential oils and resinoids; perfumery, cosmetic or toilet preparations",World,World,27866304.0,26.1551249,50.5344606,,,332008Bahrain,World,World,97668136.0
2008.0,2008.0,Export,Bahrain,35.0,Albuminoidal substances; modified starches; glues; enzymes,World,World,104122.0,26.1551249,50.5344606,,,352008Bahrain,World,World,9999898.0
2008.0,2008.0,Export,Bahrain,37.0,Photographic or cinematographic goods,World,World,12319.0,26.1551249,50.5344606,,,372008Bahrain,World,World,13634474.0
2008.0,2008.0,Export,Bahrain,38.0,Miscellaneous chemical products,World,World,28414391.0,26.1551249,50.5344606,,,382008Bahrain,World,World,66619322.0
2008.0,2008.0,Export,Bahrain,39.0,Plastics and articles thereof,World,World,111238342.0,26.1551249,50.5344606,,,392008Bahrain,World,World,243379168.0
2008.0,2008.0,Export,Bahrain,40.0,Rubber and articles thereof,World,World,12990037.0,26.1551249,50.5344606,,,402008Bahrain,World,World,67324413.0
2008.0,2008.0,Export,Bahrain,41.0,Raw hides and skins (other than fur skins) and leather,World,World,392303.0,26.1551249,50.5344606,,,412008Bahrain,World,World,609334.0
2008.0,2008.0,Export,Bahrain,42.0,Articles of leather; saddlery and harness,World,World,231332.0,26.1551249,50.5344606,,,422008Bahrain,World,World,33550124.0
2008.0,2008.0,Export,Bahrain,44.0,Wood and articles of wood; wood charcoal,World,World,1631947.0,26.1551249,50.5344606,,,442008Bahrain,World,World,114316534.0
2008.0,2008.0,Export,Bahrain,45.0,Cork and articles of cork,World,World,74319.0,26.1551249,50.5344606,,,452008Bahrain,World,World,760313.0
2008.0,2008.0,Export,Bahrain,46.0,"Manufactures of straw, of esparto or of other plaiting materials",World,World,4867.0,26.1551249,50.5344606,,,462008Bahrain,World,World,1465878.0
2008.0,2008.0,Export,Bahrain,47.0,Pulp of wood or of other fibrous cellulose material,World,World,1231370.0,26.1551249,50.5344606,,,472008Bahrain,World,World,9108280.0
2008.0,2008.0,Export,Bahrain,48.0,"Paper and paperboard; articles of paper pulp, of paper or of paperboard",World,World,60833470.0,26.1551249,50.5344606,,,482008Bahrain,World,World,127932875.0
2008.0,2008.0,Export,Bahrain,49.0,"Printed books, newspapers, pictures and other products of the printing indu ...",World,World,507233.0,26.1551249,50.5344606,,,492008Bahrain,World,World,16230672.0
2008.0,2008.0,Export,Bahrain,52.0,Cotton,World,World,57679781.0,26.1551249,50.5344606,,,522008Bahrain,World,World,94536581.0
2008.0,2008.0,Export,Bahrain,54.0,Man-made filaments,World,World,1105267.0,26.1551249,50.5344606,,,542008Bahrain,World,World,18571684.0
2008.0,2008.0,Export,Bahrain,55.0,Man-made staple fibers,World,World,1430330.0,26.1551249,50.5344606,,,552008Bahrain,World,World,14472319.0
2008.0,2008.0,Export,Bahrain,56.0,"Wadding, felt and non-wovens; special yarns, twine, cordage, ropes and cabl ...",World,World,403148.0,26.1551249,50.5344606,,,562008Bahrain,World,World,7886540.0
2008.0,2008.0,Export,Bahrain,57.0,Carpets and other textile floor coverings,World,World,232239.0,26.1551249,50.5344606,,,572008Bahrain,World,World,17505388.0
2008.0,2008.0,Export,Bahrain,58.0,"Special woven fabrics; tufted textile fabrics; lace, tapestries; trimmings; ...",World,World,203944.0,26.1551249,50.5344606,,,582008Bahrain,World,World,3645664.0
2008.0,2008.0,Export,Bahrain,59.0,"Impregnated, coated, covered or laminated textile fabrics",World,World,29808.0,26.1551249,50.5344606,,,592008Bahrain,World,World,11170646.0
2008.0,2008.0,Export,Bahrain,60.0,Knitted or crocheted fabrics,World,World,2984.0,26.1551249,50.5344606,,,602008Bahrain,World,World,1363184.0
2008.0,2008.0,Export,Bahrain,61.0,"Articles of apparel and clothing accessories, knitted or crocheted",World,World,2635775.0,26.1551249,50.5344606,,,612008Bahrain,World,World,71137370.0
2008.0,2008.0,Export,Bahrain,62.0,"Articles of apparel and clothing accessories, not knitted or crocheted",World,World,55998714.0,26.1551249,50.5344606,,,622008Bahrain,World,World,87249784.0
2008.0,2008.0,Export,Bahrain,64.0,"Footwear, gaiters and the like; parts of such articles",World,World,163859.0,26.1551249,50.5344606,,,642008Bahrain,World,World,39883648.0
2008.0,2008.0,Export,Bahrain,67.0,Prepared feathers and down and articles made of feathers or of down,World,World,51380.0,26.1551249,50.5344606,,,672008Bahrain,World,World,1120761.0
2008.0,2008.0,Export,Bahrain,69.0,Ceramic products,World,World,1238668.0,26.1551249,50.5344606,,,692008Bahrain,World,World,87235372.0
2008.0,2008.0,Export,Bahrain,70.0,Glass and glassware,World,World,2899756.0,26.1551249,50.5344606,,,702008Bahrain,World,World,72476317.0
2008.0,2008.0,Export,Bahrain,71.0,"Natural or cultured pearls, precious or semi-precious stones",World,World,11602762.0,26.1551249,50.5344606,,,712008Bahrain,World,World,97557618.0
2008.0,2008.0,Export,Bahrain,72.0,Iron and steel,World,World,63705116.0,26.1551249,50.5344606,,,722008Bahrain,World,World,778806979.0
2008.0,2008.0,Export,Bahrain,74.0,Copper and articles thereof,World,World,4720601.0,26.1551249,50.5344606,,,742008Bahrain,World,World,41405800.0
2008.0,2008.0,Export,Bahrain,75.0,Nickel and articles thereof,World,World,2338.0,26.1551249,50.5344606,,,752008Bahrain,World,World,2675929.0
2008.0,2008.0,Export,Bahrain,76.0,Aluminum and articles thereof,World,World,1774293580.0,26.1551249,50.5344606,,,762008Bahrain,World,World,121017831.0
2008.0,2008.0,Export,Bahrain,78.0,Lead and articles thereof,World,World,1369155.0,26.1551249,50.5344606,,,782008Bahrain,World,World,2759131.0
2008.0,2008.0,Export,Bahrain,79.0,Zinc and articles thereof,World,World,28566.0,26.1551249,50.5344606,,,792008Bahrain,World,World,1987350.0
2008.0,2008.0,Export,Bahrain,81.0,Other base metals; cermets; articles thereof,World,World,23043.0,26.1551249,50.5344606,,,812008Bahrain,World,World,27514770.0
2008.0,2008.0,Export,Bahrain,83.0,Miscellaneous articles of base metal,World,World,24589251.0,26.1551249,50.5344606,,,832008Bahrain,World,World,66427939.0
2008.0,2008.0,Export,Bahrain,84.0,Machinery and mechanical appliances; parts thereof,World,World,260845543.0,26.1551249,50.5344606,,,842008Bahrain,World,World,1385691752.0
2008.0,2008.0,Export,Bahrain,85.0,Electrical machinery and equipment and parts thereof; sound recorders and r ...,World,World,39948388.0,26.1551249,50.5344606,,,852008Bahrain,World,World,1027149926.0
2008.0,2008.0,Export,Bahrain,86.0,"Railway or tramway locomotives, rolling-stock and parts thereof",World,World,256758.0,26.1551249,50.5344606,,,862008Bahrain,World,World,1776332.0
2008.0,2008.0,Export,Bahrain,87.0,Vehicles other than railway or tramway rolling stock,World,World,227263315.0,26.1551249,50.5344606,,,872008Bahrain,World,World,1465534979.0
2008.0,2008.0,Export,Bahrain,88.0,"Aircraft, spacecraft, and parts thereof",World,World,1488779.0,26.1551249,50.5344606,,,882008Bahrain,World,World,127329257.0
2008.0,2008.0,Export,Bahrain,89.0,"Ships, boats and floating structures",World,World,8449619.0,26.1551249,50.5344606,,,892008Bahrain,World,World,74816148.0
2008.0,2008.0,Export,Bahrain,90.0,"Optical, photographic, cinematographic, measuring, checking, precision, med ...",World,World,9692492.0,26.1551249,50.5344606,,,902008Bahrain,World,World,100922854.0
2008.0,2008.0,Export,Bahrain,91.0,Clocks and watches and parts thereof,World,World,3359082.0,26.1551249,50.5344606,,,912008Bahrain,World,World,50665168.0
2008.0,2008.0,Export,Bahrain,92.0,Musical instruments; parts and accessories of such articles,World,World,165462.0,26.1551249,50.5344606,,,922008Bahrain,World,World,1547447.0
2008.0,2008.0,Export,Bahrain,94.0,"Furniture; bedding, mattresses, cushions and similar stuffed furnishing",World,World,51142148.0,26.1551249,50.5344606,,,942008Bahrain,World,World,223978504.0
2008.0,2008.0,Export,Bahrain,95.0,"Toys, games and sports requisites; parts and accessories thereof",World,World,657605.0,26.1551249,50.5344606,,,952008Bahrain,World,World,32420227.0
2008.0,2008.0,Export,Bahrain,96.0,Miscellaneous manufactured articles,World,World,272055.0,26.1551249,50.5344606,,,962008Bahrain,World,World,16323473.0
2008.0,2008.0,Export,Bahrain,97.0,"Works of art, collectors' pieces and antiques",World,World,8532.0,26.1551249,50.5344606,,,972008Bahrain,World,World,729259.0
