yr,periodDesc,rgDesc,rtTitle,cmdCode,cmdDescE,Subregion_export,Region_export,TradeValue_export,rtLat,rtLon,ptLon,ptLat,mid,Subregion_import,Region_import,TradeValue_import
2001.0,2001.0,Export,Mauritania,3.0,"Fish, crustaceans, molluscs, aquatic invertebrates nes",World,World,134066963.0,20.2540382,-9.2399263,,,32001Mauritania,World,World,411.0
2001.0,2001.0,Export,Mauritania,13.0,"Lac, gums, resins, vegetable saps and extracts nes",World,World,6984.0,20.2540382,-9.2399263,,,132001Mauritania,World,World,9393.0
2001.0,2001.0,Export,Mauritania,15.0,"Animal,vegetable fats and oils, cleavage products, etc",World,World,162893.0,20.2540382,-9.2399263,,,152001Mauritania,World,World,8997159.0
2001.0,2001.0,Export,Mauritania,16.0,"Meat, fish and seafood food preparations nes",World,World,4692945.0,20.2540382,-9.2399263,,,162001Mauritania,World,World,29578.0
2001.0,2001.0,Export,Mauritania,23.0,"Residues, wastes of food industry, animal fodder",World,World,3492800.0,20.2540382,-9.2399263,,,232001Mauritania,World,World,274442.0
2001.0,2001.0,Export,Mauritania,26.0,"Ores, slag and ash",World,World,204468475.0,20.2540382,-9.2399263,,,262001Mauritania,,,
2001.0,2001.0,Export,Mauritania,41.0,Raw hides and skins (other than furskins) and leather,World,World,17691.0,20.2540382,-9.2399263,,,412001Mauritania,World,World,221.0
