yr,periodDesc,rgDesc,rtTitle,cmdCode,cmdDescE,Subregion_export,Region_export,TradeValue_export,rtLat,rtLon,ptLon,ptLat,mid,Subregion_import,Region_import,TradeValue_import
2014.0,2014.0,Export,Lebanon,1.0,Animals; live,World,World,7427689.0,33.87,35.84,,,12014Lebanon,World,World,367595988.0
2014.0,2014.0,Export,Lebanon,2.0,Meat and edible meat offal,World,World,3947691.0,33.87,35.84,,,22014Lebanon,World,World,181778616.0
2014.0,2014.0,Export,Lebanon,3.0,"Fish and crustaceans, molluscs and other aquatic invertebrates",World,World,1163548.0,33.87,35.84,,,32014Lebanon,World,World,95080719.0
2014.0,2014.0,Export,Lebanon,4.0,"Dairy produce; birds' eggs; natural honey; edible products of animal origin, not elsewhere specified or included",World,World,8880825.0,33.87,35.84,,,42014Lebanon,World,World,401870170.0
2014.0,2014.0,Export,Lebanon,5.0,Animal originated products; not elsewhere specified or included,World,World,4370255.0,33.87,35.84,,,52014Lebanon,World,World,3893042.0
2014.0,2014.0,Export,Lebanon,6.0,"Trees and other plants, live; bulbs, roots and the like; cut flowers and ornamental foliage",World,World,1118678.0,33.87,35.84,,,62014Lebanon,World,World,22605188.0
2014.0,2014.0,Export,Lebanon,8.0,"Fruit and nuts, edible; peel of citrus fruit or melons",World,World,63632632.0,33.87,35.84,,,82014Lebanon,World,World,159045139.0
2014.0,2014.0,Export,Lebanon,9.0,"Coffee, tea, mate and spices",World,World,31464476.0,33.87,35.84,,,92014Lebanon,World,World,110460645.0
2014.0,2014.0,Export,Lebanon,10.0,Cereals,World,World,7087878.0,33.87,35.84,,,102014Lebanon,World,World,360648434.0
2014.0,2014.0,Export,Lebanon,11.0,"Products of the milling industry; malt, starches, inulin, wheat gluten",World,World,20978727.0,33.87,35.84,,,112014Lebanon,World,World,34791926.0
2014.0,2014.0,Export,Lebanon,12.0,"Oil seeds and oleaginous fruits; miscellaneous grains, seeds and fruit, industrial or medicinal plants; straw and fodder",World,World,3504751.0,33.87,35.84,,,122014Lebanon,World,World,128691623.0
2014.0,2014.0,Export,Lebanon,13.0,"Lac; gums, resins and other vegetable saps and extracts",World,World,466858.0,33.87,35.84,,,132014Lebanon,World,World,2354111.0
2014.0,2014.0,Export,Lebanon,14.0,Vegetable plaiting materials; vegetable products not elsewhere specified or included,World,World,218972.0,33.87,35.84,,,142014Lebanon,World,World,623056.0
2014.0,2014.0,Export,Lebanon,15.0,Animal or vegetable fats and oils and their cleavage products; prepared animal fats; animal or vegetable waxes,World,World,32773612.0,33.87,35.84,,,152014Lebanon,World,World,186855390.0
2014.0,2014.0,Export,Lebanon,16.0,"Meat, fish or crustaceans, molluscs or other aquatic invertebrates; preparations thereof",World,World,24853599.0,33.87,35.84,,,162014Lebanon,World,World,116336554.0
2014.0,2014.0,Export,Lebanon,18.0,Cocoa and cocoa preparations,World,World,51390433.0,33.87,35.84,,,182014Lebanon,World,World,95791642.0
2014.0,2014.0,Export,Lebanon,20.0,"Preparations of vegetables, fruit, nuts or other parts of plants",World,World,127712585.0,33.87,35.84,,,202014Lebanon,World,World,88549097.0
2014.0,2014.0,Export,Lebanon,21.0,Miscellaneous edible preparations,World,World,83130797.0,33.87,35.84,,,212014Lebanon,World,World,202848305.0
2014.0,2014.0,Export,Lebanon,23.0,"Food industries, residues and wastes thereof; prepared animal fodder",World,World,3711740.0,33.87,35.84,,,232014Lebanon,World,World,142704257.0
2014.0,2014.0,Export,Lebanon,25.0,"Salt; sulphur; earths, stone; plastering materials, lime and cement",World,World,10717297.0,33.87,35.84,,,252014Lebanon,World,World,135003686.0
2014.0,2014.0,Export,Lebanon,27.0,"Mineral fuels, mineral oils and products of their distillation; bituminous substances; mineral waxes",World,World,32300619.0,33.87,35.84,,,272014Lebanon,World,World,4746230717.0
2014.0,2014.0,Export,Lebanon,28.0,"Inorganic chemicals; organic and inorganic compounds of precious metals; of rare earth metals, of radio-active elements and of isotopes",World,World,49222267.0,33.87,35.84,,,282014Lebanon,World,World,38630707.0
2014.0,2014.0,Export,Lebanon,29.0,Organic chemicals,World,World,2953636.0,33.87,35.84,,,292014Lebanon,World,World,90425595.0
2014.0,2014.0,Export,Lebanon,30.0,Pharmaceutical products,World,World,38207554.0,33.87,35.84,,,302014Lebanon,World,World,1140674040.0
2014.0,2014.0,Export,Lebanon,31.0,Fertilizers,World,World,72604490.0,33.87,35.84,,,312014Lebanon,World,World,55618589.0
2014.0,2014.0,Export,Lebanon,33.0,"Essential oils and resinoids; perfumery, cosmetic or toilet preparations",World,World,115048746.0,33.87,35.84,,,332014Lebanon,World,World,233285843.0
2014.0,2014.0,Export,Lebanon,35.0,Albuminoidal substances; modified starches; glues; enzymes,World,World,767069.0,33.87,35.84,,,352014Lebanon,World,World,26411227.0
2014.0,2014.0,Export,Lebanon,36.0,Explosives; pyrotechnic products; matches; pyrophoric alloys; certain combustible preparations,World,World,20022.0,33.87,35.84,,,362014Lebanon,World,World,7580278.0
2014.0,2014.0,Export,Lebanon,37.0,Photographic or cinematographic goods,World,World,144951.0,33.87,35.84,,,372014Lebanon,World,World,13105721.0
2014.0,2014.0,Export,Lebanon,39.0,Plastics and articles thereof,World,World,130567707.0,33.87,35.84,,,392014Lebanon,World,World,694875021.0
2014.0,2014.0,Export,Lebanon,40.0,Rubber and articles thereof,World,World,6515937.0,33.87,35.84,,,402014Lebanon,World,World,133828111.0
2014.0,2014.0,Export,Lebanon,41.0,Raw hides and skins (other than furskins) and leather,World,World,9342954.0,33.87,35.84,,,412014Lebanon,World,World,4750804.0
2014.0,2014.0,Export,Lebanon,42.0,"Articles of leather; saddlery and harness; travel goods, handbags and similar containers; articles of animal gut (other than silk-worm gut)",World,World,11237877.0,33.87,35.84,,,422014Lebanon,World,World,73772780.0
2014.0,2014.0,Export,Lebanon,43.0,Furskins and artificial fur; manufactures thereof,World,World,131937.0,33.87,35.84,,,432014Lebanon,World,World,2508954.0
2014.0,2014.0,Export,Lebanon,45.0,Cork and articles of cork,World,World,145828.0,33.87,35.84,,,452014Lebanon,World,World,1689999.0
2014.0,2014.0,Export,Lebanon,46.0,"Manufactures of straw, esparto or other plaiting materials; basketware and wickerwork",World,World,84520.0,33.87,35.84,,,462014Lebanon,World,World,1825473.0
2014.0,2014.0,Export,Lebanon,47.0,Pulp of wood or other fibrous cellulosic material; recovered (waste and scrap) paper or paperboard,World,World,1051125.0,33.87,35.84,,,472014Lebanon,World,World,20891981.0
2014.0,2014.0,Export,Lebanon,48.0,"Paper and paperboard; articles of paper pulp, of paper or paperboard",World,World,84233613.0,33.87,35.84,,,482014Lebanon,World,World,297003463.0
2014.0,2014.0,Export,Lebanon,49.0,"Printed books, newspapers, pictures and other products of the printing industry; manuscripts, typescripts and plans",World,World,124499244.0,33.87,35.84,,,492014Lebanon,World,World,60705842.0
2014.0,2014.0,Export,Lebanon,50.0,Silk,World,World,571575.0,33.87,35.84,,,502014Lebanon,World,World,3689305.0
2014.0,2014.0,Export,Lebanon,51.0,"Wool, fine or coarse animal hair; horsehair yarn and woven fabric",World,World,384806.0,33.87,35.84,,,512014Lebanon,World,World,3465942.0
2014.0,2014.0,Export,Lebanon,52.0,Cotton,World,World,7447467.0,33.87,35.84,,,522014Lebanon,World,World,22939038.0
2014.0,2014.0,Export,Lebanon,53.0,Vegetable textile fibres; paper yarn and woven fabrics of paper yarn,World,World,53885.0,33.87,35.84,,,532014Lebanon,World,World,4437448.0
2014.0,2014.0,Export,Lebanon,54.0,Man-made filaments; strip and the like of man-made textile materials,World,World,979953.0,33.87,35.84,,,542014Lebanon,World,World,31952887.0
2014.0,2014.0,Export,Lebanon,55.0,Man-made staple fibres,World,World,10075923.0,33.87,35.84,,,552014Lebanon,World,World,65760481.0
2014.0,2014.0,Export,Lebanon,56.0,"Wadding, felt and nonwovens, special yarns; twine, cordage, ropes and cables and articles thereof",World,World,5273694.0,33.87,35.84,,,562014Lebanon,World,World,22060253.0
2014.0,2014.0,Export,Lebanon,57.0,Carpets and other textile floor coverings,World,World,1522608.0,33.87,35.84,,,572014Lebanon,World,World,29499290.0
2014.0,2014.0,Export,Lebanon,58.0,"Fabrics; special woven fabrics, tufted textile fabrics, lace, tapestries, trimmings, embroidery",World,World,2709884.0,33.87,35.84,,,582014Lebanon,World,World,30979655.0
2014.0,2014.0,Export,Lebanon,59.0,"Textile fabrics; impregnated, coated, covered or laminated; textile articles of a kind suitable for industrial use",World,World,481196.0,33.87,35.84,,,592014Lebanon,World,World,16802349.0
2014.0,2014.0,Export,Lebanon,60.0,Fabrics; knitted or crocheted,World,World,2914007.0,33.87,35.84,,,602014Lebanon,World,World,30109550.0
2014.0,2014.0,Export,Lebanon,62.0,Apparel and clothing accessories; not knitted or crocheted,World,World,54029571.0,33.87,35.84,,,622014Lebanon,World,World,304506564.0
2014.0,2014.0,Export,Lebanon,63.0,"Textiles, made up articles; sets; worn clothing and worn textile articles; rags",World,World,7921899.0,33.87,35.84,,,632014Lebanon,World,World,55090723.0
2014.0,2014.0,Export,Lebanon,64.0,Footwear; gaiters and the like; parts of such articles,World,World,25297533.0,33.87,35.84,,,642014Lebanon,World,World,146594736.0
2014.0,2014.0,Export,Lebanon,65.0,Headgear and parts thereof,World,World,238610.0,33.87,35.84,,,652014Lebanon,World,World,5947205.0
2014.0,2014.0,Export,Lebanon,66.0,"Umbrellas, sun umbrellas, walking-sticks, seat sticks, whips, riding crops; and parts thereof",World,World,51619.0,33.87,35.84,,,662014Lebanon,World,World,2782006.0
2014.0,2014.0,Export,Lebanon,67.0,"Feathers and down, prepared; and articles made of feather or of down; artificial flowers; articles of human hair",World,World,1219644.0,33.87,35.84,,,672014Lebanon,World,World,3696315.0
2014.0,2014.0,Export,Lebanon,70.0,Glass and glassware,World,World,7853553.0,33.87,35.84,,,702014Lebanon,World,World,124880596.0
2014.0,2014.0,Export,Lebanon,71.0,"Natural, cultured pearls; precious, semi-precious stones; precious metals, metals clad with precious metal, and articles thereof; imitation jewellery; coin",World,World,541551999.0,33.87,35.84,,,712014Lebanon,World,World,973378040.0
2014.0,2014.0,Export,Lebanon,72.0,Iron and steel,World,World,99132844.0,33.87,35.84,,,722014Lebanon,World,World,813505813.0
2014.0,2014.0,Export,Lebanon,73.0,Iron or steel articles,World,World,52655878.0,33.87,35.84,,,732014Lebanon,World,World,236383376.0
2014.0,2014.0,Export,Lebanon,74.0,Copper and articles thereof,World,World,99668130.0,33.87,35.84,,,742014Lebanon,World,World,108825144.0
2014.0,2014.0,Export,Lebanon,75.0,Nickel and articles thereof,World,World,2037.0,33.87,35.84,,,752014Lebanon,World,World,242068.0
2014.0,2014.0,Export,Lebanon,76.0,Aluminium and articles thereof,World,World,72457307.0,33.87,35.84,,,762014Lebanon,World,World,205294650.0
2014.0,2014.0,Export,Lebanon,78.0,Lead and articles thereof,World,World,30231931.0,33.87,35.84,,,782014Lebanon,World,World,526482.0
2014.0,2014.0,Export,Lebanon,79.0,Zinc and articles thereof,World,World,616214.0,33.87,35.84,,,792014Lebanon,World,World,1650403.0
2014.0,2014.0,Export,Lebanon,80.0,Tin; articles thereof,World,World,7441.0,33.87,35.84,,,802014Lebanon,World,World,279132.0
2014.0,2014.0,Export,Lebanon,82.0,"Tools, implements, cutlery, spoons and forks, of base metal; parts thereof, of base metal",World,World,10002277.0,33.87,35.84,,,822014Lebanon,World,World,46815954.0
2014.0,2014.0,Export,Lebanon,83.0,Metal; miscellaneous products of base metal,World,World,9295860.0,33.87,35.84,,,832014Lebanon,World,World,84691758.0
2014.0,2014.0,Export,Lebanon,86.0,"Railway, tramway locomotives, rolling-stock and parts thereof; railway or tramway track fixtures and fittings and parts thereof; mechanical (including electro-mechanical) traffic signalling equipment of all kinds",World,World,445689.0,33.87,35.84,,,862014Lebanon,World,World,3004312.0
2014.0,2014.0,Export,Lebanon,87.0,"Vehicles; other than railway or tramway rolling stock, and parts and accessories thereof",World,World,28886176.0,33.87,35.84,,,872014Lebanon,World,World,1473180930.0
2014.0,2014.0,Export,Lebanon,88.0,"Aircraft, spacecraft and parts thereof",World,World,4189752.0,33.87,35.84,,,882014Lebanon,World,World,16628811.0
2014.0,2014.0,Export,Lebanon,89.0,"Ships, boats and floating structures",World,World,564476.0,33.87,35.84,,,892014Lebanon,World,World,14526527.0
2014.0,2014.0,Export,Lebanon,90.0,"Optical, photographic, cinematographic, measuring, checking, medical or surgical instruments and apparatus; parts and accessories",World,World,8285100.0,33.87,35.84,,,902014Lebanon,World,World,292952090.0
2014.0,2014.0,Export,Lebanon,91.0,Clocks and watches and parts thereof,World,World,11628670.0,33.87,35.84,,,912014Lebanon,World,World,51988484.0
2014.0,2014.0,Export,Lebanon,92.0,Musical instruments; parts and accessories of such articles,World,World,201612.0,33.87,35.84,,,922014Lebanon,World,World,3326065.0
2014.0,2014.0,Export,Lebanon,93.0,Arms and ammunition; parts and accessories thereof,World,World,325933.0,33.87,35.84,,,932014Lebanon,World,World,22964254.0
2014.0,2014.0,Export,Lebanon,94.0,"Furniture; bedding, mattresses, mattress supports, cushions and similar stuffed furnishings; lamps and lighting fittings, n.e.c.; illuminated signs, illuminated name-plates and the like; prefabricated buildings",World,World,88846763.0,33.87,35.84,,,942014Lebanon,World,World,238151940.0
2014.0,2014.0,Export,Lebanon,95.0,"Toys, games and sports requisites; parts and accessories thereof",World,World,3684819.0,33.87,35.84,,,952014Lebanon,World,World,79122467.0
2014.0,2014.0,Export,Lebanon,96.0,Miscellaneous manufactured articles,World,World,24914178.0,33.87,35.84,,,962014Lebanon,World,World,98437718.0
2014.0,2014.0,Export,Lebanon,97.0,Works of art; collectors' pieces and antiques,World,World,1946957.0,33.87,35.84,,,972014Lebanon,World,World,8468548.0
