yr,periodDesc,rgDesc,rtTitle,ptTitle,cmdCode,cmdDescE,TradeValue_export,Unnamed: 0_export,rtLat,rtLon,ptLat,ptLon,mid,TradeValue_import,Unnamed: 0_import
2013.0,2013.0,Export,Armenia,World,1.0,Animals; live,4951158.0,,40.7696272,44.6736646,-36.8535712,174.7456809,1.02013.0Armenia,7253058.0,
2013.0,2013.0,Export,Armenia,World,2.0,Meat and edible meat offal,142576.0,,40.7696272,44.6736646,-36.8535712,174.7456809,2.02013.0Armenia,88106697.0,
2013.0,2013.0,Export,Armenia,World,3.0,"Fish and crustaceans, molluscs and other aquatic invertebrates",32456507.0,,40.7696272,44.6736646,-36.8535712,174.7456809,3.02013.0Armenia,3547418.0,
2013.0,2013.0,Export,Armenia,World,4.0,"Dairy produce; birds' eggs; natural honey; edible products of animal origin, not elsewhere specified or included",7128174.0,,40.7696272,44.6736646,-36.8535712,174.7456809,4.02013.0Armenia,42211324.0,
2013.0,2013.0,Export,Armenia,World,5.0,Animal originated products; not elsewhere specified or included,172980.0,,40.7696272,44.6736646,-36.8535712,174.7456809,5.02013.0Armenia,3201998.0,
2013.0,2013.0,Export,Armenia,World,6.0,"Trees and other plants, live; bulbs, roots and the like; cut flowers and ornamental foliage",2068699.0,,40.7696272,44.6736646,-36.8535712,174.7456809,6.02013.0Armenia,2955116.0,
2013.0,2013.0,Export,Armenia,World,7.0,Vegetables and certain roots and tubers; edible,10136288.0,,40.7696272,44.6736646,-36.8535712,174.7456809,7.02013.0Armenia,11329133.0,
2013.0,2013.0,Export,Armenia,World,8.0,"Fruit and nuts, edible; peel of citrus fruit or melons",24622460.0,,40.7696272,44.6736646,-36.8535712,174.7456809,8.02013.0Armenia,35277558.0,
2013.0,2013.0,Export,Armenia,World,9.0,"Coffee, tea, mate and spices",5067808.0,,40.7696272,44.6736646,-36.8535712,174.7456809,9.02013.0Armenia,30260226.0,
2013.0,2013.0,Export,Armenia,World,11.0,"Products of the milling industry; malt, starches, inulin, wheat gluten",119922.0,,40.7696272,44.6736646,-36.8535712,174.7456809,11.02013.0Armenia,7910782.0,
2013.0,2013.0,Export,Armenia,World,12.0,"Oil seeds and oleaginous fruits; miscellaneous grains, seeds and fruit, industrial or medicinal plants; straw and fodder",165223.0,,40.7696272,44.6736646,-36.8535712,174.7456809,12.02013.0Armenia,8101271.0,
2013.0,2013.0,Export,Armenia,World,13.0,"Lac; gums, resins and other vegetable saps and extracts",33300.0,,40.7696272,44.6736646,-36.8535712,174.7456809,13.02013.0Armenia,5957170.0,
2013.0,2013.0,Export,Armenia,World,15.0,Animal or vegetable fats and oils and their cleavage products; prepared animal fats; animal or vegetable waxes,52436.0,,40.7696272,44.6736646,-36.8535712,174.7456809,15.02013.0Armenia,60600561.0,
2013.0,2013.0,Export,Armenia,World,16.0,"Meat, fish or crustaceans, molluscs or other aquatic invertebrates; preparations thereof",3867396.0,,40.7696272,44.6736646,-36.8535712,174.7456809,16.02013.0Armenia,11049605.0,
2013.0,2013.0,Export,Armenia,World,17.0,Sugars and sugar confectionery,1182983.0,,40.7696272,44.6736646,-36.8535712,174.7456809,17.02013.0Armenia,52278814.0,
2013.0,2013.0,Export,Armenia,World,18.0,Cocoa and cocoa preparations,1570829.0,,40.7696272,44.6736646,-36.8535712,174.7456809,18.02013.0Armenia,48706720.0,
2013.0,2013.0,Export,Armenia,World,19.0,"Preparations of cereals, flour, starch or milk; pastrycooks' products",1229113.0,,40.7696272,44.6736646,-36.8535712,174.7456809,19.02013.0Armenia,29049840.0,
2013.0,2013.0,Export,Armenia,World,20.0,"Preparations of vegetables, fruit, nuts or other parts of plants",18268605.0,,40.7696272,44.6736646,-36.8535712,174.7456809,20.02013.0Armenia,21131438.0,
2013.0,2013.0,Export,Armenia,World,21.0,Miscellaneous edible preparations,1881214.0,,40.7696272,44.6736646,-36.8535712,174.7456809,21.02013.0Armenia,30557217.0,
2013.0,2013.0,Export,Armenia,World,22.0,"Beverages, spirits and vinegar",212905614.0,,40.7696272,44.6736646,-36.8535712,174.7456809,22.02013.0Armenia,56605461.0,
2013.0,2013.0,Export,Armenia,World,23.0,"Food industries, residues and wastes thereof; prepared animal fodder",52435.0,,40.7696272,44.6736646,-36.8535712,174.7456809,23.02013.0Armenia,39666759.0,
2013.0,2013.0,Export,Armenia,World,24.0,Tobacco and manufactured tobacco substitutes,69079148.0,,40.7696272,44.6736646,-36.8535712,174.7456809,24.02013.0Armenia,107019816.0,
2013.0,2013.0,Export,Armenia,World,25.0,"Salt; sulphur; earths, stone; plastering materials, lime and cement",15777119.0,,40.7696272,44.6736646,-36.8535712,174.7456809,25.02013.0Armenia,13217184.0,
2013.0,2013.0,Export,Armenia,World,26.0,"Ores, slag and ash",303604933.0,,40.7696272,44.6736646,-36.8535712,174.7456809,26.02013.0Armenia,1092086.0,
2013.0,2013.0,Export,Armenia,World,27.0,"Mineral fuels, mineral oils and products of their distillation; bituminous substances; mineral waxes",88417903.0,,40.7696272,44.6736646,-36.8535712,174.7456809,27.02013.0Armenia,938218899.0,
2013.0,2013.0,Export,Armenia,World,28.0,"Inorganic chemicals; organic and inorganic compounds of precious metals; of rare earth metals, of radio-active elements and of isotopes",2355759.0,,40.7696272,44.6736646,-36.8535712,174.7456809,28.02013.0Armenia,31671579.0,
2013.0,2013.0,Export,Armenia,World,29.0,Organic chemicals,256069.0,,40.7696272,44.6736646,-36.8535712,174.7456809,29.02013.0Armenia,10697938.0,
2013.0,2013.0,Export,Armenia,World,30.0,Pharmaceutical products,7818963.0,,40.7696272,44.6736646,-36.8535712,174.7456809,30.02013.0Armenia,127781116.0,
2013.0,2013.0,Export,Armenia,World,31.0,Fertilizers,1306341.0,,40.7696272,44.6736646,-36.8535712,174.7456809,31.02013.0Armenia,24657649.0,
2013.0,2013.0,Export,Armenia,World,32.0,"Tanning or dyeing extracts; tannins and their derivatives; dyes, pigments and other colouring matter; paints, varnishes; putty, other mastics; inks",1691767.0,,40.7696272,44.6736646,-36.8535712,174.7456809,32.02013.0Armenia,26895716.0,
2013.0,2013.0,Export,Armenia,World,33.0,"Essential oils and resinoids; perfumery, cosmetic or toilet preparations",291013.0,,40.7696272,44.6736646,-36.8535712,174.7456809,33.02013.0Armenia,52730693.0,
2013.0,2013.0,Export,Armenia,World,34.0,"Soap, organic surface-active agents; washing, lubricating, polishing or scouring preparations; artificial or prepared waxes, candles and similar articles, modelling pastes, dental waxes and dental preparations with a basis of plaster",687358.0,,40.7696272,44.6736646,-36.8535712,174.7456809,34.02013.0Armenia,44119038.0,
2013.0,2013.0,Export,Armenia,World,35.0,Albuminoidal substances; modified starches; glues; enzymes,640911.0,,40.7696272,44.6736646,-36.8535712,174.7456809,35.02013.0Armenia,7399550.0,
2013.0,2013.0,Export,Armenia,World,36.0,Explosives; pyrotechnic products; matches; pyrophoric alloys; certain combustible preparations,28178.0,,40.7696272,44.6736646,-36.8535712,174.7456809,36.02013.0Armenia,6032993.0,
2013.0,2013.0,Export,Armenia,World,37.0,Photographic or cinematographic goods,2492.0,,40.7696272,44.6736646,-36.8535712,174.7456809,37.02013.0Armenia,1422204.0,
2013.0,2013.0,Export,Armenia,World,38.0,Chemical products n.e.c.,1193254.0,,40.7696272,44.6736646,-36.8535712,174.7456809,38.02013.0Armenia,25291439.0,
2013.0,2013.0,Export,Armenia,World,39.0,Plastics and articles thereof,11539255.0,,40.7696272,44.6736646,-36.8535712,174.7456809,39.02013.0Armenia,123458633.0,
2013.0,2013.0,Export,Armenia,World,40.0,Rubber and articles thereof,75034.0,,40.7696272,44.6736646,-36.8535712,174.7456809,40.02013.0Armenia,53446012.0,
2013.0,2013.0,Export,Armenia,World,41.0,Raw hides and skins (other than furskins) and leather,162773.0,,40.7696272,44.6736646,-36.8535712,174.7456809,41.02013.0Armenia,3434658.0,
2013.0,2013.0,Export,Armenia,World,42.0,"Articles of leather; saddlery and harness; travel goods, handbags and similar containers; articles of animal gut (other than silk-worm gut)",2294030.0,,40.7696272,44.6736646,-36.8535712,174.7456809,42.02013.0Armenia,8600297.0,
2013.0,2013.0,Export,Armenia,World,43.0,Furskins and artificial fur; manufactures thereof,495348.0,,40.7696272,44.6736646,-36.8535712,174.7456809,43.02013.0Armenia,682879.0,
2013.0,2013.0,Export,Armenia,World,44.0,Wood and articles of wood; wood charcoal,674216.0,,40.7696272,44.6736646,-36.8535712,174.7456809,44.02013.0Armenia,61450449.0,
2013.0,2013.0,Export,Armenia,World,45.0,Cork and articles of cork,54662.0,,40.7696272,44.6736646,-36.8535712,174.7456809,45.02013.0Armenia,6322544.0,
2013.0,2013.0,Export,Armenia,World,46.0,"Manufactures of straw, esparto or other plaiting materials; basketware and wickerwork",5.0,,40.7696272,44.6736646,-36.8535712,174.7456809,46.02013.0Armenia,238223.0,
2013.0,2013.0,Export,Armenia,World,48.0,"Paper and paperboard; articles of paper pulp, of paper or paperboard",420264.0,,40.7696272,44.6736646,-36.8535712,174.7456809,48.02013.0Armenia,67042231.0,
2013.0,2013.0,Export,Armenia,World,49.0,"Printed books, newspapers, pictures and other products of the printing industry; manuscripts, typescripts and plans",439929.0,,40.7696272,44.6736646,-36.8535712,174.7456809,49.02013.0Armenia,5431758.0,
2013.0,2013.0,Export,Armenia,World,52.0,Cotton,165863.0,,40.7696272,44.6736646,-36.8535712,174.7456809,52.02013.0Armenia,10512329.0,
2013.0,2013.0,Export,Armenia,World,53.0,Vegetable textile fibres; paper yarn and woven fabrics of paper yarn,8350.0,,40.7696272,44.6736646,-36.8535712,174.7456809,53.02013.0Armenia,109353.0,
2013.0,2013.0,Export,Armenia,World,54.0,Man-made filaments; strip and the like of man-made textile materials,115147.0,,40.7696272,44.6736646,-36.8535712,174.7456809,54.02013.0Armenia,16188495.0,
2013.0,2013.0,Export,Armenia,World,55.0,Man-made staple fibres,56719.0,,40.7696272,44.6736646,-36.8535712,174.7456809,55.02013.0Armenia,17220316.0,
2013.0,2013.0,Export,Armenia,World,56.0,"Wadding, felt and nonwovens, special yarns; twine, cordage, ropes and cables and articles thereof",38213.0,,40.7696272,44.6736646,-36.8535712,174.7456809,56.02013.0Armenia,3891305.0,
2013.0,2013.0,Export,Armenia,World,57.0,Carpets and other textile floor coverings,110115.0,,40.7696272,44.6736646,-36.8535712,174.7456809,57.02013.0Armenia,4752423.0,
2013.0,2013.0,Export,Armenia,World,59.0,"Textile fabrics; impregnated, coated, covered or laminated; textile articles of a kind suitable for industrial use",3110.0,,40.7696272,44.6736646,-36.8535712,174.7456809,59.02013.0Armenia,2971505.0,
2013.0,2013.0,Export,Armenia,World,61.0,Apparel and clothing accessories; knitted or crocheted,4590885.0,,40.7696272,44.6736646,-36.8535712,174.7456809,61.02013.0Armenia,30304637.0,
2013.0,2013.0,Export,Armenia,World,62.0,Apparel and clothing accessories; not knitted or crocheted,33277311.0,,40.7696272,44.6736646,-36.8535712,174.7456809,62.02013.0Armenia,43493861.0,
2013.0,2013.0,Export,Armenia,World,63.0,"Textiles, made up articles; sets; worn clothing and worn textile articles; rags",248691.0,,40.7696272,44.6736646,-36.8535712,174.7456809,63.02013.0Armenia,12124937.0,
2013.0,2013.0,Export,Armenia,World,64.0,Footwear; gaiters and the like; parts of such articles,2117952.0,,40.7696272,44.6736646,-36.8535712,174.7456809,64.02013.0Armenia,30148340.0,
2013.0,2013.0,Export,Armenia,World,65.0,Headgear and parts thereof,21785.0,,40.7696272,44.6736646,-36.8535712,174.7456809,65.02013.0Armenia,706952.0,
2013.0,2013.0,Export,Armenia,World,66.0,"Umbrellas, sun umbrellas, walking-sticks, seat sticks, whips, riding crops; and parts thereof",1348.0,,40.7696272,44.6736646,-36.8535712,174.7456809,66.02013.0Armenia,415110.0,
2013.0,2013.0,Export,Armenia,World,68.0,"Stone, plaster, cement, asbestos, mica or similar materials; articles thereof",7091087.0,,40.7696272,44.6736646,-36.8535712,174.7456809,68.02013.0Armenia,19466343.0,
2013.0,2013.0,Export,Armenia,World,69.0,Ceramic products,1328315.0,,40.7696272,44.6736646,-36.8535712,174.7456809,69.02013.0Armenia,30302302.0,
2013.0,2013.0,Export,Armenia,World,70.0,Glass and glassware,17096988.0,,40.7696272,44.6736646,-36.8535712,174.7456809,70.02013.0Armenia,35539974.0,
2013.0,2013.0,Export,Armenia,World,71.0,"Natural, cultured pearls; precious, semi-precious stones; precious metals, metals clad with precious metal, and articles thereof; imitation jewellery; coin",187085214.0,,40.7696272,44.6736646,-36.8535712,174.7456809,71.02013.0Armenia,295240256.0,
2013.0,2013.0,Export,Armenia,World,72.0,Iron and steel,105196921.0,,40.7696272,44.6736646,-36.8535712,174.7456809,72.02013.0Armenia,107984460.0,
2013.0,2013.0,Export,Armenia,World,73.0,Iron or steel articles,2190973.0,,40.7696272,44.6736646,-36.8535712,174.7456809,73.02013.0Armenia,72607388.0,
2013.0,2013.0,Export,Armenia,World,74.0,Copper and articles thereof,95074603.0,,40.7696272,44.6736646,-36.8535712,174.7456809,74.02013.0Armenia,3452205.0,
2013.0,2013.0,Export,Armenia,World,76.0,Aluminium and articles thereof,85461803.0,,40.7696272,44.6736646,-36.8535712,174.7456809,76.02013.0Armenia,79748259.0,
2013.0,2013.0,Export,Armenia,World,78.0,Lead and articles thereof,364858.0,,40.7696272,44.6736646,-36.8535712,174.7456809,78.02013.0Armenia,543906.0,
2013.0,2013.0,Export,Armenia,World,81.0,"Metals; n.e.c., cermets and articles thereof",17521988.0,,40.7696272,44.6736646,-36.8535712,174.7456809,81.02013.0Armenia,76921.0,
2013.0,2013.0,Export,Armenia,World,82.0,"Tools, implements, cutlery, spoons and forks, of base metal; parts thereof, of base metal",1813918.0,,40.7696272,44.6736646,-36.8535712,174.7456809,82.02013.0Armenia,12623980.0,
2013.0,2013.0,Export,Armenia,World,83.0,Metal; miscellaneous products of base metal,1209358.0,,40.7696272,44.6736646,-36.8535712,174.7456809,83.02013.0Armenia,18724924.0,
2013.0,2013.0,Export,Armenia,World,84.0,"Nuclear reactors, boilers, machinery and mechanical appliances; parts thereof",10059797.0,,40.7696272,44.6736646,-36.8535712,174.7456809,84.02013.0Armenia,408089994.0,
2013.0,2013.0,Export,Armenia,World,85.0,"Electrical machinery and equipment and parts thereof; sound recorders and reproducers; television image and sound recorders and reproducers, parts and accessories of such articles",10799681.0,,40.7696272,44.6736646,-36.8535712,174.7456809,85.02013.0Armenia,171924313.0,
2013.0,2013.0,Export,Armenia,World,86.0,"Railway, tramway locomotives, rolling-stock and parts thereof; railway or tramway track fixtures and fittings and parts thereof; mechanical (including electro-mechanical) traffic signalling equipment of all kinds",1148241.0,,40.7696272,44.6736646,-36.8535712,174.7456809,86.02013.0Armenia,10923059.0,
2013.0,2013.0,Export,Armenia,World,87.0,"Vehicles; other than railway or tramway rolling stock, and parts and accessories thereof",581138.0,,40.7696272,44.6736646,-36.8535712,174.7456809,87.02013.0Armenia,132302791.0,
2013.0,2013.0,Export,Armenia,World,88.0,"Aircraft, spacecraft and parts thereof",22710061.0,,40.7696272,44.6736646,-36.8535712,174.7456809,88.02013.0Armenia,7137945.0,
2013.0,2013.0,Export,Armenia,World,89.0,"Ships, boats and floating structures",5335.0,,40.7696272,44.6736646,-36.8535712,174.7456809,89.02013.0Armenia,134983.0,
2013.0,2013.0,Export,Armenia,World,90.0,"Optical, photographic, cinematographic, measuring, checking, medical or surgical instruments and apparatus; parts and accessories",6899258.0,,40.7696272,44.6736646,-36.8535712,174.7456809,90.02013.0Armenia,67761784.0,
2013.0,2013.0,Export,Armenia,World,91.0,Clocks and watches and parts thereof,13951631.0,,40.7696272,44.6736646,-36.8535712,174.7456809,91.02013.0Armenia,6487296.0,
2013.0,2013.0,Export,Armenia,World,92.0,Musical instruments; parts and accessories of such articles,1151.0,,40.7696272,44.6736646,-36.8535712,174.7456809,92.02013.0Armenia,626847.0,
2013.0,2013.0,Export,Armenia,World,93.0,Arms and ammunition; parts and accessories thereof,15245.0,,40.7696272,44.6736646,-36.8535712,174.7456809,93.02013.0Armenia,,
2013.0,2013.0,Export,Armenia,World,94.0,"Furniture; bedding, mattresses, mattress supports, cushions and similar stuffed furnishings; lamps and lighting fittings, n.e.c.; illuminated signs, illuminated name-plates and the like; prefabricated buildings",1582492.0,,40.7696272,44.6736646,-36.8535712,174.7456809,94.02013.0Armenia,58826864.0,
2013.0,2013.0,Export,Armenia,World,95.0,"Toys, games and sports requisites; parts and accessories thereof",308795.0,,40.7696272,44.6736646,-36.8535712,174.7456809,95.02013.0Armenia,12458970.0,
2013.0,2013.0,Export,Armenia,World,96.0,Miscellaneous manufactured articles,54881.0,,40.7696272,44.6736646,-36.8535712,174.7456809,96.02013.0Armenia,25466221.0,
2013.0,2013.0,Export,Armenia,World,97.0,Works of art; collectors' pieces and antiques,39668.0,,40.7696272,44.6736646,-36.8535712,174.7456809,97.02013.0Armenia,57818.0,
2013.0,2013.0,Export,Armenia,World,99.0,Commodities not specified according to kind,65127.0,,40.7696272,44.6736646,-36.8535712,174.7456809,99.02013.0Armenia,1792485.0,
