yr,periodDesc,rgDesc,rtTitle,cmdCode,cmdDescE,Subregion_export,Region_export,TradeValue_export,rtLat,rtLon,ptLon,ptLat,mid,Subregion_import,Region_import,TradeValue_import
2005.0,2005.0,Export,Georgia,1.0,Live animals,World,World,15595.0,32.3293809,-83.1137366,,,12005Georgia,World,World,564325.0
2005.0,2005.0,Export,Georgia,2.0,Meat and edible meat offal,World,World,532980.0,32.3293809,-83.1137366,,,22005Georgia,World,World,21135300.0
2005.0,2005.0,Export,Georgia,3.0,"Fish and crustaceans, molluscs and other aquatic invertebrates",World,World,992329.0,32.3293809,-83.1137366,,,32005Georgia,World,World,8109405.0
2005.0,2005.0,Export,Georgia,4.0,Dairy produce; birds eggs; natural honey;,World,World,2625462.0,32.3293809,-83.1137366,,,42005Georgia,World,World,26814201.0
2005.0,2005.0,Export,Georgia,5.0,"Products of animal origin, not elsewhere specified",World,World,412.0,32.3293809,-83.1137366,,,52005Georgia,World,World,83168.0
2005.0,2005.0,Export,Georgia,6.0,Live trees and other plants;,World,World,873643.0,32.3293809,-83.1137366,,,62005Georgia,World,World,1031569.0
2005.0,2005.0,Export,Georgia,7.0,Edible vegetables and certain roots and tubers,World,World,1053564.0,32.3293809,-83.1137366,,,72005Georgia,World,World,4515555.0
2005.0,2005.0,Export,Georgia,8.0,Edible fruit and nuts; peel of citrus fruit or melons,World,World,76937277.0,32.3293809,-83.1137366,,,82005Georgia,World,World,4462855.0
2005.0,2005.0,Export,Georgia,9.0,"Coffee, tea, matΦ and spices",World,World,5199469.0,32.3293809,-83.1137366,,,92005Georgia,World,World,7178556.0
2005.0,2005.0,Export,Georgia,10.0,Cereals,World,World,6152561.0,32.3293809,-83.1137366,,,102005Georgia,World,World,50000087.0
2005.0,2005.0,Export,Georgia,11.0,Products of the milling industry; malt; starches; inulin,World,World,1926898.0,32.3293809,-83.1137366,,,112005Georgia,World,World,54599789.0
2005.0,2005.0,Export,Georgia,12.0,Oil seeds and oleaginous fruits,World,World,2579043.0,32.3293809,-83.1137366,,,122005Georgia,World,World,3770769.0
2005.0,2005.0,Export,Georgia,13.0,"Lac; gums, resins and other vegetable saps and extracts",World,World,215922.0,32.3293809,-83.1137366,,,132005Georgia,World,World,223184.0
2005.0,2005.0,Export,Georgia,14.0,Vegetable plaiting materials; vegetable products nes,World,World,42073.0,32.3293809,-83.1137366,,,142005Georgia,World,World,123332.0
2005.0,2005.0,Export,Georgia,15.0,Animal or vegetable fats and oils,World,World,202953.0,32.3293809,-83.1137366,,,152005Georgia,World,World,32472338.0
2005.0,2005.0,Export,Georgia,16.0,"Preparations of meat, of fish or of crustaceans",World,World,41317.0,32.3293809,-83.1137366,,,162005Georgia,World,World,12432101.0
2005.0,2005.0,Export,Georgia,17.0,Sugars and sugar confectionery,World,World,30571383.0,32.3293809,-83.1137366,,,172005Georgia,World,World,87141119.0
2005.0,2005.0,Export,Georgia,18.0,Cocoa and cocoa preparations,World,World,1094471.0,32.3293809,-83.1137366,,,182005Georgia,World,World,25247056.0
2005.0,2005.0,Export,Georgia,19.0,"Preparations of cereals, flour, starch or milk; bakers' wares",World,World,84423.0,32.3293809,-83.1137366,,,192005Georgia,World,World,20219858.0
2005.0,2005.0,Export,Georgia,20.0,"Preparations of vegetables, fruit or nuts",World,World,5445363.0,32.3293809,-83.1137366,,,202005Georgia,World,World,10372545.0
2005.0,2005.0,Export,Georgia,21.0,Miscellaneous edible preparations,World,World,829929.0,32.3293809,-83.1137366,,,212005Georgia,World,World,17844102.0
2005.0,2005.0,Export,Georgia,22.0,"Beverages, spirits and vinegar",World,World,164356689.0,32.3293809,-83.1137366,,,222005Georgia,World,World,20383956.0
2005.0,2005.0,Export,Georgia,23.0,Residues and waste from the food industries,World,World,782824.0,32.3293809,-83.1137366,,,232005Georgia,World,World,5512052.0
2005.0,2005.0,Export,Georgia,24.0,Tobacco and manufactured tobacco substitutes,World,World,1345789.0,32.3293809,-83.1137366,,,242005Georgia,World,World,23268517.0
2005.0,2005.0,Export,Georgia,25.0,Salt; sulfur; earths and stone; plastering materials,World,World,18461459.0,32.3293809,-83.1137366,,,252005Georgia,World,World,21014676.0
2005.0,2005.0,Export,Georgia,26.0,"Ores, slag and ash",World,World,38386925.0,32.3293809,-83.1137366,,,262005Georgia,World,World,188374.0
2005.0,2005.0,Export,Georgia,27.0,"Mineral fuels, mineral oils and products of their distillation",World,World,27981847.0,32.3293809,-83.1137366,,,272005Georgia,World,World,495633512.0
2005.0,2005.0,Export,Georgia,28.0,Inorganic chemicals,World,World,7358897.0,32.3293809,-83.1137366,,,282005Georgia,World,World,8914080.0
2005.0,2005.0,Export,Georgia,29.0,Organic chemicals,World,World,367555.0,32.3293809,-83.1137366,,,292005Georgia,World,World,3515381.0
2005.0,2005.0,Export,Georgia,30.0,Pharmaceutical products,World,World,4009023.0,32.3293809,-83.1137366,,,302005Georgia,World,World,104961062.0
2005.0,2005.0,Export,Georgia,31.0,Fertilizers,World,World,35838604.0,32.3293809,-83.1137366,,,312005Georgia,World,World,838795.0
2005.0,2005.0,Export,Georgia,32.0,Tanning or dyeing extracts,World,World,1050852.0,32.3293809,-83.1137366,,,322005Georgia,World,World,14523633.0
2005.0,2005.0,Export,Georgia,33.0,"Essential oils and resinoids; perfumery, cosmetic or toilet preparations",World,World,8295272.0,32.3293809,-83.1137366,,,332005Georgia,World,World,39224256.0
2005.0,2005.0,Export,Georgia,35.0,Albuminoidal substances; modified starches; glues; enzymes,World,World,124.0,32.3293809,-83.1137366,,,352005Georgia,World,World,2496421.0
2005.0,2005.0,Export,Georgia,36.0,Explosives; pyrotechnic products; matches,World,World,58542.0,32.3293809,-83.1137366,,,362005Georgia,World,World,2452629.0
2005.0,2005.0,Export,Georgia,37.0,Photographic or cinematographic goods,World,World,52647.0,32.3293809,-83.1137366,,,372005Georgia,World,World,1103390.0
2005.0,2005.0,Export,Georgia,38.0,Miscellaneous chemical products,World,World,509885.0,32.3293809,-83.1137366,,,382005Georgia,World,World,15895597.0
2005.0,2005.0,Export,Georgia,39.0,Plastics and articles thereof,World,World,472530.0,32.3293809,-83.1137366,,,392005Georgia,World,World,56055368.0
2005.0,2005.0,Export,Georgia,40.0,Rubber and articles thereof,World,World,174462.0,32.3293809,-83.1137366,,,402005Georgia,World,World,26294767.0
2005.0,2005.0,Export,Georgia,41.0,Raw hides and skins (other than fur skins) and leather,World,World,1510535.0,32.3293809,-83.1137366,,,412005Georgia,World,World,645514.0
2005.0,2005.0,Export,Georgia,42.0,Articles of leather; saddlery and harness,World,World,168047.0,32.3293809,-83.1137366,,,422005Georgia,World,World,3468115.0
2005.0,2005.0,Export,Georgia,44.0,Wood and articles of wood; wood charcoal,World,World,16261487.0,32.3293809,-83.1137366,,,442005Georgia,World,World,13724488.0
2005.0,2005.0,Export,Georgia,45.0,Cork and articles of cork,World,World,43465.0,32.3293809,-83.1137366,,,452005Georgia,World,World,3602938.0
2005.0,2005.0,Export,Georgia,46.0,"Manufactures of straw, of esparto or of other plaiting materials",World,World,709.0,32.3293809,-83.1137366,,,462005Georgia,World,World,48800.0
2005.0,2005.0,Export,Georgia,48.0,"Paper and paperboard; articles of paper pulp, of paper or of paperboard",World,World,625407.0,32.3293809,-83.1137366,,,482005Georgia,World,World,46469797.0
2005.0,2005.0,Export,Georgia,49.0,"Printed books, newspapers, pictures and other products of the printing indu ...",World,World,263264.0,32.3293809,-83.1137366,,,492005Georgia,World,World,9798663.0
2005.0,2005.0,Export,Georgia,50.0,Silk,World,World,7000.0,32.3293809,-83.1137366,,,502005Georgia,World,World,98151.0
2005.0,2005.0,Export,Georgia,51.0,"Wool, fine or coarse animal hair; horsehair yarn and woven fabric",World,World,62293.0,32.3293809,-83.1137366,,,512005Georgia,World,World,458585.0
2005.0,2005.0,Export,Georgia,54.0,Man-made filaments,World,World,1926.0,32.3293809,-83.1137366,,,542005Georgia,World,World,4287179.0
2005.0,2005.0,Export,Georgia,55.0,Man-made staple fibers,World,World,124580.0,32.3293809,-83.1137366,,,552005Georgia,World,World,2479560.0
2005.0,2005.0,Export,Georgia,56.0,"Wadding, felt and non-wovens; special yarns, twine, cordage, ropes and cabl ...",World,World,11702.0,32.3293809,-83.1137366,,,562005Georgia,World,World,3441149.0
2005.0,2005.0,Export,Georgia,57.0,Carpets and other textile floor coverings,World,World,5868.0,32.3293809,-83.1137366,,,572005Georgia,World,World,2116294.0
2005.0,2005.0,Export,Georgia,58.0,"Special woven fabrics; tufted textile fabrics; lace, tapestries; trimmings; ...",World,World,4054.0,32.3293809,-83.1137366,,,582005Georgia,World,World,329078.0
2005.0,2005.0,Export,Georgia,59.0,"Impregnated, coated, covered or laminated textile fabrics",World,World,3286.0,32.3293809,-83.1137366,,,592005Georgia,World,World,1179705.0
2005.0,2005.0,Export,Georgia,60.0,Knitted or crocheted fabrics,World,World,232.0,32.3293809,-83.1137366,,,602005Georgia,World,World,1106702.0
2005.0,2005.0,Export,Georgia,61.0,"Articles of apparel and clothing accessories, knitted or crocheted",World,World,299771.0,32.3293809,-83.1137366,,,612005Georgia,World,World,10567693.0
2005.0,2005.0,Export,Georgia,62.0,"Articles of apparel and clothing accessories, not knitted or crocheted",World,World,8220639.0,32.3293809,-83.1137366,,,622005Georgia,World,World,21710481.0
2005.0,2005.0,Export,Georgia,63.0,Other made up textile articles; sets; worn clothing and worn textile articl ...,World,World,219535.0,32.3293809,-83.1137366,,,632005Georgia,World,World,14948930.0
2005.0,2005.0,Export,Georgia,64.0,"Footwear, gaiters and the like; parts of such articles",World,World,131031.0,32.3293809,-83.1137366,,,642005Georgia,World,World,14878740.0
2005.0,2005.0,Export,Georgia,65.0,Headgear and parts thereof,World,World,2481.0,32.3293809,-83.1137366,,,652005Georgia,World,World,1303139.0
2005.0,2005.0,Export,Georgia,66.0,"Umbrellas, sun umbrellas, walking sticks, seat sticks, whips, riding-crops",World,World,11200.0,32.3293809,-83.1137366,,,662005Georgia,World,World,561539.0
2005.0,2005.0,Export,Georgia,67.0,Prepared feathers and down and articles made of feathers or of down,World,World,210.0,32.3293809,-83.1137366,,,672005Georgia,World,World,35571.0
2005.0,2005.0,Export,Georgia,68.0,"Articles of stone, plaster, cement, asbestos, mica or similar materials",World,World,263093.0,32.3293809,-83.1137366,,,682005Georgia,World,World,11076321.0
2005.0,2005.0,Export,Georgia,69.0,Ceramic products,World,World,388138.0,32.3293809,-83.1137366,,,692005Georgia,World,World,21322196.0
2005.0,2005.0,Export,Georgia,70.0,Glass and glassware,World,World,452506.0,32.3293809,-83.1137366,,,702005Georgia,World,World,24910137.0
2005.0,2005.0,Export,Georgia,71.0,"Natural or cultured pearls, precious or semi-precious stones",World,World,39413600.0,32.3293809,-83.1137366,,,712005Georgia,World,World,3144980.0
2005.0,2005.0,Export,Georgia,72.0,Iron and steel,World,World,167709847.0,32.3293809,-83.1137366,,,722005Georgia,World,World,44845415.0
2005.0,2005.0,Export,Georgia,73.0,Articles of iron or steel,World,World,3066783.0,32.3293809,-83.1137366,,,732005Georgia,World,World,53537361.0
2005.0,2005.0,Export,Georgia,74.0,Copper and articles thereof,World,World,11624407.0,32.3293809,-83.1137366,,,742005Georgia,World,World,1657285.0
2005.0,2005.0,Export,Georgia,76.0,Aluminum and articles thereof,World,World,11842144.0,32.3293809,-83.1137366,,,762005Georgia,World,World,11252942.0
2005.0,2005.0,Export,Georgia,78.0,Lead and articles thereof,World,World,538204.0,32.3293809,-83.1137366,,,782005Georgia,World,World,23797.0
2005.0,2005.0,Export,Georgia,79.0,Zinc and articles thereof,World,World,86505.0,32.3293809,-83.1137366,,,792005Georgia,World,World,183264.0
2005.0,2005.0,Export,Georgia,80.0,Tin and articles thereof,World,World,11.0,32.3293809,-83.1137366,,,802005Georgia,World,World,45215.0
2005.0,2005.0,Export,Georgia,81.0,Other base metals; cermets; articles thereof,World,World,146566.0,32.3293809,-83.1137366,,,812005Georgia,World,World,258909.0
2005.0,2005.0,Export,Georgia,82.0,"Tools, implements, cutlery, spoons and forks, of base metal",World,World,162245.0,32.3293809,-83.1137366,,,822005Georgia,World,World,6802781.0
2005.0,2005.0,Export,Georgia,83.0,Miscellaneous articles of base metal,World,World,245741.0,32.3293809,-83.1137366,,,832005Georgia,World,World,11460279.0
2005.0,2005.0,Export,Georgia,84.0,Machinery and mechanical appliances; parts thereof,World,World,29708396.0,32.3293809,-83.1137366,,,842005Georgia,World,World,251680689.0
2005.0,2005.0,Export,Georgia,85.0,Electrical machinery and equipment and parts thereof; sound recorders and r ...,World,World,5074794.0,32.3293809,-83.1137366,,,852005Georgia,World,World,158028276.0
2005.0,2005.0,Export,Georgia,86.0,"Railway or tramway locomotives, rolling-stock and parts thereof",World,World,2944943.0,32.3293809,-83.1137366,,,862005Georgia,World,World,3454791.0
2005.0,2005.0,Export,Georgia,87.0,Vehicles other than railway or tramway rolling stock,World,World,24648258.0,32.3293809,-83.1137366,,,872005Georgia,World,World,252015133.0
2005.0,2005.0,Export,Georgia,88.0,"Aircraft, spacecraft, and parts thereof",World,World,78197911.0,32.3293809,-83.1137366,,,882005Georgia,World,World,56707185.0
2005.0,2005.0,Export,Georgia,89.0,"Ships, boats and floating structures",World,World,6106414.0,32.3293809,-83.1137366,,,892005Georgia,World,World,2293688.0
2005.0,2005.0,Export,Georgia,90.0,"Optical, photographic, cinematographic, measuring, checking, precision, med ...",World,World,1187449.0,32.3293809,-83.1137366,,,902005Georgia,World,World,64427805.0
2005.0,2005.0,Export,Georgia,91.0,Clocks and watches and parts thereof,World,World,46447.0,32.3293809,-83.1137366,,,912005Georgia,World,World,1110648.0
2005.0,2005.0,Export,Georgia,92.0,Musical instruments; parts and accessories of such articles,World,World,32314.0,32.3293809,-83.1137366,,,922005Georgia,World,World,780474.0
2005.0,2005.0,Export,Georgia,93.0,Arms and ammunition; parts and accessories thereof,World,World,2514.0,32.3293809,-83.1137366,,,932005Georgia,World,World,3760.0
2005.0,2005.0,Export,Georgia,94.0,"Furniture; bedding, mattresses, cushions and similar stuffed furnishing",World,World,4143432.0,32.3293809,-83.1137366,,,942005Georgia,World,World,40512186.0
2005.0,2005.0,Export,Georgia,95.0,"Toys, games and sports requisites; parts and accessories thereof",World,World,183164.0,32.3293809,-83.1137366,,,952005Georgia,World,World,9590343.0
2005.0,2005.0,Export,Georgia,96.0,Miscellaneous manufactured articles,World,World,184132.0,32.3293809,-83.1137366,,,962005Georgia,World,World,4581077.0
2005.0,2005.0,Export,Georgia,97.0,"Works of art, collectors' pieces and antiques",World,World,33701.0,32.3293809,-83.1137366,,,972005Georgia,World,World,80197.0
