yr,periodDesc,rgDesc,rtTitle,ptTitle,cmdCode,cmdDescE,TradeValue_export,Unnamed: 0_export,rtLat,rtLon,ptLat,ptLon,mid,TradeValue_import,Unnamed: 0_import
2010.0,2010.0,Export,Qatar,World,1.0,Live animals,31397594.0,,25.3336984,51.2295295,-36.8535712,174.7456809,1.02010.0Qatar,177524849.0,
2010.0,2010.0,Export,Qatar,World,2.0,Meat and edible meat offal,3713774.0,,25.3336984,51.2295295,-36.8535712,174.7456809,2.02010.0Qatar,283580950.0,
2010.0,2010.0,Export,Qatar,World,3.0,"Fish and crustaceans, molluscs and other aquatic invertebrates",5281013.0,,25.3336984,51.2295295,-36.8535712,174.7456809,3.02010.0Qatar,47002690.0,
2010.0,2010.0,Export,Qatar,World,4.0,Dairy produce; birds eggs; natural honey;,1321825.0,,25.3336984,51.2295295,-36.8535712,174.7456809,4.02010.0Qatar,238472669.0,
2010.0,2010.0,Export,Qatar,World,5.0,"Products of animal origin, not elsewhere specified",14149.0,,25.3336984,51.2295295,-36.8535712,174.7456809,5.02010.0Qatar,170359.0,
2010.0,2010.0,Export,Qatar,World,6.0,Live trees and other plants;,582380.0,,25.3336984,51.2295295,-36.8535712,174.7456809,6.02010.0Qatar,17035845.0,
2010.0,2010.0,Export,Qatar,World,7.0,Edible vegetables and certain roots and tubers,1853918.0,,25.3336984,51.2295295,-36.8535712,174.7456809,7.02010.0Qatar,139559335.0,
2010.0,2010.0,Export,Qatar,World,8.0,Edible fruit and nuts; peel of citrus fruit or melons,2357601.0,,25.3336984,51.2295295,-36.8535712,174.7456809,8.02010.0Qatar,98732871.0,
2010.0,2010.0,Export,Qatar,World,9.0,"Coffee, tea, matΦ and spices",860361.0,,25.3336984,51.2295295,-36.8535712,174.7456809,9.02010.0Qatar,48866277.0,
2010.0,2010.0,Export,Qatar,World,10.0,Cereals,3125739.0,,25.3336984,51.2295295,-36.8535712,174.7456809,10.02010.0Qatar,199005944.0,
2010.0,2010.0,Export,Qatar,World,11.0,Products of the milling industry; malt; starches; inulin,3913123.0,,25.3336984,51.2295295,-36.8535712,174.7456809,11.02010.0Qatar,26853678.0,
2010.0,2010.0,Export,Qatar,World,12.0,Oil seeds and oleaginous fruits,92530.0,,25.3336984,51.2295295,-36.8535712,174.7456809,12.02010.0Qatar,13042347.0,
2010.0,2010.0,Export,Qatar,World,13.0,"Lac; gums, resins and other vegetable saps and extracts",101053.0,,25.3336984,51.2295295,-36.8535712,174.7456809,13.02010.0Qatar,2205387.0,
2010.0,2010.0,Export,Qatar,World,15.0,Animal or vegetable fats and oils,1954190.0,,25.3336984,51.2295295,-36.8535712,174.7456809,15.02010.0Qatar,70749679.0,
2010.0,2010.0,Export,Qatar,World,16.0,"Preparations of meat, of fish or of crustaceans",2083182.0,,25.3336984,51.2295295,-36.8535712,174.7456809,16.02010.0Qatar,24717601.0,
2010.0,2010.0,Export,Qatar,World,17.0,Sugars and sugar confectionery,1063809.0,,25.3336984,51.2295295,-36.8535712,174.7456809,17.02010.0Qatar,44327134.0,
2010.0,2010.0,Export,Qatar,World,18.0,Cocoa and cocoa preparations,221406.0,,25.3336984,51.2295295,-36.8535712,174.7456809,18.02010.0Qatar,46132626.0,
2010.0,2010.0,Export,Qatar,World,19.0,"Preparations of cereals, flour, starch or milk; bakers' wares",2168906.0,,25.3336984,51.2295295,-36.8535712,174.7456809,19.02010.0Qatar,113429770.0,
2010.0,2010.0,Export,Qatar,World,20.0,"Preparations of vegetables, fruit or nuts",869165.0,,25.3336984,51.2295295,-36.8535712,174.7456809,20.02010.0Qatar,51887307.0,
2010.0,2010.0,Export,Qatar,World,21.0,Miscellaneous edible preparations,2635439.0,,25.3336984,51.2295295,-36.8535712,174.7456809,21.02010.0Qatar,114727776.0,
2010.0,2010.0,Export,Qatar,World,22.0,"Beverages, spirits and vinegar",4550061.0,,25.3336984,51.2295295,-36.8535712,174.7456809,22.02010.0Qatar,140909939.0,
2010.0,2010.0,Export,Qatar,World,23.0,Residues and waste from the food industries,4505.0,,25.3336984,51.2295295,-36.8535712,174.7456809,23.02010.0Qatar,25416981.0,
2010.0,2010.0,Export,Qatar,World,24.0,Tobacco and manufactured tobacco substitutes,56132.0,,25.3336984,51.2295295,-36.8535712,174.7456809,24.02010.0Qatar,73184041.0,
2010.0,2010.0,Export,Qatar,World,25.0,Salt; sulfur; earths and stone; plastering materials,189383967.0,,25.3336984,51.2295295,-36.8535712,174.7456809,25.02010.0Qatar,325626172.0,
2010.0,2010.0,Export,Qatar,World,26.0,"Ores, slag and ash",2381890.0,,25.3336984,51.2295295,-36.8535712,174.7456809,26.02010.0Qatar,290678059.0,
2010.0,2010.0,Export,Qatar,World,27.0,"Mineral fuels, mineral oils and products of their distillation",67536260359.0,,25.3336984,51.2295295,-36.8535712,174.7456809,27.02010.0Qatar,273204025.0,
2010.0,2010.0,Export,Qatar,World,28.0,Inorganic chemicals,417291139.0,,25.3336984,51.2295295,-36.8535712,174.7456809,28.02010.0Qatar,449865058.0,
2010.0,2010.0,Export,Qatar,World,29.0,Organic chemicals,961958680.0,,25.3336984,51.2295295,-36.8535712,174.7456809,29.02010.0Qatar,113234353.0,
2010.0,2010.0,Export,Qatar,World,30.0,Pharmaceutical products,1994150.0,,25.3336984,51.2295295,-36.8535712,174.7456809,30.02010.0Qatar,280213252.0,
2010.0,2010.0,Export,Qatar,World,31.0,Fertilizers,861469297.0,,25.3336984,51.2295295,-36.8535712,174.7456809,31.02010.0Qatar,4598704.0,
2010.0,2010.0,Export,Qatar,World,32.0,Tanning or dyeing extracts,3050331.0,,25.3336984,51.2295295,-36.8535712,174.7456809,32.02010.0Qatar,115598736.0,
2010.0,2010.0,Export,Qatar,World,33.0,"Essential oils and resinoids; perfumery, cosmetic or toilet preparations",5124366.0,,25.3336984,51.2295295,-36.8535712,174.7456809,33.02010.0Qatar,218958725.0,
2010.0,2010.0,Export,Qatar,World,34.0,"Soap, organic surface-active agents",12957491.0,,25.3336984,51.2295295,-36.8535712,174.7456809,34.02010.0Qatar,95980540.0,
2010.0,2010.0,Export,Qatar,World,35.0,Albuminoidal substances; modified starches; glues; enzymes,405031.0,,25.3336984,51.2295295,-36.8535712,174.7456809,35.02010.0Qatar,16575879.0,
2010.0,2010.0,Export,Qatar,World,36.0,Explosives; pyrotechnic products; matches,13654.0,,25.3336984,51.2295295,-36.8535712,174.7456809,36.02010.0Qatar,5940237.0,
2010.0,2010.0,Export,Qatar,World,37.0,Photographic or cinematographic goods,472912.0,,25.3336984,51.2295295,-36.8535712,174.7456809,37.02010.0Qatar,23268007.0,
2010.0,2010.0,Export,Qatar,World,38.0,Miscellaneous chemical products,23620680.0,,25.3336984,51.2295295,-36.8535712,174.7456809,38.02010.0Qatar,360379297.0,
2010.0,2010.0,Export,Qatar,World,39.0,Plastics and articles thereof,1494152081.0,,25.3336984,51.2295295,-36.8535712,174.7456809,39.02010.0Qatar,423554616.0,
2010.0,2010.0,Export,Qatar,World,40.0,Rubber and articles thereof,4757789.0,,25.3336984,51.2295295,-36.8535712,174.7456809,40.02010.0Qatar,234429327.0,
2010.0,2010.0,Export,Qatar,World,41.0,Raw hides and skins (other than fur skins) and leather,2185474.0,,25.3336984,51.2295295,-36.8535712,174.7456809,41.02010.0Qatar,1543818.0,
2010.0,2010.0,Export,Qatar,World,42.0,Articles of leather; saddlery and harness,1241037.0,,25.3336984,51.2295295,-36.8535712,174.7456809,42.02010.0Qatar,70319339.0,
2010.0,2010.0,Export,Qatar,World,43.0,Fur skins and artificial fur; manufactures thereof,210989.0,,25.3336984,51.2295295,-36.8535712,174.7456809,43.02010.0Qatar,260457.0,
2010.0,2010.0,Export,Qatar,World,44.0,Wood and articles of wood; wood charcoal,10443249.0,,25.3336984,51.2295295,-36.8535712,174.7456809,44.02010.0Qatar,217707027.0,
2010.0,2010.0,Export,Qatar,World,45.0,Cork and articles of cork,38186.0,,25.3336984,51.2295295,-36.8535712,174.7456809,45.02010.0Qatar,3348494.0,
2010.0,2010.0,Export,Qatar,World,46.0,"Manufactures of straw, of esparto or of other plaiting materials",14888.0,,25.3336984,51.2295295,-36.8535712,174.7456809,46.02010.0Qatar,3814689.0,
2010.0,2010.0,Export,Qatar,World,47.0,Pulp of wood or of other fibrous cellulose material,2030978.0,,25.3336984,51.2295295,-36.8535712,174.7456809,47.02010.0Qatar,2153218.0,
2010.0,2010.0,Export,Qatar,World,48.0,"Paper and paperboard; articles of paper pulp, of paper or of paperboard",11319635.0,,25.3336984,51.2295295,-36.8535712,174.7456809,48.02010.0Qatar,168565083.0,
2010.0,2010.0,Export,Qatar,World,49.0,"Printed books, newspapers, pictures and other products of the printing indu ...",2245161.0,,25.3336984,51.2295295,-36.8535712,174.7456809,49.02010.0Qatar,62462557.0,
2010.0,2010.0,Export,Qatar,World,51.0,"Wool, fine or coarse animal hair; horsehair yarn and woven fabric",12692.0,,25.3336984,51.2295295,-36.8535712,174.7456809,51.02010.0Qatar,922319.0,
2010.0,2010.0,Export,Qatar,World,52.0,Cotton,76783.0,,25.3336984,51.2295295,-36.8535712,174.7456809,52.02010.0Qatar,5525130.0,
2010.0,2010.0,Export,Qatar,World,53.0,Other vegetable textile fibers; paper yarn and woven fabric of paper yarn,23930.0,,25.3336984,51.2295295,-36.8535712,174.7456809,53.02010.0Qatar,1965515.0,
2010.0,2010.0,Export,Qatar,World,54.0,Man-made filaments,46878.0,,25.3336984,51.2295295,-36.8535712,174.7456809,54.02010.0Qatar,9065031.0,
2010.0,2010.0,Export,Qatar,World,55.0,Man-made staple fibers,6448.0,,25.3336984,51.2295295,-36.8535712,174.7456809,55.02010.0Qatar,18901573.0,
2010.0,2010.0,Export,Qatar,World,56.0,"Wadding, felt and non-wovens; special yarns, twine, cordage, ropes and cabl ...",315552.0,,25.3336984,51.2295295,-36.8535712,174.7456809,56.02010.0Qatar,11424724.0,
2010.0,2010.0,Export,Qatar,World,58.0,"Special woven fabrics; tufted textile fabrics; lace, tapestries; trimmings; ...",101798.0,,25.3336984,51.2295295,-36.8535712,174.7456809,58.02010.0Qatar,12642762.0,
2010.0,2010.0,Export,Qatar,World,59.0,"Impregnated, coated, covered or laminated textile fabrics",129003.0,,25.3336984,51.2295295,-36.8535712,174.7456809,59.02010.0Qatar,8470489.0,
2010.0,2010.0,Export,Qatar,World,60.0,Knitted or crocheted fabrics,432443.0,,25.3336984,51.2295295,-36.8535712,174.7456809,60.02010.0Qatar,12124947.0,
2010.0,2010.0,Export,Qatar,World,61.0,"Articles of apparel and clothing accessories, knitted or crocheted",1095346.0,,25.3336984,51.2295295,-36.8535712,174.7456809,61.02010.0Qatar,97712040.0,
2010.0,2010.0,Export,Qatar,World,62.0,"Articles of apparel and clothing accessories, not knitted or crocheted",7646132.0,,25.3336984,51.2295295,-36.8535712,174.7456809,62.02010.0Qatar,210176237.0,
2010.0,2010.0,Export,Qatar,World,63.0,Other made up textile articles; sets; worn clothing and worn textile articl ...,1252795.0,,25.3336984,51.2295295,-36.8535712,174.7456809,63.02010.0Qatar,73473357.0,
2010.0,2010.0,Export,Qatar,World,64.0,"Footwear, gaiters and the like; parts of such articles",1697838.0,,25.3336984,51.2295295,-36.8535712,174.7456809,64.02010.0Qatar,90156167.0,
2010.0,2010.0,Export,Qatar,World,65.0,Headgear and parts thereof,94764.0,,25.3336984,51.2295295,-36.8535712,174.7456809,65.02010.0Qatar,7015258.0,
2010.0,2010.0,Export,Qatar,World,66.0,"Umbrellas, sun umbrellas, walking sticks, seat sticks, whips, riding-crops",238836.0,,25.3336984,51.2295295,-36.8535712,174.7456809,66.02010.0Qatar,2207279.0,
2010.0,2010.0,Export,Qatar,World,67.0,Prepared feathers and down and articles made of feathers or of down,474.0,,25.3336984,51.2295295,-36.8535712,174.7456809,67.02010.0Qatar,19202437.0,
2010.0,2010.0,Export,Qatar,World,68.0,"Articles of stone, plaster, cement, asbestos, mica or similar materials",7012101.0,,25.3336984,51.2295295,-36.8535712,174.7456809,68.02010.0Qatar,406860785.0,
2010.0,2010.0,Export,Qatar,World,69.0,Ceramic products,3466329.0,,25.3336984,51.2295295,-36.8535712,174.7456809,69.02010.0Qatar,174376066.0,
2010.0,2010.0,Export,Qatar,World,70.0,Glass and glassware,23244469.0,,25.3336984,51.2295295,-36.8535712,174.7456809,70.02010.0Qatar,159845788.0,
2010.0,2010.0,Export,Qatar,World,71.0,"Natural or cultured pearls, precious or semi-precious stones",9392510.0,,25.3336984,51.2295295,-36.8535712,174.7456809,71.02010.0Qatar,439816465.0,
2010.0,2010.0,Export,Qatar,World,72.0,Iron and steel,746362533.0,,25.3336984,51.2295295,-36.8535712,174.7456809,72.02010.0Qatar,547259712.0,
2010.0,2010.0,Export,Qatar,World,73.0,Articles of iron or steel,323939651.0,,25.3336984,51.2295295,-36.8535712,174.7456809,73.02010.0Qatar,1697908017.0,
2010.0,2010.0,Export,Qatar,World,74.0,Copper and articles thereof,18457786.0,,25.3336984,51.2295295,-36.8535712,174.7456809,74.02010.0Qatar,105382551.0,
2010.0,2010.0,Export,Qatar,World,75.0,Nickel and articles thereof,2129491.0,,25.3336984,51.2295295,-36.8535712,174.7456809,75.02010.0Qatar,11828984.0,
2010.0,2010.0,Export,Qatar,World,76.0,Aluminum and articles thereof,397296424.0,,25.3336984,51.2295295,-36.8535712,174.7456809,76.02010.0Qatar,423183041.0,
2010.0,2010.0,Export,Qatar,World,78.0,Lead and articles thereof,53188.0,,25.3336984,51.2295295,-36.8535712,174.7456809,78.02010.0Qatar,879869.0,
2010.0,2010.0,Export,Qatar,World,79.0,Zinc and articles thereof,617678.0,,25.3336984,51.2295295,-36.8535712,174.7456809,79.02010.0Qatar,23911750.0,
2010.0,2010.0,Export,Qatar,World,80.0,Tin and articles thereof,229742.0,,25.3336984,51.2295295,-36.8535712,174.7456809,80.02010.0Qatar,12021449.0,
2010.0,2010.0,Export,Qatar,World,81.0,Other base metals; cermets; articles thereof,20186.0,,25.3336984,51.2295295,-36.8535712,174.7456809,81.02010.0Qatar,10927164.0,
2010.0,2010.0,Export,Qatar,World,82.0,"Tools, implements, cutlery, spoons and forks, of base metal",6944803.0,,25.3336984,51.2295295,-36.8535712,174.7456809,82.02010.0Qatar,96761763.0,
2010.0,2010.0,Export,Qatar,World,83.0,Miscellaneous articles of base metal,2172109.0,,25.3336984,51.2295295,-36.8535712,174.7456809,83.02010.0Qatar,85434536.0,
2010.0,2010.0,Export,Qatar,World,84.0,Machinery and mechanical appliances; parts thereof,617589333.0,,25.3336984,51.2295295,-36.8535712,174.7456809,84.02010.0Qatar,4432377023.0,
2010.0,2010.0,Export,Qatar,World,85.0,Electrical machinery and equipment and parts thereof; sound recorders and r ...,152722107.0,,25.3336984,51.2295295,-36.8535712,174.7456809,85.02010.0Qatar,3189691503.0,
2010.0,2010.0,Export,Qatar,World,86.0,"Railway or tramway locomotives, rolling-stock and parts thereof",7669152.0,,25.3336984,51.2295295,-36.8535712,174.7456809,86.02010.0Qatar,6929003.0,
2010.0,2010.0,Export,Qatar,World,88.0,"Aircraft, spacecraft, and parts thereof",134390978.0,,25.3336984,51.2295295,-36.8535712,174.7456809,88.02010.0Qatar,988875534.0,
2010.0,2010.0,Export,Qatar,World,89.0,"Ships, boats and floating structures",34954678.0,,25.3336984,51.2295295,-36.8535712,174.7456809,89.02010.0Qatar,176825161.0,
2010.0,2010.0,Export,Qatar,World,90.0,"Optical, photographic, cinematographic, measuring, checking, precision, med ...",30967172.0,,25.3336984,51.2295295,-36.8535712,174.7456809,90.02010.0Qatar,476641911.0,
2010.0,2010.0,Export,Qatar,World,91.0,Clocks and watches and parts thereof,4907866.0,,25.3336984,51.2295295,-36.8535712,174.7456809,91.02010.0Qatar,133940594.0,
2010.0,2010.0,Export,Qatar,World,92.0,Musical instruments; parts and accessories of such articles,239800.0,,25.3336984,51.2295295,-36.8535712,174.7456809,92.02010.0Qatar,6410467.0,
2010.0,2010.0,Export,Qatar,World,93.0,Arms and ammunition; parts and accessories thereof,6736554.0,,25.3336984,51.2295295,-36.8535712,174.7456809,93.02010.0Qatar,40229846.0,
2010.0,2010.0,Export,Qatar,World,94.0,"Furniture; bedding, mattresses, cushions and similar stuffed furnishing",27719015.0,,25.3336984,51.2295295,-36.8535712,174.7456809,94.02010.0Qatar,587670492.0,
2010.0,2010.0,Export,Qatar,World,95.0,"Toys, games and sports requisites; parts and accessories thereof",1272344.0,,25.3336984,51.2295295,-36.8535712,174.7456809,95.02010.0Qatar,59831950.0,
2010.0,2010.0,Export,Qatar,World,96.0,Miscellaneous manufactured articles,1554971.0,,25.3336984,51.2295295,-36.8535712,174.7456809,96.02010.0Qatar,42498781.0,
2010.0,2010.0,Export,Qatar,World,97.0,"Works of art, collectors' pieces and antiques",1548662.0,,25.3336984,51.2295295,-36.8535712,174.7456809,97.02010.0Qatar,30257577.0,
2010.0,2010.0,Export,Qatar,World,99.0,Commodities not specified according to kind,1.0,,25.3336984,51.2295295,-36.8535712,174.7456809,99.02010.0Qatar,1.0,
