yr,periodDesc,rgDesc,rtTitle,ptTitle,cmdCode,cmdDescE,TradeValue_export,Unnamed: 0_export,rtLat,rtLon,ptLat,ptLon,mid,TradeValue_import,Unnamed: 0_import
2008.0,2008.0,Export,Israel,World,1.0,Live animals; animal products,8334000.0,,30.8124247,34.8594762,-36.8535712,174.7456809,1.02008.0Israel,68841000.0,
2008.0,2008.0,Export,Israel,World,2.0,Meat and edible meat offal,30345000.0,,30.8124247,34.8594762,-36.8535712,174.7456809,2.02008.0Israel,327046000.0,
2008.0,2008.0,Export,Israel,World,3.0,"Fish and crustaceans, molluscs and other acquatic invertebrates",19721000.0,,30.8124247,34.8594762,-36.8535712,174.7456809,3.02008.0Israel,156016000.0,
2008.0,2008.0,Export,Israel,World,4.0,"Dairy produce; birds' eggs; natural honey; edible products of animal origin, not elsewhere specified or included",17531000.0,,30.8124247,34.8594762,-36.8535712,174.7456809,4.02008.0Israel,73237000.0,
2008.0,2008.0,Export,Israel,World,5.0,"Products of animal origin, not elsewhere specified or included",1063000.0,,30.8124247,34.8594762,-36.8535712,174.7456809,5.02008.0Israel,8787000.0,
2008.0,2008.0,Export,Israel,World,6.0,"Live trees and other plants; bulbs, roots and the like; cut flowers and ornamental foliage",260945000.0,,30.8124247,34.8594762,-36.8535712,174.7456809,6.02008.0Israel,12386000.0,
2008.0,2008.0,Export,Israel,World,7.0,Edible vegetables and certain roots and tubers,502465000.0,,30.8124247,34.8594762,-36.8535712,174.7456809,7.02008.0Israel,104758000.0,
2008.0,2008.0,Export,Israel,World,8.0,Edible fruit and nuts; peel of citrus fruit or melons,289563000.0,,30.8124247,34.8594762,-36.8535712,174.7456809,8.02008.0Israel,169156000.0,
2008.0,2008.0,Export,Israel,World,9.0,"Coffee, tea, maté and spices",17734000.0,,30.8124247,34.8594762,-36.8535712,174.7456809,9.02008.0Israel,107544000.0,
2008.0,2008.0,Export,Israel,World,10.0,Cereals,13123000.0,,30.8124247,34.8594762,-36.8535712,174.7456809,10.02008.0Israel,974152000.0,
2008.0,2008.0,Export,Israel,World,11.0,Products of the milling industry; malt; starches; inulin; wheat gluten,7004000.0,,30.8124247,34.8594762,-36.8535712,174.7456809,11.02008.0Israel,90160000.0,
2008.0,2008.0,Export,Israel,World,12.0,"Oil seeds and oleaginous fruits; miscellaneous grains, seeds and fruit; industrial or medicinal plants; straw and fodder",176158000.0,,30.8124247,34.8594762,-36.8535712,174.7456809,12.02008.0Israel,331116000.0,
2008.0,2008.0,Export,Israel,World,13.0,"Lac; gums, resins and other vegetable saps and extracts",18363000.0,,30.8124247,34.8594762,-36.8535712,174.7456809,13.02008.0Israel,27902000.0,
2008.0,2008.0,Export,Israel,World,14.0,Vegetable plaiting materials; vegetable products not elsewhere specified or included,27000.0,,30.8124247,34.8594762,-36.8535712,174.7456809,14.02008.0Israel,9688000.0,
2008.0,2008.0,Export,Israel,World,15.0,Animal or vegetable fats and oils and their cleavage products; prepared edible fats; animal or vegetable waxes,8454000.0,,30.8124247,34.8594762,-36.8535712,174.7456809,15.02008.0Israel,141363000.0,
2008.0,2008.0,Export,Israel,World,16.0,"Preparations of meat, of fish or of crustaceans, molluscs or other aquatic invertebrates",45611000.0,,30.8124247,34.8594762,-36.8535712,174.7456809,16.02008.0Israel,81521000.0,
2008.0,2008.0,Export,Israel,World,17.0,Sugars and sugar confectionery,96191000.0,,30.8124247,34.8594762,-36.8535712,174.7456809,17.02008.0Israel,293632000.0,
2008.0,2008.0,Export,Israel,World,18.0,Cocoa and cocoa preparations,12731000.0,,30.8124247,34.8594762,-36.8535712,174.7456809,18.02008.0Israel,109792000.0,
2008.0,2008.0,Export,Israel,World,20.0,"Preparations of vegetables, fruit, nuts or other parts of plants",231774000.0,,30.8124247,34.8594762,-36.8535712,174.7456809,20.02008.0Israel,215177000.0,
2008.0,2008.0,Export,Israel,World,22.0,"Beverages, spirits and vinegar",33495000.0,,30.8124247,34.8594762,-36.8535712,174.7456809,22.02008.0Israel,182210000.0,
2008.0,2008.0,Export,Israel,World,23.0,Residues and waste from the food industries; prepared animal fodder,20900000.0,,30.8124247,34.8594762,-36.8535712,174.7456809,23.02008.0Israel,243666000.0,
2008.0,2008.0,Export,Israel,World,24.0,Tobacco and manufactured tobacco substitutes,10008000.0,,30.8124247,34.8594762,-36.8535712,174.7456809,24.02008.0Israel,166581000.0,
2008.0,2008.0,Export,Israel,World,25.0,"Salt; sulphur; earths and stone; plastering materials, lime and cement",231573000.0,,30.8124247,34.8594762,-36.8535712,174.7456809,25.02008.0Israel,505963000.0,
2008.0,2008.0,Export,Israel,World,26.0,"Ores, slag and ash",1702000.0,,30.8124247,34.8594762,-36.8535712,174.7456809,26.02008.0Israel,5350000.0,
2008.0,2008.0,Export,Israel,World,27.0,"Mineral fuels, mineral oils and products of their distillation; bituminous substances; mineral waxes",559113000.0,,30.8124247,34.8594762,-36.8535712,174.7456809,27.02008.0Israel,12842427000.0,
2008.0,2008.0,Export,Israel,World,28.0,"Inorganic chemicals; organic or inorganic compounds of precious metals, of rare-earth metals, of radioactive elements or of isotopes",1063203000.0,,30.8124247,34.8594762,-36.8535712,174.7456809,28.02008.0Israel,432817000.0,
2008.0,2008.0,Export,Israel,World,29.0,Organic chemicals,1621688000.0,,30.8124247,34.8594762,-36.8535712,174.7456809,29.02008.0Israel,1928244000.0,
2008.0,2008.0,Export,Israel,World,30.0,Pharmaceutical products,4789260000.0,,30.8124247,34.8594762,-36.8535712,174.7456809,30.02008.0Israel,1289046000.0,
2008.0,2008.0,Export,Israel,World,31.0,Fertilisers,2569769000.0,,30.8124247,34.8594762,-36.8535712,174.7456809,31.02008.0Israel,69801000.0,
2008.0,2008.0,Export,Israel,World,32.0,"Tanning or dyeing extracts; tannins and their derivatives; dyes, pigments and other colouring matter; paints and varnishes; putty and other mastics; inks",226869000.0,,30.8124247,34.8594762,-36.8535712,174.7456809,32.02008.0Israel,290562000.0,
2008.0,2008.0,Export,Israel,World,33.0,"Essential oils and resinoids; perfumery, cosmetic or toilet preparations",337650000.0,,30.8124247,34.8594762,-36.8535712,174.7456809,33.02008.0Israel,371180000.0,
2008.0,2008.0,Export,Israel,World,34.0,"Soap, organic surface-active agents, washing preparations, lubricating preparations, artificialwaxes, prepared waxes, polishing or scouring preparations, candles and similar articles, modelling pastes, dental waxes and dental preparations with a basis o",186586000.0,,30.8124247,34.8594762,-36.8535712,174.7456809,34.02008.0Israel,265726000.0,
2008.0,2008.0,Export,Israel,World,35.0,Albuminoidal substances; modified starches; glues; enzymes,17136000.0,,30.8124247,34.8594762,-36.8535712,174.7456809,35.02008.0Israel,93385000.0,
2008.0,2008.0,Export,Israel,World,36.0,Explosives; pyrotechnic products; matches; pyrophoric alloys; certain combustible preparations,14595000.0,,30.8124247,34.8594762,-36.8535712,174.7456809,36.02008.0Israel,4185000.0,
2008.0,2008.0,Export,Israel,World,37.0,Photographic or cinematographic goods,6710000.0,,30.8124247,34.8594762,-36.8535712,174.7456809,37.02008.0Israel,120129000.0,
2008.0,2008.0,Export,Israel,World,38.0,Miscellaneous chemical products,3515066000.0,,30.8124247,34.8594762,-36.8535712,174.7456809,38.02008.0Israel,599702000.0,
2008.0,2008.0,Export,Israel,World,39.0,Plastics and articles thereof,2563854000.0,,30.8124247,34.8594762,-36.8535712,174.7456809,39.02008.0Israel,2242541000.0,
2008.0,2008.0,Export,Israel,World,40.0,Rubber and articles thereof,252397000.0,,30.8124247,34.8594762,-36.8535712,174.7456809,40.02008.0Israel,412200000.0,
2008.0,2008.0,Export,Israel,World,42.0,"Articles of leather; saddlery and harness; travel goods, handbags and similar containers; articles of animal gut (other than silk-worm gut)",6723000.0,,30.8124247,34.8594762,-36.8535712,174.7456809,42.02008.0Israel,112146000.0,
2008.0,2008.0,Export,Israel,World,43.0,Furskins and artificial fur; manufactures thereof,1768000.0,,30.8124247,34.8594762,-36.8535712,174.7456809,43.02008.0Israel,1063000.0,
2008.0,2008.0,Export,Israel,World,44.0,Wood and articles of wood; wood charcoal,13991000.0,,30.8124247,34.8594762,-36.8535712,174.7456809,44.02008.0Israel,510526000.0,
2008.0,2008.0,Export,Israel,World,46.0,"Manufactures of straw, of esparto or of other plaiting materials; basketware and wickerwork",43000.0,,30.8124247,34.8594762,-36.8535712,174.7456809,46.02008.0Israel,9968000.0,
2008.0,2008.0,Export,Israel,World,47.0,Pulp of wood or of other fibrous cellulosic material; recovered (waste and scrap) of paper or paperboard,33039000.0,,30.8124247,34.8594762,-36.8535712,174.7456809,47.02008.0Israel,131054000.0,
2008.0,2008.0,Export,Israel,World,48.0,"Paper and paperboard; articles of paper pulp, of paper or of paperboard",191244000.0,,30.8124247,34.8594762,-36.8535712,174.7456809,48.02008.0Israel,834878000.0,
2008.0,2008.0,Export,Israel,World,49.0,"Printed books, newspapers, pictures and other products of the printing industry; manuscripts, typescripts and plans",73037000.0,,30.8124247,34.8594762,-36.8535712,174.7456809,49.02008.0Israel,72787000.0,
2008.0,2008.0,Export,Israel,World,50.0,Silk,249000.0,,30.8124247,34.8594762,-36.8535712,174.7456809,50.02008.0Israel,2451000.0,
2008.0,2008.0,Export,Israel,World,51.0,"Wool, fine or coarse animal hair; horsehair yarn and woven fabric",4426000.0,,30.8124247,34.8594762,-36.8535712,174.7456809,51.02008.0Israel,5784000.0,
2008.0,2008.0,Export,Israel,World,52.0,Cotton,65507000.0,,30.8124247,34.8594762,-36.8535712,174.7456809,52.02008.0Israel,110977000.0,
2008.0,2008.0,Export,Israel,World,53.0,Other vegetable textile fibres; paper yarn and woven fabrics of paper yarn,430000.0,,30.8124247,34.8594762,-36.8535712,174.7456809,53.02008.0Israel,3463000.0,
2008.0,2008.0,Export,Israel,World,54.0,Man-made filaments; strip and the like of man-made textile materials,170480000.0,,30.8124247,34.8594762,-36.8535712,174.7456809,54.02008.0Israel,161240000.0,
2008.0,2008.0,Export,Israel,World,55.0,Man-made staple fibres,11460000.0,,30.8124247,34.8594762,-36.8535712,174.7456809,55.02008.0Israel,223485000.0,
2008.0,2008.0,Export,Israel,World,56.0,"Wadding, felt and nonwovens; special yarns; twine, cordage, ropes and cables and articles thereof",316684000.0,,30.8124247,34.8594762,-36.8535712,174.7456809,56.02008.0Israel,90208000.0,
2008.0,2008.0,Export,Israel,World,57.0,Carpets and other textile floor coverings,17824000.0,,30.8124247,34.8594762,-36.8535712,174.7456809,57.02008.0Israel,34051000.0,
2008.0,2008.0,Export,Israel,World,58.0,Special woven fabrics; tufted textile fabrics; lace; tapestries; trimmings; embroidery,3265000.0,,30.8124247,34.8594762,-36.8535712,174.7456809,58.02008.0Israel,23538000.0,
2008.0,2008.0,Export,Israel,World,59.0,"Impregnated, coated, covered or laminated textile fabrics; textile articles of a kind suitable for industrial use",37236000.0,,30.8124247,34.8594762,-36.8535712,174.7456809,59.02008.0Israel,85084000.0,
2008.0,2008.0,Export,Israel,World,60.0,Knitted or crocheted fabrics,55654000.0,,30.8124247,34.8594762,-36.8535712,174.7456809,60.02008.0Israel,62968000.0,
2008.0,2008.0,Export,Israel,World,61.0,"Articles of apparel and clothing accessories, knitted or crocheted",235297000.0,,30.8124247,34.8594762,-36.8535712,174.7456809,61.02008.0Israel,491766000.0,
2008.0,2008.0,Export,Israel,World,62.0,"Articles of apparel and clothing accessories, not knitted or crocheted",82452000.0,,30.8124247,34.8594762,-36.8535712,174.7456809,62.02008.0Israel,562740000.0,
2008.0,2008.0,Export,Israel,World,63.0,Other made up textile articles; sets; worn clothing and worn textile articles; rags,165863000.0,,30.8124247,34.8594762,-36.8535712,174.7456809,63.02008.0Israel,140682000.0,
2008.0,2008.0,Export,Israel,World,64.0,"Footwear, gaiters and the like; parts of such articles",45188000.0,,30.8124247,34.8594762,-36.8535712,174.7456809,64.02008.0Israel,342617000.0,
2008.0,2008.0,Export,Israel,World,65.0,Headgear and parts thereof,9189000.0,,30.8124247,34.8594762,-36.8535712,174.7456809,65.02008.0Israel,26402000.0,
2008.0,2008.0,Export,Israel,World,66.0,"Umbrella, sun umbrellas, walking-sticks, seat-sticks, whips, riding-crops and parts thereof",115000.0,,30.8124247,34.8594762,-36.8535712,174.7456809,66.02008.0Israel,6380000.0,
2008.0,2008.0,Export,Israel,World,67.0,Prepared feathers and down and articles made of feathers or of down; artificial flowers; articles of human hair,1298000.0,,30.8124247,34.8594762,-36.8535712,174.7456809,67.02008.0Israel,13003000.0,
2008.0,2008.0,Export,Israel,World,68.0,"Articles of stone, plaster, cement, asbestos, mica or similar materials",195157000.0,,30.8124247,34.8594762,-36.8535712,174.7456809,68.02008.0Israel,159087000.0,
2008.0,2008.0,Export,Israel,World,69.0,Ceramic products,26296000.0,,30.8124247,34.8594762,-36.8535712,174.7456809,69.02008.0Israel,289737000.0,
2008.0,2008.0,Export,Israel,World,70.0,Glass and glassware,124615000.0,,30.8124247,34.8594762,-36.8535712,174.7456809,70.02008.0Israel,238736000.0,
2008.0,2008.0,Export,Israel,World,71.0,"Natural or cultured pearls, precious or semi-precious stones, precious metals, metals cladwith precious metal, and articles thereof; imitation jewellery; coin",19961660000.0,,30.8124247,34.8594762,-36.8535712,174.7456809,71.02008.0Israel,9688169000.0,
2008.0,2008.0,Export,Israel,World,72.0,Iron and steel,239507000.0,,30.8124247,34.8594762,-36.8535712,174.7456809,72.02008.0Israel,1490647000.0,
2008.0,2008.0,Export,Israel,World,73.0,Articles of iron or steel,1011645000.0,,30.8124247,34.8594762,-36.8535712,174.7456809,73.02008.0Israel,881060000.0,
2008.0,2008.0,Export,Israel,World,74.0,Copper and articles thereof,137765000.0,,30.8124247,34.8594762,-36.8535712,174.7456809,74.02008.0Israel,340320000.0,
2008.0,2008.0,Export,Israel,World,75.0,Nickel and articles thereof,5298000.0,,30.8124247,34.8594762,-36.8535712,174.7456809,75.02008.0Israel,70157000.0,
2008.0,2008.0,Export,Israel,World,76.0,Aluminum and articles thereof,245781000.0,,30.8124247,34.8594762,-36.8535712,174.7456809,76.02008.0Israel,499823000.0,
2008.0,2008.0,Export,Israel,World,78.0,Lead and articles thereof,48195000.0,,30.8124247,34.8594762,-36.8535712,174.7456809,78.02008.0Israel,30130000.0,
2008.0,2008.0,Export,Israel,World,79.0,Zinc and articles thereof,10717000.0,,30.8124247,34.8594762,-36.8535712,174.7456809,79.02008.0Israel,30010000.0,
2008.0,2008.0,Export,Israel,World,80.0,Tin and articles thereof,336000.0,,30.8124247,34.8594762,-36.8535712,174.7456809,80.02008.0Israel,5810000.0,
2008.0,2008.0,Export,Israel,World,81.0,Other base metals; cermets; articles thereof,156625000.0,,30.8124247,34.8594762,-36.8535712,174.7456809,81.02008.0Israel,175326000.0,
2008.0,2008.0,Export,Israel,World,82.0,"Tools, implements, cutlery, spoons and forks, of base metal; parts thereof of base metal",871579000.0,,30.8124247,34.8594762,-36.8535712,174.7456809,82.02008.0Israel,196643000.0,
2008.0,2008.0,Export,Israel,World,83.0,Miscellaneous articles of base metal,102642000.0,,30.8124247,34.8594762,-36.8535712,174.7456809,83.02008.0Israel,196397000.0,
2008.0,2008.0,Export,Israel,World,84.0,"Nuclear reactors, boilers, machinery and mechanical appliances; parts thereof",4161261000.0,,30.8124247,34.8594762,-36.8535712,174.7456809,84.02008.0Israel,6858951000.0,
2008.0,2008.0,Export,Israel,World,85.0,"Electrical machinery and equipment and parts thereof; sound recorders and reproducers, television image and sound recorders and reproducers, and parts and accessories of such articles",7111297000.0,,30.8124247,34.8594762,-36.8535712,174.7456809,85.02008.0Israel,5870360000.0,
2008.0,2008.0,Export,Israel,World,87.0,"Vehicles other than railway or tramway rolling-stock, and parts and accessories thereof",211458000.0,,30.8124247,34.8594762,-36.8535712,174.7456809,87.02008.0Israel,4224986000.0,
2008.0,2008.0,Export,Israel,World,89.0,"Ships, boats and floating structures",43377000.0,,30.8124247,34.8594762,-36.8535712,174.7456809,89.02008.0Israel,76109000.0,
2008.0,2008.0,Export,Israel,World,90.0,"Optical, photographic, cinematographic, measuring, checking, precision, medical or surgical instruments and apparatus; parts and accessories thereof",3239252000.0,,30.8124247,34.8594762,-36.8535712,174.7456809,90.02008.0Israel,1735454000.0,
2008.0,2008.0,Export,Israel,World,93.0,Arms and ammunition; parts and accessories thereof,200078000.0,,30.8124247,34.8594762,-36.8535712,174.7456809,93.02008.0Israel,,
2008.0,2008.0,Export,Israel,World,94.0,"Furniture; bedding, mattresses, mattress supports, cushions and similar stuffed furnishings; lamps and lighting fittings, not elsewhere specified or included; illuminated signs, illuminated name-plates and the like; prefabricated buildings",106123000.0,,30.8124247,34.8594762,-36.8535712,174.7456809,94.02008.0Israel,558864000.0,
2008.0,2008.0,Export,Israel,World,95.0,"Toys, games and sports requisites; parts and accessories thereof",35891000.0,,30.8124247,34.8594762,-36.8535712,174.7456809,95.02008.0Israel,177945000.0,
2008.0,2008.0,Export,Israel,World,96.0,Miscellaneous manufactured articles,7814000.0,,30.8124247,34.8594762,-36.8535712,174.7456809,96.02008.0Israel,106273000.0,
2008.0,2008.0,Export,Israel,World,97.0,"Works of art, collectors' pieces and antiques",71356000.0,,30.8124247,34.8594762,-36.8535712,174.7456809,97.02008.0Israel,26291000.0,
2008.0,2008.0,Export,Israel,World,99.0,Commodities not specified according to kind,11127000.0,,30.8124247,34.8594762,-36.8535712,174.7456809,99.02008.0Israel,168283000.0,
