yr,periodDesc,rgDesc,rtTitle,ptTitle,cmdCode,cmdDescE,TradeValue_export,Unnamed: 0_export,rtLat,rtLon,ptLat,ptLon,mid,TradeValue_import,Unnamed: 0_import
2019.0,2019.0,Export,State of Palestine,World,2.0,Meat and edible meat offal,1838239.0,,31.46242095,34.262716572130714,-36.8535712,174.7456809,2.02019.0State of Palestine,53255759.0,
2019.0,2019.0,Export,State of Palestine,World,3.0,"Fish and crustaceans, molluscs and other aquatic invertebrates",60703.0,,31.46242095,34.262716572130714,-36.8535712,174.7456809,3.02019.0State of Palestine,16018085.0,
2019.0,2019.0,Export,State of Palestine,World,4.0,"Dairy produce; birds' eggs; natural honey; edible products of animal origin, not elsewhere specified or included",5093461.0,,31.46242095,34.262716572130714,-36.8535712,174.7456809,4.02019.0State of Palestine,128032965.0,
2019.0,2019.0,Export,State of Palestine,World,5.0,Animal originated products; not elsewhere specified or included,400.0,,31.46242095,34.262716572130714,-36.8535712,174.7456809,5.02019.0State of Palestine,308329.0,
2019.0,2019.0,Export,State of Palestine,World,6.0,"Trees and other plants, live; bulbs, roots and the like; cut flowers and ornamental foliage",1489321.0,,31.46242095,34.262716572130714,-36.8535712,174.7456809,6.02019.0State of Palestine,7097351.0,
2019.0,2019.0,Export,State of Palestine,World,7.0,Vegetables and certain roots and tubers; edible,33204229.0,,31.46242095,34.262716572130714,-36.8535712,174.7456809,7.02019.0State of Palestine,44950358.0,
2019.0,2019.0,Export,State of Palestine,World,8.0,"Fruit and nuts, edible; peel of citrus fruit or melons",42618049.0,,31.46242095,34.262716572130714,-36.8535712,174.7456809,8.02019.0State of Palestine,145468890.0,
2019.0,2019.0,Export,State of Palestine,World,9.0,"Coffee, tea, mate and spices",9539570.0,,31.46242095,34.262716572130714,-36.8535712,174.7456809,9.02019.0State of Palestine,49435232.0,
2019.0,2019.0,Export,State of Palestine,World,10.0,Cereals,3785354.0,,31.46242095,34.262716572130714,-36.8535712,174.7456809,10.02019.0State of Palestine,159464125.0,
2019.0,2019.0,Export,State of Palestine,World,11.0,"Products of the milling industry; malt, starches, inulin, wheat gluten",6651943.0,,31.46242095,34.262716572130714,-36.8535712,174.7456809,11.02019.0State of Palestine,72595256.0,
2019.0,2019.0,Export,State of Palestine,World,12.0,"Oil seeds and oleaginous fruits; miscellaneous grains, seeds and fruit, industrial or medicinal plants; straw and fodder",3984170.0,,31.46242095,34.262716572130714,-36.8535712,174.7456809,12.02019.0State of Palestine,44726550.0,
2019.0,2019.0,Export,State of Palestine,World,13.0,"Lac; gums, resins and other vegetable saps and extracts",5424.0,,31.46242095,34.262716572130714,-36.8535712,174.7456809,13.02019.0State of Palestine,409728.0,
2019.0,2019.0,Export,State of Palestine,World,15.0,Animal or vegetable fats and oils and their cleavage products; prepared animal fats; animal or vegetable waxes,57368320.0,,31.46242095,34.262716572130714,-36.8535712,174.7456809,15.02019.0State of Palestine,66904019.0,
2019.0,2019.0,Export,State of Palestine,World,16.0,"Meat, fish or crustaceans, molluscs or other aquatic invertebrates; preparations thereof",8366340.0,,31.46242095,34.262716572130714,-36.8535712,174.7456809,16.02019.0State of Palestine,21311660.0,
2019.0,2019.0,Export,State of Palestine,World,17.0,Sugars and sugar confectionery,6796231.0,,31.46242095,34.262716572130714,-36.8535712,174.7456809,17.02019.0State of Palestine,90060071.0,
2019.0,2019.0,Export,State of Palestine,World,18.0,Cocoa and cocoa preparations,6643450.0,,31.46242095,34.262716572130714,-36.8535712,174.7456809,18.02019.0State of Palestine,60632565.0,
2019.0,2019.0,Export,State of Palestine,World,19.0,"Preparations of cereals, flour, starch or milk; pastrycooks' products",6991725.0,,31.46242095,34.262716572130714,-36.8535712,174.7456809,19.02019.0State of Palestine,148256144.0,
2019.0,2019.0,Export,State of Palestine,World,20.0,"Preparations of vegetables, fruit, nuts or other parts of plants",13135824.0,,31.46242095,34.262716572130714,-36.8535712,174.7456809,20.02019.0State of Palestine,58763852.0,
2019.0,2019.0,Export,State of Palestine,World,21.0,Miscellaneous edible preparations,17372724.0,,31.46242095,34.262716572130714,-36.8535712,174.7456809,21.02019.0State of Palestine,47734858.0,
2019.0,2019.0,Export,State of Palestine,World,22.0,"Beverages, spirits and vinegar",12213365.0,,31.46242095,34.262716572130714,-36.8535712,174.7456809,22.02019.0State of Palestine,175486790.0,
2019.0,2019.0,Export,State of Palestine,World,23.0,"Food industries, residues and wastes thereof; prepared animal fodder",17594.0,,31.46242095,34.262716572130714,-36.8535712,174.7456809,23.02019.0State of Palestine,300695168.0,
2019.0,2019.0,Export,State of Palestine,World,24.0,Tobacco and manufactured tobacco substitutes,11467625.0,,31.46242095,34.262716572130714,-36.8535712,174.7456809,24.02019.0State of Palestine,157778793.0,
2019.0,2019.0,Export,State of Palestine,World,25.0,"Salt; sulphur; earths, stone; plastering materials, lime and cement",35864626.0,,31.46242095,34.262716572130714,-36.8535712,174.7456809,25.02019.0State of Palestine,222421239.0,
2019.0,2019.0,Export,State of Palestine,World,26.0,"Ores, slag and ash",16197.0,,31.46242095,34.262716572130714,-36.8535712,174.7456809,26.02019.0State of Palestine,4247740.0,
2019.0,2019.0,Export,State of Palestine,World,27.0,"Mineral fuels, mineral oils and products of their distillation; bituminous substances; mineral waxes",954712.0,,31.46242095,34.262716572130714,-36.8535712,174.7456809,27.02019.0State of Palestine,1245658505.0,
2019.0,2019.0,Export,State of Palestine,World,28.0,"Inorganic chemicals; organic and inorganic compounds of precious metals; of rare earth metals, of radio-active elements and of isotopes",1078711.0,,31.46242095,34.262716572130714,-36.8535712,174.7456809,28.02019.0State of Palestine,9605163.0,
2019.0,2019.0,Export,State of Palestine,World,29.0,Organic chemicals,98355.0,,31.46242095,34.262716572130714,-36.8535712,174.7456809,29.02019.0State of Palestine,31565167.0,
2019.0,2019.0,Export,State of Palestine,World,30.0,Pharmaceutical products,17452820.0,,31.46242095,34.262716572130714,-36.8535712,174.7456809,30.02019.0State of Palestine,286892450.0,
2019.0,2019.0,Export,State of Palestine,World,31.0,Fertilizers,2839.0,,31.46242095,34.262716572130714,-36.8535712,174.7456809,31.02019.0State of Palestine,9449460.0,
2019.0,2019.0,Export,State of Palestine,World,32.0,"Tanning or dyeing extracts; tannins and their derivatives; dyes, pigments and other colouring matter; paints, varnishes; putty, other mastics; inks",4003235.0,,31.46242095,34.262716572130714,-36.8535712,174.7456809,32.02019.0State of Palestine,43475696.0,
2019.0,2019.0,Export,State of Palestine,World,33.0,"Essential oils and resinoids; perfumery, cosmetic or toilet preparations",9249635.0,,31.46242095,34.262716572130714,-36.8535712,174.7456809,33.02019.0State of Palestine,91877528.0,
2019.0,2019.0,Export,State of Palestine,World,34.0,"Soap, organic surface-active agents; washing, lubricating, polishing or scouring preparations; artificial or prepared waxes, candles and similar articles, modelling pastes, dental waxes and dental preparations with a basis of plaster",17492222.0,,31.46242095,34.262716572130714,-36.8535712,174.7456809,34.02019.0State of Palestine,64163094.0,
2019.0,2019.0,Export,State of Palestine,World,35.0,Albuminoidal substances; modified starches; glues; enzymes,305844.0,,31.46242095,34.262716572130714,-36.8535712,174.7456809,35.02019.0State of Palestine,10536693.0,
2019.0,2019.0,Export,State of Palestine,World,36.0,Explosives; pyrotechnic products; matches; pyrophoric alloys; certain combustible preparations,1902.0,,31.46242095,34.262716572130714,-36.8535712,174.7456809,36.02019.0State of Palestine,961835.0,
2019.0,2019.0,Export,State of Palestine,World,37.0,Photographic or cinematographic goods,1811.0,,31.46242095,34.262716572130714,-36.8535712,174.7456809,37.02019.0State of Palestine,726294.0,
2019.0,2019.0,Export,State of Palestine,World,38.0,Chemical products n.e.c.,549865.0,,31.46242095,34.262716572130714,-36.8535712,174.7456809,38.02019.0State of Palestine,41212003.0,
2019.0,2019.0,Export,State of Palestine,World,39.0,Plastics and articles thereof,91743476.0,,31.46242095,34.262716572130714,-36.8535712,174.7456809,39.02019.0State of Palestine,253304074.0,
2019.0,2019.0,Export,State of Palestine,World,40.0,Rubber and articles thereof,3967879.0,,31.46242095,34.262716572130714,-36.8535712,174.7456809,40.02019.0State of Palestine,24033689.0,
2019.0,2019.0,Export,State of Palestine,World,41.0,Raw hides and skins (other than furskins) and leather,2197435.0,,31.46242095,34.262716572130714,-36.8535712,174.7456809,41.02019.0State of Palestine,7588420.0,
2019.0,2019.0,Export,State of Palestine,World,42.0,"Articles of leather; saddlery and harness; travel goods, handbags and similar containers; articles of animal gut (other than silk-worm gut)",1377922.0,,31.46242095,34.262716572130714,-36.8535712,174.7456809,42.02019.0State of Palestine,8988524.0,
2019.0,2019.0,Export,State of Palestine,World,44.0,Wood and articles of wood; wood charcoal,38463212.0,,31.46242095,34.262716572130714,-36.8535712,174.7456809,44.02019.0State of Palestine,139643349.0,
2019.0,2019.0,Export,State of Palestine,World,45.0,Cork and articles of cork,114519.0,,31.46242095,34.262716572130714,-36.8535712,174.7456809,45.02019.0State of Palestine,797481.0,
2019.0,2019.0,Export,State of Palestine,World,46.0,"Manufactures of straw, esparto or other plaiting materials; basketware and wickerwork",10882.0,,31.46242095,34.262716572130714,-36.8535712,174.7456809,46.02019.0State of Palestine,278120.0,
2019.0,2019.0,Export,State of Palestine,World,47.0,Pulp of wood or other fibrous cellulosic material; recovered (waste and scrap) paper or paperboard,62969.0,,31.46242095,34.262716572130714,-36.8535712,174.7456809,47.02019.0State of Palestine,556813.0,
2019.0,2019.0,Export,State of Palestine,World,48.0,"Paper and paperboard; articles of paper pulp, of paper or paperboard",20515348.0,,31.46242095,34.262716572130714,-36.8535712,174.7456809,48.02019.0State of Palestine,84817639.0,
2019.0,2019.0,Export,State of Palestine,World,49.0,"Printed books, newspapers, pictures and other products of the printing industry; manuscripts, typescripts and plans",1403601.0,,31.46242095,34.262716572130714,-36.8535712,174.7456809,49.02019.0State of Palestine,5052562.0,
2019.0,2019.0,Export,State of Palestine,World,52.0,Cotton,1571939.0,,31.46242095,34.262716572130714,-36.8535712,174.7456809,52.02019.0State of Palestine,1582768.0,
2019.0,2019.0,Export,State of Palestine,World,54.0,Man-made filaments; strip and the like of man-made textile materials,712649.0,,31.46242095,34.262716572130714,-36.8535712,174.7456809,54.02019.0State of Palestine,15621924.0,
2019.0,2019.0,Export,State of Palestine,World,55.0,Man-made staple fibres,84415.0,,31.46242095,34.262716572130714,-36.8535712,174.7456809,55.02019.0State of Palestine,5172796.0,
2019.0,2019.0,Export,State of Palestine,World,56.0,"Wadding, felt and nonwovens, special yarns; twine, cordage, ropes and cables and articles thereof",68900.0,,31.46242095,34.262716572130714,-36.8535712,174.7456809,56.02019.0State of Palestine,2346329.0,
2019.0,2019.0,Export,State of Palestine,World,57.0,Carpets and other textile floor coverings,529310.0,,31.46242095,34.262716572130714,-36.8535712,174.7456809,57.02019.0State of Palestine,16261375.0,
2019.0,2019.0,Export,State of Palestine,World,58.0,"Fabrics; special woven fabrics, tufted textile fabrics, lace, tapestries, trimmings, embroidery",1014847.0,,31.46242095,34.262716572130714,-36.8535712,174.7456809,58.02019.0State of Palestine,3826339.0,
2019.0,2019.0,Export,State of Palestine,World,59.0,"Textile fabrics; impregnated, coated, covered or laminated; textile articles of a kind suitable for industrial use",947011.0,,31.46242095,34.262716572130714,-36.8535712,174.7456809,59.02019.0State of Palestine,3394471.0,
2019.0,2019.0,Export,State of Palestine,World,61.0,Apparel and clothing accessories; knitted or crocheted,1339403.0,,31.46242095,34.262716572130714,-36.8535712,174.7456809,61.02019.0State of Palestine,31487911.0,
2019.0,2019.0,Export,State of Palestine,World,62.0,Apparel and clothing accessories; not knitted or crocheted,5302923.0,,31.46242095,34.262716572130714,-36.8535712,174.7456809,62.02019.0State of Palestine,42326308.0,
2019.0,2019.0,Export,State of Palestine,World,63.0,"Textiles, made up articles; sets; worn clothing and worn textile articles; rags",1852336.0,,31.46242095,34.262716572130714,-36.8535712,174.7456809,63.02019.0State of Palestine,15255862.0,
2019.0,2019.0,Export,State of Palestine,World,64.0,Footwear; gaiters and the like; parts of such articles,29744540.0,,31.46242095,34.262716572130714,-36.8535712,174.7456809,64.02019.0State of Palestine,29475758.0,
2019.0,2019.0,Export,State of Palestine,World,65.0,Headgear and parts thereof,209859.0,,31.46242095,34.262716572130714,-36.8535712,174.7456809,65.02019.0State of Palestine,714506.0,
2019.0,2019.0,Export,State of Palestine,World,66.0,"Umbrellas, sun umbrellas, walking-sticks, seat sticks, whips, riding crops; and parts thereof",229354.0,,31.46242095,34.262716572130714,-36.8535712,174.7456809,66.02019.0State of Palestine,222474.0,
2019.0,2019.0,Export,State of Palestine,World,67.0,"Feathers and down, prepared; and articles made of feather or of down; artificial flowers; articles of human hair",1938.0,,31.46242095,34.262716572130714,-36.8535712,174.7456809,67.02019.0State of Palestine,1519404.0,
2019.0,2019.0,Export,State of Palestine,World,68.0,"Stone, plaster, cement, asbestos, mica or similar materials; articles thereof",188394228.0,,31.46242095,34.262716572130714,-36.8535712,174.7456809,68.02019.0State of Palestine,36166443.0,
2019.0,2019.0,Export,State of Palestine,World,69.0,Ceramic products,21916706.0,,31.46242095,34.262716572130714,-36.8535712,174.7456809,69.02019.0State of Palestine,92779258.0,
2019.0,2019.0,Export,State of Palestine,World,70.0,Glass and glassware,8818262.0,,31.46242095,34.262716572130714,-36.8535712,174.7456809,70.02019.0State of Palestine,31671015.0,
2019.0,2019.0,Export,State of Palestine,World,71.0,"Natural, cultured pearls; precious, semi-precious stones; precious metals, metals clad with precious metal, and articles thereof; imitation jewellery; coin",61947.0,,31.46242095,34.262716572130714,-36.8535712,174.7456809,71.02019.0State of Palestine,3935390.0,
2019.0,2019.0,Export,State of Palestine,World,72.0,Iron and steel,66692119.0,,31.46242095,34.262716572130714,-36.8535712,174.7456809,72.02019.0State of Palestine,258872967.0,
2019.0,2019.0,Export,State of Palestine,World,73.0,Iron or steel articles,35007165.0,,31.46242095,34.262716572130714,-36.8535712,174.7456809,73.02019.0State of Palestine,90871473.0,
2019.0,2019.0,Export,State of Palestine,World,74.0,Copper and articles thereof,11167496.0,,31.46242095,34.262716572130714,-36.8535712,174.7456809,74.02019.0State of Palestine,4499872.0,
2019.0,2019.0,Export,State of Palestine,World,75.0,Nickel and articles thereof,963435.0,,31.46242095,34.262716572130714,-36.8535712,174.7456809,75.02019.0State of Palestine,1449132.0,
2019.0,2019.0,Export,State of Palestine,World,76.0,Aluminium and articles thereof,34612325.0,,31.46242095,34.262716572130714,-36.8535712,174.7456809,76.02019.0State of Palestine,82971649.0,
2019.0,2019.0,Export,State of Palestine,World,78.0,Lead and articles thereof,3124742.0,,31.46242095,34.262716572130714,-36.8535712,174.7456809,78.02019.0State of Palestine,178408.0,
2019.0,2019.0,Export,State of Palestine,World,80.0,Tin; articles thereof,31282.0,,31.46242095,34.262716572130714,-36.8535712,174.7456809,80.02019.0State of Palestine,229644.0,
2019.0,2019.0,Export,State of Palestine,World,82.0,"Tools, implements, cutlery, spoons and forks, of base metal; parts thereof, of base metal",2826731.0,,31.46242095,34.262716572130714,-36.8535712,174.7456809,82.02019.0State of Palestine,14098099.0,
2019.0,2019.0,Export,State of Palestine,World,83.0,Metal; miscellaneous products of base metal,4838605.0,,31.46242095,34.262716572130714,-36.8535712,174.7456809,83.02019.0State of Palestine,18898412.0,
2019.0,2019.0,Export,State of Palestine,World,84.0,"Nuclear reactors, boilers, machinery and mechanical appliances; parts thereof",15175795.0,,31.46242095,34.262716572130714,-36.8535712,174.7456809,84.02019.0State of Palestine,299263686.0,
2019.0,2019.0,Export,State of Palestine,World,85.0,"Electrical machinery and equipment and parts thereof; sound recorders and reproducers; television image and sound recorders and reproducers, parts and accessories of such articles",21616041.0,,31.46242095,34.262716572130714,-36.8535712,174.7456809,85.02019.0State of Palestine,348203481.0,
2019.0,2019.0,Export,State of Palestine,World,86.0,"Railway, tramway locomotives, rolling-stock and parts thereof; railway or tramway track fixtures and fittings and parts thereof; mechanical (including electro-mechanical) traffic signalling equipment of all kinds",47188.0,,31.46242095,34.262716572130714,-36.8535712,174.7456809,86.02019.0State of Palestine,368935.0,
2019.0,2019.0,Export,State of Palestine,World,87.0,"Vehicles; other than railway or tramway rolling stock, and parts and accessories thereof",12165941.0,,31.46242095,34.262716572130714,-36.8535712,174.7456809,87.02019.0State of Palestine,315424330.0,
2019.0,2019.0,Export,State of Palestine,World,90.0,"Optical, photographic, cinematographic, measuring, checking, medical or surgical instruments and apparatus; parts and accessories",7134260.0,,31.46242095,34.262716572130714,-36.8535712,174.7456809,90.02019.0State of Palestine,95718349.0,
2019.0,2019.0,Export,State of Palestine,World,91.0,Clocks and watches and parts thereof,18205.0,,31.46242095,34.262716572130714,-36.8535712,174.7456809,91.02019.0State of Palestine,1924136.0,
2019.0,2019.0,Export,State of Palestine,World,92.0,Musical instruments; parts and accessories of such articles,271780.0,,31.46242095,34.262716572130714,-36.8535712,174.7456809,92.02019.0State of Palestine,784195.0,
2019.0,2019.0,Export,State of Palestine,World,94.0,"Furniture; bedding, mattresses, mattress supports, cushions and similar stuffed furnishings; lamps and lighting fittings, n.e.c.; illuminated signs, illuminated name-plates and the like; prefabricated buildings",125345134.0,,31.46242095,34.262716572130714,-36.8535712,174.7456809,94.02019.0State of Palestine,61309856.0,
2019.0,2019.0,Export,State of Palestine,World,95.0,"Toys, games and sports requisites; parts and accessories thereof",1772243.0,,31.46242095,34.262716572130714,-36.8535712,174.7456809,95.02019.0State of Palestine,14908750.0,
2019.0,2019.0,Export,State of Palestine,World,96.0,Miscellaneous manufactured articles,2600856.0,,31.46242095,34.262716572130714,-36.8535712,174.7456809,96.02019.0State of Palestine,56137773.0,
2019.0,2019.0,Export,State of Palestine,World,97.0,Works of art; collectors' pieces and antiques,22304.0,,31.46242095,34.262716572130714,-36.8535712,174.7456809,97.02019.0State of Palestine,135261.0,
