yr,periodDesc,rgDesc,rtTitle,ptTitle,cmdCode,cmdDescE,TradeValue_export,Unnamed: 0_export,rtLat,rtLon,ptLat,ptLon,mid,TradeValue_import,Unnamed: 0_import
2017.0,2017.0,Export,Jordan,World,1.0,Animals; live,167077653.0,,31.1667049,36.941628,-36.8535712,174.7456809,1.02017.0Jordan,177757300.0,
2017.0,2017.0,Export,Jordan,World,2.0,Meat and edible meat offal,26746485.0,,31.1667049,36.941628,-36.8535712,174.7456809,2.02017.0Jordan,372530648.0,
2017.0,2017.0,Export,Jordan,World,3.0,"Fish and crustaceans, molluscs and other aquatic invertebrates",1819131.0,,31.1667049,36.941628,-36.8535712,174.7456809,3.02017.0Jordan,51999570.0,
2017.0,2017.0,Export,Jordan,World,4.0,"Dairy produce; birds' eggs; natural honey; edible products of animal origin, not elsewhere specified or included",45923702.0,,31.1667049,36.941628,-36.8535712,174.7456809,4.02017.0Jordan,274335978.0,
2017.0,2017.0,Export,Jordan,World,5.0,Animal originated products; not elsewhere specified or included,571550.0,,31.1667049,36.941628,-36.8535712,174.7456809,5.02017.0Jordan,558180.0,
2017.0,2017.0,Export,Jordan,World,6.0,"Trees and other plants, live; bulbs, roots and the like; cut flowers and ornamental foliage",3387789.0,,31.1667049,36.941628,-36.8535712,174.7456809,6.02017.0Jordan,13439961.0,
2017.0,2017.0,Export,Jordan,World,7.0,Vegetables and certain roots and tubers; edible,379631532.0,,31.1667049,36.941628,-36.8535712,174.7456809,7.02017.0Jordan,109793175.0,
2017.0,2017.0,Export,Jordan,World,8.0,"Fruit and nuts, edible; peel of citrus fruit or melons",150743631.0,,31.1667049,36.941628,-36.8535712,174.7456809,8.02017.0Jordan,306233198.0,
2017.0,2017.0,Export,Jordan,World,9.0,"Coffee, tea, mate and spices",43272652.0,,31.1667049,36.941628,-36.8535712,174.7456809,9.02017.0Jordan,171794358.0,
2017.0,2017.0,Export,Jordan,World,10.0,Cereals,15081217.0,,31.1667049,36.941628,-36.8535712,174.7456809,10.02017.0Jordan,688684978.0,
2017.0,2017.0,Export,Jordan,World,11.0,"Products of the milling industry; malt, starches, inulin, wheat gluten",3696074.0,,31.1667049,36.941628,-36.8535712,174.7456809,11.02017.0Jordan,23203427.0,
2017.0,2017.0,Export,Jordan,World,12.0,"Oil seeds and oleaginous fruits; miscellaneous grains, seeds and fruit, industrial or medicinal plants; straw and fodder",14157926.0,,31.1667049,36.941628,-36.8535712,174.7456809,12.02017.0Jordan,110881662.0,
2017.0,2017.0,Export,Jordan,World,13.0,"Lac; gums, resins and other vegetable saps and extracts",221228.0,,31.1667049,36.941628,-36.8535712,174.7456809,13.02017.0Jordan,3015892.0,
2017.0,2017.0,Export,Jordan,World,14.0,Vegetable plaiting materials; vegetable products not elsewhere specified or included,61088.0,,31.1667049,36.941628,-36.8535712,174.7456809,14.02017.0Jordan,204733.0,
2017.0,2017.0,Export,Jordan,World,15.0,Animal or vegetable fats and oils and their cleavage products; prepared animal fats; animal or vegetable waxes,5907063.0,,31.1667049,36.941628,-36.8535712,174.7456809,15.02017.0Jordan,176182951.0,
2017.0,2017.0,Export,Jordan,World,16.0,"Meat, fish or crustaceans, molluscs or other aquatic invertebrates; preparations thereof",45417105.0,,31.1667049,36.941628,-36.8535712,174.7456809,16.02017.0Jordan,87916049.0,
2017.0,2017.0,Export,Jordan,World,17.0,Sugars and sugar confectionery,31730360.0,,31.1667049,36.941628,-36.8535712,174.7456809,17.02017.0Jordan,239425846.0,
2017.0,2017.0,Export,Jordan,World,18.0,Cocoa and cocoa preparations,14610725.0,,31.1667049,36.941628,-36.8535712,174.7456809,18.02017.0Jordan,88113343.0,
2017.0,2017.0,Export,Jordan,World,19.0,"Preparations of cereals, flour, starch or milk; pastrycooks' products",31672223.0,,31.1667049,36.941628,-36.8535712,174.7456809,19.02017.0Jordan,174384614.0,
2017.0,2017.0,Export,Jordan,World,20.0,"Preparations of vegetables, fruit, nuts or other parts of plants",41003784.0,,31.1667049,36.941628,-36.8535712,174.7456809,20.02017.0Jordan,121695386.0,
2017.0,2017.0,Export,Jordan,World,28.0,"Inorganic chemicals; organic and inorganic compounds of precious metals; of rare earth metals, of radio-active elements and of isotopes",384631244.0,,31.1667049,36.941628,-36.8535712,174.7456809,28.02017.0Jordan,57994486.0,
2017.0,2017.0,Export,Jordan,World,29.0,Organic chemicals,17470251.0,,31.1667049,36.941628,-36.8535712,174.7456809,29.02017.0Jordan,271114841.0,
2017.0,2017.0,Export,Jordan,World,33.0,"Essential oils and resinoids; perfumery, cosmetic or toilet preparations",37460419.0,,31.1667049,36.941628,-36.8535712,174.7456809,33.02017.0Jordan,203169417.0,
2017.0,2017.0,Export,Jordan,World,35.0,Albuminoidal substances; modified starches; glues; enzymes,6473219.0,,31.1667049,36.941628,-36.8535712,174.7456809,35.02017.0Jordan,21319219.0,
2017.0,2017.0,Export,Jordan,World,39.0,Plastics and articles thereof,270004836.0,,31.1667049,36.941628,-36.8535712,174.7456809,39.02017.0Jordan,708051657.0,
2017.0,2017.0,Export,Jordan,World,44.0,Wood and articles of wood; wood charcoal,7419914.0,,31.1667049,36.941628,-36.8535712,174.7456809,44.02017.0Jordan,181335518.0,
2017.0,2017.0,Export,Jordan,World,45.0,Cork and articles of cork,2112.0,,31.1667049,36.941628,-36.8535712,174.7456809,45.02017.0Jordan,138031.0,
2017.0,2017.0,Export,Jordan,World,46.0,"Manufactures of straw, esparto or other plaiting materials; basketware and wickerwork",18911.0,,31.1667049,36.941628,-36.8535712,174.7456809,46.02017.0Jordan,144456.0,
2017.0,2017.0,Export,Jordan,World,47.0,Pulp of wood or other fibrous cellulosic material; recovered (waste and scrap) paper or paperboard,14660659.0,,31.1667049,36.941628,-36.8535712,174.7456809,47.02017.0Jordan,59256171.0,
2017.0,2017.0,Export,Jordan,World,48.0,"Paper and paperboard; articles of paper pulp, of paper or paperboard",141926021.0,,31.1667049,36.941628,-36.8535712,174.7456809,48.02017.0Jordan,300771426.0,
2017.0,2017.0,Export,Jordan,World,49.0,"Printed books, newspapers, pictures and other products of the printing industry; manuscripts, typescripts and plans",8365211.0,,31.1667049,36.941628,-36.8535712,174.7456809,49.02017.0Jordan,48607777.0,
2017.0,2017.0,Export,Jordan,World,51.0,"Wool, fine or coarse animal hair; horsehair yarn and woven fabric",327873.0,,31.1667049,36.941628,-36.8535712,174.7456809,51.02017.0Jordan,7925108.0,
2017.0,2017.0,Export,Jordan,World,53.0,Vegetable textile fibres; paper yarn and woven fabrics of paper yarn,203169.0,,31.1667049,36.941628,-36.8535712,174.7456809,53.02017.0Jordan,5989275.0,
2017.0,2017.0,Export,Jordan,World,54.0,Man-made filaments; strip and the like of man-made textile materials,4262198.0,,31.1667049,36.941628,-36.8535712,174.7456809,54.02017.0Jordan,114372566.0,
2017.0,2017.0,Export,Jordan,World,56.0,"Wadding, felt and nonwovens, special yarns; twine, cordage, ropes and cables and articles thereof",8788293.0,,31.1667049,36.941628,-36.8535712,174.7456809,56.02017.0Jordan,28298307.0,
2017.0,2017.0,Export,Jordan,World,57.0,Carpets and other textile floor coverings,26147374.0,,31.1667049,36.941628,-36.8535712,174.7456809,57.02017.0Jordan,30479155.0,
2017.0,2017.0,Export,Jordan,World,60.0,Fabrics; knitted or crocheted,7636431.0,,31.1667049,36.941628,-36.8535712,174.7456809,60.02017.0Jordan,515051708.0,
2017.0,2017.0,Export,Jordan,World,61.0,Apparel and clothing accessories; knitted or crocheted,1498441917.0,,31.1667049,36.941628,-36.8535712,174.7456809,61.02017.0Jordan,318978051.0,
2017.0,2017.0,Export,Jordan,World,62.0,Apparel and clothing accessories; not knitted or crocheted,65012071.0,,31.1667049,36.941628,-36.8535712,174.7456809,62.02017.0Jordan,88190535.0,
2017.0,2017.0,Export,Jordan,World,65.0,Headgear and parts thereof,143650.0,,31.1667049,36.941628,-36.8535712,174.7456809,65.02017.0Jordan,1897659.0,
2017.0,2017.0,Export,Jordan,World,66.0,"Umbrellas, sun umbrellas, walking-sticks, seat sticks, whips, riding crops; and parts thereof",35195.0,,31.1667049,36.941628,-36.8535712,174.7456809,66.02017.0Jordan,564753.0,
2017.0,2017.0,Export,Jordan,World,67.0,"Feathers and down, prepared; and articles made of feather or of down; artificial flowers; articles of human hair",16495.0,,31.1667049,36.941628,-36.8535712,174.7456809,67.02017.0Jordan,1127690.0,
2017.0,2017.0,Export,Jordan,World,68.0,"Stone, plaster, cement, asbestos, mica or similar materials; articles thereof",67445408.0,,31.1667049,36.941628,-36.8535712,174.7456809,68.02017.0Jordan,74174400.0,
2017.0,2017.0,Export,Jordan,World,69.0,Ceramic products,3014199.0,,31.1667049,36.941628,-36.8535712,174.7456809,69.02017.0Jordan,188066143.0,
2017.0,2017.0,Export,Jordan,World,70.0,Glass and glassware,11496123.0,,31.1667049,36.941628,-36.8535712,174.7456809,70.02017.0Jordan,70579772.0,
2017.0,2017.0,Export,Jordan,World,71.0,"Natural, cultured pearls; precious, semi-precious stones; precious metals, metals clad with precious metal, and articles thereof; imitation jewellery; coin",189546045.0,,31.1667049,36.941628,-36.8535712,174.7456809,71.02017.0Jordan,645935639.0,
2017.0,2017.0,Export,Jordan,World,72.0,Iron and steel,33849732.0,,31.1667049,36.941628,-36.8535712,174.7456809,72.02017.0Jordan,422731294.0,
2017.0,2017.0,Export,Jordan,World,73.0,Iron or steel articles,76186217.0,,31.1667049,36.941628,-36.8535712,174.7456809,73.02017.0Jordan,309170607.0,
2017.0,2017.0,Export,Jordan,World,75.0,Nickel and articles thereof,368759.0,,31.1667049,36.941628,-36.8535712,174.7456809,75.02017.0Jordan,287632.0,
2017.0,2017.0,Export,Jordan,World,76.0,Aluminium and articles thereof,139182591.0,,31.1667049,36.941628,-36.8535712,174.7456809,76.02017.0Jordan,168935249.0,
2017.0,2017.0,Export,Jordan,World,78.0,Lead and articles thereof,12418456.0,,31.1667049,36.941628,-36.8535712,174.7456809,78.02017.0Jordan,410077.0,
2017.0,2017.0,Export,Jordan,World,79.0,Zinc and articles thereof,765160.0,,31.1667049,36.941628,-36.8535712,174.7456809,79.02017.0Jordan,5032813.0,
2017.0,2017.0,Export,Jordan,World,80.0,Tin; articles thereof,578466.0,,31.1667049,36.941628,-36.8535712,174.7456809,80.02017.0Jordan,47709.0,
2017.0,2017.0,Export,Jordan,World,81.0,"Metals; n.e.c., cermets and articles thereof",19116.0,,31.1667049,36.941628,-36.8535712,174.7456809,81.02017.0Jordan,358604.0,
2017.0,2017.0,Export,Jordan,World,82.0,"Tools, implements, cutlery, spoons and forks, of base metal; parts thereof, of base metal",3032358.0,,31.1667049,36.941628,-36.8535712,174.7456809,82.02017.0Jordan,26446395.0,
2017.0,2017.0,Export,Jordan,World,83.0,Metal; miscellaneous products of base metal,3093280.0,,31.1667049,36.941628,-36.8535712,174.7456809,83.02017.0Jordan,86637235.0,
2017.0,2017.0,Export,Jordan,World,84.0,"Nuclear reactors, boilers, machinery and mechanical appliances; parts thereof",223149687.0,,31.1667049,36.941628,-36.8535712,174.7456809,84.02017.0Jordan,2016772296.0,
2017.0,2017.0,Export,Jordan,World,85.0,"Electrical machinery and equipment and parts thereof; sound recorders and reproducers; television image and sound recorders and reproducers, parts and accessories of such articles",361522533.0,,31.1667049,36.941628,-36.8535712,174.7456809,85.02017.0Jordan,1225686774.0,
2017.0,2017.0,Export,Jordan,World,86.0,"Railway, tramway locomotives, rolling-stock and parts thereof; railway or tramway track fixtures and fittings and parts thereof; mechanical (including electro-mechanical) traffic signalling equipment of all kinds",74598.0,,31.1667049,36.941628,-36.8535712,174.7456809,86.02017.0Jordan,1891422.0,
2017.0,2017.0,Export,Jordan,World,87.0,"Vehicles; other than railway or tramway rolling stock, and parts and accessories thereof",104590547.0,,31.1667049,36.941628,-36.8535712,174.7456809,87.02017.0Jordan,2073924763.0,
2017.0,2017.0,Export,Jordan,World,88.0,"Aircraft, spacecraft and parts thereof",253093272.0,,31.1667049,36.941628,-36.8535712,174.7456809,88.02017.0Jordan,233941418.0,
2017.0,2017.0,Export,Jordan,World,91.0,Clocks and watches and parts thereof,5407496.0,,31.1667049,36.941628,-36.8535712,174.7456809,91.02017.0Jordan,16042158.0,
2017.0,2017.0,Export,Jordan,World,92.0,Musical instruments; parts and accessories of such articles,3464.0,,31.1667049,36.941628,-36.8535712,174.7456809,92.02017.0Jordan,558986.0,
2017.0,2017.0,Export,Jordan,World,94.0,"Furniture; bedding, mattresses, mattress supports, cushions and similar stuffed furnishings; lamps and lighting fittings, n.e.c.; illuminated signs, illuminated name-plates and the like; prefabricated buildings",45778788.0,,31.1667049,36.941628,-36.8535712,174.7456809,94.02017.0Jordan,210820534.0,
2017.0,2017.0,Export,Jordan,World,95.0,"Toys, games and sports requisites; parts and accessories thereof",1656266.0,,31.1667049,36.941628,-36.8535712,174.7456809,95.02017.0Jordan,35861262.0,
2017.0,2017.0,Export,Jordan,World,96.0,Miscellaneous manufactured articles,39436350.0,,31.1667049,36.941628,-36.8535712,174.7456809,96.02017.0Jordan,99124072.0,
2017.0,2017.0,Export,Jordan,World,97.0,Works of art; collectors' pieces and antiques,199969.0,,31.1667049,36.941628,-36.8535712,174.7456809,97.02017.0Jordan,266474.0,
2017.0,2017.0,Export,Jordan,World,99.0,Commodities not specified according to kind,17997354.0,,31.1667049,36.941628,-36.8535712,174.7456809,99.02017.0Jordan,357146146.0,
