yr,periodDesc,rgDesc,rtTitle,cmdCode,cmdDescE,Subregion_export,Region_export,TradeValue_export,rtLat,rtLon,ptLon,ptLat,mid,Subregion_import,Region_import,TradeValue_import
1991.0,1991.0,Export,Cyprus,1.0,Live animals,World,World,294261.0,34.9823018,33.1451285,,,11991Cyprus,World,World,1478744.0
1991.0,1991.0,Export,Cyprus,2.0,Meat and edible meat offal,World,World,1428157.0,34.9823018,33.1451285,,,21991Cyprus,World,World,17299684.0
1991.0,1991.0,Export,Cyprus,3.0,"Fish, crustaceans, molluscs, aquatic invertebrates ne",World,World,3440163.0,34.9823018,33.1451285,,,31991Cyprus,World,World,16057466.0
1991.0,1991.0,Export,Cyprus,4.0,"Dairy products, eggs, honey, edible animal product nes",World,World,7822842.0,34.9823018,33.1451285,,,41991Cyprus,World,World,15713077.0
1991.0,1991.0,Export,Cyprus,5.0,"Products of animal origin, nes",World,World,324678.0,34.9823018,33.1451285,,,51991Cyprus,World,World,603572.0
1991.0,1991.0,Export,Cyprus,6.0,"Live trees, plants, bulbs, roots, cut flowers etc",World,World,230996.0,34.9823018,33.1451285,,,61991Cyprus,World,World,3079784.0
1991.0,1991.0,Export,Cyprus,7.0,Edible vegetables and certain roots and tubers,World,World,68750080.0,34.9823018,33.1451285,,,71991Cyprus,World,World,9071863.0
1991.0,1991.0,Export,Cyprus,8.0,"Edible fruit, nuts, peel of citrus fruit, melons",World,World,55463536.0,34.9823018,33.1451285,,,81991Cyprus,World,World,5560937.0
1991.0,1991.0,Export,Cyprus,9.0,"Coffee, tea, mate and spices",World,World,1577630.0,34.9823018,33.1451285,,,91991Cyprus,World,World,5565229.0
1991.0,1991.0,Export,Cyprus,10.0,Cereals,World,World,23015.0,34.9823018,33.1451285,,,101991Cyprus,World,World,60994744.0
1991.0,1991.0,Export,Cyprus,11.0,"Milling products, malt, starches, inulin, wheat glute",World,World,211619.0,34.9823018,33.1451285,,,111991Cyprus,World,World,2582913.0
1991.0,1991.0,Export,Cyprus,12.0,"Oil seed, oleagic fruits, grain, seed, fruit, etc, ne",World,World,3552821.0,34.9823018,33.1451285,,,121991Cyprus,World,World,5369925.0
1991.0,1991.0,Export,Cyprus,13.0,"Lac, gums, resins, vegetable saps and extracts nes",World,World,5335.0,34.9823018,33.1451285,,,131991Cyprus,World,World,544182.0
1991.0,1991.0,Export,Cyprus,14.0,"Vegetable plaiting materials, vegetable products nes",World,World,693951.0,34.9823018,33.1451285,,,141991Cyprus,World,World,447519.0
1991.0,1991.0,Export,Cyprus,15.0,"Animal,vegetable fats and oils, cleavage products, et",World,World,13693617.0,34.9823018,33.1451285,,,151991Cyprus,World,World,25161972.0
1991.0,1991.0,Export,Cyprus,16.0,"Meat, fish and seafood food preparations nes",World,World,1702629.0,34.9823018,33.1451285,,,161991Cyprus,World,World,11406703.0
1991.0,1991.0,Export,Cyprus,17.0,Sugars and sugar confectionery,World,World,1245438.0,34.9823018,33.1451285,,,171991Cyprus,World,World,12822801.0
1991.0,1991.0,Export,Cyprus,18.0,Cocoa and cocoa preparations,World,World,2813146.0,34.9823018,33.1451285,,,181991Cyprus,World,World,6845229.0
1991.0,1991.0,Export,Cyprus,19.0,"Cereal, flour, starch, milk preparations and products",World,World,2785502.0,34.9823018,33.1451285,,,191991Cyprus,World,World,15141688.0
1991.0,1991.0,Export,Cyprus,20.0,"Vegetable, fruit, nut, etc food preparations",World,World,16581348.0,34.9823018,33.1451285,,,201991Cyprus,World,World,8339577.0
1991.0,1991.0,Export,Cyprus,21.0,Miscellaneous edible preparations,World,World,2903996.0,34.9823018,33.1451285,,,211991Cyprus,World,World,15929917.0
1991.0,1991.0,Export,Cyprus,22.0,"Beverages, spirits and vinegar",World,World,33755760.0,34.9823018,33.1451285,,,221991Cyprus,World,World,19360872.0
1991.0,1991.0,Export,Cyprus,23.0,"Residues, wastes of food industry, animal fodder",World,World,930297.0,34.9823018,33.1451285,,,231991Cyprus,World,World,30255460.0
1991.0,1991.0,Export,Cyprus,24.0,Tobacco and manufactured tobacco substitutes,World,World,126393744.0,34.9823018,33.1451285,,,241991Cyprus,World,World,149780656.0
1991.0,1991.0,Export,Cyprus,25.0,"Salt, sulphur, earth, stone, plaster, lime and cement",World,World,15302251.0,34.9823018,33.1451285,,,251991Cyprus,World,World,10587876.0
1991.0,1991.0,Export,Cyprus,27.0,"Mineral fuels, oils, distillation products, etc",World,World,43607328.0,34.9823018,33.1451285,,,271991Cyprus,World,World,270095744.0
1991.0,1991.0,Export,Cyprus,28.0,"Inorganic chemicals, precious metal compound, isotope",World,World,46873.0,34.9823018,33.1451285,,,281991Cyprus,World,World,9841833.0
1991.0,1991.0,Export,Cyprus,29.0,Organic chemicals,World,World,421489.0,34.9823018,33.1451285,,,291991Cyprus,World,World,23855554.0
1991.0,1991.0,Export,Cyprus,30.0,Pharmaceutical products,World,World,23999736.0,34.9823018,33.1451285,,,301991Cyprus,World,World,38537512.0
1991.0,1991.0,Export,Cyprus,31.0,Fertilizers,World,World,3003.0,34.9823018,33.1451285,,,311991Cyprus,World,World,14283081.0
1991.0,1991.0,Export,Cyprus,32.0,"Tanning, dyeing extracts, tannins, derivs,pigments et",World,World,1807036.0,34.9823018,33.1451285,,,321991Cyprus,World,World,12541675.0
1991.0,1991.0,Export,Cyprus,33.0,"Essential oils, perfumes, cosmetics, toileteries",World,World,15343460.0,34.9823018,33.1451285,,,331991Cyprus,World,World,22515084.0
1991.0,1991.0,Export,Cyprus,35.0,"Albuminoids, modified starches, glues, enzymes",World,World,248861.0,34.9823018,33.1451285,,,351991Cyprus,World,World,3594297.0
1991.0,1991.0,Export,Cyprus,36.0,"Explosives, pyrotechnics, matches, pyrophorics, etc",World,World,426834.0,34.9823018,33.1451285,,,361991Cyprus,World,World,2123584.0
1991.0,1991.0,Export,Cyprus,37.0,Photographic or cinematographic goods,World,World,2224536.0,34.9823018,33.1451285,,,371991Cyprus,World,World,11268125.0
1991.0,1991.0,Export,Cyprus,38.0,Miscellaneous chemical products,World,World,2262714.0,34.9823018,33.1451285,,,381991Cyprus,World,World,19669658.0
1991.0,1991.0,Export,Cyprus,39.0,Plastics and articles thereof,World,World,7212943.0,34.9823018,33.1451285,,,391991Cyprus,World,World,76138208.0
1991.0,1991.0,Export,Cyprus,40.0,Rubber and articles thereof,World,World,478828.0,34.9823018,33.1451285,,,401991Cyprus,World,World,25467712.0
1991.0,1991.0,Export,Cyprus,41.0,Raw hides and skins (other than furskins) and leather,World,World,1854377.0,34.9823018,33.1451285,,,411991Cyprus,World,World,19570828.0
1991.0,1991.0,Export,Cyprus,42.0,"Articles of leather, animal gut, harness, travel good",World,World,9816013.0,34.9823018,33.1451285,,,421991Cyprus,World,World,3549036.0
1991.0,1991.0,Export,Cyprus,43.0,"Furskins and artificial fur, manufactures thereof",World,World,62815.0,34.9823018,33.1451285,,,431991Cyprus,World,World,67636.0
1991.0,1991.0,Export,Cyprus,44.0,"Wood and articles of wood, wood charcoal",World,World,387919.0,34.9823018,33.1451285,,,441991Cyprus,World,World,43797912.0
1991.0,1991.0,Export,Cyprus,45.0,Cork and articles of cork,World,World,6.0,34.9823018,33.1451285,,,451991Cyprus,World,World,812666.0
1991.0,1991.0,Export,Cyprus,46.0,"Manufactures of plaiting material, basketwork, etc.",World,World,3902.0,34.9823018,33.1451285,,,461991Cyprus,World,World,625700.0
1991.0,1991.0,Export,Cyprus,47.0,"Pulp of wood, fibrous cellulosic material, waste etc",World,World,699635.0,34.9823018,33.1451285,,,471991Cyprus,World,World,1423859.0
1991.0,1991.0,Export,Cyprus,48.0,"Paper & paperboard, articles of pulp, paper and board",World,World,12281749.0,34.9823018,33.1451285,,,481991Cyprus,World,World,70834096.0
1991.0,1991.0,Export,Cyprus,49.0,"Printed books, newspapers, pictures etc",World,World,4871241.0,34.9823018,33.1451285,,,491991Cyprus,World,World,22197154.0
1991.0,1991.0,Export,Cyprus,50.0,Silk,World,World,65725.0,34.9823018,33.1451285,,,501991Cyprus,World,World,1880022.0
1991.0,1991.0,Export,Cyprus,51.0,"Wool, animal hair, horsehair yarn and fabric thereof",World,World,728162.0,34.9823018,33.1451285,,,511991Cyprus,World,World,6899768.0
1991.0,1991.0,Export,Cyprus,52.0,Cotton,World,World,10554336.0,34.9823018,33.1451285,,,521991Cyprus,World,World,42059516.0
1991.0,1991.0,Export,Cyprus,53.0,"Vegetable textile fibres nes, paper yarn, woven fabri",World,World,265532.0,34.9823018,33.1451285,,,531991Cyprus,World,World,794944.0
1991.0,1991.0,Export,Cyprus,54.0,manmade filaments,World,World,12563388.0,34.9823018,33.1451285,,,541991Cyprus,World,World,28089940.0
1991.0,1991.0,Export,Cyprus,55.0,manmade staple fibres,World,World,32410968.0,34.9823018,33.1451285,,,551991Cyprus,World,World,92542176.0
1991.0,1991.0,Export,Cyprus,56.0,"Wadding, felt, nonwovens, yarns, twine, cordage, etc",World,World,237696.0,34.9823018,33.1451285,,,561991Cyprus,World,World,7124091.0
1991.0,1991.0,Export,Cyprus,57.0,Carpets and other textile floor coverings,World,World,610842.0,34.9823018,33.1451285,,,571991Cyprus,World,World,8949984.0
1991.0,1991.0,Export,Cyprus,58.0,"Special woven or tufted fabric, lace, tapestry etc",World,World,1582970.0,34.9823018,33.1451285,,,581991Cyprus,World,World,8524239.0
1991.0,1991.0,Export,Cyprus,59.0,"Impregnated, coated or laminated textile fabric",World,World,731131.0,34.9823018,33.1451285,,,591991Cyprus,World,World,7619400.0
1991.0,1991.0,Export,Cyprus,60.0,Knitted or crocheted fabric,World,World,8356629.0,34.9823018,33.1451285,,,601991Cyprus,World,World,16538990.0
1991.0,1991.0,Export,Cyprus,61.0,"Articles of apparel, accessories, knit or crochet",World,World,30817576.0,34.9823018,33.1451285,,,611991Cyprus,World,World,15093874.0
1991.0,1991.0,Export,Cyprus,62.0,"Articles of apparel, accessories, not knit or crochet",World,World,130756456.0,34.9823018,33.1451285,,,621991Cyprus,World,World,20105514.0
1991.0,1991.0,Export,Cyprus,63.0,"Other made textile articles, sets, worn clothing etc",World,World,10471518.0,34.9823018,33.1451285,,,631991Cyprus,World,World,13865685.0
1991.0,1991.0,Export,Cyprus,64.0,"Footwear, gaiters and the like, parts thereof",World,World,34875280.0,34.9823018,33.1451285,,,641991Cyprus,World,World,20302272.0
1991.0,1991.0,Export,Cyprus,65.0,Headgear and parts thereof,World,World,42865.0,34.9823018,33.1451285,,,651991Cyprus,World,World,892386.0
1991.0,1991.0,Export,Cyprus,66.0,"Umbrellas, walking-sticks, seat-sticks, whips, etc",World,World,43514.0,34.9823018,33.1451285,,,661991Cyprus,World,World,505095.0
1991.0,1991.0,Export,Cyprus,67.0,"Bird skin, feathers, artificial flowers, human hair",World,World,9343.0,34.9823018,33.1451285,,,671991Cyprus,World,World,1355566.0
1991.0,1991.0,Export,Cyprus,68.0,"Stone, plaster, cement, asbestos, mica, etc articles",World,World,424787.0,34.9823018,33.1451285,,,681991Cyprus,World,World,14139611.0
1991.0,1991.0,Export,Cyprus,69.0,Ceramic products,World,World,293344.0,34.9823018,33.1451285,,,691991Cyprus,World,World,28415976.0
1991.0,1991.0,Export,Cyprus,70.0,Glass and glassware,World,World,768051.0,34.9823018,33.1451285,,,701991Cyprus,World,World,21272156.0
1991.0,1991.0,Export,Cyprus,71.0,"Pearls, precious stones, metals, coins, etc",World,World,5636442.0,34.9823018,33.1451285,,,711991Cyprus,World,World,44856408.0
1991.0,1991.0,Export,Cyprus,72.0,Iron and steel,World,World,1984074.0,34.9823018,33.1451285,,,721991Cyprus,World,World,71325040.0
1991.0,1991.0,Export,Cyprus,73.0,Articles of iron or steel,World,World,5131596.0,34.9823018,33.1451285,,,731991Cyprus,World,World,50869696.0
1991.0,1991.0,Export,Cyprus,74.0,Copper and articles thereof,World,World,2067797.0,34.9823018,33.1451285,,,741991Cyprus,World,World,9391080.0
1991.0,1991.0,Export,Cyprus,76.0,Aluminium and articles thereof,World,World,3877423.0,34.9823018,33.1451285,,,761991Cyprus,World,World,32840248.0
1991.0,1991.0,Export,Cyprus,78.0,Lead and articles thereof,World,World,213117.0,34.9823018,33.1451285,,,781991Cyprus,World,World,1117815.0
1991.0,1991.0,Export,Cyprus,79.0,Zinc and articles thereof,World,World,84417.0,34.9823018,33.1451285,,,791991Cyprus,World,World,542146.0
1991.0,1991.0,Export,Cyprus,82.0,"Tools, implements, cutlery, etc of base metal",World,World,3067667.0,34.9823018,33.1451285,,,821991Cyprus,World,World,15512460.0
1991.0,1991.0,Export,Cyprus,83.0,Miscellaneous articles of base metal,World,World,1518284.0,34.9823018,33.1451285,,,831991Cyprus,World,World,14363656.0
1991.0,1991.0,Export,Cyprus,84.0,"Nuclear reactors, boilers, machinery, etc",World,World,42937160.0,34.9823018,33.1451285,,,841991Cyprus,World,World,247704080.0
1991.0,1991.0,Export,Cyprus,85.0,"Electrical, electronic equipment",World,World,53005180.0,34.9823018,33.1451285,,,851991Cyprus,World,World,207896672.0
1991.0,1991.0,Export,Cyprus,86.0,"Railway, tramway locomotives, rolling stock, equipmen",World,World,170461.0,34.9823018,33.1451285,,,861991Cyprus,World,World,447028.0
1991.0,1991.0,Export,Cyprus,87.0,"Vehicles other than railway, tramway",World,World,20310804.0,34.9823018,33.1451285,,,871991Cyprus,World,World,277024416.0
1991.0,1991.0,Export,Cyprus,88.0,"Aircraft, spacecraft, and parts thereof",World,World,40058.0,34.9823018,33.1451285,,,881991Cyprus,World,World,4344946.0
1991.0,1991.0,Export,Cyprus,89.0,"Ships, boats and other floating structures",World,World,454654.0,34.9823018,33.1451285,,,891991Cyprus,World,World,5850812.0
1991.0,1991.0,Export,Cyprus,90.0,"Optical, photo, technical, medical, etc apparatus",World,World,7712305.0,34.9823018,33.1451285,,,901991Cyprus,World,World,47901280.0
1991.0,1991.0,Export,Cyprus,91.0,Clocks and watches and parts thereof,World,World,9500437.0,34.9823018,33.1451285,,,911991Cyprus,World,World,15648583.0
1991.0,1991.0,Export,Cyprus,92.0,"Musical instruments, parts and accessories",World,World,400810.0,34.9823018,33.1451285,,,921991Cyprus,World,World,2820994.0
1991.0,1991.0,Export,Cyprus,93.0,"Arms and ammunition, parts and accessories thereof",World,World,5869030.0,34.9823018,33.1451285,,,931991Cyprus,World,World,6318996.0
1991.0,1991.0,Export,Cyprus,94.0,"Furniture, lighting, signs, prefabricated buildings",World,World,10489821.0,34.9823018,33.1451285,,,941991Cyprus,World,World,20829488.0
1991.0,1991.0,Export,Cyprus,95.0,"Toys, games, sports requisites",World,World,2213519.0,34.9823018,33.1451285,,,951991Cyprus,World,World,17041968.0
1991.0,1991.0,Export,Cyprus,96.0,Miscellaneous manufactured articles,World,World,5796706.0,34.9823018,33.1451285,,,961991Cyprus,World,World,14493106.0
1991.0,1991.0,Export,Cyprus,97.0,"Works of art, collectors pieces and antiques",World,World,331332.0,34.9823018,33.1451285,,,971991Cyprus,World,World,1880017.0
