yr,periodDesc,rgDesc,rtTitle,ptTitle,cmdCode,cmdDescE,TradeValue_export,Unnamed: 0_export,rtLat,rtLon,ptLat,ptLon,mid,TradeValue_import,Unnamed: 0_import
1996.0,1996.0,Export,Oman,World,1.0,Live animals,30208292.0,,21.0000287,57.0036901,-36.8535712,174.7456809,1.01996.0Oman,46707776.0,
1996.0,1996.0,Export,Oman,World,2.0,Meat and edible meat offal,8729263.0,,21.0000287,57.0036901,-36.8535712,174.7456809,2.01996.0Oman,87682384.0,
1996.0,1996.0,Export,Oman,World,3.0,"Fish, crustaceans, molluscs, aquatic invertebrates ne",63379732.0,,21.0000287,57.0036901,-36.8535712,174.7456809,3.01996.0Oman,3733423.0,
1996.0,1996.0,Export,Oman,World,4.0,"Dairy products, eggs, honey, edible animal product nes",7771837.0,,21.0000287,57.0036901,-36.8535712,174.7456809,4.01996.0Oman,103718832.0,
1996.0,1996.0,Export,Oman,World,6.0,"Live trees, plants, bulbs, roots, cut flowers etc",78723.0,,21.0000287,57.0036901,-36.8535712,174.7456809,6.01996.0Oman,3175919.0,
1996.0,1996.0,Export,Oman,World,8.0,"Edible fruit, nuts, peel of citrus fruit, melons",5271102.0,,21.0000287,57.0036901,-36.8535712,174.7456809,8.01996.0Oman,51020272.0,
1996.0,1996.0,Export,Oman,World,11.0,"Milling products, malt, starches, inulin, wheat glute",10879362.0,,21.0000287,57.0036901,-36.8535712,174.7456809,11.01996.0Oman,15280493.0,
1996.0,1996.0,Export,Oman,World,12.0,"Oil seed, oleagic fruits, grain, seed, fruit, etc, ne",1273305.0,,21.0000287,57.0036901,-36.8535712,174.7456809,12.01996.0Oman,5047729.0,
1996.0,1996.0,Export,Oman,World,13.0,"Lac, gums, resins, vegetable saps and extracts nes",298794.0,,21.0000287,57.0036901,-36.8535712,174.7456809,13.01996.0Oman,12381.0,
1996.0,1996.0,Export,Oman,World,14.0,"Vegetable plaiting materials, vegetable products nes",183227.0,,21.0000287,57.0036901,-36.8535712,174.7456809,14.01996.0Oman,27822.0,
1996.0,1996.0,Export,Oman,World,15.0,"Animal,vegetable fats and oils, cleavage products, et",11813768.0,,21.0000287,57.0036901,-36.8535712,174.7456809,15.01996.0Oman,27947646.0,
1996.0,1996.0,Export,Oman,World,16.0,"Meat, fish and seafood food preparations nes",89454.0,,21.0000287,57.0036901,-36.8535712,174.7456809,16.01996.0Oman,6058142.0,
1996.0,1996.0,Export,Oman,World,17.0,Sugars and sugar confectionery,1127904.0,,21.0000287,57.0036901,-36.8535712,174.7456809,17.01996.0Oman,23511876.0,
1996.0,1996.0,Export,Oman,World,18.0,Cocoa and cocoa preparations,558024.0,,21.0000287,57.0036901,-36.8535712,174.7456809,18.01996.0Oman,14899162.0,
1996.0,1996.0,Export,Oman,World,19.0,"Cereal, flour, starch, milk preparations and products",6295534.0,,21.0000287,57.0036901,-36.8535712,174.7456809,19.01996.0Oman,17598096.0,
1996.0,1996.0,Export,Oman,World,20.0,"Vegetable, fruit, nut, etc food preparations",2350437.0,,21.0000287,57.0036901,-36.8535712,174.7456809,20.01996.0Oman,26937672.0,
1996.0,1996.0,Export,Oman,World,21.0,Miscellaneous edible preparations,3610654.0,,21.0000287,57.0036901,-36.8535712,174.7456809,21.01996.0Oman,28202146.0,
1996.0,1996.0,Export,Oman,World,22.0,"Beverages, spirits and vinegar",6512033.0,,21.0000287,57.0036901,-36.8535712,174.7456809,22.01996.0Oman,38704012.0,
1996.0,1996.0,Export,Oman,World,23.0,"Residues, wastes of food industry, animal fodder",1204804.0,,21.0000287,57.0036901,-36.8535712,174.7456809,23.01996.0Oman,7679202.0,
1996.0,1996.0,Export,Oman,World,24.0,Tobacco and manufactured tobacco substitutes,103382512.0,,21.0000287,57.0036901,-36.8535712,174.7456809,24.01996.0Oman,154940608.0,
1996.0,1996.0,Export,Oman,World,25.0,"Salt, sulphur, earth, stone, plaster, lime and cement",9010867.0,,21.0000287,57.0036901,-36.8535712,174.7456809,25.01996.0Oman,49260428.0,
1996.0,1996.0,Export,Oman,World,26.0,"Ores, slag and ash",1017741.0,,21.0000287,57.0036901,-36.8535712,174.7456809,26.01996.0Oman,55564816.0,
1996.0,1996.0,Export,Oman,World,27.0,"Mineral fuels, oils, distillation products, etc",5808360960.0,,21.0000287,57.0036901,-36.8535712,174.7456809,27.01996.0Oman,50248680.0,
1996.0,1996.0,Export,Oman,World,28.0,"Inorganic chemicals, precious metal compound, isotope",975341.0,,21.0000287,57.0036901,-36.8535712,174.7456809,28.01996.0Oman,15421795.0,
1996.0,1996.0,Export,Oman,World,29.0,Organic chemicals,93056.0,,21.0000287,57.0036901,-36.8535712,174.7456809,29.01996.0Oman,1071078.0,
1996.0,1996.0,Export,Oman,World,30.0,Pharmaceutical products,976378.0,,21.0000287,57.0036901,-36.8535712,174.7456809,30.01996.0Oman,64240784.0,
1996.0,1996.0,Export,Oman,World,31.0,Fertilizers,4915958.0,,21.0000287,57.0036901,-36.8535712,174.7456809,31.01996.0Oman,8820078.0,
1996.0,1996.0,Export,Oman,World,32.0,"Tanning, dyeing extracts, tannins, derivs,pigments et",3518464.0,,21.0000287,57.0036901,-36.8535712,174.7456809,32.01996.0Oman,15475253.0,
1996.0,1996.0,Export,Oman,World,33.0,"Essential oils, perfumes, cosmetics, toileteries",7942180.0,,21.0000287,57.0036901,-36.8535712,174.7456809,33.01996.0Oman,67192208.0,
1996.0,1996.0,Export,Oman,World,34.0,"Soaps, lubricants, waxes, candles, modelling pastes",11532997.0,,21.0000287,57.0036901,-36.8535712,174.7456809,34.01996.0Oman,15797343.0,
1996.0,1996.0,Export,Oman,World,35.0,"Albuminoids, modified starches, glues, enzymes",37973.0,,21.0000287,57.0036901,-36.8535712,174.7456809,35.01996.0Oman,1582881.0,
1996.0,1996.0,Export,Oman,World,36.0,"Explosives, pyrotechnics, matches, pyrophorics, etc",26971.0,,21.0000287,57.0036901,-36.8535712,174.7456809,36.01996.0Oman,3584084.0,
1996.0,1996.0,Export,Oman,World,37.0,Photographic or cinematographic goods,10459032.0,,21.0000287,57.0036901,-36.8535712,174.7456809,37.01996.0Oman,18140366.0,
1996.0,1996.0,Export,Oman,World,38.0,Miscellaneous chemical products,3996865.0,,21.0000287,57.0036901,-36.8535712,174.7456809,38.01996.0Oman,64813180.0,
1996.0,1996.0,Export,Oman,World,39.0,Plastics and articles thereof,9988446.0,,21.0000287,57.0036901,-36.8535712,174.7456809,39.01996.0Oman,71676672.0,
1996.0,1996.0,Export,Oman,World,40.0,Rubber and articles thereof,30355064.0,,21.0000287,57.0036901,-36.8535712,174.7456809,40.01996.0Oman,74404072.0,
1996.0,1996.0,Export,Oman,World,41.0,Raw hides and skins (other than furskins) and leather,496366.0,,21.0000287,57.0036901,-36.8535712,174.7456809,41.01996.0Oman,666263.0,
1996.0,1996.0,Export,Oman,World,42.0,"Articles of leather, animal gut, harness, travel good",192504.0,,21.0000287,57.0036901,-36.8535712,174.7456809,42.01996.0Oman,6953261.0,
1996.0,1996.0,Export,Oman,World,51.0,"Wool, animal hair, horsehair yarn and fabric thereof",59757.0,,21.0000287,57.0036901,-36.8535712,174.7456809,51.01996.0Oman,135990.0,
1996.0,1996.0,Export,Oman,World,52.0,Cotton,876246.0,,21.0000287,57.0036901,-36.8535712,174.7456809,52.01996.0Oman,24851436.0,
1996.0,1996.0,Export,Oman,World,54.0,manmade filaments,159540.0,,21.0000287,57.0036901,-36.8535712,174.7456809,54.01996.0Oman,19770022.0,
1996.0,1996.0,Export,Oman,World,55.0,manmade staple fibres,13952450.0,,21.0000287,57.0036901,-36.8535712,174.7456809,55.01996.0Oman,92306064.0,
1996.0,1996.0,Export,Oman,World,56.0,"Wadding, felt, nonwovens, yarns, twine, cordage, etc",190997.0,,21.0000287,57.0036901,-36.8535712,174.7456809,56.01996.0Oman,5267502.0,
1996.0,1996.0,Export,Oman,World,57.0,Carpets and other textile floor coverings,842393.0,,21.0000287,57.0036901,-36.8535712,174.7456809,57.01996.0Oman,15496145.0,
1996.0,1996.0,Export,Oman,World,58.0,"Special woven or tufted fabric, lace, tapestry etc",1820.0,,21.0000287,57.0036901,-36.8535712,174.7456809,58.01996.0Oman,1458270.0,
1996.0,1996.0,Export,Oman,World,59.0,"Impregnated, coated or laminated textile fabric",44709.0,,21.0000287,57.0036901,-36.8535712,174.7456809,59.01996.0Oman,147707.0,
1996.0,1996.0,Export,Oman,World,61.0,"Articles of apparel, accessories, knit or crochet",38841208.0,,21.0000287,57.0036901,-36.8535712,174.7456809,61.01996.0Oman,26702880.0,
1996.0,1996.0,Export,Oman,World,62.0,"Articles of apparel, accessories, not knit or crochet",52050144.0,,21.0000287,57.0036901,-36.8535712,174.7456809,62.01996.0Oman,8101069.0,
1996.0,1996.0,Export,Oman,World,63.0,"Other made textile articles, sets, worn clothing etc",33883.0,,21.0000287,57.0036901,-36.8535712,174.7456809,63.01996.0Oman,10769748.0,
1996.0,1996.0,Export,Oman,World,64.0,"Footwear, gaiters and the like, parts thereof",1317142.0,,21.0000287,57.0036901,-36.8535712,174.7456809,64.01996.0Oman,20564792.0,
1996.0,1996.0,Export,Oman,World,65.0,Headgear and parts thereof,178845.0,,21.0000287,57.0036901,-36.8535712,174.7456809,65.01996.0Oman,554211.0,
1996.0,1996.0,Export,Oman,World,67.0,"Bird skin, feathers, artificial flowers, human hair",11209.0,,21.0000287,57.0036901,-36.8535712,174.7456809,67.01996.0Oman,322128.0,
1996.0,1996.0,Export,Oman,World,68.0,"Stone, plaster, cement, asbestos, mica, etc articles",4676975.0,,21.0000287,57.0036901,-36.8535712,174.7456809,68.01996.0Oman,4655601.0,
1996.0,1996.0,Export,Oman,World,69.0,Ceramic products,1078972.0,,21.0000287,57.0036901,-36.8535712,174.7456809,69.01996.0Oman,35823708.0,
1996.0,1996.0,Export,Oman,World,70.0,Glass and glassware,5696733.0,,21.0000287,57.0036901,-36.8535712,174.7456809,70.01996.0Oman,33453048.0,
1996.0,1996.0,Export,Oman,World,71.0,"Pearls, precious stones, metals, coins, etc",7415101.0,,21.0000287,57.0036901,-36.8535712,174.7456809,71.01996.0Oman,161620672.0,
1996.0,1996.0,Export,Oman,World,72.0,Iron and steel,10950191.0,,21.0000287,57.0036901,-36.8535712,174.7456809,72.01996.0Oman,87521016.0,
1996.0,1996.0,Export,Oman,World,73.0,Articles of iron or steel,11647039.0,,21.0000287,57.0036901,-36.8535712,174.7456809,73.01996.0Oman,140661920.0,
1996.0,1996.0,Export,Oman,World,74.0,Copper and articles thereof,66316940.0,,21.0000287,57.0036901,-36.8535712,174.7456809,74.01996.0Oman,14099117.0,
1996.0,1996.0,Export,Oman,World,75.0,Nickel and articles thereof,35809.0,,21.0000287,57.0036901,-36.8535712,174.7456809,75.01996.0Oman,5139.0,
1996.0,1996.0,Export,Oman,World,76.0,Aluminium and articles thereof,21790882.0,,21.0000287,57.0036901,-36.8535712,174.7456809,76.01996.0Oman,34437580.0,
1996.0,1996.0,Export,Oman,World,78.0,Lead and articles thereof,191792.0,,21.0000287,57.0036901,-36.8535712,174.7456809,78.01996.0Oman,4966615.0,
1996.0,1996.0,Export,Oman,World,79.0,Zinc and articles thereof,259642.0,,21.0000287,57.0036901,-36.8535712,174.7456809,79.01996.0Oman,53864.0,
1996.0,1996.0,Export,Oman,World,81.0,"Other base metals, cermets, articles thereof",457597.0,,21.0000287,57.0036901,-36.8535712,174.7456809,81.01996.0Oman,285.0,
1996.0,1996.0,Export,Oman,World,82.0,"Tools, implements, cutlery, etc of base metal",621833.0,,21.0000287,57.0036901,-36.8535712,174.7456809,82.01996.0Oman,7984445.0,
1996.0,1996.0,Export,Oman,World,83.0,Miscellaneous articles of base metal,1585094.0,,21.0000287,57.0036901,-36.8535712,174.7456809,83.01996.0Oman,23984262.0,
1996.0,1996.0,Export,Oman,World,84.0,"Nuclear reactors, boilers, machinery, etc",71054112.0,,21.0000287,57.0036901,-36.8535712,174.7456809,84.01996.0Oman,612894400.0,
1996.0,1996.0,Export,Oman,World,85.0,"Electrical, electronic equipment",74984144.0,,21.0000287,57.0036901,-36.8535712,174.7456809,85.01996.0Oman,354367776.0,
1996.0,1996.0,Export,Oman,World,86.0,"Railway, tramway locomotives, rolling stock, equipmen",196654.0,,21.0000287,57.0036901,-36.8535712,174.7456809,86.01996.0Oman,90707.0,
1996.0,1996.0,Export,Oman,World,87.0,"Vehicles other than railway, tramway",518106784.0,,21.0000287,57.0036901,-36.8535712,174.7456809,87.01996.0Oman,901464000.0,
1996.0,1996.0,Export,Oman,World,88.0,"Aircraft, spacecraft, and parts thereof",14723273.0,,21.0000287,57.0036901,-36.8535712,174.7456809,88.01996.0Oman,28767512.0,
1996.0,1996.0,Export,Oman,World,89.0,"Ships, boats and other floating structures",683007.0,,21.0000287,57.0036901,-36.8535712,174.7456809,89.01996.0Oman,3539024.0,
1996.0,1996.0,Export,Oman,World,90.0,"Optical, photo, technical, medical, etc apparatus",16650207.0,,21.0000287,57.0036901,-36.8535712,174.7456809,90.01996.0Oman,54783384.0,
1996.0,1996.0,Export,Oman,World,91.0,Clocks and watches and parts thereof,11482435.0,,21.0000287,57.0036901,-36.8535712,174.7456809,91.01996.0Oman,33289432.0,
1996.0,1996.0,Export,Oman,World,92.0,"Musical instruments, parts and accessories",974663.0,,21.0000287,57.0036901,-36.8535712,174.7456809,92.01996.0Oman,2521454.0,
1996.0,1996.0,Export,Oman,World,93.0,"Arms and ammunition, parts and accessories thereof",45643.0,,21.0000287,57.0036901,-36.8535712,174.7456809,93.01996.0Oman,135197.0,
1996.0,1996.0,Export,Oman,World,94.0,"Furniture, lighting, signs, prefabricated buildings",21293502.0,,21.0000287,57.0036901,-36.8535712,174.7456809,94.01996.0Oman,49673528.0,
1996.0,1996.0,Export,Oman,World,95.0,"Toys, games, sports requisites",675916.0,,21.0000287,57.0036901,-36.8535712,174.7456809,95.01996.0Oman,10023761.0,
1996.0,1996.0,Export,Oman,World,96.0,Miscellaneous manufactured articles,1972256.0,,21.0000287,57.0036901,-36.8535712,174.7456809,96.01996.0Oman,6626561.0,
1996.0,1996.0,Export,Oman,World,99.0,Commodities not specified according to kind,51421704.0,,21.0000287,57.0036901,-36.8535712,174.7456809,99.01996.0Oman,227797072.0,
